,nl_command,ltl,map_name,result,eq
2082,go to Golden Triangle but keep avoiding Clyfford Still Museum and once you have been to Golden Triangle go to Clyfford Still Museum,& U ! clyfford_still_museum golden_triangle F clyfford_still_museum,Denver #1,"error:['&', '&', 'lm(', 'lm(', 'lm(', ')lm', ')lm', 'lm(', 'lm(', 'lm(', 'lm(', 'Clyfford', 'Clyfford', ')lm', ')lm', 'lm(', 'lm(', 'lm(', 'Clyfford', 'Clyfford', ')lm', ')lm', 'lm(', 'lm(', 'lm(', 'Clyfford', 'Clyfford', ')lm', 'F', 'lm(', 'lm(', 'lm(', ')lm', ')lm']",False
2083,go to History Colorado Center but keep avoiding Denver Art Museum and once you have been to History Colorado Center go to Denver Art Museum,& U ! denver_art_museum history_colorado_center F denver_art_museum,Denver #1,"error:['&', '&', 'U', 'lm(', 'lm(', 'Center', ')lm', 'lm(', 'Center', ')lm', 'lm(', 'Center', ')lm', ')lm', 'lm(', 'lm(', 'Denver', 'Art', ')lm', ')lm', 'lm(', 'lm(', 'lm(', 'Denver', ')lm', 'F', 'F', 'lm(', 'lm(', 'lm(', 'Center', ')lm', ')lm', 'lm(', 'lm(', 'Center', ')lm', ')lm']",False
2084,you must visit Clyfford Still Museum first before going to Kirkland Museum of Fine & Decorative Art,& U ! kirkland_museum_of_fine_&_decorative_art clyfford_still_museum F kirkland_museum_of_fine_&_decorative_art,Denver #1,& U ! kirkland_museum_of_fine_&_decorative_art broadway_&_13th_ave,False
2085,you must visit Cultural Center Garden first before going to Bcycle @ Denver Public Library,& U ! bcycle_@_denver_public_library cultural_center_garden F bcycle_@_denver_public_library,Denver #1,"error:['&', 'U', '!', 'lm(', 'Bcycle', '@', '@', 'Public', 'Library', ')lm', 'lm(', 'lm(', 'Center', ')lm', 'Center', 'lm(']",False
2086,go to Dozens but do not go to Dozens until you go to Pints Pub first,& U ! dozens pints_pub F dozens,Denver #1,"error:['U', '!', 'lm(', 'lm(', ')lm', ')lm', 'lm(', 'lm(', 'Dozens', 'lm(', 'lm(', ')lm', ')lm', ')lm', 'Dozens', ')lm', 'Dozens', ')lm', 'Dozens', ')lm']",False
2087,go to Cultural Center Garden but do not go to Cultural Center Garden until you go to Denver Art Museum first,& U ! cultural_center_garden denver_art_museum F cultural_center_garden,Denver #1,"error:['&', 'U', '!', 'lm(', 'Center', 'Garden', ')lm', 'lm(', 'Cultural', 'Center', ')lm', 'Center', ')lm', 'lm(', 'lm(', 'Center', ')lm', ')lm', 'Center', ')lm', 'lm(', ')lm', ')lm', ')lm', ')lm', 'Center', ')lm', ')lm', ')lm', ')lm', 'Center', ')lm', 'Center', ')lm']",False
2088,first go to Golden Triangle then go to North Entry Terrace only after Golden Triangle,& U ! north_entry_terrace golden_triangle F north_entry_terrace,Denver #1,"error:['&', 'U', '!', 'lm(', 'North', ')lm', ')lm', 'lm(', 'lm(', 'Golden', ')lm', ')lm', 'F', 'lm(', 'North', 'North', 'Entry', ')lm', ')lm', 'F', 'lm(', 'lm(', ')lm', ')lm', ')lm']",False
2089,first go to Ralph L. Carr Colorado Judicial Center then go to Broadway & 13th Ave only after Ralph L. Carr Colorado Judicial Center,& U ! broadway_&_13th_ave ralph_l._carr_colorado_judicial_center F broadway_&_13th_ave,Denver #1,"error:['&', '&', 'U', '!', 'lm(', 'Broadway', ')lm', 'lm(', 'Ralph', 'L.', ')lm', '&', 'Center', '!', 'lm(', 'lm(', 'Broadway', ')lm', ')lm', 'lm(', 'lm(', 'Broadway', '&', '13th', ')lm', 'F', 'lm(', 'lm(', ')lm', ')lm', ')lm', ')lm', ')lm', ')lm', 'lm(', ')lm', ')lm', ')lm', ')lm', ')lm', ')lm', ')lm', ')lm', ')lm', ')lm', ')lm', ')lm', ')lm', ')lm', ')lm', ')lm', 'Center', ')lm', ')lm', ')lm', 'Center', ')lm', ')lm', 'Broadway', 'Broadway', 'Broadway', ')lm', ')lm', ')lm', ')lm', ')lm', ')lm', ')lm', ')lm', ')lm', ')lm', ')lm', ')lm', ')lm']",False
2090,go to Security Life Center Building after going to Clyfford Still Museum do not go to Security Life Center Building before,& U ! security_life_center_building clyfford_still_museum F security_life_center_building,Denver #1,"error:['&', 'U', '!', 'lm(', 'lm(', ')lm', ')lm', 'lm(', 'lm(', ')lm', 'lm(', 'Center', 'Center', ')lm', 'lm(', 'lm(', 'Center', 'Center', 'Center', 'Building', ')lm', 'Center', 'Building', 'Building', ')lm', 'Center', ')lm', 'Building', ')lm', ')lm', ')lm', ')lm', ')lm', ')lm', ')lm', ')lm', ')lm', ')lm', ')lm']",False
2091,go to Golden Triangle after going to Clyfford Still Museum do not go to Golden Triangle before,& U ! golden_triangle clyfford_still_museum F golden_triangle,Denver #1,"error:['&', 'U', '!', 'lm(', 'lm(', ')lm', ')lm', 'lm(', 'lm(', ')lm', 'lm(', 'lm(', ')lm', ')lm', 'lm(', 'lm(', ')lm', 'Triangle', ')lm', ')lm', 'lm(', 'lm(', ')lm', ')lm', ')lm', ')lm', 'Triangle', 'Triangle', ')lm', ')lm', ')lm', ')lm', ')lm', ')lm', ')lm', ')lm', ')lm']",False
2092,head to Denver Art Museum Administration Building first and then to Golden Triangle but do not visit Golden Triangle if you have not been to Denver Art Museum Administration Building,& U ! golden_triangle denver_art_museum_administration_building F golden_triangle,Denver #1,"error:['&', '&', 'U', '!', 'lm(', 'Building', ')lm', 'lm(', 'lm(', 'Denver', ')lm', ')lm', 'lm(', ')lm', 'lm(', 'lm(', 'Building', ')lm', 'F', 'lm(', 'Golden', 'lm(', ')lm', ')lm', ')lm', ')lm', 'lm(', 'lm(', 'lm(', ')lm', ')lm', ')lm', ')lm', 'Building', ')lm', ')lm', 'Building', ')lm', ')lm', 'Building', ')lm', ')lm', 'Building', ')lm']",False
2093,head to Denver Public Library first and then to Dozens but do not visit Dozens if you have not been to Denver Public Library,& U ! dozens denver_public_library F dozens,Denver #1,"error:['&', '&', 'lm(', 'lm(', 'Library', ')lm', 'F', 'lm(', 'Library', ')lm', 'F', 'lm(', 'lm(', 'Denver', 'Public', ')lm', 'Library', ')lm', 'Dozens', 'lm(', ')lm', ')lm', ')lm']",False
2094,visit the Art Hotel an infinite number of times,G F the_art_hotel,Denver #1,"error:['G', 'F', 'lm(', 'lm(', 'Art', 'the', 'G', 'G', 'G', 'G', 'lm(', 'lm(']",False
2095,visit Byers-Evans House an infinite number of times,G F byers-evans_house,Denver #1,G F four_winds_interactive G G G G byers-evans_house,False
2096,make sure at any point in time you will visit Denver Art Museum at least once in the future,G F denver_art_museum,Denver #1,"error:['G', '&', 'lm(', 'lm(', 'lm(', ')lm', ')lm', 'F', ')lm', 'lm(', 'lm(', 'Art', ')lm', 'Art', ')lm', 'lm(', 'lm(', 'lm(', ')lm', ')lm']",False
2097,make sure at any point in time you will visit Denver Art Museum Frederick C. Hamilton Building at least once in the future,G F denver_art_museum_frederick_c._hamilton_building,Denver #1,"error:['&', '&', 'lm(', 'lm(', 'lm(', ')lm', 'Art', ')lm', ')lm', 'lm(', 'lm(', 'lm(', 'Art', 'Art', ')lm', 'Museum', 'lm(', 'lm(', 'lm(', ')lm']",False
2098,keep visiting Bcycle @ Denver Public Library,G F bcycle_@_denver_public_library,Denver #1,G F bcycle_@_denver_public_library,True
2099,keep visiting Rendezvous Cafe,G F rendezvous_cafe,Denver #1,G F rendezvous_cafe,True
2100,keep going to North Entry Terrace,G F north_entry_terrace,Denver #1,"error:['G', 'F', 'lm(', 'lm(', ')lm', ')lm', 'G', 'G', ')lm', 'lm(', 'lm(', 'lm(', ')lm', ')lm', ')lm', 'F', 'lm(', 'lm(', 'lm(', ')lm']",False
2101,keep going to Denver Art Museum,G F denver_art_museum,Denver #1,"error:['G', 'F', 'lm(', 'lm(', ')lm', ')lm', 'G', 'G', ')lm', 'lm(', 'lm(', 'lm(', ')lm', ')lm', ')lm', 'F', 'lm(', 'lm(', 'lm(', ')lm']",False
2102,make sure you frequent Broadway & 13th Ave infinitely,G F broadway_&_13th_ave,Denver #1,"error:['G', 'G', 'lm(', 'lm(', '&', '&', ')lm', 'G', 'F', 'F', 'lm(', 'G', 'G', 'G', 'G', 'G', 'lm(', 'lm(', '&']",False
2103,make sure you frequent North Entry Terrace infinitely,G F north_entry_terrace,Denver #1,G F north_entry_terrace,True
2104,visit Native American Trading Company Ralph L. Carr Colorado Judicial Center North Entry Terrace and Eviva Cherokee in that specific order make sure not to visit waypoints out of turn,& U ! ralph_l._carr_colorado_judicial_center native_american_trading_company & U ! north_entry_terrace ralph_l._carr_colorado_judicial_center & U ! eviva_cherokee north_entry_terrace F eviva_cherokee,Denver #1,"error:['&', 'U', '!', 'lm(', 'lm(', ')lm', ')lm', 'lm(', 'lm(', 'lm(', 'lm(', 'Native', 'American', ')lm', ')lm', 'U', '!', 'lm(', 'lm(', ')lm', ')lm', 'lm(', 'L.', 'L.', 'L.', ')lm', ')lm', 'Center', ')lm', 'lm(', 'lm(', '!', ')lm', ')lm', ')lm', 'lm(', 'Center', ')lm', 'Center', ')lm', '!', 'lm(', '!', 'lm(', ')lm', ')lm', 'lm(', 'lm(', ')lm']",False
2105,visit North Entry Terrace Byers-Evans House Foster & Graham Huttner LLP and Denver Art Museum Frederick C. Hamilton Building in that specific order make sure not to visit waypoints out of turn,& U ! byers-evans_house north_entry_terrace & U ! foster_&_graham_huttner_llp byers-evans_house & U ! denver_art_museum_frederick_c._hamilton_building foster_&_graham_huttner_llp F denver_art_museum_frederick_c._hamilton_building,Denver #1,"error:['&', '&', '!', 'lm(', 'lm(', 'Foster', ')lm', 'lm(', 'lm(', 'Entry', 'Entry', 'Terrace', ')lm', ')lm', '&', '!', 'lm(', 'lm(', ')lm', ')lm', 'lm(', 'Foster', '&', ')lm', ')lm', 'lm(', '!', 'lm(', 'lm(', ')lm', ')lm', 'lm(', 'lm(', '&', 'Graham', ')lm', ')lm', 'lm(', 'lm(', 'lm(', ')lm', ')lm', ')lm', 'lm(', 'lm(', 'lm(', ')lm', ')lm', 'lm(', 'lm(']",False
2106,visit Golden Triangle without visiting Four Winds Interactive then visit Four Winds Interactive without visiting Denver Art Museum Frederick C. Hamilton Building then visit Denver Art Museum Frederick C. Hamilton Building without visiting Security Life Center Building finally visit Security Life Center Building,& U ! four_winds_interactive golden_triangle & U ! denver_art_museum_frederick_c._hamilton_building four_winds_interactive & U ! security_life_center_building denver_art_museum_frederick_c._hamilton_building F security_life_center_building,Denver #1,"error:['&', '&', 'U', '!', 'lm(', 'Four', 'Winds', ')lm', 'lm(', 'lm(', 'Golden', 'Triangle', ')lm', '&', ')lm', '!', 'lm(', 'lm(', 'St', ')lm', 'lm(', 'lm(', 'lm(', ')lm', ')lm', ')lm', ')lm', 'Winds', 'Winds', 'Center', ')lm', ')lm', 'lm(', 'lm(', ')lm', ')lm', ')lm', ')lm', ')lm', 'Building', ')lm', 'Center', 'Building', ')lm', 'Building', 'Center', 'Building', ')lm', 'Center', 'Building', 'Building', ')lm', ')lm', 'Center', 'Building', ')lm', ')lm', ')lm', ')lm', ')lm', ')lm', ')lm', ')lm', ')lm', ')lm', ')lm', ')lm', ')lm', ')lm', ')lm', ')lm', 'lm(', ')lm', ')lm', ')lm', ')lm', ')lm', 'Four', 'Four', ')lm', ')lm', 'Four', 'Winds', 'Winds', 'Winds', ')lm', ')lm', ')lm', ')lm', 'Winds', 'Winds', ')lm', ')lm', ')lm', ')lm', ')lm', ')lm', ')lm', ')lm', ')lm', ')lm', ')lm', 'Building', ')lm', 'Denver', ')lm', ')lm', 'Building', ')lm', ')lm', 'Building', ')lm', 'Building', ')lm', 'Building', ')lm', 'Building', ')lm', 'Building', ')lm', 'Building', ')lm', 'Building', ')lm', 'Building', ')lm', 'Building', ')lm', 'Building', ')lm']",False
2107,visit Pints Pub without visiting the Art Hotel then visit the Art Hotel without visiting North Entry Terrace then visit North Entry Terrace without visiting Byers-Evans House finally visit Byers-Evans House,& U ! the_art_hotel pints_pub & U ! north_entry_terrace the_art_hotel & U ! byers-evans_house north_entry_terrace F byers-evans_house,Denver #1,"error:['&', '&', 'U', '!', 'lm(', 'Art', 'Art', ')lm', 'lm(', 'Pints', 'Pub', 'the', 'Art', ')lm', '&', 'U', '!', 'lm(', 'North', ')lm', ')lm', 'lm(', 'lm(', 'Art', 'the', 'Hotel', ')lm', 'F', 'lm(', 'lm(', 'Entry', ')lm', ')lm', ')lm', ')lm', 'lm(', 'lm(', 'lm(', ')lm', 'the', 'U', ')lm', 'lm(', 'lm(', 'lm(', 'the', 'U', ')lm', 'the', 'U', ')lm', 'the', 'U', 'the', 'U', ')lm', 'the', 'U', 'the', 'the', ')lm', 'the', 'U', ')lm', 'the', 'the', ')lm', 'the', 'U', 'the', 'the', ')lm', 'the', 'U', ')lm', 'the', 'Art', 'Art', ')lm', ')lm', 'the', 'Art', 'Art', ')lm', ')lm', '!', '!', '!', 'Art', 'Art', 'Art', 'Hotel', ')lm', ')lm', ')lm', '!', '!', '!', '!', ')lm', ')lm', ')lm', ')lm', ')lm', ')lm', ')lm', ')lm', ')lm', ')lm']",False
2108,visit Golden Triangle first while avoiding Cultural Complex Parking & Museum Residences then visit Cultural Complex Parking & Museum Residences while avoiding The Balustrade Condos then visit The Balustrade Condos while avoiding Pints Pub then visit Pints Pub,& U ! cultural_complex_parking_&_museum_residences golden_triangle & U ! the_balustrade_condos cultural_complex_parking_&_museum_residences & U ! pints_pub the_balustrade_condos F pints_pub,Denver #1,"error:['&', '&', '!', 'lm(', 'lm(', 'Parking', ')lm', 'lm(', 'lm(', 'Golden', 'Triangle', 'Triangle', ')lm', ')lm', '&', 'lm(', 'lm(', 'lm(', 'Cultural', 'lm(', ')lm', 'lm(', 'lm(', 'lm(', ')lm', '&', ')lm', ')lm', 'lm(', 'The', 'lm(', 'The', 'lm(', 'The', 'lm(', ')lm', 'The', 'lm(', ')lm', ')lm', 'The', 'lm(', ')lm', ')lm', 'The', 'lm(']",False
2109,visit Center for Colorado Women’s History first while avoiding Byers-Evans House then visit Byers-Evans House while avoiding Pints Pub then visit Pints Pub while avoiding Denver Art Museum Administration Building then visit Denver Art Museum Administration Building,& U ! byers-evans_house center_for_colorado_women’s_history & U ! pints_pub byers-evans_house & U ! denver_art_museum_administration_building pints_pub F denver_art_museum_administration_building,Denver #1,"error:['&', '&', 'U', '!', 'lm(', 'Byers-Evans', ')lm', ')lm', 'lm(', 'Center', ')lm', 'Center', ')lm', '!', 'lm(', '!', 'Byers-Evans', ')lm', ')lm', 'avoiding', 'lm(', 'lm(', 'avoiding', 'avoiding', 'avoiding', ')lm', ')lm', 'F', 'lm(', 'lm(', ')lm', ')lm', ')lm', ')lm', ')lm', ')lm', ')lm', ')lm', ')lm', ')lm', ')lm', ')lm', '!', 'lm(', '!', 'lm(', 'Byers-Evans', ')lm', ')lm', ')lm', 'Byers-Evans', ')lm', ')lm', 'avoiding', 'Byers-Evans', 'avoiding', '!', 'lm(', 'Byers-Evans', 'avoiding', 'Byers-Evans', 'avoiding', 'U', 'avoiding', '!', 'avoiding', 'Byers-Evans', 'avoiding', 'U', 'avoiding', 'avoiding', 'avoiding', 'U', 'avoiding', 'avoiding', 'avoiding', ')lm', 'avoiding', ')lm', 'avoiding', ')lm', 'avoiding', ')lm', 'avoiding', ')lm', 'avoiding', ')lm', 'avoiding', ')lm', ')lm', 'avoiding', ')lm', ')lm', 'Building', ')lm', 'avoiding', ')lm', ')lm']",False
2110,go to the Art Hotel only after that go to Rendezvous Cafe only then go to Clyfford Still Museum and only then go to Center for Colorado Women’s History,& U ! rendezvous_cafe the_art_hotel & U ! clyfford_still_museum rendezvous_cafe & U ! center_for_colorado_women’s_history clyfford_still_museum F center_for_colorado_women’s_history,Denver #1,"error:['&', '&', 'U', '!', 'lm(', 'Rendezvous', 'Cafe', ')lm', 'lm(', 'the', 'Art', 'the', 'Hotel', ')lm', '&', 'U', '!', 'lm(', 'Clyfford', 'Clyfford', ')lm', 'lm(', 'Rendezvous', 'Cafe', ')lm', '&', 'U', '!', 'lm(', 'lm(', 'Center', ')lm', 'lm(', 'lm(', 'Clyfford', 'Still', ')lm', 'F', 'F', 'lm(', 'Center', ')lm', 'F', ')lm', ')lm', ')lm', ')lm', ')lm', ')lm', ')lm', ')lm', 'the', ')lm', ')lm', 'the', ')lm', ')lm', ')lm', 'lm(', 'the', 'Art', ')lm', 'lm(', 'lm(', 'the', 'Hotel', ')lm', 'lm(', 'lm(', 'Cafe', ')lm', 'U', 'lm(', 'U', ')lm', 'Cafe', ')lm', 'Cafe', ')lm', 'Cafe', ')lm', 'U', 'lm(', 'Rendezvous', 'Cafe', ')lm', 'lm(', 'Cafe', ')lm', 'U', '!', 'lm(', 'Cafe', ')lm', 'lm(', 'to', 'lm(', ')lm', 'to', ')lm', ')lm', 'to', 'lm(', ')lm', 'Clyfford', 'lm(', ')lm', ')lm', ')lm', ')lm', ')lm', ')lm', ')lm', 'Center', 'Clyfford', ')lm', ')lm', ')lm', ')lm', 'Center', ')lm', ')lm', ')lm', ')lm', 'Center', ')lm', ')lm', ')lm', ')lm', 'Center', ')lm', ')lm', ')lm', 'Center', ')lm', ')lm', ')lm', ')lm', 'Center', ')lm', ')lm', ')lm', ')lm', 'Center', ')lm']",False
2111,go to Security Life Center Building only after that go to Byers-Evans House only then go to Cultural Complex Parking & Museum Residences and only then go to Eviva Cherokee,& U ! byers-evans_house security_life_center_building & U ! cultural_complex_parking_&_museum_residences byers-evans_house & U ! eviva_cherokee cultural_complex_parking_&_museum_residences F eviva_cherokee,Denver #1,"error:['&', '&', 'U', '!', 'lm(', 'Building', ')lm', 'lm(', 'Security', 'Life', 'Building', ')lm', '&', 'U', '!', 'lm(', 'Cultural', 'Cultural', ')lm', 'lm(', 'Building', ')lm', '&', 'U', '!', 'lm(', '!', '!', 'lm(', 'lm(', ')lm', ')lm', ')lm', ')lm', ')lm', 'lm(', ')lm', ')lm', 'lm(', ')lm', 'lm(', ')lm', ')lm', 'lm(', ')lm', 'Museum', 'lm(', ')lm', ')lm', ')lm', ')lm', ')lm', ')lm', ')lm', ')lm', 'lm(', 'Center', ')lm', ')lm', 'Center', ')lm', 'lm(', 'Center', 'Center', ')lm', 'lm(', 'lm(', 'Center', ')lm', 'lm(', 'lm(', 'Center', ')lm', 'lm(', 'lm(', ')lm', ')lm', 'Building', ')lm', 'lm(', 'U', 'lm(', ')lm', ')lm', 'lm(', 'Building', ')lm', 'lm(', 'Byers-Evans', 'lm(', ')lm', 'Byers-Evans', 'lm(', ')lm', 'lm(', 'Cultural', 'lm(', 'Cultural', 'lm(', 'Cultural', 'lm(', 'Cultural', 'lm(', ')lm', 'Cultural', 'lm(', ')lm', 'lm(', 'U', 'lm(', 'Cultural', 'lm(', ')lm', 'lm(', 'lm(', ')lm', 'lm(', ')lm', 'lm(', ')lm', ')lm', ')lm', ')lm', 'lm(', ')lm', ')lm', ')lm', 'Museum', 'lm(', ')lm', ')lm', ')lm', ')lm', 'Museum', 'lm(', ')lm', ')lm', ')lm', ')lm', ')lm', ')lm', ')lm', ')lm', 'Museum', 'lm(', ')lm', ')lm', ')lm', ')lm', ')lm', ')lm']",False
2112,go to Native American Trading Company but not through the Art Hotel North Entry Terrace Pints Pub or Broadway & 13th Ave and then go to the Art Hotel but not through North Entry Terrace Pints Pub or Broadway & 13th Ave and then go to North Entry Terrace but not through Pints Pub or Broadway & 13th Ave and then go to Pints Pub but not through Broadway & 13th Ave and finally go to Broadway & 13th Ave,& U ! the_art_hotel native_american_trading_company & U ! north_entry_terrace the_art_hotel & U ! pints_pub north_entry_terrace & U ! broadway_&_13th_ave pints_pub F broadway_&_13th_ave,Denver #1,"error:['&', '&', 'U', '!', 'lm(', 'the', 'Art', 'the', 'lm(', 'lm(', 'Native', 'American', 'American', ')lm', ')lm', '&', 'lm(', 'lm(', 'lm(', ')lm', ')lm', 'lm(', 'lm(', 'the', 'the', 'the', ')lm', ')lm', 'lm(', 'lm(', 'lm(', '&', 'the', ')lm', ')lm', 'lm(', 'lm(', 'lm(', '&', ')lm', ')lm', 'lm(', 'lm(', ')lm', '&', ')lm', ')lm', 'lm(', 'lm(', ')lm', ')lm', ')lm', 'lm(', 'lm(', 'the', ')lm', ')lm', 'the', 'U', 'lm(', 'the', 'Art', 'the', 'U', ')lm', 'the', 'Art', 'the', 'the', ')lm', 'the', 'U', 'the', 'the', 'the', ')lm', 'the', 'U', 'the', 'the', 'the', ')lm', 'the', 'the', '&', ')lm', 'the', 'the', ')lm', 'the', 'U', 'the', ')lm', 'the', ')lm', 'the', '&', ')lm', ')lm', 'the', ')lm', ')lm', ')lm', ')lm', ')lm', '&', ')lm']",False
2113,go to Golden Triangle but not through Denver Art Museum Administration Building Byers-Evans House Broadway & 13th Ave or Rendezvous Cafe and then go to Denver Art Museum Administration Building but not through Byers-Evans House Broadway & 13th Ave or Rendezvous Cafe and then go to Byers-Evans House but not through Broadway & 13th Ave or Rendezvous Cafe and then go to Broadway & 13th Ave but not through Rendezvous Cafe and finally go to Rendezvous Cafe,& U ! denver_art_museum_administration_building golden_triangle & U ! byers-evans_house denver_art_museum_administration_building & U ! broadway_&_13th_ave byers-evans_house & U ! rendezvous_cafe broadway_&_13th_ave F rendezvous_cafe,Denver #1,"error:['&', 'U', 'U', '!', 'lm(', 'Art', ')lm', ')lm', 'lm(', 'Golden', 'Triangle', ')lm', '&', 'U', '!', 'lm(', '!', 'Building', ')lm', 'lm(', 'lm(', 'Building', ')lm', 'Art', '&', 'Cafe', ')lm', ')lm', ')lm', 'Cafe', ')lm', ')lm', 'lm(', ')lm', 'Cafe', ')lm', 'F', 'Cafe', ')lm', 'Cafe', ')lm', ')lm', 'Cafe', ')lm', ')lm', 'lm(', ')lm', ')lm', ')lm', 'lm(', 'lm(', ')lm', 'Cafe', ')lm', ')lm', 'lm(', ')lm', ')lm', 'lm(', 'Art', 'Art', ')lm', ')lm', 'lm(', 'Art', 'Art', ')lm', ')lm', 'Art', 'Art', 'Art', ')lm', ')lm', 'Art', 'Museum', 'Building', ')lm', ')lm', 'lm(', 'Art', 'Museum', 'Museum', 'Building', ')lm', 'Cafe', ')lm', 'lm(', 'U', '!', 'lm(', 'Building', ')lm', 'lm(', 'Building', ')lm', 'lm(', 'Building', ')lm', '&', ')lm', '&', ')lm', 'lm(', '&', ')lm', 'lm(', '&', ')lm', ')lm', 'Cafe', ')lm']",False
2114,only after you visit Center for Colorado Women’s History you can go to Four Winds Interactive only after you visit Four Winds Interactive you can go to Dozens only after you visit Dozens you can go to Clyfford Still Museum only after you visit Clyfford Still Museum you can go to History Colorado Center,& U ! four_winds_interactive center_for_colorado_women’s_history & U ! dozens four_winds_interactive & U ! clyfford_still_museum dozens & U ! history_colorado_center clyfford_still_museum F history_colorado_center,Denver #1,"error:['&', 'U', '!', 'lm(', 'lm(', ')lm', ')lm', 'Center', ')lm', 'lm(', 'lm(', 'Center', ')lm', 'Center', ')lm', ')lm', 'lm(', 'Interactive', 'Interactive', ')lm', ')lm', ')lm', 'lm(', ')lm', ')lm', ')lm', ')lm', ')lm', ')lm', ')lm', ')lm', ')lm', ')lm', ')lm', ')lm', 'Four', ')lm', ')lm', ')lm', ')lm', 'Four', ')lm', ')lm', ')lm', ')lm', 'Four', 'Winds']",False
2115,only after you visit the Art Hotel you can go to Broadway & 13th Ave only after you visit Broadway & 13th Ave you can go to Ralph L. Carr Colorado Judicial Center only after you visit Ralph L. Carr Colorado Judicial Center you can go to Eviva Cherokee only after you visit Eviva Cherokee you can go to Cultural Complex Parking & Museum Residences,& U ! broadway_&_13th_ave the_art_hotel & U ! ralph_l._carr_colorado_judicial_center broadway_&_13th_ave & U ! eviva_cherokee ralph_l._carr_colorado_judicial_center & U ! cultural_complex_parking_&_museum_residences eviva_cherokee F cultural_complex_parking_&_museum_residences,Denver #1,"error:['&', '&', '!', '!', 'lm(', '13th', ')lm', 'lm(', 'lm(', 'Art', 'the', 'the', ')lm', ')lm', '&', 'U', '!', 'lm(', '!', ')lm', ')lm', 'lm(', '&', 'Ave', 'Ave', ')lm', 'F', 'lm(', 'lm(', 'lm(', ')lm', ')lm', ')lm', ')lm', ')lm', ')lm', ')lm', ')lm', ')lm', ')lm']",False
2116,visit Bcycle @ Denver Public Library then Denver Art Museum Administration Building then Denver Art Museum then Denver Art Museum Frederick C. Hamilton Building then Security Life Center Building while ensuring not to visit Denver Art Museum Administration Building before Bcycle @ Denver Public Library not to visit Denver Art Museum before Denver Art Museum Administration Building not to visit Denver Art Museum Frederick C. Hamilton Building before Denver Art Museum not to visit Security Life Center Building before Denver Art Museum Frederick C. Hamilton Building,& U ! denver_art_museum_administration_building bcycle_@_denver_public_library & U ! denver_art_museum denver_art_museum_administration_building & U ! denver_art_museum_frederick_c._hamilton_building denver_art_museum & U ! security_life_center_building denver_art_museum_frederick_c._hamilton_building F security_life_center_building,Denver #1,"error:['&', 'U', '!', 'lm(', 'Denver', 'Art', ')lm', 'lm(', 'Bcycle', 'Bcycle', '@', 'Denver', 'Library', ')lm', '&', 'U', '!', 'lm(', 'Administration', 'Building', ')lm', 'lm(', 'Denver', 'Art', ')lm', '&', 'U', '!', 'lm(', 'lm(', 'St', ')lm', 'lm(', 'lm(', ')lm', '@', 'Administration', 'Building', ')lm', ')lm', 'lm(', 'lm(', ')lm', ')lm', 'Center', 'Building', ')lm', 'lm(', ')lm', ')lm', ')lm', 'Center', 'Building', ')lm', ')lm', 'Building', ')lm', ')lm', ')lm', 'Center', 'Building', ')lm', ')lm', ')lm', ')lm', ')lm', ')lm', ')lm', ')lm', ')lm', ')lm', ')lm', ')lm', ')lm', ')lm', ')lm', ')lm', '@', ')lm', ')lm', 'Building', 'Denver', 'Art', 'Art', 'Art', ')lm', 'Building', ')lm', 'Building', ')lm', ')lm', 'Building', ')lm', 'Art', 'Art', 'Art', ')lm', 'Building', ')lm', 'Building', ')lm', 'Building', ')lm', 'Building', 'Building', ')lm', 'Building', 'Building', 'Building', 'Building', 'Building', 'Building', 'Building', 'Building', 'Building', ')lm', 'Building', 'Building', ')lm', 'Building', 'Building', ')lm', 'Building', ')lm', 'Building', ')lm', ')lm', 'Building', ')lm', ')lm', 'Building', ')lm', ')lm', 'Building', ')lm', ')lm', ')lm', 'Building', ')lm', ')lm', ')lm', 'Building', ')lm', ')lm', ')lm', 'Building', ')lm', ')lm', ')lm', 'Building', ')lm', ')lm', ')lm', 'Building', ')lm', ')lm', ')lm', 'Building', ')lm', ')lm', 'Building', ')lm', ')lm', 'Building', ')lm']",False
2117,visit Denver Public Library then Denver Art Museum Frederick C. Hamilton Building then the Art Hotel then The Balustrade Condos then Broadway & 13th Ave while ensuring not to visit Denver Art Museum Frederick C. Hamilton Building before Denver Public Library not to visit the Art Hotel before Denver Art Museum Frederick C. Hamilton Building not to visit The Balustrade Condos before the Art Hotel not to visit Broadway & 13th Ave before The Balustrade Condos,& U ! denver_art_museum_frederick_c._hamilton_building denver_public_library & U ! the_art_hotel denver_art_museum_frederick_c._hamilton_building & U ! the_balustrade_condos the_art_hotel & U ! broadway_&_13th_ave the_balustrade_condos F broadway_&_13th_ave,Denver #1,"error:['&', 'U', '!', 'lm(', 'The', ')lm', ')lm', 'lm(', 'Library', ')lm', '&', 'U', '!', 'lm(', 'The', 'Building', ')lm', 'lm(', 'Denver', 'Art', ')lm', ')lm', 'U', '!', 'lm(', 'The', 'Balustrade', ')lm', 'lm(', 'The', 'Building', ')lm', '&', 'U', '!', 'lm(', '&', '&', ')lm', 'lm(', 'The', ')lm', ')lm', 'F', 'lm(', '&', '&', ')lm']",False
