,nl_command,ltl,map_name,result,eq
7400,do not visit Elizabeth Billiards until you visit Nova's Bakery visit Nova's Bakery only once do not visit Nova's Bakery until you visit CVS visit CVS only once do not visit CVS until you visit Zada Jane's visit Zada Jane's only once do no visit Zada Jane's until you visit Diamond Restaurant visit Diamond Restaurant only once,& & U ! zada_jane's diamond_restaurant & U ! cvs zada_jane's & U ! nova's_bakery cvs & U ! elizabeth_billiards nova's_bakery F elizabeth_billiards & U ! diamond_restaurant U diamond_restaurant U ! diamond_restaurant zada_jane's & U ! zada_jane's U zada_jane's U ! zada_jane's cvs & U ! cvs U cvs U ! cvs nova's_bakery U ! nova's_bakery U nova's_bakery U ! nova's_bakery elizabeth_billiards,Charlotte #2,"error:['&', '&', 'U', '!', 'lm(', 'lm(', ')lm', 'Restaurant', ')lm', 'lm(', 'Diamond', 'Restaurant', ')lm', 'F', 'lm(', '!', 'lm(', ""Nova's"", 'Bakery', ')lm', ')lm', 'lm(', 'lm(', 'lm(', ')lm', ')lm', ')lm', 'lm(', 'lm(', ""Nova's"", ')lm', ')lm', ')lm', 'Restaurant', ""Nova's"", ')lm', ')lm', 'Restaurant', 'Restaurant', ')lm', ')lm', 'lm(', 'Restaurant', 'Restaurant', 'Restaurant', ')lm', 'lm(', 'lm(', 'Restaurant', 'Restaurant', 'Restaurant', ')lm', ')lm', ')lm', 'Restaurant', 'Restaurant']",False
7401,do not visit Elizabeth Billiards until you visit Diamond Restaurant visit Diamond Restaurant only once do not visit Diamond Restaurant until you visit The Plaza Post Office visit The Plaza Post Office only once do not visit The Plaza Post Office until you visit Public Library of Charlotte and Mecklenburg County - Plaza Midwood Branch visit Public Library of Charlotte and Mecklenburg County - Plaza Midwood Branch only once do no visit Public Library of Charlotte and Mecklenburg County - Plaza Midwood Branch until you visit Common Market visit Common Market only once,& & U ! public_library_of_charlotte_and_mecklenburg_county_-_plaza_midwood_branch common_market & U ! the_plaza_post_office public_library_of_charlotte_and_mecklenburg_county_-_plaza_midwood_branch & U ! diamond_restaurant the_plaza_post_office & U ! elizabeth_billiards diamond_restaurant F elizabeth_billiards & U ! common_market U common_market U ! common_market public_library_of_charlotte_and_mecklenburg_county_-_plaza_midwood_branch & U ! public_library_of_charlotte_and_mecklenburg_county_-_plaza_midwood_branch U public_library_of_charlotte_and_mecklenburg_county_-_plaza_midwood_branch U ! public_library_of_charlotte_and_mecklenburg_county_-_plaza_midwood_branch the_plaza_post_office & U ! the_plaza_post_office U the_plaza_post_office U ! the_plaza_post_office diamond_restaurant U ! diamond_restaurant U diamond_restaurant U ! diamond_restaurant elizabeth_billiards,Charlotte #2,"error:['&', '&', 'U', '!', 'lm(', 'The', ')lm', ')lm', 'lm(', 'The', ')lm', 'Restaurant', ')lm', '&', 'U', 'lm(', 'lm(', 'The', 'lm(', ')lm', 'lm(', 'The', 'Restaurant', ')lm', 'F', 'lm(', '!', 'lm(', '-', 'St', ')lm', ')lm', ')lm', 'lm(', 'The', 'Restaurant', ')lm', 'F', 'lm(', ')lm', ')lm', 'Restaurant', ')lm', ')lm', ')lm', 'lm(', 'Restaurant', 'Restaurant', ')lm', 'Restaurant', ')lm', 'lm(', 'Restaurant', 'Restaurant', ')lm', ')lm', 'lm(', 'Restaurant', 'Restaurant', ')lm', 'Restaurant', ')lm', 'The', ')lm', ')lm', 'Restaurant', ')lm', 'Restaurant', ')lm', 'Restaurant', ')lm', 'The', ')lm', ')lm', 'Restaurant', ')lm', 'The', 'lm(', 'The', ')lm', ')lm', ')lm', 'The', ')lm', ')lm', 'The', ')lm', ')lm', ')lm', 'The', ')lm', ')lm', ')lm', ')lm', 'lm(', 'The', ')lm', ')lm', ')lm', ')lm', ')lm', ')lm', 'Restaurant', ')lm', 'lm(', 'The', ')lm', ')lm', ')lm', ')lm', ')lm', 'Restaurant', ')lm', 'lm(', ')lm', ')lm']",False
7402,don not stop visiting Public Library of Charlotte and Mecklenburg County - Plaza Midwood Branch Zada Jane's and Diamond Restaurant,& & U ! zada_jane's public_library_of_charlotte_and_mecklenburg_county_-_plaza_midwood_branch & U ! diamond_restaurant zada_jane's & U ! the_plaza_post_office diamond_restaurant & U ! commonwealth_animal_hospital the_plaza_post_office F commonwealth_animal_hospital & U ! public_library_of_charlotte_and_mecklenburg_county_-_plaza_midwood_branch U public_library_of_charlotte_and_mecklenburg_county_-_plaza_midwood_branch U ! public_library_of_charlotte_and_mecklenburg_county_-_plaza_midwood_branch zada_jane's & U ! zada_jane's U zada_jane's U ! zada_jane's diamond_restaurant & U ! diamond_restaurant U diamond_restaurant U ! diamond_restaurant the_plaza_post_office U ! the_plaza_post_office U the_plaza_post_office U ! the_plaza_post_office commonwealth_animal_hospital,Charlotte #2,"error:['&', 'G', 'F', 'lm(', 'Public', 'Library', 'Library', 'of', 'Library', ')lm', '&', 'G', 'F', 'lm(', 'Mecklenburg', 'County', '-', 'Plaza', ')lm', ')lm', 'F', 'F', 'lm(', 'Diamond', 'Restaurant', ')lm']",False
7403,don not stop visiting Harris Teeter Dish and The Plaza Post Office,& & U ! dish harris_teeter & U ! the_plaza_post_office dish & U ! public_library_of_charlotte_and_mecklenburg_county_-_plaza_midwood_branch the_plaza_post_office & U ! commonwealth_animal_hospital public_library_of_charlotte_and_mecklenburg_county_-_plaza_midwood_branch F commonwealth_animal_hospital & U ! harris_teeter U harris_teeter U ! harris_teeter dish & U ! dish U dish U ! dish the_plaza_post_office & U ! the_plaza_post_office U the_plaza_post_office U ! the_plaza_post_office public_library_of_charlotte_and_mecklenburg_county_-_plaza_midwood_branch U ! public_library_of_charlotte_and_mecklenburg_county_-_plaza_midwood_branch U public_library_of_charlotte_and_mecklenburg_county_-_plaza_midwood_branch U ! public_library_of_charlotte_and_mecklenburg_county_-_plaza_midwood_branch commonwealth_animal_hospital,Charlotte #2,& G F the_plaza_post_office )lm G F F The elizabeth_billiards lm( Plaza F,False
7404,before visiting Zada Jane's Common Market Wells Fargo and The Plaza Post Office visit CVS and never visit it again then visit Zada Jane's before Common Market Wells Fargo and The Plaza Post Office and never visit it again do not visit Wells Fargo and The Plaza Post Office until you visit Common Market never visit Common Market again then visit Wells Fargo before The Plaza Post Office and never visit The Plaza Post Office again finally visit The Plaza Post Office,& & U ! zada_jane's cvs & U ! common_market zada_jane's & U ! wells_fargo common_market & U ! the_plaza_post_office wells_fargo F the_plaza_post_office & U ! cvs U cvs U ! cvs zada_jane's & U ! zada_jane's U zada_jane's U ! zada_jane's common_market & U ! common_market U common_market U ! common_market wells_fargo U ! wells_fargo U wells_fargo U ! wells_fargo the_plaza_post_office,Charlotte #2,"error:['&', '&', 'U', '!', 'lm(', 'The', ')lm', ')lm', 'lm(', 'Common', ""Jane's"", ')lm', '&', 'U', '!', 'lm(', 'The', ')lm', ')lm', 'lm(', 'Wells', 'Fargo', ')lm', 'F', 'lm(', 'The', 'The', ')lm', 'The', ')lm', '!', 'lm(', 'The', 'lm(', ')lm']",False
7405,before visiting Public Library of Charlotte and Mecklenburg County - Plaza Midwood Branch The Plaza Post Office Nova's Bakery and Elizabeth Billiards visit Wells Fargo and never visit it again then visit Public Library of Charlotte and Mecklenburg County - Plaza Midwood Branch before The Plaza Post Office Nova's Bakery and Elizabeth Billiards and never visit it again do not visit Nova's Bakery and Elizabeth Billiards until you visit The Plaza Post Office never visit The Plaza Post Office again then visit Nova's Bakery before Elizabeth Billiards and never visit Elizabeth Billiards again finally visit Elizabeth Billiards,& & U ! public_library_of_charlotte_and_mecklenburg_county_-_plaza_midwood_branch wells_fargo & U ! the_plaza_post_office public_library_of_charlotte_and_mecklenburg_county_-_plaza_midwood_branch & U ! nova's_bakery the_plaza_post_office & U ! elizabeth_billiards nova's_bakery F elizabeth_billiards & U ! wells_fargo U wells_fargo U ! wells_fargo public_library_of_charlotte_and_mecklenburg_county_-_plaza_midwood_branch & U ! public_library_of_charlotte_and_mecklenburg_county_-_plaza_midwood_branch U public_library_of_charlotte_and_mecklenburg_county_-_plaza_midwood_branch U ! public_library_of_charlotte_and_mecklenburg_county_-_plaza_midwood_branch the_plaza_post_office & U ! the_plaza_post_office U the_plaza_post_office U ! the_plaza_post_office nova's_bakery U ! nova's_bakery U nova's_bakery U ! nova's_bakery elizabeth_billiards,Charlotte #2,"error:['&', '&', 'U', '!', 'lm(', 'The', ')lm', ')lm', 'lm(', 'The', 'Library', ')lm', '&', 'U', '!', 'lm(', 'The', 'Plaza', ')lm', 'lm(', 'The', 'and', '-', 'Plaza', ')lm', ')lm', '&', 'U', '!', 'lm(', 'Elizabeth', ""Nova's"", 'lm(', 'lm(', 'lm(', 'The', 'The', ')lm', 'F', 'lm(', 'lm(', 'Elizabeth', ')lm']",False
7406,go to Zada Jane's but keep avoiding Wells Fargo and once you have been to Zada Jane's go to Wells Fargo,& U ! wells_fargo zada_jane's F wells_fargo,Charlotte #2,"error:['G', 'i', 'lm(', ""Jane's"", ""Jane's"", ')lm', 'F', 'lm(', 'lm(', 'lm(', 'Zada', ')lm', ')lm', '&', 'lm(', 'lm(', 'Zada', 'Wells', ')lm', ')lm', 'F', 'lm(', 'lm(', 'Zada', 'avoiding', ')lm', ')lm', 'F', 'lm(', 'lm(', 'Zada', ""Jane's"", ')lm', ')lm', 'lm(', 'lm(', 'lm(', 'Zada', ""Jane's"", ')lm', ')lm', 'lm(', 'lm(', 'lm(', 'Wells', ')lm', ')lm', ')lm', 'lm(', 'lm(', 'Zada', ""Jane's"", 'avoiding', ')lm', ')lm', 'lm(', 'lm(', 'Zada', ""Jane's"", 'avoiding']",False
7407,go to Harris Teeter but keep avoiding CVS and once you have been to Harris Teeter go to CVS,& U ! cvs harris_teeter F cvs,Charlotte #2,"error:['G', 'i', 'lm(', 'Teeter', 'Teeter', ')lm', 'F', 'lm(', '!', 'lm(', 'Harris', ')lm', ')lm', 'F', 'lm(', 'lm(', 'lm(', 'Harris', ')lm', ')lm', ')lm', 'lm(', 'lm(', 'Harris', 'Teeter', ')lm', ')lm', '!', 'lm(', 'lm(', 'Harris', 'Teeter', ')lm', ')lm', 'lm(', 'lm(', 'lm(', 'Harris', 'Teeter', ')lm', ')lm', 'lm(', 'lm(', 'lm(', 'Harris', 'Teeter']",False
7408,you must visit Public Library of Charlotte and Mecklenburg County - Plaza Midwood Branch first before going to Wells Fargo,& U ! wells_fargo public_library_of_charlotte_and_mecklenburg_county_-_plaza_midwood_branch F wells_fargo,Charlotte #2,"error:['&', 'U', '!', 'lm(', 'County', 'County', '-', 'Plaza', ')lm', 'lm(', 'lm(', 'lm(', 'Library', 'of', 'of', ')lm', ')lm', 'F', 'lm(', 'County', 'lm(', '-', 'St', ')lm', ')lm', ')lm', 'lm(', 'lm(', 'Library', 'Library', ')lm', ')lm', ')lm', 'U']",False
7409,you must visit Common Market first before going to Public Library of Charlotte and Mecklenburg County - Plaza Midwood Branch,& U ! public_library_of_charlotte_and_mecklenburg_county_-_plaza_midwood_branch common_market F public_library_of_charlotte_and_mecklenburg_county_-_plaza_midwood_branch,Charlotte #2,"error:['&', 'U', '!', 'lm(', 'Library', 'Library', 'of', 'Charlotte', ')lm', 'lm(', 'lm(', 'lm(', ')lm', ')lm', ')lm', 'lm(', 'lm(', 'lm(', 'of', 'Charlotte', 'of', 'of', 'Charlotte', ')lm', ')lm', 'lm(', 'lm(', 'lm(', 'Public', 'Library', 'of', 'Library', ')lm']",False
7410,go to CVS but do not go to CVS until you go to Wells Fargo first,& U ! cvs wells_fargo F cvs,Charlotte #2,"error:['U', '!', 'lm(', 'lm(', ')lm', ')lm', 'lm(', 'lm(', 'CVS', 'lm(', 'lm(', ')lm', ')lm', ')lm', 'CVS', ')lm', 'CVS', ')lm', 'CVS', ')lm']",False
7411,go to Common Market but do not go to Common Market until you go to CVS first,& U ! common_market cvs F common_market,Charlotte #2,"error:['&', 'U', 'lm(', 'lm(', 'Common', 'Common', 'Common', 'lm(', 'lm(', 'lm(', 'Common', ')lm', ')lm', ')lm', 'lm(', 'Common', 'Market', ')lm', ')lm', ')lm', ')lm', 'lm(', ')lm', ')lm', ')lm', ')lm']",False
7412,first go to Zada Jane's then go to Commonwealth Animal Hospital only after Zada Jane's,& U ! commonwealth_animal_hospital zada_jane's F commonwealth_animal_hospital,Charlotte #2,"error:['&', 'U', '!', 'lm(', 'Commonwealth', ')lm', ')lm', 'lm(', 'lm(', 'Zada', ')lm', ')lm', 'F', 'lm(', 'Commonwealth', 'Commonwealth', 'Animal', ')lm', ')lm', 'F', 'lm(', 'lm(', ')lm', ')lm', ')lm']",False
7413,first go to Nova's Bakery then go to The Plaza Post Office only after Nova's Bakery,& U ! the_plaza_post_office nova's_bakery F the_plaza_post_office,Charlotte #2,"error:['&', 'U', '!', 'lm(', 'The', ')lm', ')lm', 'lm(', 'lm(', ""Nova's"", ')lm', ')lm', 'F', 'lm(', 'The', 'Plaza', 'Plaza', 'Post', 'Post', 'Post', 'Office', ')lm', ')lm', ')lm']",False
7414,go to Common Market after going to Public Library of Charlotte and Mecklenburg County - Plaza Midwood Branch do not go to Common Market before,& U ! common_market public_library_of_charlotte_and_mecklenburg_county_-_plaza_midwood_branch F common_market,Charlotte #2,"error:['&', 'U', '!', 'lm(', 'lm(', 'Library', ')lm', 'lm(', 'lm(', 'lm(', 'lm(', 'Public', 'Library', 'of', 'Library', ')lm', ')lm', 'lm(', 'lm(', 'lm(', ')lm', ')lm', ')lm', 'lm(', 'lm(', 'lm(', ')lm', ')lm', ')lm', 'lm(', 'lm(', ')lm', ')lm', ')lm', ')lm', 'lm(', ')lm', ')lm', ')lm', ')lm', 'lm(', 'Library', 'Library', ')lm', 'Library', ')lm', 'Library', ')lm', 'Library', ')lm']",False
7415,go to The Plaza Post Office after going to Public Library of Charlotte and Mecklenburg County - Plaza Midwood Branch do not go to The Plaza Post Office before,& U ! the_plaza_post_office public_library_of_charlotte_and_mecklenburg_county_-_plaza_midwood_branch F the_plaza_post_office,Charlotte #2,"error:['&', 'U', '!', 'lm(', 'The', ')lm', ')lm', 'lm(', 'lm(', 'Library', 'of', 'of', ')lm', ')lm', 'lm(', 'lm(', 'lm(', 'The', 'The', 'lm(', ')lm', ')lm', 'The', 'lm(', 'The', 'lm(', ')lm', ')lm', ')lm', 'The', 'lm(', ')lm', ')lm', ')lm', ')lm', ')lm', ')lm']",False
7416,head to The Plaza Post Office first and then to Wells Fargo but do not visit Wells Fargo if you have not been to The Plaza Post Office,& U ! wells_fargo the_plaza_post_office F wells_fargo,Charlotte #2,"error:['F', '&', 'U', 'lm(', 'The', ')lm', ')lm', 'F', 'lm(', 'The', ')lm', ')lm', 'F', 'lm(', 'Wells', 'Wells', ')lm', ')lm', ')lm', '!', 'lm(', 'The', ')lm', ')lm', ')lm', 'lm(', 'lm(', 'The', ')lm', ')lm']",False
7417,head to Harris Teeter first and then to Commonwealth Animal Hospital but do not visit Commonwealth Animal Hospital if you have not been to Harris Teeter,& U ! commonwealth_animal_hospital harris_teeter F commonwealth_animal_hospital,Charlotte #2,"error:['F', '&', 'lm(', 'lm(', 'lm(', ')lm', ')lm', 'lm(', 'lm(', 'Harris', 'Teeter', ')lm', ')lm', 'lm(', 'lm(', 'Commonwealth', ')lm', ')lm', 'Commonwealth', ')lm', 'Commonwealth', 'lm(', ')lm', ')lm']",False
7418,visit The Plaza Post Office an infinite number of times,G F the_plaza_post_office,Charlotte #2,"error:['G', 'F', 'lm(', 'The', ')lm', ')lm', 'G', 'G', 'lm(', 'The', 'Plaza', ')lm', 'G']",False
7419,visit Nova's Bakery an infinite number of times,G F nova's_bakery,Charlotte #2,G F dairy_queen G G G G nova's_bakery,False
7420,make sure at any point in time you will visit CVS at least once in the future,G F cvs,Charlotte #2,"error:['G', 'i', 'lm(', 'lm(', 'St', ')lm', 'F', 'F', 'lm(', 'lm(', 'lm(', ')lm', ')lm', ')lm', 'F', 'lm(', 'lm(', 'CVS', ')lm', ')lm']",False
7421,make sure at any point in time you will visit Dish at least once in the future,G F dish,Charlotte #2,"error:['G', 'i', 'lm(', 'lm(', 'St', ')lm', 'F', 'F', 'lm(', 'lm(', 'lm(', ')lm', ')lm', ')lm', 'F', 'lm(', 'lm(', 'Dish', ')lm', ')lm']",False
7422,keep visiting Subway,G F subway,Charlotte #2,G F subway,True
7423,keep visiting CVS,G F cvs,Charlotte #2,G F cvs,True
7424,keep going to Zada Jane's,G F zada_jane's,Charlotte #2,G F zada_jane's,True
7425,keep going to CVS,G F cvs,Charlotte #2,"error:['G', 'F', 'lm(', 'CVS', ')lm', ')lm']",False
7426,make sure you frequent Common Market infinitely,G F common_market,Charlotte #2,G F common_market,True
7427,make sure you frequent Zada Jane's infinitely,G F zada_jane's,Charlotte #2,G F zada_jane's,True
7428,visit CVS The Plaza Post Office Public Library of Charlotte and Mecklenburg County - Plaza Midwood Branch and Commonwealth Animal Hospital in that specific order make sure not to visit waypoints out of turn,& U ! the_plaza_post_office cvs & U ! public_library_of_charlotte_and_mecklenburg_county_-_plaza_midwood_branch the_plaza_post_office & U ! commonwealth_animal_hospital public_library_of_charlotte_and_mecklenburg_county_-_plaza_midwood_branch F commonwealth_animal_hospital,Charlotte #2,"error:['&', 'U', '!', 'lm(', 'The', ')lm', ')lm', 'lm(', 'The', ')lm', ')lm', '&', 'U', '!', 'lm(', 'lm(', ')lm', ')lm', 'lm(', 'Office', 'Library', 'Library', ')lm', 'Library', ')lm', 'Office', 'Library', 'Library', 'Library', ')lm', ')lm', ')lm', '!', 'Library', 'Library', ')lm', ')lm', ')lm', 'lm(', 'lm(', 'County', 'County', 'lm(', ')lm', ')lm', 'lm(', 'lm(', 'County', 'lm(', '-', 'Midwood', ')lm']",False
7429,visit Subway Harris Teeter Wells Fargo and The Plaza Post Office in that specific order make sure not to visit waypoints out of turn,& U ! harris_teeter subway & U ! wells_fargo harris_teeter & U ! the_plaza_post_office wells_fargo F the_plaza_post_office,Charlotte #2,"error:['&', 'U', '!', 'lm(', 'The', ')lm', ')lm', 'lm(', 'lm(', 'Harris', ')lm', ')lm', ')lm', ')lm', 'lm(', 'lm(', 'The', 'lm(', ')lm', 'lm(', 'lm(', 'lm(', 'Plaza', 'Post', 'Post', ')lm', 'F', 'lm(', 'lm(']",False
7430,visit Dish without visiting Subway then visit Subway without visiting Diamond Restaurant then visit Diamond Restaurant without visiting Wells Fargo finally visit Wells Fargo,& U ! subway dish & U ! diamond_restaurant subway & U ! wells_fargo diamond_restaurant F wells_fargo,Charlotte #2,"error:['&', '&', 'U', '!', 'lm(', 'Restaurant', ')lm', 'lm(', 'lm(', 'St', ')lm', ')lm', 'Dish', ')lm', 'lm(', 'Restaurant', 'Restaurant', 'Restaurant', 'Restaurant', ')lm', 'lm(', 'lm(', ')lm', ')lm', ')lm', ')lm', 'lm(', 'lm(', 'lm(', ')lm', ')lm', ')lm', ')lm', 'lm(', 'lm(', ')lm', ')lm', ')lm', ')lm', 'Restaurant', ')lm', ')lm', 'Restaurant', ')lm', ')lm', 'Restaurant', ')lm', ')lm', 'Restaurant', ')lm']",False
7431,visit Wells Fargo without visiting Commonwealth Animal Hospital then visit Commonwealth Animal Hospital without visiting Elizabeth Billiards then visit Elizabeth Billiards without visiting Dish finally visit Dish,& U ! commonwealth_animal_hospital wells_fargo & U ! elizabeth_billiards commonwealth_animal_hospital & U ! dish elizabeth_billiards F dish,Charlotte #2,"error:['&', '&', 'U', '!', 'lm(', 'Commonwealth', 'Animal', ')lm', 'lm(', 'lm(', 'Wells', ')lm', ')lm', 'lm(', ')lm', 'lm(', 'lm(', 'Commonwealth', ')lm', ')lm', 'F', 'lm(', 'lm(', 'lm(', ')lm', 'F', 'F', 'lm(', 'lm(', 'lm(', ')lm', ')lm', ')lm', 'lm(', 'lm(', 'lm(', 'lm(', ')lm', ')lm', ')lm', ')lm', 'lm(', ')lm', ')lm', ')lm', ')lm', 'Commonwealth', 'Commonwealth', ')lm', ')lm', 'Commonwealth', 'Commonwealth', 'Commonwealth', ')lm', ')lm', ')lm', 'Commonwealth', 'Commonwealth', 'Commonwealth', 'Commonwealth', ')lm', ')lm']",False
7432,visit Zada Jane's first while avoiding Elizabeth Billiards then visit Elizabeth Billiards while avoiding The Plaza Post Office then visit The Plaza Post Office while avoiding Diamond Restaurant then visit Diamond Restaurant,& U ! elizabeth_billiards zada_jane's & U ! the_plaza_post_office elizabeth_billiards & U ! diamond_restaurant the_plaza_post_office F diamond_restaurant,Charlotte #2,"error:['&', 'U', '!', 'lm(', 'lm(', 'Elizabeth', ')lm', ')lm', 'lm(', 'Zada', ""Jane's"", ')lm', ')lm', '&', '!', 'lm(', 'lm(', 'The', 'lm(', ')lm', 'lm(', 'The', 'The', 'The', ')lm', ')lm', 'The', 'lm(', '!', 'lm(', 'The', 'lm(', ')lm', 'Restaurant', ')lm', 'The', 'Restaurant', ')lm', 'Restaurant', 'Restaurant', 'Restaurant', 'Restaurant', 'Restaurant', ')lm', 'Restaurant', 'Restaurant', ')lm']",False
7433,visit Elizabeth Billiards first while avoiding Wells Fargo then visit Wells Fargo while avoiding Harris Teeter then visit Harris Teeter while avoiding Nova's Bakery then visit Nova's Bakery,& U ! wells_fargo elizabeth_billiards & U ! harris_teeter wells_fargo & U ! nova's_bakery harris_teeter F nova's_bakery,Charlotte #2,"error:['&', '&', 'U', '!', 'lm(', 'Wells', 'Fargo', ')lm', 'lm(', 'Elizabeth', 'Billiards', ')lm', '&', 'U', '!', 'lm(', 'lm(', 'St', ')lm', 'lm(', 'Wells', 'Fargo', ')lm', 'F', 'lm(', 'lm(', 'avoiding', ')lm', ')lm', ')lm', 'F', 'lm(', 'F', ')lm', ')lm', ')lm', ')lm', ')lm', ')lm', ')lm', ')lm', 'Wells', ')lm', ')lm', 'lm(', 'Wells', ')lm', ')lm', 'Wells', ')lm', ')lm', 'Wells', 'Wells', ')lm', 'Wells', 'Wells', ')lm', 'Wells', 'Wells', 'Fargo', ')lm', '!', '!', 'Wells', 'Fargo', 'Fargo', 'Fargo', ')lm']",False
7434,go to Diamond Restaurant only after that go to Common Market only then go to Harris Teeter and only then go to Zada Jane's,& U ! common_market diamond_restaurant & U ! harris_teeter common_market & U ! zada_jane's harris_teeter F zada_jane's,Charlotte #2,"error:['&', '&', 'U', '!', 'lm(', 'Common', 'Market', ')lm', 'lm(', 'Diamond', 'Restaurant', ')lm', '&', 'U', '!', 'lm(', 'Harris', 'Teeter', ')lm', 'lm(', 'Common', 'Market', ')lm', '&', 'U', '!', 'lm(', 'Zada', 'Zada', ')lm', 'lm(', 'lm(', 'lm(', 'Harris', ')lm', 'F', 'lm(', 'F', ')lm', 'F', ')lm']",False
7435,go to Elizabeth Billiards only after that go to Subway only then go to CVS and only then go to Dish,& U ! subway elizabeth_billiards & U ! cvs subway & U ! dish cvs F dish,Charlotte #2,"error:['&', '&', 'U', '!', 'lm(', 'Subway', ')lm', ')lm', 'lm(', 'Elizabeth', 'Billiards', ')lm', '&', 'U', '!', 'lm(', 'lm(', 'St', ')lm', 'lm(', 'lm(', 'Subway', 'CVS', ')lm', 'F', 'lm(', 'F', 'F', 'F', 'F', 'F', 'F', ')lm', ')lm', ')lm', ')lm', ')lm', ')lm', ')lm', 'Subway', ')lm', ')lm', 'lm(', ')lm', ')lm', 'Subway', ')lm', ')lm', 'lm(', 'Subway', 'Subway', 'Subway', ')lm', ')lm', ')lm', 'Subway', 'Subway', 'Subway', ')lm', ')lm', 'Subway', 'Subway', 'CVS', ')lm', ')lm', ')lm', 'Subway', 'CVS', 'CVS', 'U', ')lm', ')lm', 'CVS', 'CVS', 'CVS', ')lm', ')lm', ')lm']",False
7436,go to CVS but not through Dairy Queen Zada Jane's Subway or Common Market and then go to Dairy Queen but not through Zada Jane's Subway or Common Market and then go to Zada Jane's but not through Subway or Common Market and then go to Subway but not through Common Market and finally go to Common Market,& U ! dairy_queen cvs & U ! zada_jane's dairy_queen & U ! subway zada_jane's & U ! common_market subway F common_market,Charlotte #2,"error:['&', '&', 'U', '!', 'lm(', 'lm(', ')lm', ')lm', 'lm(', 'lm(', 'CVS', ')lm', 'Dairy', 'lm(', ')lm', ')lm', 'lm(', 'lm(', ')lm', ')lm', ')lm', ')lm', 'lm(', 'Queen', 'lm(', ')lm', ')lm', 'F', 'lm(', ')lm', ')lm', ')lm', ')lm', 'lm(', 'lm(', ')lm', ')lm', ')lm', 'lm(', ')lm', ')lm', 'lm(', 'Queen', 'lm(', ')lm', 'Queen', 'lm(', ')lm', 'lm(', 'Queen', ')lm', 'Queen', 'lm(', ')lm', 'Queen', 'Queen', ')lm', 'lm(', 'Queen', 'Queen', ')lm', ')lm', 'Queen', ')lm', 'Queen', ')lm', ')lm', 'Queen', 'Zada', ')lm', ')lm', 'Zada', ')lm', ')lm']",False
7437,go to Zada Jane's but not through Nova's Bakery Dish Wells Fargo or Dairy Queen and then go to Nova's Bakery but not through Dish Wells Fargo or Dairy Queen and then go to Dish but not through Wells Fargo or Dairy Queen and then go to Wells Fargo but not through Dairy Queen and finally go to Dairy Queen,& U ! nova's_bakery zada_jane's & U ! dish nova's_bakery & U ! wells_fargo dish & U ! dairy_queen wells_fargo F dairy_queen,Charlotte #2,"error:['&', '&', 'U', '!', 'lm(', 'Bakery', ')lm', ')lm', 'lm(', 'Zada', ""Jane's"", ')lm', '&', 'U', '!', 'lm(', '!', ')lm', ')lm', ""Nova's"", 'lm(', 'Bakery', 'Bakery', ')lm', 'F', 'lm(', 'lm(', 'F', ')lm', ')lm', 'F', ')lm', ')lm', 'lm(', ')lm', ')lm', ')lm', ')lm', 'lm(', 'lm(', ')lm', ')lm', ')lm', ')lm', 'lm(', ')lm', 'lm(', ')lm', ')lm', 'lm(', ""Nova's"", 'lm(', ')lm', ')lm', 'Bakery', 'lm(', ')lm', 'Bakery', 'Bakery', ')lm', ')lm', 'Bakery', 'Bakery', ')lm', 'Bakery', 'Bakery', ')lm', ')lm', 'Bakery', 'Bakery', ')lm', ')lm', 'Bakery', 'Bakery', ')lm', ')lm']",False
7438,only after you visit Elizabeth Billiards you can go to Common Market only after you visit Common Market you can go to Zada Jane's only after you visit Zada Jane's you can go to Public Library of Charlotte and Mecklenburg County - Plaza Midwood Branch only after you visit Public Library of Charlotte and Mecklenburg County - Plaza Midwood Branch you can go to Fuel Pizza,& U ! common_market elizabeth_billiards & U ! zada_jane's common_market & U ! public_library_of_charlotte_and_mecklenburg_county_-_plaza_midwood_branch zada_jane's & U ! fuel_pizza public_library_of_charlotte_and_mecklenburg_county_-_plaza_midwood_branch F fuel_pizza,Charlotte #2,"error:['&', 'U', '!', 'lm(', 'lm(', 'Public', 'Library', 'of', 'Charlotte', ')lm', 'lm(', 'visit', 'St', 'Library', 'of', 'St', ')lm', '&', 'U', '!', 'lm(', 'County', 'lm(', 'Pizza', ')lm', 'lm(', 'lm(', 'and', '-', 'Plaza', ')lm', ')lm', 'F', 'lm(', 'lm(', 'lm(', '-', ')lm', 'of', ')lm', ')lm', ')lm', 'Pizza', ')lm', ')lm', ')lm', ')lm', ')lm', 'Library', ')lm', ')lm', 'lm(', ')lm', ')lm', 'Library', ')lm', ')lm', ')lm', ')lm', ')lm', ')lm', 'Library', ')lm', ')lm', ')lm', ')lm', ')lm', 'Library', 'lm(', 'of', 'lm(', ')lm', ')lm', 'Library', ')lm', 'of', 'Charlotte', ')lm', ')lm', ')lm', 'Charlotte', ')lm', 'Charlotte', ')lm', 'Charlotte', ')lm', ')lm', 'Charlotte', ')lm', ')lm', 'of', 'Charlotte', ')lm', ')lm', 'of', 'lm(', ')lm', 'of', ')lm', ')lm', 'of', ')lm', 'of', ')lm', '-', 'of', ')lm', ')lm', 'of', ')lm', '-', 'of', ')lm', ')lm', '-', 'of', ')lm', ')lm', '-', ')lm', ')lm', ')lm', ')lm', ')lm', ')lm', ')lm', ')lm', ')lm', ')lm', ')lm', ')lm', ')lm', ')lm', ')lm', 'Pizza', ')lm']",False
