,nl_command,ltl,map_name,result,eq
7976,visit Capital One Bank Walgreens Pharmacy Chipotle Fiesta once do not visit Walgreens Pharmacy without visiting Capital One Bank and do not visit Walgreens Pharmacy without visiting Chipotle do not visit Fiesta without visiting Chipotle,& & U ! walgreens_pharmacy capital_one_bank & U ! chipotle walgreens_pharmacy & U ! fiesta chipotle F fiesta & U ! capital_one_bank U capital_one_bank U ! capital_one_bank walgreens_pharmacy & U ! walgreens_pharmacy U walgreens_pharmacy U ! walgreens_pharmacy chipotle U ! chipotle U chipotle U ! chipotle fiesta,Houston,"error:['&', '&', 'U', '!', 'lm(', 'Walgreens', 'Pharmacy', ')lm', 'lm(', 'lm(', 'lm(', 'lm(', 'lm(', 'Bank', 'lm(', 'lm(', 'lm(', 'lm(', 'lm(', 'lm(', 'lm(', 'lm(', 'lm(', 'lm(', 'lm(', ')lm', 'Bank', ')lm', 'Bank', 'Bank', ')lm', 'Bank', ')lm', 'Bank', 'Bank', 'Bank', 'Bank', ')lm', 'Bank', 'Bank', 'Bank', 'Bank', 'Bank', ')lm', 'Bank', 'Bank', 'Bank', ')lm', 'Bank', ')lm', 'Bank', ')lm', 'lm(', '!', 'lm(', 'Walgreens', 'Walgreens', 'Pharmacy', 'Pharmacy', 'Pharmacy', '!', 'lm(', 'Walgreens', '!', 'lm(', 'Walgreens', 'Pharmacy', 'Pharmacy', 'Pharmacy', 'Pharmacy', ')lm', 'lm(', 'lm(', 'lm(', 'lm(', 'lm(', 'lm(', 'lm(', 'lm(', 'lm(', 'lm(', 'lm(', 'lm(', 'lm(', ')lm', 'lm(', ')lm']",False
7977,visit Viet's Express Fiesta Pizza Hut Glazed the Doughnut Cafe once do not visit Fiesta without visiting Viet's Express and do not visit Fiesta without visiting Pizza Hut do not visit Glazed the Doughnut Cafe without visiting Pizza Hut,& & U ! fiesta viet's_express & U ! pizza_hut fiesta & U ! glazed_the_doughnut_cafe pizza_hut F glazed_the_doughnut_cafe & U ! viet's_express U viet's_express U ! viet's_express fiesta & U ! fiesta U fiesta U ! fiesta pizza_hut U ! pizza_hut U pizza_hut U ! pizza_hut glazed_the_doughnut_cafe,Houston,"error:['&', '&', 'U', '!', 'lm(', 'the', 'Cafe', ')lm', 'lm(', ""Viet's"", 'Express', 'Pizza', ')lm', '&', 'U', '!', 'lm(', 'Glazed', 'Cafe', ')lm', 'the', 'Cafe', ')lm', 'the', 'Cafe', ')lm', ')lm', 'lm(', 'lm(', 'lm(', 'lm(', 'Pizza', 'lm(', 'lm(', 'lm(', 'Pizza', 'lm(', 'Pizza', 'lm(', 'lm(', 'Express', 'Pizza', 'Pizza', 'lm(', 'lm(', 'lm(', 'lm(', 'lm(', 'the', 'the', 'the', 'lm(', 'lm(', 'the', 'the', 'Cafe', 'lm(', 'Cafe', 'Cafe', 'the', 'Cafe', 'lm(', 'the', 'the', 'Cafe', 'Cafe', 'Cafe', 'lm(', 'the', 'Cafe', 'Cafe', 'Cafe', 'lm(', 'the', 'the', 'Cafe', 'Cafe', 'lm(', 'the', 'Cafe', 'Cafe', 'lm(', 'the', 'Cafe', 'lm(', 'the', 'Cafe', ')lm', 'Cafe', 'lm(', 'Cafe', 'lm(', 'Cafe', ')lm', 'Cafe', ')lm', ')lm', 'Cafe', ')lm', ')lm']",False
7978,go to Infinite Smiles Family Dentistry but not through Purple Lot Capital One Bank Office Depot or PetSmart and then go to Purple Lot but not through Capital One Bank Office Depot or PetSmart and then go to Capital One Bank but not through Office Depot or PetSmart and then go to Office Depot but not through PetSmart and finally go to PetSmart no revisiting is allowed here,& & U ! purple_lot infinite_smiles_family_dentistry & U ! capital_one_bank purple_lot & U ! office_depot capital_one_bank & U ! petsmart office_depot F petsmart & U ! infinite_smiles_family_dentistry U infinite_smiles_family_dentistry U ! infinite_smiles_family_dentistry purple_lot & U ! purple_lot U purple_lot U ! purple_lot capital_one_bank & U ! capital_one_bank U capital_one_bank U ! capital_one_bank office_depot U ! office_depot U office_depot U ! office_depot petsmart,Houston,"error:['&', '&', 'U', '!', 'lm(', 'Purple', 'Lot', ')lm', 'lm(', 'Infinite', 'Smiles', 'Family', ')lm', '&', 'U', '!', 'lm(', 'One', 'Bank', 'Depot', ')lm', 'Bank', 'lm(', 'Bank', 'lm(', 'Bank', 'Bank', ')lm', ')lm', 'lm(', 'lm(', 'lm(', 'and', ')lm', ')lm', ')lm', 'lm(', 'lm(', 'and', 'lm(', ')lm', ')lm', 'lm(', 'lm(', 'lm(', 'lm(', 'U', 'Smiles', 'Smiles', 'Smiles', 'Smiles', 'Smiles', 'Family', 'Family', 'Family', ')lm', 'U', '!', 'lm(', 'lm(', 'Bank', 'Bank', 'lm(', 'lm(', 'Bank', 'Bank', 'Bank', 'lm(', 'lm(', 'Bank', 'Bank', 'Bank', 'Bank', 'lm(', 'lm(', 'Bank', 'Bank', 'Bank', 'Bank', 'Bank', 'lm(', 'Bank', 'Bank', 'Bank', 'lm(', 'Bank', 'Bank', 'Bank', 'lm(', 'lm(', 'Bank', 'Bank', 'Bank', 'Bank', 'lm(', 'Bank', 'Bank', 'Bank', 'lm(', 'lm(', 'Bank', 'Bank', 'Bank', 'and', 'Bank', 'lm(', 'lm(', 'Bank', 'Bank', 'Bank', 'and', 'Bank', 'lm(', 'lm(', 'lm(', 'Bank', 'Bank', 'and', 'Bank', ')lm', 'lm(', 'lm(', 'lm(', 'lm(', 'Bank', 'and', 'Bank', 'and', ')lm', ')lm', ')lm', 'lm(', 'lm(', 'lm(', 'lm(', ')lm', 'Bank', 'and', 'lm(', ')lm', ')lm', 'lm(', 'lm(', 'lm(', 'lm(']",False
7979,go to Five Guys but not through Fannin Substation Capital One Bank PetSmart or North Kirby Lot and then go to Fannin Substation but not through Capital One Bank PetSmart or North Kirby Lot and then go to Capital One Bank but not through PetSmart or North Kirby Lot and then go to PetSmart but not through North Kirby Lot and finally go to North Kirby Lot no revisiting is allowed here,& & U ! fannin_substation five_guys & U ! capital_one_bank fannin_substation & U ! petsmart capital_one_bank & U ! north_kirby_lot petsmart F north_kirby_lot & U ! five_guys U five_guys U ! five_guys fannin_substation & U ! fannin_substation U fannin_substation U ! fannin_substation capital_one_bank & U ! capital_one_bank U capital_one_bank U ! capital_one_bank petsmart U ! petsmart U petsmart U ! petsmart north_kirby_lot,Houston,"error:['&', '&', 'U', '!', 'lm(', 'Fannin', 'Capital', ')lm', 'lm(', 'lm(', 'Five', 'Guys', ')lm', '&', '&', '!', 'lm(', 'lm(', 'Bank', 'Bank', 'Bank', ')lm', 'Bank', 'lm(', 'Bank', 'Bank', 'and', 'Bank', ')lm', ')lm', 'lm(', 'lm(', 'lm(', 'and', ')lm', ')lm', 'lm(', 'lm(', 'lm(', 'and', ')lm', ')lm', 'lm(', 'lm(', 'lm(', 'lm(', 'U', '!', 'lm(', 'Guys', 'Guys', 'Guys', 'Guys', 'Guys', 'Guys', 'Guys', 'Guys', ')lm', 'lm(', 'Bank', 'Bank', 'lm(', 'lm(', 'Bank', 'Bank', 'lm(', 'lm(', 'Bank', 'Bank', 'Bank', 'lm(', 'lm(', 'Bank', 'Bank', 'Bank', 'Bank', 'lm(', 'Bank', 'Bank', 'lm(', 'Bank', 'Bank', 'Bank', 'lm(', 'Bank', 'Bank', 'Bank', 'lm(', 'lm(', 'Bank', 'Bank', 'Bank', 'Bank', 'lm(', 'Bank', 'Bank', 'lm(', 'Bank', 'Bank', 'and', 'Bank', 'lm(', 'lm(', 'Bank', 'Bank', 'and', 'Bank', 'Bank', 'lm(', 'lm(', 'lm(', 'Bank', 'Bank', 'and', 'Bank', 'lm(', 'lm(', 'lm(', 'lm(', 'Bank', 'and', 'and', 'Bank', ')lm', 'lm(', 'lm(', 'lm(', 'lm(', 'lm(', 'Bank', 'and', 'and', ')lm', ')lm', 'lm(', 'lm(', 'lm(', 'lm(', ')lm']",False
7980,make your way to Holiday Inn Houston - NRG/Medical Center Area only after going to Chipotle before that make your way to Chipotle only after going to GameStop before that make your way to GameStop only after going to North Kirby Lot before that make your way to North Kirby Lot only after going to Freebirds World Burrito do not go back to the previous location you have visited while heading to the next,& & U ! north_kirby_lot freebirds_world_burrito & U ! gamestop north_kirby_lot & U ! chipotle gamestop & U ! holiday_inn_houston_-_nrg/medical_center_area chipotle F holiday_inn_houston_-_nrg/medical_center_area & U ! freebirds_world_burrito U freebirds_world_burrito U ! freebirds_world_burrito north_kirby_lot & U ! north_kirby_lot U north_kirby_lot U ! north_kirby_lot gamestop & U ! gamestop U gamestop U ! gamestop chipotle U ! chipotle U chipotle U ! chipotle holiday_inn_houston_-_nrg/medical_center_area,Houston,"error:['&', '&', 'U', '!', 'lm(', 'North', 'Kirby', ')lm', 'lm(', 'Freebirds', 'World', ')lm', '&', 'U', '!', 'lm(', '!', 'GameStop', ')lm', ')lm', 'lm(', ')lm', 'North', '&', 'Kirby', ')lm', '&', 'U', '!', 'lm(', '-', '-', '-', 'Center', ')lm', ')lm', ')lm', ')lm', 'GameStop', ')lm', 'Center', '-', 'Center', '-', ')lm', ')lm', ')lm', 'Center', '!', 'lm(', 'Chipotle', 'Chipotle', 'World', 'World', 'U', 'World', 'World', 'World', ')lm', 'World', ')lm', 'Freebirds', ')lm', 'Freebirds', ')lm', 'U', '!', 'lm(', 'U', '!', 'lm(', 'U', '!', 'lm(', 'U', '!', 'lm(', 'U', '!', 'lm(', 'North', 'North', 'North', 'Kirby', ')lm', ')lm', 'North', 'North', 'North', ')lm', 'U', '!', 'lm(', 'U', 'to', 'lm(', 'lm(', 'to', 'way', 'to', 'U', '!', 'lm(', 'to', 'to', ')lm', 'lm(', 'way', 'way', 'way', '-', 'lm(', ')lm', '-', 'lm(', 'lm(', '-', 'lm(', '-', 'way', 'Chipotle', ')lm', 'Center', '-', 'lm(', '-', ')lm', 'Center', 'Chipotle', 'Center', 'Chipotle', 'Chipotle', ')lm', ')lm', 'Center', '-', 'lm(', ')lm', '-', 'Center', 'Chipotle', 'Center', 'Chipotle', ')lm', ')lm', '-', 'lm(', '-', 'Center', ')lm', 'Center', ')lm', 'lm(', 'lm(', '-', '-', 'Center', 'Chipotle', 'Center', 'Chipotle', 'Chipotle', ')lm', ')lm', 'lm(', '-', 'lm(', '-', 'Center', '-', ')lm', 'Center']",False
7981,make your way to NRG Park only after going to Holiday Inn Houston - NRG/Medical Center Area before that make your way to Holiday Inn Houston - NRG/Medical Center Area only after going to Fiesta before that make your way to Fiesta only after going to TGF Hair Salon before that make your way to TGF Hair Salon only after going to SpringHill Suites Houston Medical Center/NRG Park do not go back to the previous location you have visited while heading to the next,& & U ! tgf_hair_salon springhill_suites_houston_medical_center/nrg_park & U ! fiesta tgf_hair_salon & U ! holiday_inn_houston_-_nrg/medical_center_area fiesta & U ! nrg_park holiday_inn_houston_-_nrg/medical_center_area F nrg_park & U ! springhill_suites_houston_medical_center/nrg_park U springhill_suites_houston_medical_center/nrg_park U ! springhill_suites_houston_medical_center/nrg_park tgf_hair_salon & U ! tgf_hair_salon U tgf_hair_salon U ! tgf_hair_salon fiesta & U ! fiesta U fiesta U ! fiesta holiday_inn_houston_-_nrg/medical_center_area U ! holiday_inn_houston_-_nrg/medical_center_area U holiday_inn_houston_-_nrg/medical_center_area U ! holiday_inn_houston_-_nrg/medical_center_area nrg_park,Houston,"error:['&', '&', 'U', '!', 'lm(', 'TGF', 'Hair', ')lm', 'lm(', 'SpringHill', 'Suites', 'Park', ')lm', '&', 'U', '!', 'lm(', 'Holiday', 'Houston', '-', 'Center', ')lm', 'lm(', 'lm(', 'TGF', 'Hair', '&', '&', 'U', '!', 'lm(', 'Houston', 'Houston', '-', 'Center', '-', 'Center', 'lm(', ')lm', 'lm(', '-', '-', 'Center', '-', 'Center', ')lm', 'F', 'lm(', 'lm(', 'lm(', '-', '-', 'Center', '-', 'Center', 'lm(', ')lm', 'lm(', 'lm(', 'lm(', 'Park', 'lm(', 'lm(', 'lm(', 'lm(', 'lm(', 'SpringHill', 'lm(', 'SpringHill', 'lm(', 'SpringHill', 'lm(', 'SpringHill', 'lm(', 'lm(', 'lm(', 'lm(', 'SpringHill', 'lm(', 'lm(', 'lm(', 'lm(', 'SpringHill', 'lm(', 'U', '!', 'lm(', 'lm(', 'lm(', 'that', 'U', 'lm(', 'lm(', 'TGF', 'Hair', 'Hair', ')lm', 'U', 'lm(', 'lm(', 'lm(', 'TGF', 'Hair', 'Hair', 'Hair', ')lm', 'lm(', 'lm(', 'lm(', '-', 'lm(', '-', 'lm(', 'U', '-', 'lm(', '-', 'lm(', '-', 'Center', '-', ')lm', 'U', '-', 'lm(', '-', '-', 'Center', '-', ')lm', 'lm(', 'lm(', '-', '-', 'Center', '-', 'Center', '-', 'Center', '-', ')lm', 'lm(', 'lm(', 'lm(', '-', '-', 'Center', '-', 'Center', '-', 'Center', ')lm', 'U', 'lm(', 'lm(', 'lm(', '-', '-', 'Center', '-', 'Center', '-', 'Center', ')lm', 'lm(', 'lm(', 'lm(', '-', '-', 'Center', '-', 'Center', '-', ')lm', ')lm', 'lm(', 'lm(', 'lm(', '-', '-', 'Center', '-', 'Center', '-', 'Center', ')lm', ')lm', 'lm(', 'lm(', 'lm(', '-', '-', 'Center', '-', 'Center', ')lm', ')lm', 'lm(', 'lm(']",False
7982,go to Walgreens Pharmacy only then go to Purple Lot without returning only after that go to Infinite Smiles Family Dentistry without returning only after that go to The UPS Store without returning and finally only then go to Texas Medical Center without returning,& & U ! purple_lot walgreens_pharmacy & U ! infinite_smiles_family_dentistry purple_lot & U ! the_ups_store infinite_smiles_family_dentistry & U ! texas_medical_center the_ups_store F texas_medical_center & U ! walgreens_pharmacy U walgreens_pharmacy U ! walgreens_pharmacy purple_lot & U ! purple_lot U purple_lot U ! purple_lot infinite_smiles_family_dentistry & U ! infinite_smiles_family_dentistry U infinite_smiles_family_dentistry U ! infinite_smiles_family_dentistry the_ups_store U ! the_ups_store U the_ups_store U ! the_ups_store texas_medical_center,Houston,"error:['&', '&', 'U', '!', 'lm(', 'Purple', 'Lot', ')lm', 'lm(', 'lm(', 'Pharmacy', 'Pharmacy', ')lm', '&', 'U', '!', 'lm(', 'The', ')lm', ')lm', 'lm(', 'Smiles', 'lm(', '&', 'U', '!', 'lm(', '!', 'lm(', ')lm', 'lm(', 'lm(', 'The', 'lm(', ')lm', 'lm(', 'The', ')lm', ')lm', 'lm(', 'Center', ')lm', 'Center', ')lm', ')lm', 'Center', ')lm', ')lm', ')lm', 'lm(', 'lm(', 'lm(', 'Pharmacy', 'Pharmacy', 'Pharmacy', 'lm(', 'lm(', 'Pharmacy', ')lm', ')lm', ')lm', 'Purple', ')lm', 'lm(', 'Lot', 'Lot', ')lm', ')lm', ')lm', 'Lot', 'lm(', 'lm(', 'Lot', 'Lot', ')lm', 'lm(', 'lm(', 'lm(', 'lm(', 'Lot', 'Lot', ')lm', 'lm(', 'lm(', 'lm(', 'lm(', ')lm', 'lm(', 'lm(', 'lm(', 'lm(', 'Smiles', 'Smiles', ')lm', 'lm(', 'The', ')lm', ')lm', 'The', ')lm', 'lm(', 'The', 'lm(', 'The', 'lm(', 'The', 'lm(', 'The', 'UPS', ')lm', 'UPS', 'U', 'UPS', 'lm(', 'UPS', 'UPS', 'lm(', 'UPS', 'lm(', 'UPS', 'lm(', 'UPS', 'UPS', 'lm(', 'Center', 'UPS', 'lm(', 'lm(', 'Center', 'UPS', 'lm(', 'lm(', 'Center', 'UPS', 'lm(', 'Center', 'UPS', 'lm(']",False
7983,go to North Kirby Lot only then go to The UPS Store without returning only after that go to Olive Garden without returning only after that go to TGF Hair Salon without returning and finally only then go to Glazed the Doughnut Cafe without returning,& & U ! the_ups_store north_kirby_lot & U ! olive_garden the_ups_store & U ! tgf_hair_salon olive_garden & U ! glazed_the_doughnut_cafe tgf_hair_salon F glazed_the_doughnut_cafe & U ! north_kirby_lot U north_kirby_lot U ! north_kirby_lot the_ups_store & U ! the_ups_store U the_ups_store U ! the_ups_store olive_garden & U ! olive_garden U olive_garden U ! olive_garden tgf_hair_salon U ! tgf_hair_salon U tgf_hair_salon U ! tgf_hair_salon glazed_the_doughnut_cafe,Houston,& & U ! the_ups_store north_kirby_lot & U ! olive_garden the_ups_store & U ! glazed_the_doughnut_cafe olive_garden )lm F five_guys lm( Glazed Cafe )lm & U ! five_guys lm( North Kirby )lm )lm U five_guys lm( North Kirby )lm )lm U five_guys lm( five_guys lm( North Lot )lm five_guys lm( The UPS )lm )lm U ! five_guys lm( The UPS )lm U five_guys lm( The UPS )lm U ! five_guys lm( The UPS UPS five_guys lm( five_guys lm( Garden )lm )lm U ! five_guys lm( Garden Garden )lm )lm five_guys lm( five_guys lm( Hair Hair )lm U ! five_guys lm( TGF five_guys lm( Hair )lm five_guys lm( glazed_the_doughnut_cafe,False
7984,visit Fiesta followed by visiting Domain at Kirby then visit North Kirby Lot GameStop and Texas Medical Center in this exact order visit all locations once,& & U ! domain_at_kirby fiesta & U ! north_kirby_lot domain_at_kirby & U ! gamestop north_kirby_lot & U ! texas_medical_center gamestop F texas_medical_center & U ! fiesta U fiesta U ! fiesta domain_at_kirby & U ! domain_at_kirby U domain_at_kirby U ! domain_at_kirby north_kirby_lot & U ! north_kirby_lot U north_kirby_lot U ! north_kirby_lot gamestop U ! gamestop U gamestop U ! gamestop texas_medical_center,Houston,"error:['&', '&', 'U', '!', 'lm(', 'North', 'Kirby', ')lm', 'lm(', 'Fiesta', 'followed', ')lm', '&', '&', '!', 'lm(', 'lm(', 'Center', ')lm', 'lm(', 'Lot', ')lm', ')lm', 'lm(', 'Center', ')lm', 'Center', ')lm', 'Center', ')lm', 'Center', ')lm', 'lm(', 'lm(', 'Fiesta', 'Fiesta', 'Fiesta', ')lm', 'Fiesta', ')lm', 'Fiesta', ')lm', ')lm', 'U', 'lm(', 'U', 'North', 'North', 'U', 'North', 'North', 'North', 'U', 'North', 'North', 'North', 'North', 'U', 'North', 'Kirby', 'Kirby', 'Kirby', 'Kirby', 'U', 'Kirby', 'Kirby', 'Kirby', 'U', 'Kirby', 'U', 'Kirby', 'lm(', 'Kirby', 'Lot', 'Lot', 'Lot', 'U', 'lm(', 'U', 'Lot', 'Lot', 'Lot', 'Lot', 'GameStop', 'lm(', 'U', 'lm(', 'lm(', 'GameStop', 'GameStop', 'GameStop', 'GameStop', 'GameStop', 'GameStop', 'U', ')lm', 'Center', 'GameStop', 'lm(', 'Center', 'lm(', 'Center', 'lm(', 'lm(', 'Center', 'GameStop', 'lm(', 'Center', 'Center', 'Center', 'Center', 'Center', 'Center', 'Center', ')lm', 'Center', ')lm', 'Center', ')lm', 'Center', ')lm', 'Center', ')lm', 'Center', ')lm', 'Center', ')lm', ')lm']",False
7985,visit The UPS Store followed by visiting Extended Stay America - Houston - Med. Ctr. - NRG Park - Kirby then visit Glazed the Doughnut Cafe NRG Park and Viet's Express in this exact order visit all locations once,& & U ! extended_stay_america_-_houston_-_med._ctr._-_nrg_park_-_kirby the_ups_store & U ! glazed_the_doughnut_cafe extended_stay_america_-_houston_-_med._ctr._-_nrg_park_-_kirby & U ! nrg_park glazed_the_doughnut_cafe & U ! viet's_express nrg_park F viet's_express & U ! the_ups_store U the_ups_store U ! the_ups_store extended_stay_america_-_houston_-_med._ctr._-_nrg_park_-_kirby & U ! extended_stay_america_-_houston_-_med._ctr._-_nrg_park_-_kirby U extended_stay_america_-_houston_-_med._ctr._-_nrg_park_-_kirby U ! extended_stay_america_-_houston_-_med._ctr._-_nrg_park_-_kirby glazed_the_doughnut_cafe & U ! glazed_the_doughnut_cafe U glazed_the_doughnut_cafe U ! glazed_the_doughnut_cafe nrg_park U ! nrg_park U nrg_park U ! nrg_park viet's_express,Houston,"error:['&', '&', 'U', '!', 'lm(', 'Extended', 'Stay', '-', '-', 'Med.', '-', ')lm', 'lm(', 'The', 'UPS', ')lm', '&', 'U', '!', 'lm(', 'Glazed', 'Cafe', ')lm', 'lm(', 'lm(', 'Extended', '-', '-', '-', '-', '-', '-', '-', '-', '-', '-', '-', '-', '-', '-', '-', ')lm', '-', ')lm', '-', '!', '-', '!', 'Park', ')lm', 'lm(', '-', '-', '-', 'Park', ')lm', 'Park', ')lm', 'U', 'Park', '!', 'lm(', 'Park', ')lm', 'Park', ')lm', 'Park', ')lm', 'Park', 'Park', ')lm', 'Park', 'The', ')lm', ')lm', ""Viet's"", 'The', 'lm(', ')lm', 'The', 'U', ')lm', 'The', 'lm(', ')lm', 'lm(', ')lm', ')lm', '-', '-', '-', '-', '-', '-', '-', '-', ')lm', '-', '-', '-', 'U', '-', '-', '-', 'U', '-', '-', '-', 'U', '-', '-', '-', '-', 'U', '-', '-', '-', '-', 'U', '-', '-', '-', 'U', '-', '-', '-', '-', 'U', '-', '-', '-', '-', 'U', '-', '-', '-', 'U', '-', '-', '-', 'U', '-', '-', '-', 'U', '-', '-', 'U', '-', '-', 'lm(', '-', '-', 'lm(', '-', '-', 'Park', '-', 'U', 'Park', '-', 'U', 'Park', '-', 'U', 'Park', 'lm(', 'lm(', 'lm(', 'lm(', '-', 'Park', '-', 'Park', 'lm(', 'lm(', 'lm(', 'lm(', 'Park', '-', 'U', 'Park', 'lm(', 'lm(', 'lm(', 'Park', '-', 'Park', 'lm(', 'lm(', 'lm(', 'Park', 'lm(', 'Park', 'lm(', 'lm(', 'Park', '-', 'Park']",False
7986,go to Holiday Inn Houston - NRG/Medical Center Area but only after going to TGF Hair Salon only once go to TGF Hair Salon only after going to Catfish Station only once go to Catfish Station only after going to Infinite Smiles Family Dentistry only once and go to Infinite Smiles Family Dentistry only after going to PetSmart only once,& & U ! infinite_smiles_family_dentistry petsmart & U ! catfish_station infinite_smiles_family_dentistry & U ! tgf_hair_salon catfish_station & U ! holiday_inn_houston_-_nrg/medical_center_area tgf_hair_salon F holiday_inn_houston_-_nrg/medical_center_area & U ! petsmart U petsmart U ! petsmart infinite_smiles_family_dentistry & U ! infinite_smiles_family_dentistry U infinite_smiles_family_dentistry U ! infinite_smiles_family_dentistry catfish_station & U ! catfish_station U catfish_station U ! catfish_station tgf_hair_salon U ! tgf_hair_salon U tgf_hair_salon U ! tgf_hair_salon holiday_inn_houston_-_nrg/medical_center_area,Houston,"error:['&', '&', 'U', '!', 'lm(', 'TGF', 'Hair', ')lm', 'lm(', 'Infinite', 'Smiles', ')lm', ')lm', '&', 'lm(', '!', 'lm(', 'lm(', ')lm', 'lm(', 'lm(', 'lm(', 'lm(', 'lm(', 'lm(', 'lm(', 'lm(', 'lm(', '-', 'Center', ')lm', ')lm', ')lm', 'lm(', '-', 'Center', '-', 'Center', '-', 'Center', ')lm', 'Infinite', 'Center', 'Infinite', '-', 'Infinite', 'Infinite', 'Infinite', ')lm', 'Infinite', 'Infinite', ')lm', 'Infinite', ')lm', 'Infinite', ')lm', 'Infinite', ')lm', ')lm', 'lm(', 'lm(', 'lm(', 'lm(', 'lm(', 'lm(', 'lm(', 'lm(', 'lm(', 'lm(', 'lm(', 'lm(', 'lm(', 'lm(', 'lm(', 'lm(', 'lm(', 'lm(', 'lm(', 'lm(', 'lm(', 'lm(', 'lm(', 'lm(', 'lm(', 'lm(', ')lm', 'lm(', ')lm', 'lm(', ')lm', 'lm(', 'lm(', 'lm(', 'lm(', '-', ')lm', ')lm', ')lm', ')lm', 'lm(', '-', 'Center', ')lm', ')lm', ')lm', ')lm', '-', 'Center', ')lm', ')lm', ')lm', 'Center', ')lm', '-', 'Center', ')lm', ')lm', ')lm', 'Center', ')lm', '-', 'Center', ')lm', ')lm', 'Center', ')lm', ')lm', '-', 'Center', ')lm', ')lm', 'Center', ')lm', ')lm', 'Center', ')lm', '-', ')lm', ')lm', 'Center', ')lm', '-', 'Center', ')lm', ')lm', 'Center', ')lm', '-', ')lm', ')lm', 'Center', ')lm', '-', ')lm', ')lm', 'Center', ')lm', '-', 'Center', ')lm', ')lm', 'Center', ')lm', '-', ')lm', ')lm', 'Center', ')lm', '-', ')lm', '-', 'Center', ')lm', ')lm', 'Center', ')lm', '-', ')lm', ')lm', 'Center', ')lm', '-', ')lm', '-', 'Center', ')lm']",False
7987,go to Texas Medical Center but only after going to Domain at Kirby only once go to Domain at Kirby only after going to GameStop only once go to GameStop only after going to Akashi Asian Sushi Cuisine & Wine Bar only once and go to Akashi Asian Sushi Cuisine & Wine Bar only after going to Big Lots only once,& & U ! akashi_asian_sushi_cuisine_&_wine_bar big_lots & U ! gamestop akashi_asian_sushi_cuisine_&_wine_bar & U ! domain_at_kirby gamestop & U ! texas_medical_center domain_at_kirby F texas_medical_center & U ! big_lots U big_lots U ! big_lots akashi_asian_sushi_cuisine_&_wine_bar & U ! akashi_asian_sushi_cuisine_&_wine_bar U akashi_asian_sushi_cuisine_&_wine_bar U ! akashi_asian_sushi_cuisine_&_wine_bar gamestop & U ! gamestop U gamestop U ! gamestop domain_at_kirby U ! domain_at_kirby U domain_at_kirby U ! domain_at_kirby texas_medical_center,Houston,"error:['&', '&', 'U', '!', 'lm(', 'GameStop', '&', ')lm', 'lm(', 'Akashi', 'Asian', ')lm', ')lm', '&', 'lm(', '!', 'lm(', 'lm(', ')lm', 'lm(', '&', '&', 'lm(', 'lm(', 'lm(', 'lm(', 'lm(', 'lm(', 'lm(', 'lm(', 'lm(', 'lm(', 'lm(', 'Center', 'lm(', 'Center', 'lm(', 'Center', 'lm(', 'Center', 'Asian', 'Center', 'Akashi', 'Center', 'Akashi', 'Asian', 'Center', 'Akashi', ')lm', 'Akashi', ')lm', 'Akashi', ')lm', 'lm(', 'lm(', 'lm(', 'lm(', 'lm(', 'lm(', 'lm(', 'lm(', 'lm(', '&', '&', 'lm(', 'lm(', 'lm(', 'lm(', '&', '&', ')lm', 'lm(', 'lm(', 'lm(', '&', '&', ')lm', ')lm', 'lm(', '&', ')lm', ')lm', '&', ')lm', ')lm', '&', ')lm', ')lm', 'lm(', 'lm(', 'Asian', '&', ')lm', ')lm', 'lm(', ')lm', 'Asian', ')lm', ')lm', 'Sushi', ')lm', ')lm', 'Cuisine', 'go', ')lm', ')lm', 'Domain', ')lm', 'Wine', 'go', ')lm', ')lm']",False
7988,go to Extended Stay America - Houston - Med. Ctr. - NRG Park - Kirby after going to Viet's Express do not go to Extended Stay America - Houston - Med. Ctr. - NRG Park - Kirby before,& U ! extended_stay_america_-_houston_-_med._ctr._-_nrg_park_-_kirby viet's_express F extended_stay_america_-_houston_-_med._ctr._-_nrg_park_-_kirby,Houston,"error:['&', 'U', '!', 'lm(', 'Extended', 'America', '-', 'Houston', ')lm', ')lm', 'lm(', ""Viet's"", ""Viet's"", '-', ""Viet's"", ')lm', ')lm', '&', '!', '-', '-', '-', '-', '-', '-', '-', '-', '-', '-', '-', '-', '-', ')lm', ')lm', '-', 'lm(', '-', '-', '-', '-', 'Park', '-', ')lm', ')lm', '-', '-', '-', '-', '-', '-', ')lm', ')lm', '-', '-', '-', '-', '-', '-', '-', ')lm']",False
7989,go to Five Guys after going to SpringHill Suites Houston Medical Center/NRG Park do not go to Five Guys before,& U ! five_guys springhill_suites_houston_medical_center/nrg_park F five_guys,Houston,"error:['&', 'U', '!', 'lm(', 'Five', ')lm', ')lm', 'lm(', 'SpringHill', 'SpringHill', 'Suites', ')lm', ')lm', 'F', 'lm(', 'lm(', 'Five', 'Park', ')lm']",False
7990,visit Glazed the Doughnut Cafe but do not visit Glazed the Doughnut Cafe before you reach Holiday Inn Houston - NRG/Medical Center Area,& U ! glazed_the_doughnut_cafe holiday_inn_houston_-_nrg/medical_center_area F glazed_the_doughnut_cafe,Houston,& U ! glazed_the_doughnut_cafe glazed_the_doughnut_cafe F glazed_the_doughnut_cafe,False
7991,visit Domain at Kirby but do not visit Domain at Kirby before you reach Holiday Inn Houston - NRG/Medical Center Area,& U ! domain_at_kirby holiday_inn_houston_-_nrg/medical_center_area F domain_at_kirby,Houston,"error:['G', '!', 'lm(', 'Domain', 'Domain', ')lm', ')lm', 'lm(', 'Inn', '-', '-', 'Center', ')lm', ')lm', 'F', 'lm(', 'Domain', 'Domain', 'Domain', ')lm', ')lm']",False
7992,first go to Infinite Smiles Family Dentistry while avoiding Texas Medical Center then move to Texas Medical Center,& U ! texas_medical_center infinite_smiles_family_dentistry F texas_medical_center,Houston,& U ! texas_medical_center infinite_smiles_family_dentistry F texas_medical_center,True
7993,first go to Fiesta while avoiding PetSmart then move to PetSmart,& U ! petsmart fiesta F petsmart,Houston,"error:['&', 'U', '!', 'lm(', 'move', 'PetSmart', ')lm', ')lm', 'lm(', 'Fiesta', 'to', ')lm', ')lm', 'F', 'lm(', 'lm(', 'PetSmart', 'PetSmart', ')lm']",False
7994,do not visit TGF Hair Salon until you go to Viet's Express,& U ! tgf_hair_salon viet's_express F tgf_hair_salon,Houston,"error:['U', '!', 'lm(', 'TGF', ')lm', ')lm', ')lm', ')lm', 'lm(', 'lm(', 'lm(', ')lm', ')lm', ')lm', 'lm(', 'lm(', 'Hair', ')lm', ')lm']",False
7995,do not visit GameStop until you go to Chipotle,& U ! gamestop chipotle F gamestop,Houston,"error:['U', '!', 'lm(', 'lm(', ')lm', 'lm(', 'lm(', ')lm', 'lm(', 'lm(', '!', 'lm(', 'lm(', ')lm', 'lm(', 'lm(', 'lm(', 'lm(', 'lm(', 'lm(', 'lm(', 'lm(', 'lm(', 'lm(', 'lm(', 'lm(', 'lm(', 'lm(']",False
7996,go to Taco Cabana while staying away from Pizza Hut then move to Pizza Hut,& U ! pizza_hut taco_cabana F pizza_hut,Houston,& U ! pizza_hut taco_cabana F pizza_hut,True
7997,go to PetSmart while staying away from GameStop then move to GameStop,& U ! gamestop petsmart F gamestop,Houston,"error:['&', 'U', '!', 'lm(', 'move', 'GameStop', ')lm', ')lm', 'lm(', 'PetSmart', 'PetSmart', ')lm', 'F', 'F', 'lm(', 'GameStop', 'GameStop', ')lm', ')lm']",False
