,nl_command,ltl,map_name,result,eq
7477,visit The UPS Store and only then visit Five Guys without returning to The UPS Store only then visit Big Lots without returning to Five Guys only then visit Office Depot without returning to Big Lots and only then visit North Kirby Lot without returning to Office Depot,& & U ! five_guys the_ups_store & U ! big_lots five_guys & U ! office_depot big_lots & U ! north_kirby_lot office_depot F north_kirby_lot & U ! the_ups_store U the_ups_store U ! the_ups_store five_guys & U ! five_guys U five_guys U ! five_guys big_lots & U ! big_lots U big_lots U ! big_lots office_depot U ! office_depot U office_depot U ! office_depot north_kirby_lot,Houston,"error:['&', '&', 'U', '!', 'lm(', 'The', 'Five', ')lm', 'lm(', 'The', 'UPS', ')lm', '&', 'U', '!', 'lm(', 'The', 'Big', ')lm', 'lm(', 'lm(', 'Five', ')lm', ')lm', 'U', 'lm(', 'lm(', 'lm(', ')lm', 'lm(', 'lm(', 'lm(', 'lm(', ')lm', 'lm(', 'lm(', 'lm(', 'The', 'The', ')lm', 'lm(', 'U', 'lm(', 'The', 'The', 'The', ')lm', 'The', 'lm(', 'The', 'lm(', 'The', 'lm(', ')lm', 'The', 'The', ')lm', ')lm', 'lm(', 'The', 'lm(', ')lm', ')lm', ')lm', ')lm', 'lm(', 'Five', ')lm', ')lm', 'lm(', 'Five', ')lm', ')lm', 'lm(', 'Five', ')lm', ')lm', 'lm(', ')lm', 'lm(', ')lm', ')lm', 'lm(', ')lm', ')lm', 'lm(', ')lm', ')lm', 'lm(', ')lm', ')lm', 'lm(', 'visit', ')lm', ')lm', 'lm(', 'visit', ')lm', 'The', 'lm(', ')lm']",False
7478,visit Akashi Asian Sushi Cuisine & Wine Bar Freebirds World Burrito Infinite Smiles Family Dentistry Walgreens Pharmacy and NRG Park in that exact order once you leave any location you can not return to it,& & U ! freebirds_world_burrito akashi_asian_sushi_cuisine_&_wine_bar & U ! infinite_smiles_family_dentistry freebirds_world_burrito & U ! walgreens_pharmacy infinite_smiles_family_dentistry & U ! nrg_park walgreens_pharmacy F nrg_park & U ! akashi_asian_sushi_cuisine_&_wine_bar U akashi_asian_sushi_cuisine_&_wine_bar U ! akashi_asian_sushi_cuisine_&_wine_bar freebirds_world_burrito & U ! freebirds_world_burrito U freebirds_world_burrito U ! freebirds_world_burrito infinite_smiles_family_dentistry & U ! infinite_smiles_family_dentistry U infinite_smiles_family_dentistry U ! infinite_smiles_family_dentistry walgreens_pharmacy U ! walgreens_pharmacy U walgreens_pharmacy U ! walgreens_pharmacy nrg_park,Houston,"error:['!', '&', '!', 'lm(', 'Wine', ')lm', ')lm', 'lm(', 'Akashi', ')lm', ')lm', 'U', '!', 'lm(', 'lm(', 'Park', ')lm', 'lm(', 'lm(', 'Wine', ')lm', 'F', 'lm(', 'lm(', ')lm', 'lm(', 'NRG', 'Park', ')lm', 'lm(', 'lm(', 'lm(', 'lm(', 'lm(', 'lm(', 'lm(', 'lm(', 'lm(', 'lm(', 'lm(', 'lm(', 'lm(', 'lm(', 'lm(', ')lm', 'lm(', 'lm(', ')lm', ')lm', 'lm(', ')lm', ')lm', ')lm', 'lm(', ')lm', ')lm', ')lm', ')lm', ')lm', ')lm', ')lm', ')lm', ')lm', ')lm', ')lm', ')lm', ')lm', ')lm', ')lm', ')lm', 'Park', ')lm', ')lm', ')lm', ')lm', 'lm(', 'Park', ')lm', ')lm', ')lm', ')lm', 'Park', ')lm', ')lm', ')lm', 'Park', ')lm', ')lm', 'Park', ')lm']",False
7479,visit Pizza Hut Fiesta PetSmart Viet's Express and Domain at Kirby in that exact order once you leave any location you can not return to it,& & U ! fiesta pizza_hut & U ! petsmart fiesta & U ! viet's_express petsmart & U ! domain_at_kirby viet's_express F domain_at_kirby & U ! pizza_hut U pizza_hut U ! pizza_hut fiesta & U ! fiesta U fiesta U ! fiesta petsmart & U ! petsmart U petsmart U ! petsmart viet's_express U ! viet's_express U viet's_express U ! viet's_express domain_at_kirby,Houston,"error:['!', 'F', 'lm(', 'lm(', ')lm', ')lm', 'lm(', 'lm(', 'lm(', 'Pizza', ')lm', 'lm(', 'lm(', 'lm(', 'lm(', ')lm', 'lm(', 'lm(', 'lm(', 'lm(', 'lm(', 'lm(', 'lm(', 'lm(', 'lm(', 'lm(', 'lm(', ')lm', 'lm(', ')lm', 'lm(', ')lm', ')lm', ')lm', ')lm', ')lm', ')lm', ')lm', ')lm', ')lm', ')lm', ')lm', ')lm', ')lm', ')lm', ')lm', ')lm', ')lm', ')lm', ')lm', ')lm', ')lm', ')lm', ')lm', ')lm', ')lm']",False
7480,before visiting Bank of America Financial Center Fiesta The UPS Store and Five Guys visit SpringHill Suites Houston Medical Center/NRG Park and never visit it again then visit Bank of America Financial Center before Fiesta The UPS Store and Five Guys and never visit it again do not visit The UPS Store and Five Guys until you visit Fiesta never visit Fiesta again then visit The UPS Store before Five Guys and never visit Five Guys again finally visit Five Guys,& & U ! bank_of_america_financial_center springhill_suites_houston_medical_center/nrg_park & U ! fiesta bank_of_america_financial_center & U ! the_ups_store fiesta & U ! five_guys the_ups_store F five_guys & U ! springhill_suites_houston_medical_center/nrg_park U springhill_suites_houston_medical_center/nrg_park U ! springhill_suites_houston_medical_center/nrg_park bank_of_america_financial_center & U ! bank_of_america_financial_center U bank_of_america_financial_center U ! bank_of_america_financial_center fiesta & U ! fiesta U fiesta U ! fiesta the_ups_store U ! the_ups_store U the_ups_store U ! the_ups_store five_guys,Houston,"error:['&', '&', 'U', '!', 'lm(', 'The', 'UPS', ')lm', 'lm(', 'America', 'Center', ')lm', '&', 'U', '!', 'lm(', 'The', 'and', ')lm', 'lm(', 'The', 'Center', ')lm', '&', 'U', '!', 'lm(', 'Five', 'Center', ')lm', 'lm(', 'The', 'lm(', ')lm', 'F', 'lm(', 'The', 'Center', ')lm', '&', 'U', '!', 'lm(', 'of', 'Center', ')lm', 'U', 'lm(', 'America', 'America', 'Center', ')lm', 'U', '!', 'lm(', 'The', 'America', ')lm', ')lm', 'The', 'The', 'Center', ')lm', 'lm(', 'The', 'The', ')lm', ')lm', ')lm', 'The', 'The', 'The', ')lm', ')lm', 'The', 'The', 'The', ')lm', ')lm', 'The', 'The', ')lm', ')lm', 'The', 'The', ')lm', ')lm', 'lm(', 'The', 'The', ')lm', ')lm', ')lm', 'The', 'lm(', 'The', 'and', ')lm', ')lm', ')lm', ')lm', 'The', 'and', ')lm']",False
7481,before visiting Royal Nails & Spa Chipotle Extended Stay America - Houston - Med. Ctr. - NRG Park - Kirby and Texas Medical Center visit Big Lots and never visit it again then visit Royal Nails & Spa before Chipotle Extended Stay America - Houston - Med. Ctr. - NRG Park - Kirby and Texas Medical Center and never visit it again do not visit Extended Stay America - Houston - Med. Ctr. - NRG Park - Kirby and Texas Medical Center until you visit Chipotle never visit Chipotle again then visit Extended Stay America - Houston - Med. Ctr. - NRG Park - Kirby before Texas Medical Center and never visit Texas Medical Center again finally visit Texas Medical Center,& & U ! royal_nails_&_spa big_lots & U ! chipotle royal_nails_&_spa & U ! extended_stay_america_-_houston_-_med._ctr._-_nrg_park_-_kirby chipotle & U ! texas_medical_center extended_stay_america_-_houston_-_med._ctr._-_nrg_park_-_kirby F texas_medical_center & U ! big_lots U big_lots U ! big_lots royal_nails_&_spa & U ! royal_nails_&_spa U royal_nails_&_spa U ! royal_nails_&_spa chipotle & U ! chipotle U chipotle U ! chipotle extended_stay_america_-_houston_-_med._ctr._-_nrg_park_-_kirby U ! extended_stay_america_-_houston_-_med._ctr._-_nrg_park_-_kirby U extended_stay_america_-_houston_-_med._ctr._-_nrg_park_-_kirby U ! extended_stay_america_-_houston_-_med._ctr._-_nrg_park_-_kirby texas_medical_center,Houston,"error:['&', '&', 'U', '!', 'lm(', 'Spa', ')lm', '-', 'lm(', ')lm', ')lm', 'lm(', 'Royal', 'Nails', ')lm', '!', 'lm(', 'lm(', 'lm(', '-', '-', '-', '-', '-', '-', 'Park', ')lm', '-', 'lm(', '-', ')lm', '-', 'Center', ')lm', '-', 'Center', 'Center', ')lm', '-', 'Center', ')lm', '&', ')lm', '&', 'lm(', '&', 'lm(', '&', 'lm(', '&', 'lm(', '-', '&', '-', '&', '-', '&', ')lm', '-', '&', ')lm', '-', '&', '-', '&', '-', '&', '-', 'lm(', '-', 'Center', ')lm', '-', ')lm', '-', ')lm', '-', 'Center', ')lm', '-', ')lm', '-', ')lm', '-', ')lm', '-', 'Center', ')lm', '-', ')lm', '-', ')lm', '-', ')lm', '-', 'Center', ')lm', 'Park', ')lm', '-', ')lm', '-', ')lm', '-', ')lm', '-', 'Center', ')lm', 'Park', 'Park', ')lm', 'Park', ')lm', 'Park', ')lm', 'Park', ')lm', 'Park', ')lm', 'Center', ')lm', 'Park', ')lm', 'Center', ')lm', 'Center', ')lm', 'Center', ')lm', 'Center', ')lm', 'Center']",False
7482,go from Capital One Bank to Purple Lot to PetSmart to Royal Nails & Spa to Holiday Inn Houston - NRG/Medical Center Area in that specific order and only visit each landmark one time,& & U ! purple_lot capital_one_bank & U ! petsmart purple_lot & U ! royal_nails_&_spa petsmart & U ! holiday_inn_houston_-_nrg/medical_center_area royal_nails_&_spa F holiday_inn_houston_-_nrg/medical_center_area & U ! capital_one_bank U capital_one_bank U ! capital_one_bank purple_lot & U ! purple_lot U purple_lot U ! purple_lot petsmart & U ! petsmart U petsmart U ! petsmart royal_nails_&_spa U ! royal_nails_&_spa U royal_nails_&_spa U ! royal_nails_&_spa holiday_inn_houston_-_nrg/medical_center_area,Houston,"error:['&', '&', 'U', '!', 'lm(', 'Royal', ')lm', ')lm', 'lm(', 'Capital', 'Bank', ')lm', ')lm', '&', 'U', '!', 'lm(', 'Holiday', '-', '-', 'Center', ')lm', 'lm(', 'lm(', 'Royal', ')lm', '&', 'U', '!', 'lm(', 'lm(', 'and', ')lm', 'lm(', 'lm(', 'Center', ')lm', 'Center', 'lm(', 'lm(', 'lm(', ')lm', '&', '&', 'U', 'lm(', 'lm(', '&', '!', 'lm(', '&', 'U', '!', 'lm(', ')lm', 'U', '!', 'lm(', ')lm', 'U', '!', 'lm(', 'Royal', ')lm', ')lm', ')lm', 'U', '!', 'lm(', 'Royal', ')lm', ')lm', ')lm', ')lm', ')lm', ')lm', ')lm', ')lm', ')lm', 'Center', ')lm', ')lm', '!', ')lm', 'Center', ')lm', ')lm', 'Center', ')lm', ')lm', ')lm', 'Center', ')lm', ')lm', 'Center', '!', ')lm', 'Center', ')lm', 'Center', ')lm', ')lm', '!', 'lm(', ')lm', 'Center', ')lm', 'Center', ')lm', 'Center', ')lm', 'Center', ')lm', 'Center', ')lm', 'Center', ')lm', 'Center', ')lm', 'Center', ')lm', 'Center', ')lm']",False
7483,go from Capital One Bank to Chipotle to Viet's Express to Infinite Smiles Family Dentistry to Bank of America Financial Center in that specific order and only visit each landmark one time,& & U ! chipotle capital_one_bank & U ! viet's_express chipotle & U ! infinite_smiles_family_dentistry viet's_express & U ! bank_of_america_financial_center infinite_smiles_family_dentistry F bank_of_america_financial_center & U ! capital_one_bank U capital_one_bank U ! capital_one_bank chipotle & U ! chipotle U chipotle U ! chipotle viet's_express & U ! viet's_express U viet's_express U ! viet's_express infinite_smiles_family_dentistry U ! infinite_smiles_family_dentistry U infinite_smiles_family_dentistry U ! infinite_smiles_family_dentistry bank_of_america_financial_center,Houston,"error:['&', '&', 'U', '!', 'lm(', 'Infinite', ')lm', ')lm', 'lm(', 'Capital', ')lm', ')lm', '&', 'U', '!', 'lm(', 'America', 'Center', ')lm', 'lm(', 'Infinite', 'Infinite', ')lm', '&', 'U', '!', 'lm(', 'lm(', 'and', ')lm', 'lm(', 'lm(', 'Financial', 'Center', ')lm', 'F', 'lm(', 'lm(', ')lm', '&', 'U', '!', 'lm(', 'U', 'Bank', 'U', 'lm(', 'Bank', ')lm', ')lm', 'Bank', '!', 'lm(', 'Bank', ')lm', ')lm', 'Bank', '!', ')lm', ')lm', 'Bank', ')lm', ')lm', ')lm', 'U', '!', 'lm(', 'Infinite', ')lm', ')lm', ')lm', 'Center', ')lm', ')lm', 'U', '!', 'lm(', 'of', ')lm', 'Center', ')lm', 'Center', ')lm', ')lm', 'Center', '!', ')lm', ')lm', 'Center', ')lm', 'Center', ')lm', ')lm', 'Center', '!', 'lm(', ')lm', 'Center', ')lm', 'Center', ')lm', 'Center', ')lm', 'Center', ')lm', 'Center', ')lm', 'Center', ')lm', 'Center', ')lm', 'Center', ')lm', ')lm', 'Center', ')lm']",False
7484,first visit Viet's Express while avoiding Glazed the Doughnut Cafe then visit Glazed the Doughnut Cafe while avoiding Freebirds World Burrito then visit Freebirds World Burrito while avoiding The UPS Store then visit The UPS Store while avoiding Fiesta finally visit Fiesta visit each location once,& & U ! glazed_the_doughnut_cafe viet's_express & U ! freebirds_world_burrito glazed_the_doughnut_cafe & U ! the_ups_store freebirds_world_burrito & U ! fiesta the_ups_store F fiesta & U ! viet's_express U viet's_express U ! viet's_express glazed_the_doughnut_cafe & U ! glazed_the_doughnut_cafe U glazed_the_doughnut_cafe U ! glazed_the_doughnut_cafe freebirds_world_burrito & U ! freebirds_world_burrito U freebirds_world_burrito U ! freebirds_world_burrito the_ups_store U ! the_ups_store U the_ups_store U ! the_ups_store fiesta,Houston,"error:['&', '&', 'U', '!', 'lm(', 'Glazed', 'Cafe', ')lm', 'lm(', ""Viet's"", 'Cafe', ')lm', '&', 'U', '!', 'lm(', 'The', 'Cafe', ')lm', 'lm(', 'The', 'Cafe', ')lm', '&', 'U', '!', 'lm(', 'The', 'Fiesta', ')lm', 'lm(', 'The', 'Cafe', ')lm', 'F', 'lm(', 'The', 'Fiesta', ')lm', '&', 'U', '!', 'lm(', ""Viet's"", 'Cafe', ')lm', 'U', 'lm(', ""Viet's"", 'Cafe', ')lm', 'U', '!', 'lm(', ""Viet's"", 'Cafe', ')lm', 'lm(', 'the', 'Cafe', ')lm', '&', 'U', '!', 'lm(', 'the', 'Cafe', ')lm', 'U', 'lm(', 'Glazed', 'Cafe', ')lm', 'U', '!', 'lm(', 'the', 'Cafe', ')lm', 'lm(', 'The', 'Cafe', ')lm', 'U', '!', 'lm(', 'lm(', ')lm', 'U', 'lm(', 'The', 'U', ')lm', 'U', '!', 'lm(', 'The', 'lm(', ')lm', 'lm(', 'The', 'The', ')lm', ')lm']",False
7485,first visit Fannin Substation while avoiding Extended Stay America - Houston - Med. Ctr. - NRG Park - Kirby then visit Extended Stay America - Houston - Med. Ctr. - NRG Park - Kirby while avoiding SpringHill Suites Houston Medical Center/NRG Park then visit SpringHill Suites Houston Medical Center/NRG Park while avoiding Chipotle then visit Chipotle while avoiding Texas Medical Center finally visit Texas Medical Center visit each location once,& & U ! extended_stay_america_-_houston_-_med._ctr._-_nrg_park_-_kirby fannin_substation & U ! springhill_suites_houston_medical_center/nrg_park extended_stay_america_-_houston_-_med._ctr._-_nrg_park_-_kirby & U ! chipotle springhill_suites_houston_medical_center/nrg_park & U ! texas_medical_center chipotle F texas_medical_center & U ! fannin_substation U fannin_substation U ! fannin_substation extended_stay_america_-_houston_-_med._ctr._-_nrg_park_-_kirby & U ! extended_stay_america_-_houston_-_med._ctr._-_nrg_park_-_kirby U extended_stay_america_-_houston_-_med._ctr._-_nrg_park_-_kirby U ! extended_stay_america_-_houston_-_med._ctr._-_nrg_park_-_kirby springhill_suites_houston_medical_center/nrg_park & U ! springhill_suites_houston_medical_center/nrg_park U springhill_suites_houston_medical_center/nrg_park U ! springhill_suites_houston_medical_center/nrg_park chipotle U ! chipotle U chipotle U ! chipotle texas_medical_center,Houston,"error:['&', '&', 'U', '!', 'lm(', 'NRG', ')lm', '-', 'lm(', ')lm', ')lm', 'lm(', 'Fannin', '-', '-', '&', 'U', '!', 'lm(', 'Extended', 'Park', '-', 'lm(', 'lm(', 'Park', ')lm', '&', 'U', '!', 'lm(', 'Texas', 'Park', ')lm', 'lm(', 'lm(', 'Park', '-', 'F', 'lm(', 'Center', ')lm', '&', 'U', '!', 'lm(', 'Fannin', ')lm', '-', 'lm(', 'lm(', 'Park', ')lm', 'U', 'lm(', 'lm(', ')lm', '-', '-', '-', '-', '-', '-', '-', '-', '-', '-', '-', '-', '-', '-', '-', '-', '-', '-', 'Park', ')lm', '-', '-', '-', 'Park', ')lm', '-', '-', 'Park', ')lm', 'Park', '-', 'Park', ')lm', 'Park', 'U', '-', 'Park', 'Park', 'Park', 'Park', 'Park', 'Park', 'Park', 'Park', ')lm', 'Park', ')lm', 'Park', ')lm', 'Park', ')lm', 'Park', ')lm', 'Park', ')lm', 'Park', ')lm', 'Park', ')lm', 'Park', ')lm', 'Park', 'Park', 'Park', ')lm', 'Park', ')lm', 'Park', ')lm', 'Park', ')lm', '-', 'Park', 'Park', 'Park', ')lm', '-', 'Park']",False
7486,go to Akashi Asian Sushi Cuisine & Wine Bar once without visiting GameStop then go to GameStop once without visiting Taco Cabana then go to Taco Cabana once without visiting Glazed the Doughnut Cafe then go to Glazed the Doughnut Cafe once without visiting Five Guys finally go to Five Guys,& & U ! gamestop akashi_asian_sushi_cuisine_&_wine_bar & U ! taco_cabana gamestop & U ! glazed_the_doughnut_cafe taco_cabana & U ! five_guys glazed_the_doughnut_cafe F five_guys & U ! akashi_asian_sushi_cuisine_&_wine_bar U akashi_asian_sushi_cuisine_&_wine_bar U ! akashi_asian_sushi_cuisine_&_wine_bar gamestop & U ! gamestop U gamestop U ! gamestop taco_cabana & U ! taco_cabana U taco_cabana U ! taco_cabana glazed_the_doughnut_cafe U ! glazed_the_doughnut_cafe U glazed_the_doughnut_cafe U ! glazed_the_doughnut_cafe five_guys,Houston,"error:['&', '&', 'U', '!', 'lm(', 'GameStop', 'Cafe', ')lm', 'lm(', 'Akashi', 'Cafe', ')lm', '&', 'U', '!', 'lm(', 'the', 'Cafe', ')lm', 'lm(', 'Wine', 'Cafe', ')lm', '&', 'U', '!', 'lm(', 'Five', 'Cafe', ')lm', 'lm(', 'the', 'Cafe', ')lm', 'F', 'lm(', 'Doughnut', 'Cafe', ')lm', '&', 'U', '!', 'lm(', 'Akashi', 'Cafe', ')lm', 'U', 'lm(', 'Akashi', 'Sushi', ')lm', 'U', '!', 'lm(', 'Akashi', 'Sushi', ')lm', 'lm(', 'lm(', 'Cafe', ')lm', 'U', '!', 'lm(', 'lm(', 'Wine', 'Wine', 'U', 'lm(', 'the', ')lm', 'the', 'U', ')lm', 'lm(', 'the', ')lm', 'the', ')lm', 'Cafe', ')lm', 'Cafe', ')lm', 'Cafe', 'Cafe', 'Cafe', ')lm', 'Cafe', ')lm', 'Cafe', ')lm', 'Cafe', ')lm', 'Cafe', ')lm', 'Cafe', ')lm', 'Cafe', ')lm', ')lm', ')lm', ')lm', ')lm', 'Cafe', ')lm']",False
7487,go to Office Depot once without visiting Extended Stay America - Houston - Med. Ctr. - NRG Park - Kirby then go to Extended Stay America - Houston - Med. Ctr. - NRG Park - Kirby once without visiting Chipotle then go to Chipotle once without visiting Five Guys then go to Five Guys once without visiting Capital One Bank finally go to Capital One Bank,& & U ! extended_stay_america_-_houston_-_med._ctr._-_nrg_park_-_kirby office_depot & U ! chipotle extended_stay_america_-_houston_-_med._ctr._-_nrg_park_-_kirby & U ! five_guys chipotle & U ! capital_one_bank five_guys F capital_one_bank & U ! office_depot U office_depot U ! office_depot extended_stay_america_-_houston_-_med._ctr._-_nrg_park_-_kirby & U ! extended_stay_america_-_houston_-_med._ctr._-_nrg_park_-_kirby U extended_stay_america_-_houston_-_med._ctr._-_nrg_park_-_kirby U ! extended_stay_america_-_houston_-_med._ctr._-_nrg_park_-_kirby chipotle & U ! chipotle U chipotle U ! chipotle five_guys U ! five_guys U five_guys U ! five_guys capital_one_bank,Houston,"error:['&', '&', 'U', '!', 'lm(', 'NRG', 'Park', '-', 'lm(', ')lm', ')lm', 'lm(', 'Office', '-', '-', '&', 'U', '!', 'lm(', 'lm(', 'Stay', '-', '-', ')lm', ')lm', '-', 'lm(', '-', '-', '-', ')lm', '-', '-', 'lm(', 'lm(', 'lm(', '-', 'lm(', '-', 'Bank', '-', ')lm', '-', 'Bank', '-', 'lm(', 'Bank', ')lm', '-', 'Bank', ')lm', ')lm', '-', 'lm(', 'lm(', '-', '-', '-', '-', '-', '-', '-', '-', '-', 'lm(', '-', '-', '-', '-', '-', '-', 'lm(', '-', ')lm', '-', '-', '-', ')lm', '-', ')lm', '-', '-', '-', ')lm', '-', ')lm', '-', ')lm', '-', '-', '-', ')lm', '-', ')lm', '-', ')lm', '-', ')lm', '-', ')lm', '-', ')lm', '-', ')lm', '-', ')lm', '-', ')lm', '-', ')lm', '-', 'Park', ')lm', '-', 'Park', ')lm', '-', 'Park', ')lm', '-', ')lm', '-', 'Park', ')lm', '-', ')lm', '-', 'Park', ')lm', '-', ')lm', '-', ')lm', '-', ')lm', '-', ')lm', '-', ')lm', '-', ')lm', '-', 'Bank', '-', ')lm', '-', 'Bank', ')lm', '-']",False
7488,visit Chipotle while staying away from Capital One Bank then visit Capital One Bank while staying away from Viet's Express then visit Viet's Express while staying away from Five Guys then visit Five Guys while staying away from Texas Medical Center finally reach Texas Medical Center without returning to any previously visited locations,& & U ! capital_one_bank chipotle & U ! viet's_express capital_one_bank & U ! five_guys viet's_express & U ! texas_medical_center five_guys F texas_medical_center & U ! chipotle U chipotle U ! chipotle capital_one_bank & U ! capital_one_bank U capital_one_bank U ! capital_one_bank viet's_express & U ! viet's_express U viet's_express U ! viet's_express five_guys U ! five_guys U five_guys U ! five_guys texas_medical_center,Houston,"error:['&', '&', 'U', '!', 'lm(', 'Capital', ')lm', ')lm', 'lm(', 'Chipotle', ')lm', ')lm', '&', 'U', '!', 'lm(', ""Viet's"", ')lm', ')lm', 'lm(', 'lm(', 'Bank', ')lm', ')lm', 'U', 'lm(', 'lm(', 'Center', 'Center', ')lm', 'lm(', 'lm(', 'lm(', 'Center', 'Center', ')lm', 'lm(', 'lm(', 'lm(', 'lm(', 'lm(', 'lm(', 'lm(', 'lm(', 'lm(', 'lm(', 'lm(', 'lm(', 'Bank', 'lm(', ')lm', 'U', '!', 'lm(', 'Bank', 'Bank', ')lm', ')lm', 'U', '!', 'lm(', 'Bank', 'Bank', ')lm', ')lm', 'U', '!', 'lm(', ')lm', 'lm(', 'lm(', ')lm', 'lm(', ')lm', 'lm(', 'lm(', ')lm', 'lm(', ')lm', 'lm(', 'lm(', ')lm', 'lm(', 'lm(', ')lm', 'Center', ')lm', 'Center', ')lm', 'lm(', 'Center', ')lm', 'Center', ')lm', 'Center', ')lm', 'Center', ')lm', 'Center', ')lm', 'Center', ')lm']",False
7489,visit Catfish Station while staying away from Five Guys then visit Five Guys while staying away from GameStop then visit GameStop while staying away from Royal Nails & Spa then visit Royal Nails & Spa while staying away from Office Depot finally reach Office Depot without returning to any previously visited locations,& & U ! five_guys catfish_station & U ! gamestop five_guys & U ! royal_nails_&_spa gamestop & U ! office_depot royal_nails_&_spa F office_depot & U ! catfish_station U catfish_station U ! catfish_station five_guys & U ! five_guys U five_guys U ! five_guys gamestop & U ! gamestop U gamestop U ! gamestop royal_nails_&_spa U ! royal_nails_&_spa U royal_nails_&_spa U ! royal_nails_&_spa office_depot,Houston,"error:['&', '&', 'U', '!', 'lm(', 'Five', ')lm', ')lm', 'lm(', 'Catfish', ')lm', ')lm', '&', 'U', '!', 'lm(', '&', '&', ')lm', 'lm(', 'Five', 'Guys', ')lm', '&', 'U', '!', 'lm(', 'Office', ')lm', ')lm', 'lm(', 'lm(', '&', '&', ')lm', 'lm(', 'lm(', 'lm(', ')lm', '&', 'U', '!', 'lm(', 'U', 'lm(', ')lm', 'U', 'lm(', 'lm(', 'lm(', 'U', '!', 'lm(', 'U', '!', 'lm(', 'U', '!', 'lm(', 'U', '!', 'lm(', 'away', 'away', 'away', ')lm', ')lm', 'U', '!', 'lm(', '&', 'U', '!', 'lm(', '&', 'U', '!', 'lm(', '&', '&', 'U', '&', 'U', '&', 'U', '&', 'U', '&', 'U', '&', '&', 'U', '&', 'U', '&', '&', 'U', '&', 'U', '&', '&', 'U', '&', 'U', '&', '&', 'U', '&', 'U', '&', '&', ')lm', '&', ')lm', '&', ')lm', ')lm', '&', ')lm', '&', ')lm']",False
7490,go to Five Guys without visiting Chipotle then go to Chipotle without visiting GameStop third go to GameStop without visiting Infinite Smiles Family Dentistry fourth go to Infinite Smiles Family Dentistry without visiting Akashi Asian Sushi Cuisine & Wine Bar finally go to Akashi Asian Sushi Cuisine & Wine Bar visit Five Guys Chipotle GameStop and Infinite Smiles Family Dentistry only one time,& & U ! chipotle five_guys & U ! gamestop chipotle & U ! infinite_smiles_family_dentistry gamestop & U ! akashi_asian_sushi_cuisine_&_wine_bar infinite_smiles_family_dentistry F akashi_asian_sushi_cuisine_&_wine_bar & U ! five_guys U five_guys U ! five_guys chipotle & U ! chipotle U chipotle U ! chipotle gamestop & U ! gamestop U gamestop U ! gamestop infinite_smiles_family_dentistry U ! infinite_smiles_family_dentistry U infinite_smiles_family_dentistry U ! infinite_smiles_family_dentistry akashi_asian_sushi_cuisine_&_wine_bar,Houston,"error:['&', '&', 'U', '!', 'lm(', 'GameStop', ')lm', ')lm', 'lm(', 'Five', ')lm', ')lm', '&', 'U', '!', 'lm(', 'Infinite', ')lm', ')lm', 'lm(', 'lm(', 'GameStop', ')lm', ')lm', 'U', 'lm(', 'lm(', '&', ')lm', 'lm(', 'lm(', 'lm(', '&', ')lm', 'lm(', 'lm(', '&', ')lm', 'lm(', 'lm(', 'lm(', 'lm(', '&', ')lm', 'lm(', 'lm(', 'lm(', '&', ')lm', 'lm(', 'lm(', 'lm(', ')lm', ')lm', 'lm(', 'lm(', ')lm', ')lm', 'lm(', ')lm', ')lm', ')lm', 'lm(', ')lm', ')lm', ')lm', ')lm', ')lm', ')lm', ')lm', ')lm', ')lm', ')lm', ')lm', ')lm', ')lm', ')lm', ')lm', ')lm', ')lm', ')lm', ')lm', ')lm', ')lm', ')lm', ')lm', ')lm', ')lm', ')lm']",False
7491,go to Fannin Substation without visiting Chipotle then go to Chipotle without visiting GameStop third go to GameStop without visiting Office Depot fourth go to Office Depot without visiting NRG Park finally go to NRG Park visit Fannin Substation Chipotle GameStop and Office Depot only one time,& & U ! chipotle fannin_substation & U ! gamestop chipotle & U ! office_depot gamestop & U ! nrg_park office_depot F nrg_park & U ! fannin_substation U fannin_substation U ! fannin_substation chipotle & U ! chipotle U chipotle U ! chipotle gamestop & U ! gamestop U gamestop U ! gamestop office_depot U ! office_depot U office_depot U ! office_depot nrg_park,Houston,"error:['&', '&', 'U', '!', 'lm(', 'GameStop', ')lm', ')lm', 'lm(', 'Fannin', ')lm', ')lm', '&', 'U', '!', 'lm(', 'Office', 'Park', ')lm', 'lm(', 'GameStop', ')lm', ')lm', '&', 'U', '!', 'lm(', 'lm(', 'Park', ')lm', 'lm(', 'lm(', 'Park', ')lm', 'lm(', 'lm(', 'lm(', 'lm(', 'lm(', 'lm(', 'lm(', 'lm(', 'lm(', 'lm(', 'lm(', 'lm(', 'lm(', 'lm(', 'lm(', 'lm(', ')lm', 'lm(', 'lm(', ')lm', 'lm(', ')lm', ')lm', 'lm(', ')lm', ')lm', 'lm(', ')lm', ')lm', ')lm', 'Park', ')lm', ')lm', ')lm', ')lm', ')lm', 'Park', ')lm', ')lm', ')lm', ')lm', 'Park', ')lm', ')lm', ')lm', 'Park', ')lm', ')lm', ')lm', 'Park', ')lm', 'Park', ')lm', ')lm', ')lm']",False
7492,keep visiting Olive Garden,G F olive_garden,Houston,"error:['G', 'lm(', 'lm(', 'Garden']",False
7493,keep visiting Antone's Import Co.,G F antone's_import_co.,Houston,"error:['!', 'lm(', 'lm(', 'Import', ')lm']",False
7494,go to Royal Nails & Spa an infinite number of times,G F royal_nails_&_spa,Houston,F G five_guys F five_guys lm( royal_nails_&_spa,False
7495,go to Catfish Station an infinite number of times,G F catfish_station,Houston,"error:['F', 'lm(', 'lm(', 'number', ')lm', ')lm', 'F', ')lm', 'F', 'F', 'F']",False
7496,continue moving to GameStop,G F gamestop,Houston,"error:['G', 'lm(', 'lm(', 'moving']",False
7497,continue moving to Glazed the Doughnut Cafe,G F glazed_the_doughnut_cafe,Houston,G ! glazed_the_doughnut_cafe,False
7498,do not stop visiting Akashi Asian Sushi Cuisine & Wine Bar,G F akashi_asian_sushi_cuisine_&_wine_bar,Houston,"error:['&', 'G', '!', 'lm(', 'Akashi', ')lm', ')lm', 'G', '!', 'lm(', 'Cuisine', '&', ')lm']",False
7499,do not stop visiting NRG Park,G F nrg_park,Houston,"error:['G', 'lm(', 'lm(', 'Park', ')lm']",False
7500,do not stop going to PetSmart,G F petsmart,Houston,! bank_of_america_financial_center,False
7501,do not stop going to Akashi Asian Sushi Cuisine & Wine Bar,G F akashi_asian_sushi_cuisine_&_wine_bar,Houston,"error:['&', 'G', '!', 'lm(', '&', ')lm', ')lm', ')lm', ')lm', ')lm', 'lm(', '&', '&', '&', ')lm']",False
