,nl_command,ltl,map_name,result,eq
8829,visit Novel Cafe Westwood Gayley & Lindbrook Apartments UCLA Extension - Lindbrook Center Occidental Petroleum Heliport and U-Mini once do not visit Gayley & Lindbrook Apartments without visiting Novel Cafe Westwood and do not visit UCLA Extension - Lindbrook Center without visiting Gayley & Lindbrook Apartments also do not visit Occidental Petroleum Heliport without visiting UCLA Extension - Lindbrook Center and do not visit U-Mini without visiting Occidental Petroleum Heliport,& & U ! gayley_&_lindbrook_apartments novel_cafe_westwood & U ! ucla_extension_-_lindbrook_center gayley_&_lindbrook_apartments & U ! occidental_petroleum_heliport ucla_extension_-_lindbrook_center & U ! u-mini occidental_petroleum_heliport F u-mini & U ! novel_cafe_westwood U novel_cafe_westwood U ! novel_cafe_westwood gayley_&_lindbrook_apartments & U ! gayley_&_lindbrook_apartments U gayley_&_lindbrook_apartments U ! gayley_&_lindbrook_apartments ucla_extension_-_lindbrook_center & U ! ucla_extension_-_lindbrook_center U ucla_extension_-_lindbrook_center U ! ucla_extension_-_lindbrook_center occidental_petroleum_heliport U ! occidental_petroleum_heliport U occidental_petroleum_heliport U ! occidental_petroleum_heliport u-mini,Los Angeles #1,"error:['&', '&', 'U', '!', 'lm(', '&', ')lm', ')lm', 'lm(', 'Cafe', 'Cafe', ')lm', 'U', '!', 'lm(', 'lm(', 'Cafe', ')lm', 'lm(', 'lm(', '&', '-', '&', 'Center', ')lm', 'F', 'lm(', 'lm(', 'lm(', '-', ')lm', '&', 'U', '!', 'lm(', '&', 'U', 'Cafe', ')lm', '&', 'U', 'Cafe', ')lm', '-', 'lm(', '&', 'U', 'Cafe', ')lm', 'lm(', 'lm(', 'lm(', 'Cafe', 'Center', ')lm', '-', ')lm', 'lm(', 'lm(', '&', 'U', '!', 'lm(', '&', ')lm', 'Center', ')lm', 'lm(', '&', ')lm', '&', ')lm', '&', 'Center', ')lm', '!', 'lm(', '&', 'Center', ')lm', '-', ')lm', 'Center', ')lm', 'Center', ')lm', 'Center', ')lm', '-', ')lm', '!', 'lm(', ')lm', 'Center', 'Center', ')lm', 'Center', ')lm', '-', ')lm', 'Center', ')lm']",False
8830,visit UCLA Extension - Lindbrook Center followed by visiting bibigo then visit Westwood Sporting Goods Subway and Native Foods in this exact order visit all locations once,& & U ! bibigo ucla_extension_-_lindbrook_center & U ! westwood_sporting_goods bibigo & U ! subway westwood_sporting_goods & U ! native_foods subway F native_foods & U ! ucla_extension_-_lindbrook_center U ucla_extension_-_lindbrook_center U ! ucla_extension_-_lindbrook_center bibigo & U ! bibigo U bibigo U ! bibigo westwood_sporting_goods & U ! westwood_sporting_goods U westwood_sporting_goods U ! westwood_sporting_goods subway U ! subway U subway U ! subway native_foods,Los Angeles #1,"error:['&', '&', 'U', '!', 'lm(', 'bibigo', ')lm', ')lm', 'lm(', 'UCLA', '-', '-', 'Center', ')lm', '&', 'U', '!', 'lm(', 'Goods', 'and', ')lm', 'lm(', 'bibigo', ')lm', ')lm', '&', 'U', '!', 'lm(', 'Foods', 'Foods', ')lm', 'lm(', 'lm(', 'lm(', 'lm(', 'lm(', 'lm(', 'lm(', 'lm(', 'lm(', 'lm(', 'lm(', 'lm(', 'lm(', 'lm(', 'lm(', 'lm(', 'lm(', 'bibigo', 'U', 'lm(', 'bibigo', ')lm', 'lm(', 'bibigo', ')lm', 'bibigo', ')lm', 'bibigo', ')lm', 'bibigo', ')lm', 'bibigo', ')lm', 'bibigo', 'Westwood', ')lm', 'bibigo', ')lm', 'bibigo', 'Westwood', ')lm', 'Westwood', ')lm', 'Westwood', ')lm', 'Westwood', ')lm', 'Westwood', ')lm', 'Westwood', ')lm', ')lm', ')lm', 'Westwood', ')lm', 'Sporting', ')lm']",False
8831,visit Poke Bar followed by visiting Mio Babbo's then visit Westwood Sporting Goods U-Mini and Red Pelican Music in this exact order visit all locations once,& & U ! mio_babbo's poke_bar & U ! westwood_sporting_goods mio_babbo's & U ! u-mini westwood_sporting_goods & U ! red_pelican_music u-mini F red_pelican_music & U ! poke_bar U poke_bar U ! poke_bar mio_babbo's & U ! mio_babbo's U mio_babbo's U ! mio_babbo's westwood_sporting_goods & U ! westwood_sporting_goods U westwood_sporting_goods U ! westwood_sporting_goods u-mini U ! u-mini U u-mini U ! u-mini red_pelican_music,Los Angeles #1,"error:['&', '&', 'U', '!', 'lm(', 'Mio', ')lm', ')lm', 'lm(', 'Poke', ')lm', '&', 'U', '!', 'lm(', 'Sporting', 'and', ')lm', 'lm(', 'lm(', ""Babbo's"", ')lm', '&', 'U', '!', 'lm(', 'Music', 'Music', ')lm', 'lm(', 'lm(', 'lm(', 'lm(', 'lm(', 'lm(', 'lm(', 'lm(', 'lm(', 'lm(', 'lm(', 'lm(', 'lm(', 'lm(', 'lm(', 'lm(', 'lm(', 'lm(', 'Mio', ')lm', 'lm(', 'Mio', ')lm', 'lm(', 'Mio', ')lm', 'Mio', ')lm', 'Mio', ')lm', 'Mio', ')lm', 'Mio', ')lm', 'Westwood', ')lm', ')lm', ')lm', 'Westwood', ')lm', 'Westwood', ')lm', ')lm', 'Westwood', ')lm', 'Westwood', ')lm', 'Westwood', ')lm', ')lm', 'Westwood', ')lm', 'Westwood', ')lm', 'Sporting', ')lm', ')lm', ')lm', 'Sporting', ')lm', 'Sporting', ')lm']",False
8832,go to Peet's Coffee & Tea only then go to TCT Foods only then go to UCLA Extension - Westwood Village Center only then go to Veggie Grill and only then go to Urban Outfitters make sure to not revisit any of the locations before completing the task,& & U ! tct_foods peet's_coffee_&_tea & U ! ucla_extension_-_westwood_village_center tct_foods & U ! veggie_grill ucla_extension_-_westwood_village_center & U ! urban_outfitters veggie_grill F urban_outfitters & U ! peet's_coffee_&_tea U peet's_coffee_&_tea U ! peet's_coffee_&_tea tct_foods & U ! tct_foods U tct_foods U ! tct_foods ucla_extension_-_westwood_village_center & U ! ucla_extension_-_westwood_village_center U ucla_extension_-_westwood_village_center U ! ucla_extension_-_westwood_village_center veggie_grill U ! veggie_grill U veggie_grill U ! veggie_grill urban_outfitters,Los Angeles #1,"error:['!', '&', 'lm(', 'the', ')lm', ')lm', 'lm(', ""Peet's"", '&', ')lm', 'U', '!', 'lm(', 'UCLA', ')lm', '-', 'Center', ')lm', 'lm(', 'lm(', 'the', '!', 'the', 'the', '!', ')lm', 'the', 'the', ')lm', 'lm(', ')lm', ')lm', ')lm', 'Urban', ')lm', ')lm', ')lm', 'lm(', 'the', ')lm', 'the', 'the', ')lm', 'the', 'the', 'the', 'the', 'the', 'the', 'the', 'the', ')lm', ')lm', ')lm', ')lm', 'lm(', 'the', 'the', 'the', 'the', 'the', 'the', 'the', ')lm', ')lm', ')lm', ')lm', 'lm(', 'the', 'the', 'the', ')lm', ')lm', ')lm', ')lm', ')lm', ')lm', ')lm', 'the', 'the', 'the', 'the', ')lm', ')lm', ')lm', ')lm', ')lm', ')lm', 'the', 'the', 'the', ')lm', ')lm', ')lm', ')lm', ')lm', ')lm', 'the', 'the', 'the', ')lm', ')lm', ')lm', ')lm', ')lm', ')lm', 'the', 'the', 'the', ')lm', ')lm', ')lm', ')lm', ')lm', ')lm', '-', ')lm', '-', 'the', 'the', 'the', 'the', ')lm']",False
8833,go to Native Foods only then go to Westwood Sporting Goods only then go to Subway only then go to UTLA Beauty and only then go to bibigo make sure to not revisit any of the locations before completing the task,& & U ! westwood_sporting_goods native_foods & U ! subway westwood_sporting_goods & U ! utla_beauty subway & U ! bibigo utla_beauty F bibigo & U ! native_foods U native_foods U ! native_foods westwood_sporting_goods & U ! westwood_sporting_goods U westwood_sporting_goods U ! westwood_sporting_goods subway & U ! subway U subway U ! subway utla_beauty U ! utla_beauty U utla_beauty U ! utla_beauty bibigo,Los Angeles #1,"error:['!', '&', 'lm(', 'lm(', 'the', 'the', 'lm(', 'lm(', 'lm(', 'the', ')lm', ')lm', '!', 'lm(', 'lm(', 'the', 'the', ')lm', ')lm', '!', 'lm(', 'the', 'the', 'the', ')lm', ')lm', '!', 'lm(', 'the', 'the', 'the', ')lm', ')lm', '!', 'lm(', 'the', 'the', 'the', ')lm', ')lm', 'lm(', 'the', 'the', 'the', 'the', 'the', ')lm', 'the', 'the', 'the', 'the', 'the', ')lm', ')lm', ')lm', 'the', 'the', 'the', 'the', 'the', ')lm', ')lm', 'the', 'the', 'the', 'the', 'the', ')lm', ')lm']",False
8834,go to Occidental Petroleum Heliport only then go to Iso Fusion Café without returning only after that go to Westwood Sporting Goods without returning only after that go to Stone Canyon Creek (underground) without returning and finally only then go to Veggie Grill without returning,& & U ! iso_fusion_café occidental_petroleum_heliport & U ! westwood_sporting_goods iso_fusion_café & U ! stone_canyon_creek_(underground) westwood_sporting_goods & U ! veggie_grill stone_canyon_creek_(underground) F veggie_grill & U ! occidental_petroleum_heliport U occidental_petroleum_heliport U ! occidental_petroleum_heliport iso_fusion_café & U ! iso_fusion_café U iso_fusion_café U ! iso_fusion_café westwood_sporting_goods & U ! westwood_sporting_goods U westwood_sporting_goods U ! westwood_sporting_goods stone_canyon_creek_(underground) U ! stone_canyon_creek_(underground) U stone_canyon_creek_(underground) U ! stone_canyon_creek_(underground) veggie_grill,Los Angeles #1,"error:['&', '&', 'U', '!', 'lm(', 'Iso', ')lm', ')lm', 'lm(', 'Occidental', ')lm', ')lm', 'U', 'U', '!', 'lm(', 'Westwood', ')lm', ')lm', 'lm(', 'Iso', 'Iso', ')lm', '&', 'U', '!', 'lm(', 'lm(', ')lm', ')lm', 'lm(', 'lm(', 'lm(', ')lm', 'lm(', 'lm(', 'lm(', 'lm(', 'lm(', ')lm', 'lm(', 'lm(', 'lm(', 'lm(', 'U', 'lm(', 'U', '!', 'lm(', ')lm', 'U', '!', 'lm(', ')lm', 'U', ')lm', 'U', '!', 'lm(', 'Iso', ')lm', ')lm', 'U', ')lm', ')lm', 'Iso', 'Iso', 'Iso', 'Iso', 'Iso', ')lm', ')lm', ')lm', ')lm', ')lm', ')lm', ')lm', ')lm', ')lm', 'lm(', ')lm', ')lm', ')lm', 'lm(', ')lm', ')lm', ')lm', 'Sporting', ')lm', ')lm', ')lm', ')lm', 'Sporting', ')lm', ')lm', ')lm', 'Sporting', ')lm', ')lm', ')lm', ')lm', 'Sporting', ')lm', ')lm', ')lm']",False
8835,go to Parking 36 only then go to UCLA Extension - Lindbrook Center without returning only after that go to UCLA Extension - Westwood Village Center without returning only after that go to Noah's Bagels without returning and finally only then go to Plaza la Reina without returning,& & U ! ucla_extension_-_lindbrook_center parking_36 & U ! ucla_extension_-_westwood_village_center ucla_extension_-_lindbrook_center & U ! noah's_bagels ucla_extension_-_westwood_village_center & U ! plaza_la_reina noah's_bagels F plaza_la_reina & U ! parking_36 U parking_36 U ! parking_36 ucla_extension_-_lindbrook_center & U ! ucla_extension_-_lindbrook_center U ucla_extension_-_lindbrook_center U ! ucla_extension_-_lindbrook_center ucla_extension_-_westwood_village_center & U ! ucla_extension_-_westwood_village_center U ucla_extension_-_westwood_village_center U ! ucla_extension_-_westwood_village_center noah's_bagels U ! noah's_bagels U noah's_bagels U ! noah's_bagels plaza_la_reina,Los Angeles #1,"error:['&', '&', 'U', '!', 'lm(', 'UCLA', 'Extension', '-', 'Center', ')lm', 'lm(', 'Parking', '36', ')lm', '&', 'U', '!', 'lm(', 'UCLA', 'Extension', '-', 'Center', ')lm', 'lm(', 'UCLA', 'Extension', '-', 'Center', ')lm', '&', 'U', '!', 'lm(', 'lm(', ')lm', ')lm', 'lm(', 'lm(', 'lm(', '-', 'Center', ')lm', 'lm(', 'lm(', 'lm(', ')lm', '&', 'U', '!', 'lm(', 'U', '!', 'lm(', 'U', '!', 'lm(', 'Parking', '-', ')lm', ')lm', 'U', '!', '-', ')lm', '-', ')lm', ')lm', '-', ')lm', 'Center', ')lm', 'U', '!', '-', ')lm', 'Center', ')lm', 'Center', ')lm', 'Center', ')lm', 'Center', ')lm', 'Center', ')lm', 'Center', ')lm', 'Center', ')lm', 'Center', ')lm', 'Center', ')lm', 'Center', ')lm', 'Center', ')lm', '-', ')lm', 'Center', ')lm', 'Center', ')lm', 'Center', ')lm', 'Center', ')lm', 'Center', ')lm', 'Center', ')lm', 'Center', ')lm', 'Center', ')lm', 'Center', ')lm']",False
8836,go to Parking 32 but only after going to Mongol BBQ only once go to Mongol BBQ only after going to Native Foods only once go to Native Foods only after going to Ike's Place only once and go to Ike's Place only after going to Gayley Center only once,& & U ! ike's_place gayley_center & U ! native_foods ike's_place & U ! mongol_bbq native_foods & U ! parking_32 mongol_bbq F parking_32 & U ! gayley_center U gayley_center U ! gayley_center ike's_place & U ! ike's_place U ike's_place U ! ike's_place native_foods & U ! native_foods U native_foods U ! native_foods mongol_bbq U ! mongol_bbq U mongol_bbq U ! mongol_bbq parking_32,Los Angeles #1,"error:['&', '&', 'U', '!', 'lm(', 'Mongol', 'BBQ', ')lm', 'lm(', 'Center', ')lm', '&', 'U', '!', 'lm(', 'lm(', ')lm', ')lm', 'lm(', 'lm(', 'Mongol', 'BBQ', ')lm', 'lm(', 'lm(', 'lm(', 'lm(', 'lm(', 'lm(', 'lm(', 'lm(', 'lm(', 'lm(', 'lm(', 'lm(', ')lm', 'U', 'lm(', ')lm', ')lm', ')lm', ')lm', ')lm', 'only', 'only', 'only', 'only', 'only', 'only', 'only', 'only', 'only', 'only', 'only', 'only', 'only', 'BBQ', 'only', 'BBQ', 'only', 'BBQ', 'only', ')lm', 'only']",False
8837,go to Subway but only after going to Urban Outfitters only once go to Urban Outfitters only after going to 800 Degrees only once go to 800 Degrees only after going to Peet's Coffee & Tea only once and go to Peet's Coffee & Tea only after going to UCLA Extension - Lindbrook Center only once,& & U ! peet's_coffee_&_tea ucla_extension_-_lindbrook_center & U ! 800_degrees peet's_coffee_&_tea & U ! urban_outfitters 800_degrees & U ! subway urban_outfitters F subway & U ! ucla_extension_-_lindbrook_center U ucla_extension_-_lindbrook_center U ! ucla_extension_-_lindbrook_center peet's_coffee_&_tea & U ! peet's_coffee_&_tea U peet's_coffee_&_tea U ! peet's_coffee_&_tea 800_degrees & U ! 800_degrees U 800_degrees U ! 800_degrees urban_outfitters U ! urban_outfitters U urban_outfitters U ! urban_outfitters subway,Los Angeles #1,"error:['&', '&', 'U', '!', 'lm(', 'Urban', 'Outfitters', ')lm', 'lm(', 'UCLA', 'UCLA', '-', 'Center', ')lm', '&', 'U', '!', 'lm(', '800', ')lm', ')lm', 'lm(', '&', 'Urban', ')lm', ')lm', 'lm(', 'lm(', 'lm(', '&', ')lm', '&', 'U', '!', 'lm(', 'lm(', 'lm(', 'lm(', 'lm(', 'lm(', 'lm(', '&', 'Center', ')lm', 'U', 'lm(', 'lm(', '&', 'U', ')lm', 'U', '&', '&', 'only', ')lm', 'only', 'only', 'only', 'only', 'only', 'only', 'only', 'only', 'only', 'only', 'Outfitters', 'only', 'Outfitters', 'only', 'Outfitters', 'only', ')lm', 'only', ')lm']",False
8838,visit Noah's Bagels and only then visit Westwood Wilshire without returning to Noah's Bagels only then visit Mongol BBQ without returning to Westwood Wilshire only then visit Victoria's Secret without returning to Mongol BBQ and only then visit Novel Cafe Westwood without returning to Victoria's Secret,& & U ! westwood_wilshire noah's_bagels & U ! mongol_bbq westwood_wilshire & U ! victoria's_secret mongol_bbq & U ! novel_cafe_westwood victoria's_secret F novel_cafe_westwood & U ! noah's_bagels U noah's_bagels U ! noah's_bagels westwood_wilshire & U ! westwood_wilshire U westwood_wilshire U ! westwood_wilshire mongol_bbq & U ! mongol_bbq U mongol_bbq U ! mongol_bbq victoria's_secret U ! victoria's_secret U victoria's_secret U ! victoria's_secret novel_cafe_westwood,Los Angeles #1,"error:['&', '&', 'U', '!', 'lm(', 'Westwood', ')lm', ')lm', 'lm(', ""Noah's"", 'and', ')lm', '&', 'U', '!', 'lm(', 'Novel', 'Cafe', ')lm', 'lm(', 'lm(', 'Westwood', ')lm', 'F', 'lm(', 'lm(', 'Cafe', ')lm', '&', 'U', 'lm(', 'lm(', 'lm(', 'lm(', 'lm(', 'lm(', 'lm(', 'lm(', 'lm(', 'lm(', 'lm(', 'lm(', 'lm(', 'lm(', 'lm(', 'lm(', 'lm(', 'lm(', 'lm(', 'lm(', ')lm', 'lm(', 'Westwood', ')lm', 'lm(', 'Westwood', ')lm', ')lm', 'lm(', 'Westwood', ')lm', ')lm', 'lm(', 'Westwood', ')lm', ')lm', 'lm(', ')lm', ')lm', 'lm(', 'Westwood', ')lm', ')lm', ')lm', 'lm(', 'Cafe', ')lm']",False
8839,visit Westwood Sporting Goods and only then visit Mio Babbo's without returning to Westwood Sporting Goods only then visit Mongol BBQ without returning to Mio Babbo's only then visit bibigo without returning to Mongol BBQ and only then visit Red Pelican Music without returning to bibigo,& & U ! mio_babbo's westwood_sporting_goods & U ! mongol_bbq mio_babbo's & U ! bibigo mongol_bbq & U ! red_pelican_music bibigo F red_pelican_music & U ! westwood_sporting_goods U westwood_sporting_goods U ! westwood_sporting_goods mio_babbo's & U ! mio_babbo's U mio_babbo's U ! mio_babbo's mongol_bbq & U ! mongol_bbq U mongol_bbq U ! mongol_bbq bibigo U ! bibigo U bibigo U ! bibigo red_pelican_music,Los Angeles #1,"error:['&', '&', 'U', '!', 'lm(', 'Mio', ')lm', ')lm', 'lm(', 'Westwood', ')lm', ')lm', 'U', 'U', '!', 'lm(', 'Mongol', ')lm', ')lm', 'lm(', 'Mio', 'Mio', ')lm', '&', 'U', '!', 'lm(', 'lm(', ')lm', ')lm', 'lm(', 'lm(', 'lm(', ')lm', 'lm(', 'lm(', 'lm(', 'lm(', 'lm(', 'lm(', 'lm(', 'lm(', 'lm(', 'lm(', 'U', '!', 'lm(', 'U', '!', 'lm(', 'lm(', 'lm(', 'lm(', ')lm', 'lm(', 'lm(', 'Mio', ')lm', 'U', '!', 'lm(', 'Mio', ')lm', ')lm', 'lm(', 'Mio', ')lm', ')lm', 'lm(', 'Mio', ')lm', ')lm', 'lm(', 'Mio', ')lm', ')lm', 'lm(', 'Mio', ')lm', ')lm', 'lm(', 'lm(', ')lm', ')lm', 'lm(', 'Mongol', ')lm', ')lm']",False
8840,visit 800 Degrees Kinross Building South Gayley & Lindbrook Apartments Subway and Native Foods in that exact order once you leave any location you can not return to it,& & U ! kinross_building_south 800_degrees & U ! gayley_&_lindbrook_apartments kinross_building_south & U ! subway gayley_&_lindbrook_apartments & U ! native_foods subway F native_foods & U ! 800_degrees U 800_degrees U ! 800_degrees kinross_building_south & U ! kinross_building_south U kinross_building_south U ! kinross_building_south gayley_&_lindbrook_apartments & U ! gayley_&_lindbrook_apartments U gayley_&_lindbrook_apartments U ! gayley_&_lindbrook_apartments subway U ! subway U subway U ! subway native_foods,Los Angeles #1,"error:['!', '&', 'lm(', 'lm(', 'lm(', ')lm', 'lm(', 'lm(', 'Building', ')lm', '&', 'U', '!', 'lm(', 'lm(', 'and', ')lm', 'lm(', 'lm(', 'South', ')lm', ')lm', 'lm(', 'lm(', 'lm(', 'lm(', 'lm(', 'lm(', 'lm(', 'lm(', 'lm(', 'lm(', 'lm(', 'lm(', 'lm(', 'lm(', 'lm(', 'lm(', ')lm', 'U', 'lm(', ')lm', 'lm(', ')lm', ')lm', ')lm', 'lm(', ')lm', ')lm', ')lm', ')lm', ')lm', ')lm', ')lm', ')lm', ')lm', ')lm', ')lm', ')lm', ')lm', '&', ')lm', ')lm', ')lm', '&', ')lm', ')lm', ')lm', ')lm', '&', ')lm', ')lm', ')lm', ')lm', ')lm', ')lm', ')lm', ')lm', ')lm', ')lm', ')lm', 'Foods', 'Foods', 'Foods']",False
8841,visit Veggie Grill Novel Cafe Westwood Noah's Bagels bibigo and Gayley Center in that exact order once you leave any location you can not return to it,& & U ! novel_cafe_westwood veggie_grill & U ! noah's_bagels novel_cafe_westwood & U ! bibigo noah's_bagels & U ! gayley_center bibigo F gayley_center & U ! veggie_grill U veggie_grill U ! veggie_grill novel_cafe_westwood & U ! novel_cafe_westwood U novel_cafe_westwood U ! novel_cafe_westwood noah's_bagels & U ! noah's_bagels U noah's_bagels U ! noah's_bagels bibigo U ! bibigo U bibigo U ! bibigo gayley_center,Los Angeles #1,"error:['!', '&', '!', 'lm(', 'Westwood', ')lm', ')lm', 'lm(', 'Veggie', 'Cafe', ')lm', '&', 'U', '!', 'lm(', 'Gayley', 'Center', ')lm', 'lm(', 'Westwood', 'Cafe', ')lm', 'F', 'lm(', 'lm(', 'Cafe', ')lm', 'U', 'lm(', 'lm(', 'Cafe', ')lm', 'U', 'lm(', 'lm(', 'Cafe', ')lm', 'U', 'lm(', 'lm(', ')lm', 'Cafe', ')lm', 'lm(', 'lm(', ')lm', ')lm', ')lm', ')lm', 'lm(', ')lm', ')lm', ')lm', ')lm', ')lm', ')lm', ')lm', ')lm', ')lm', ')lm', ')lm', ')lm', ')lm', 'Center', ')lm', ')lm', ')lm', ')lm', 'Center', ')lm', 'Center', ')lm', ')lm', ')lm', 'Center', ')lm', 'Center', ')lm']",False
8842,before visiting Peet's Coffee & Tea Westwood Wilshire UCLA Extension - Westwood Village Center and Parking 32 visit UCLA Extension - Lindbrook Center and never visit it again then visit Peet's Coffee & Tea before Westwood Wilshire UCLA Extension - Westwood Village Center and Parking 32 and never visit it again do not visit UCLA Extension - Westwood Village Center and Parking 32 until you visit Westwood Wilshire never visit Westwood Wilshire again then visit UCLA Extension - Westwood Village Center before Parking 32 and never visit Parking 32 again finally visit Parking 32,& & U ! peet's_coffee_&_tea ucla_extension_-_lindbrook_center & U ! westwood_wilshire peet's_coffee_&_tea & U ! ucla_extension_-_westwood_village_center westwood_wilshire & U ! parking_32 ucla_extension_-_westwood_village_center F parking_32 & U ! ucla_extension_-_lindbrook_center U ucla_extension_-_lindbrook_center U ! ucla_extension_-_lindbrook_center peet's_coffee_&_tea & U ! peet's_coffee_&_tea U peet's_coffee_&_tea U ! peet's_coffee_&_tea westwood_wilshire & U ! westwood_wilshire U westwood_wilshire U ! westwood_wilshire ucla_extension_-_westwood_village_center U ! ucla_extension_-_westwood_village_center U ucla_extension_-_westwood_village_center U ! ucla_extension_-_westwood_village_center parking_32,Los Angeles #1,"error:['&', '&', 'U', '!', 'lm(', 'Tea', ')lm', '-', 'lm(', ')lm', ')lm', 'lm(', ""Peet's"", ')lm', '!', 'lm(', 'lm(', '!', '-', 'Center', 'Center', ')lm', '&', 'lm(', 'lm(', 'lm(', '-', 'Center', ')lm', 'Center', ')lm', 'lm(', 'lm(', '-', 'lm(', '-', ')lm', 'Center', ')lm', '-', 'lm(', ')lm', 'Center', ')lm', '-', 'lm(', '&', 'Center', ')lm', '-', ')lm', ')lm', '-', ')lm', '-', ')lm', '-', ')lm', 'Center', ')lm', 'Center', ')lm', '-', ')lm', '-', ')lm', 'Center', ')lm', 'Center', ')lm', '-', ')lm', 'Center', ')lm', 'Center', ')lm', '-', ')lm', ')lm', 'Center', ')lm', 'Center', ')lm', '!', ')lm', '-', ')lm', 'Center', ')lm', 'Center', ')lm', 'Center', ')lm', '!', ')lm', '-', ')lm', 'Center', ')lm', 'Center', ')lm']",False
8843,before visiting Denny's Poke Bar Plaza la Reina and UCLA Extension - Lindbrook Center visit Starbucks and never visit it again then visit Denny's before Poke Bar Plaza la Reina and UCLA Extension - Lindbrook Center and never visit it again do not visit Plaza la Reina and UCLA Extension - Lindbrook Center until you visit Poke Bar never visit Poke Bar again then visit Plaza la Reina before UCLA Extension - Lindbrook Center and never visit UCLA Extension - Lindbrook Center again finally visit UCLA Extension - Lindbrook Center,& & U ! denny's starbucks & U ! poke_bar denny's & U ! plaza_la_reina poke_bar & U ! ucla_extension_-_lindbrook_center plaza_la_reina F ucla_extension_-_lindbrook_center & U ! starbucks U starbucks U ! starbucks denny's & U ! denny's U denny's U ! denny's poke_bar & U ! poke_bar U poke_bar U ! poke_bar plaza_la_reina U ! plaza_la_reina U plaza_la_reina U ! plaza_la_reina ucla_extension_-_lindbrook_center,Los Angeles #1,"error:['&', '&', 'U', '!', 'lm(', ""Denny's"", ')lm', ')lm', 'lm(', 'lm(', ""Denny's"", ')lm', 'Center', 'U', '!', 'lm(', ')lm', '-', 'Center', ')lm', 'lm(', 'lm(', 'Center', 'lm(', 'lm(', '-', 'Center', ')lm', '-', 'Center', ')lm', 'lm(', 'lm(', 'lm(', 'lm(', 'Center', ')lm', 'lm(', 'Center', ')lm', 'lm(', '-', 'Center', ')lm', '-', 'Center', ')lm', ')lm', 'Center', ')lm', '-', ')lm', 'Center', ')lm', '-', ')lm', 'Center', ')lm', 'Center', ')lm', ')lm', '-', ')lm', ')lm', 'Center', ')lm', ')lm', '-', ')lm', 'Center', ')lm', ')lm', ')lm', 'Center', ')lm', '!', ')lm', ')lm', 'Center', ')lm', '!', 'lm(', '-', 'Center', ')lm', ')lm', ')lm', 'Center', ')lm', '!', 'lm(', '-', 'Center', ')lm', 'Center', ')lm', ')lm', '-', 'Center', ')lm', ')lm', 'Center', ')lm', 'Center', ')lm']",False
8844,go from Iso Fusion Café to Stone Canyon Creek (underground) to Ike's Place to U-Mini to UTLA Beauty in that specific order and only visit each landmark one time,& & U ! stone_canyon_creek_(underground) iso_fusion_café & U ! ike's_place stone_canyon_creek_(underground) & U ! u-mini ike's_place & U ! utla_beauty u-mini F utla_beauty & U ! iso_fusion_café U iso_fusion_café U ! iso_fusion_café stone_canyon_creek_(underground) & U ! stone_canyon_creek_(underground) U stone_canyon_creek_(underground) U ! stone_canyon_creek_(underground) ike's_place & U ! ike's_place U ike's_place U ! ike's_place u-mini U ! u-mini U u-mini U ! u-mini utla_beauty,Los Angeles #1,"error:['&', '&', 'U', '!', 'lm(', 'Creek', ')lm', ')lm', 'lm(', 'Iso', ')lm', ')lm', '&', 'U', '!', 'lm(', 'UTLA', ')lm', ')lm', 'lm(', ""Ike's"", ')lm', ')lm', 'F', 'lm(', '!', 'lm(', 'lm(', 'lm(', 'lm(', 'lm(', 'lm(', ')lm', 'lm(', 'lm(', 'lm(', 'lm(', ')lm', 'lm(', 'lm(', ')lm', 'lm(', ')lm', 'U', '!', 'lm(', ')lm', ')lm', 'U', '!', 'lm(', ')lm', ')lm', 'U', '!', 'lm(', ')lm', ')lm', ')lm', ')lm', ')lm', ')lm', ')lm', '!', ')lm', ')lm', ')lm', ')lm', ')lm', ')lm', ')lm', ')lm', ')lm', 'UTLA', ')lm', ')lm', ')lm', ')lm', 'UTLA', ')lm', ')lm', ')lm', 'UTLA', ')lm', ')lm', ')lm', 'UTLA', 'UTLA', ')lm', ')lm', ')lm', ')lm', 'UTLA', 'UTLA', ')lm', ')lm', ')lm', 'UTLA', ')lm', 'UTLA', ')lm']",False
8845,go from Occidental Petroleum Heliport to Ike's Place to Denny's to Westwood's Village Square to Parking 36 in that specific order and only visit each landmark one time,& & U ! ike's_place occidental_petroleum_heliport & U ! denny's ike's_place & U ! westwood's_village_square denny's & U ! parking_36 westwood's_village_square F parking_36 & U ! occidental_petroleum_heliport U occidental_petroleum_heliport U ! occidental_petroleum_heliport ike's_place & U ! ike's_place U ike's_place U ! ike's_place denny's & U ! denny's U denny's U ! denny's westwood's_village_square U ! westwood's_village_square U westwood's_village_square U ! westwood's_village_square parking_36,Los Angeles #1,"error:['&', '&', 'U', '!', 'lm(', ""Westwood's"", ')lm', ')lm', 'lm(', 'Occidental', ')lm', ')lm', '&', 'U', '!', 'lm(', 'Parking', ')lm', ')lm', 'lm(', ""Westwood's"", ')lm', ')lm', 'F', 'lm(', '!', 'lm(', 'lm(', 'lm(', 'lm(', 'lm(', 'lm(', 'lm(', 'lm(', 'lm(', 'lm(', 'lm(', ')lm', 'lm(', 'lm(', ')lm', 'lm(', ')lm', 'U', '!', 'lm(', ')lm', ')lm', 'U', '!', 'lm(', ')lm', ')lm', 'U', '!', 'lm(', ')lm', ')lm', ')lm', ')lm', ')lm', ')lm', '!', ')lm', ')lm', ')lm', ')lm', ')lm', ')lm', ')lm', ')lm', ')lm', ')lm', ')lm', ')lm', ')lm', ')lm', ')lm', 'Parking', 'Parking', ')lm', ')lm', ')lm', ')lm', ')lm', ')lm', 'Parking', 'Parking', ')lm', ')lm', ')lm', ')lm', ')lm', 'Parking', 'Parking', ')lm', ')lm', ')lm', ')lm', 'Parking', ')lm']",False
