,nl_command,ltl,map_name,result,eq
9769,go to Village Center Newsstand and Native Foods infinitely often,& G F village_center_newsstand G F native_foods,Los Angeles #1,& F gayley_center & F 800_degrees,False
9770,repeatedly visit UCLA Extension - Westwood Village Center and U-Mini forever,& G F ucla_extension_-_westwood_village_center G F u-mini,Los Angeles #1,"error:['&', 'F', 'lm(', 'UCLA', 'Extension', '-', 'Center', ')lm', ')lm', 'lm(', 'lm(', 'St', 'St', ')lm', ')lm']",False
9771,repeatedly visit Victoria's Secret and The Gayley Building forever,& G F victoria's_secret G F the_gayley_building,Los Angeles #1,G ! the_gayley_building,False
9772,at any point in time you must visit Westwood Wilshire and Victoria's Secret at least once after,& G F westwood_wilshire G F victoria's_secret,Los Angeles #1,"error:['G', 'i', 'lm(', 'Wilshire', ')lm', ')lm', ')lm', 'lm(', 'lm(', ')lm']",False
9773,at any point in time you must visit Denny's and Peet's Coffee & Tea at least once after,& G F denny's G F peet's_coffee_&_tea,Los Angeles #1,"error:['G', 'i', 'lm(', ""Denny's"", ')lm', ')lm', 'F', 'lm(', 'lm(', ')lm', ')lm']",False
9774,always keep visiting Janss Dome and Novel Cafe Westwood,& G F janss_dome G F novel_cafe_westwood,Los Angeles #1,"error:['G', '!', 'lm(', 'visiting', 'Janss', ')lm', 'G', 'G', 'lm(', 'lm(', 'Cafe', ')lm']",False
9775,always keep visiting Gayley & Lindbrook Apartments and Janss Dome,& G F gayley_&_lindbrook_apartments G F janss_dome,Los Angeles #1,G G ! tender_greens G ! london_cleaners,False
9776,keep going between Denny's and Gayley Center,& G F denny's G F gayley_center,Los Angeles #1,"error:['F', 'lm(', 'lm(', 'and', ')lm', 'Center', ')lm', 'F', 'lm(', 'lm(', ')lm', ')lm', ')lm']",False
9777,keep going between Westwood Wilshire and Veggie Grill,& G F westwood_wilshire G F veggie_grill,Los Angeles #1,"error:['F', 'lm(', 'lm(', 'Westwood', ')lm', 'lm(', 'F', 'lm(', 'lm(', 'lm(', 'lm(', ')lm', ')lm', ')lm']",False
9778,keep visiting Mongol BBQ and bibigo,& G F mongol_bbq G F bibigo,Los Angeles #1,"error:['&', 'lm(', 'lm(', 'Mongol', ')lm', ')lm', ')lm', 'lm(', 'lm(', ')lm', ')lm']",False
9779,keep visiting Westwood Sporting Goods and Poke Bar,& G F westwood_sporting_goods G F poke_bar,Los Angeles #1,& the_gayley_building lm( village_center_newsstand,False
9780,keep visiting Ike's Place and bibigo,& G F bibigo G F ike's_place,Los Angeles #1,"error:['&', 'lm(', 'lm(', ""Ike's"", ')lm', ')lm', ')lm', 'lm(', 'lm(', ')lm', ')lm']",False
9781,keep visiting Yogurtland and Nature's Way Café,& G F nature's_way_café G F yogurtland,Los Angeles #1,& yogurtland lm( village_center_newsstand,False
9782,keep on visiting Mio Babbo's and 800 Degrees,& G F mio_babbo's G F 800_degrees,Los Angeles #1,"error:['&', 'lm(', 'lm(', 'on', 'on', ')lm', ')lm', ')lm', 'lm(', 'lm(', ')lm', ')lm', ')lm']",False
9783,keep on visiting Poke Bar and Victoria's Secret,& G F poke_bar G F victoria's_secret,Los Angeles #1,"error:['&', 'lm(', 'lm(', 'on', 'on', ')lm', ')lm', ')lm', 'lm(', 'lm(', ')lm', ')lm', ')lm']",False
9784,travel to UTLA Beauty and The Gayley Building an infinite number of times,& G F utla_beauty G F the_gayley_building,Los Angeles #1,"error:['&', 'F', '&', 'lm(', 'The', 'Beauty', ')lm', ')lm', 'U', 'lm(', 'The', 'Gayley', ')lm', '&', '!', 'lm(', 'lm(', 'The', 'Building', ')lm', 'U', 'lm(', 'The', 'Building', ')lm', '&', '!', 'lm(', 'lm(', 'UTLA', ')lm', 'Building', ')lm', 'lm(', 'lm(', 'The', 'Building', ')lm', '&', '!', 'lm(', 'The', 'Building', ')lm', 'U', '!', 'lm(', 'The', 'Building', ')lm', 'F', '&', 'lm(', 'The', 'Building', ')lm', 'U', 'lm(', 'lm(', 'The', ')lm', ')lm', 'F', '&', 'lm(', 'The', ')lm', ')lm', 'U', 'lm(', 'lm(', 'The', ')lm', '&', '&', '!', 'lm(', 'The', 'Building', ')lm', 'U', 'lm(', 'lm(', 'The', ')lm', ')lm', '&', '!', 'lm(', 'The', 'Building', ')lm', ')lm', 'U', 'lm(', 'The', 'UTLA', ')lm', '&', '!', 'lm(', 'The', 'Building', ')lm', ')lm', 'U', 'lm(', 'The', 'UTLA', ')lm', '&', '!', 'lm(', 'The', ')lm', ')lm', ')lm', 'U', 'lm(', 'The', 'UTLA', ')lm', ')lm', '!', 'lm(', 'The', 'Building', ')lm']",False
9785,travel to Veggie Grill and Mio Babbo's an infinite number of times,& G F veggie_grill G F mio_babbo's,Los Angeles #1,"error:['!', 'F', '&', 'lm(', 'Veggie', 'Grill', ')lm', ')lm', 'U', 'lm(', 'Veggie', 'and', ')lm', ')lm', '&', '!', 'lm(', 'lm(', 'Veggie', ')lm', ')lm', ')lm', '!', 'lm(', 'lm(', '&', '&', '!', 'lm(', 'lm(', '&', '&', 'lm(', 'lm(', '&', '&', '!', 'lm(', 'Veggie', 'Grill', ')lm', ')lm', '!', 'lm(', 'lm(', 'Veggie', ')lm', ')lm', '&', 'lm(', 'lm(', 'Veggie', 'Grill', ')lm', ')lm', 'F', 'lm(', 'lm(', 'Veggie', ')lm', ')lm', ')lm', 'lm(', 'lm(', 'Veggie', 'Grill', ')lm', '&', 'F', 'lm(', 'Veggie', 'Grill', 'Grill', ')lm', ')lm', '!', 'lm(', 'Veggie', 'Grill', ')lm', '&', 'F', 'lm(', 'Veggie', 'Grill', ')lm', ')lm', ')lm', '!', 'lm(', 'Veggie', 'Grill', ')lm', ')lm', '&', 'lm(', 'Veggie', 'Grill', 'Grill', ')lm', ')lm', ')lm', 'lm(', 'Veggie', 'Grill', ')lm', ')lm', ')lm', 'Veggie', 'lm(', 'Veggie', ')lm', ')lm', ')lm', ')lm', 'Veggie', 'Grill', 'Grill', ')lm', ')lm', ')lm', 'Veggie', 'Grill', 'Grill', ')lm', ')lm', ')lm', ')lm', 'Veggie', 'Grill', ')lm', ')lm', ')lm', ')lm', 'Veggie', 'Grill', ')lm', ')lm', ')lm', ')lm', 'Veggie', ')lm', 'Veggie', ')lm', ')lm', ')lm', 'Veggie', ')lm', 'Grill', ')lm', ')lm', ')lm', 'Veggie', ')lm', 'Grill', ')lm', ')lm', ')lm', 'Veggie', ')lm', 'Grill', ')lm', ')lm', ')lm', 'Veggie', ')lm', 'Grill', ')lm', ')lm', ')lm', 'Veggie', ')lm', 'Grill', ')lm', ')lm', ')lm', 'Veggie', ')lm', ')lm', 'Veggie', ')lm', ')lm', ')lm', 'Veggie', ')lm', ')lm', 'Veggie', ')lm', ')lm']",False
9786,never stop visiting Yogurtland and Poke Bar,& G F yogurtland G F poke_bar,Los Angeles #1,"error:['G', '!', 'lm(', 'Yogurtland', 'and', ')lm', ')lm', ')lm', 'lm(', 'lm(', 'lm(', ')lm', ')lm']",False
9787,never stop visiting bibigo and Nature's Way Café,& G F bibigo G F nature's_way_café,Los Angeles #1,"error:['G', '!', 'lm(', 'bibigo', 'and', ')lm', ')lm', ')lm', 'lm(', 'lm(', 'lm(', ')lm', ')lm']",False
9788,frequent Westwood Wilshire and Parking 32 infinitely in any order,& G F westwood_wilshire G F parking_32,Los Angeles #1,"error:['G', 'F', 'lm(', 'Westwood', 'and', ')lm', ')lm', ')lm', 'lm(', 'lm(', 'lm(', ')lm', ')lm']",False
9789,frequent Noah's Bagels and bibigo infinitely in any order,& G F noah's_bagels G F bibigo,Los Angeles #1,"error:['G', 'F', 'lm(', ""Noah's"", 'and', ')lm', ')lm', ')lm', 'lm(', 'lm(', ')lm', ')lm', ')lm']",False
9790,visit Red Pelican Music and Nature's Way Café an infinite number of times,& G F red_pelican_music G F nature's_way_café,Los Angeles #1,"error:['!', 'F', '&', 'lm(', 'Pelican', 'Pelican', ')lm', ')lm', 'U', 'lm(', 'lm(', 'Pelican', ')lm', '&', '!', '!', 'lm(', 'Pelican', 'Pelican', ')lm', '&', '!', 'lm(', 'lm(', 'Pelican', ')lm', ')lm', ')lm', '!', 'lm(', 'lm(', 'Pelican', '&', '&', '!', 'lm(', 'lm(', 'Pelican', 'Pelican', ')lm', ')lm', 'F', 'lm(', 'lm(', 'Pelican', ')lm', ')lm', ')lm', 'lm(', 'lm(', 'Pelican', 'Pelican', ')lm', '&', 'F', 'lm(', 'lm(', 'Pelican', ')lm', ')lm', ')lm', 'lm(', 'lm(', 'Pelican', 'Pelican', '&', '&', '&', 'lm(', 'lm(', 'Pelican', 'Pelican', ')lm', ')lm', 'U', 'lm(', 'lm(', 'Pelican', 'Pelican', ')lm', '&', 'F', 'lm(', 'lm(', 'Pelican', ')lm', ')lm', ')lm', 'lm(', 'lm(', 'Pelican', 'Pelican', ')lm', '&', '&', 'lm(', 'lm(', 'Pelican', 'Pelican', ')lm', ')lm', ')lm', 'lm(', 'lm(', 'Pelican', 'Pelican', ')lm', ')lm', ')lm', 'lm(', 'Pelican', 'Pelican', ')lm', ')lm', ')lm', ')lm', 'lm(', 'Pelican', 'Pelican', ')lm', ')lm', ')lm', ')lm', 'Pelican', 'Pelican', ')lm', ')lm', ')lm', ')lm', 'Pelican', ')lm', ')lm', ')lm', ')lm', 'Pelican', ')lm', ')lm', ')lm', ')lm', 'Pelican', ')lm', ')lm', ')lm', ')lm', 'Pelican', ')lm', ')lm', ')lm', ')lm', 'Pelican', ')lm', ')lm', ')lm', ')lm', 'Pelican', ')lm', ')lm', ')lm', ')lm', 'Pelican', ')lm', ')lm', ')lm', ')lm', 'Pelican', ')lm', ')lm', ')lm', ')lm', 'Pelican', ')lm', ')lm', ')lm', ')lm', 'Pelican', ')lm', ')lm', ')lm', ')lm', ')lm', 'Pelican', ')lm', ')lm', ')lm', ')lm', ')lm', 'Pelican', ')lm', ')lm', ')lm', ')lm', ')lm', 'Pelican', ')lm', ')lm', ')lm', ')lm', ')lm', 'Pelican']",False
9791,visit Ike's Place and Nature's Way Café an infinite number of times,& G F ike's_place G F nature's_way_café,Los Angeles #1,"error:['!', 'F', '&', 'lm(', ""Ike's"", 'and', ')lm', ')lm', ')lm', 'U', 'lm(', 'lm(', 'Place', ')lm', '&', '!', '!', 'lm(', 'lm(', 'Place', ')lm', ')lm', '!', 'lm(', 'lm(', 'Place', '&', '&', '!', 'lm(', 'lm(', 'Place', 'Place', ')lm', '&', 'F', 'lm(', 'lm(', 'Place', ')lm', ')lm', ')lm', 'lm(', 'lm(', 'Place', 'Place', ')lm', '&', 'F', 'lm(', 'lm(', 'Place', ')lm', ')lm', ')lm', 'lm(', 'lm(', 'Place', 'Place', ')lm', '&', '&', 'lm(', 'lm(', 'Place', 'Place', ')lm', ')lm', 'lm(', 'lm(', 'lm(', 'Place', '&', '&', '&', 'lm(', 'lm(', 'Place', 'Place', ')lm', ')lm', '!', 'lm(', 'lm(', 'Place', ')lm', ')lm', '&', 'lm(', 'lm(', 'Place', 'Place', ')lm', ')lm', ')lm', 'lm(', 'lm(', 'Place', 'Place', ')lm', ')lm', ')lm', 'lm(', 'lm(', 'Place', 'Place', ')lm', ')lm', ')lm', 'lm(', 'lm(', 'Place', ')lm', ')lm', ')lm', ')lm', 'Place', ')lm', ')lm', ')lm', ')lm', ')lm', 'Place', ')lm', ')lm', ')lm', ')lm', 'Place', ')lm', ')lm', ')lm', ')lm', 'Place', ')lm', ')lm', ')lm', ')lm', ')lm', 'Place', ')lm', ')lm', ')lm', ')lm', ')lm', 'Place', ')lm', ')lm', ')lm', ')lm', ')lm', 'Place', ')lm', ')lm', ')lm', ')lm', ')lm', 'Place', ')lm', ')lm', ')lm', ')lm', ')lm', 'Place', ')lm', ')lm', ')lm', ')lm', ')lm', ')lm', 'Place', ')lm', ')lm', ')lm', ')lm', ')lm', ')lm', 'Place', ')lm', ')lm', ')lm', ')lm', ')lm', ')lm', 'Place', ')lm', ')lm', ')lm', ')lm', ')lm', ')lm', ')lm', 'Place', ')lm', ')lm', ')lm', ')lm', ')lm', ')lm', ')lm']",False
9792,keep going to bibigo and Nature's Way Café in arbitrary order,& G F bibigo G F nature's_way_café,Los Angeles #1,"error:['G', 'i', 'lm(', 'bibigo', 'and', ')lm', ')lm', 'F', 'lm(', 'lm(', ')lm', ')lm', ')lm']",False
9793,keep going to Ike's Place and Westwood's Village Square in arbitrary order,& G F ike's_place G F westwood's_village_square,Los Angeles #1,G i westwood_sporting_goods F red_pelican_music,False
9794,please keep visiting Novel Cafe Westwood and Nature's Way Café without stopping,& G F novel_cafe_westwood G F nature's_way_café,Los Angeles #1,"error:['&', 'F', 'lm(', 'keep', 'Cafe', ')lm', '&', 'F', 'lm(', 'lm(', 'Cafe', ')lm']",False
9795,please keep visiting Novel Cafe Westwood and Westwood Wilshire without stopping,& G F novel_cafe_westwood G F westwood_wilshire,Los Angeles #1,& F native_foods & )lm village_center_newsstand lm( native_foods,False
9796,keep visiting Mio Babbo's and Urban Outfitters in any order,& G F mio_babbo's G F urban_outfitters,Los Angeles #1,"error:['&', 'F', 'lm(', 'Mio', 'Mio', ')lm', ')lm', 'F', 'lm(', 'F', ')lm', ')lm', ')lm']",False
9797,keep visiting bibigo and UTLA Beauty in any order,& G F bibigo G F utla_beauty,Los Angeles #1,"error:['G', 'F', 'lm(', 'bibigo', 'and', ')lm', ')lm', 'F', 'lm(', 'lm(', ')lm', ')lm', ')lm']",False
9798,make sure Red Pelican Music and Gayley Center are visited infinitely,& G F red_pelican_music G F gayley_center,Los Angeles #1,"error:['G', 'lm(', 'lm(', 'Red', 'and', 'Center', ')lm']",False
9799,make sure UCLA Extension - Lindbrook Center and Denny's are visited infinitely,& G F ucla_extension_-_lindbrook_center G F denny's,Los Angeles #1,& F ucla_extension_-_lindbrook_center,False
9800,do not stop visiting Westwood Sporting Goods and Nature's Way Café,& G F westwood_sporting_goods G F nature's_way_café,Los Angeles #1,"error:['&', '!', 'lm(', 'lm(', 'Westwood', ')lm', ')lm', 'G', '!', 'lm(', ')lm', ')lm', ')lm', ')lm', ')lm', ')lm', ')lm', ')lm', ')lm', ')lm', ')lm', ')lm', ')lm', ')lm']",False
9801,do not stop visiting Iso Fusion Café and U-Mini,& G F iso_fusion_café G F u-mini,Los Angeles #1,"error:['G', '!', 'lm(', 'Iso', 'Fusion', ')lm', ')lm', 'G', 'lm(', 'lm(', ')lm', ')lm', ')lm', ')lm', ')lm', ')lm', ')lm', ')lm', ')lm', ')lm', ')lm', ')lm', ')lm', ')lm', ')lm', ')lm', ')lm', ')lm', ')lm', ')lm', ')lm', ')lm', ')lm', ')lm', ')lm', ')lm', ')lm', ')lm', ')lm', ')lm', ')lm', ')lm', ')lm', ')lm', ')lm']",False
9802,frequent London Cleaners and UTLA Beauty but the order can be arbitrary,& G F london_cleaners G F utla_beauty,Los Angeles #1,"error:['&', 'i', 'lm(', 'lm(', 'London', ')lm', ')lm', 'lm(', 'lm(', 'lm(', 'lm(', ')lm', ')lm', ')lm']",False
9803,frequent Janss Dome and Village Center Newsstand but the order can be arbitrary,& G F janss_dome G F village_center_newsstand,Los Angeles #1,"error:['&', '&', '!', 'lm(', 'Janss', 'and', 'the', 'Center', ')lm', 'F', 'lm(', 'arbitrary', 'arbitrary', ')lm', ')lm']",False
9804,keep going back and forth between Westwood's Village Square and London Cleaners,& G F westwood's_village_square G F london_cleaners,Los Angeles #1,"error:['F', '&', 'lm(', ')lm', ')lm', 'F', 'F', ')lm', 'F', '&', 'lm(', 'lm(', ')lm', ')lm']",False
9805,keep going back and forth between Subway and Red Pelican Music,& G F subway G F red_pelican_music,Los Angeles #1,"error:['F', '&', 'lm(', 'and', ')lm', 'F', 'F', 'lm(', 'lm(', 'F', 'lm(', 'lm(', ')lm', ')lm']",False
9806,keep going to Starbucks and Westwood Wilshire an infinite number of times,& G F starbucks G F westwood_wilshire,Los Angeles #1,"error:['!', 'F', '&', 'lm(', 'Starbucks', 'and', ')lm', ')lm', ')lm', 'U', 'lm(', 'lm(', 'and', '&', ')lm', '&', '&', '!', 'lm(', 'Starbucks', 'and', ')lm', ')lm', ')lm', '!', 'lm(', 'lm(', 'and', '&', ')lm', '&', 'F', 'lm(', 'lm(', 'Starbucks', ')lm', ')lm', ')lm', '!', 'lm(', 'lm(', 'Starbucks', '&', '&', '!', 'lm(', '&', 'Starbucks', ')lm', ')lm', '!', 'lm(', 'lm(', 'Starbucks', '&', ')lm', '&', 'lm(', 'lm(', 'Starbucks', 'Starbucks', ')lm', ')lm', 'F', 'lm(', 'Starbucks', 'Starbucks', ')lm', ')lm', 'F', 'lm(', 'lm(', 'Starbucks', ')lm', ')lm', ')lm', 'lm(', 'lm(', 'Starbucks', 'Starbucks', '&', '&', '!', 'lm(', 'Starbucks', 'Starbucks', ')lm', ')lm', ')lm', 'lm(', 'Starbucks', 'Starbucks', 'Starbucks', ')lm', ')lm', 'F', 'lm(', 'Starbucks', 'Starbucks', ')lm', ')lm', ')lm', 'lm(', 'Starbucks', 'Starbucks', ')lm', ')lm', ')lm', 'Starbucks', 'Starbucks', 'Starbucks', ')lm', ')lm', ')lm', ')lm', 'Starbucks', 'Starbucks', ')lm', ')lm', ')lm', ')lm', 'Starbucks', 'Starbucks', ')lm', ')lm', ')lm', ')lm', 'Starbucks', ')lm', 'Starbucks', ')lm', ')lm', ')lm', ')lm', 'Starbucks', ')lm', 'Starbucks', ')lm', ')lm', ')lm', 'Starbucks', ')lm', 'Starbucks', ')lm', ')lm', ')lm', ')lm', 'Starbucks', ')lm', ')lm', ')lm', ')lm', 'Starbucks', ')lm', ')lm', ')lm', 'Starbucks', ')lm', ')lm', ')lm', 'Starbucks', ')lm', ')lm', ')lm', 'Starbucks', ')lm', ')lm', ')lm', 'Starbucks', ')lm', ')lm', ')lm', 'Starbucks', ')lm', ')lm', ')lm', 'Starbucks', ')lm', ')lm', ')lm', 'Starbucks', ')lm', ')lm', ')lm', 'Starbucks']",False
9807,keep going to Veggie Grill and The Gayley Building an infinite number of times,& G F veggie_grill G F the_gayley_building,Los Angeles #1,"error:['&', 'F', '&', 'lm(', 'lm(', 'The', 'Building', ')lm', 'lm(', 'U', ')lm', ')lm', '&', 'lm(', ')lm', ')lm', '&', 'lm(', 'lm(', 'The', ')lm', ')lm', '&', 'lm(', 'lm(', 'The', ')lm', ')lm', ')lm', 'lm(', 'lm(', 'The', 'Building', ')lm', '&', '!', 'lm(', 'The', 'Building', ')lm', ')lm', 'U', 'lm(', 'The', 'Building', ')lm', '&', '!', 'lm(', 'The', 'Building', ')lm', 'U', 'U', 'lm(', 'The', ')lm', ')lm', '&', '!', 'lm(', 'The', ')lm', ')lm', 'U', 'lm(', 'lm(', 'The', ')lm', '&', '!', 'lm(', 'lm(', 'Veggie', ')lm', ')lm', ')lm', 'U', 'lm(', 'The', 'Veggie', ')lm', '&', '!', 'lm(', 'lm(', 'The', ')lm', ')lm', 'U', 'lm(', 'The', 'Veggie', ')lm', '&', '!', 'lm(', 'lm(', 'The', ')lm', ')lm', 'U', 'lm(', 'The', 'Veggie', ')lm', '&', '!', 'lm(', 'lm(', 'The', ')lm', ')lm', 'U', 'lm(', 'The', 'Veggie', ')lm', ')lm', '!', 'lm(', 'lm(', 'The', ')lm', ')lm', ')lm', 'lm(', 'The', 'lm(', ')lm', ')lm', 'lm(', 'lm(', 'lm(', 'The', ')lm', ')lm', ')lm', 'lm(', 'The', ')lm', ')lm', ')lm', 'lm(', 'lm(', 'lm(', 'The', ')lm', ')lm', ')lm', 'lm(', 'The', ')lm', ')lm', ')lm', 'lm(', 'lm(', 'lm(', 'The', ')lm', ')lm', ')lm', 'lm(', 'The', ')lm', ')lm', ')lm', 'lm(', 'lm(', 'The', ')lm', ')lm', ')lm', 'lm(', 'The']",False
9808,keep visiting Peet's Coffee & Tea and Mio Babbo's an infinite number of times,& G F peet's_coffee_&_tea G F mio_babbo's,Los Angeles #1,"error:['&', 'F', '&', 'lm(', 'lm(', ""Peet's"", ')lm', ')lm', ')lm', ')lm', 'U', 'lm(', 'lm(', ')lm', ')lm', '&', '&', 'lm(', 'lm(', '&', '&', '&', 'lm(', 'lm(', '&', '&', '&', 'lm(', 'lm(', '&', '&', 'F', 'lm(', '&', 'F', 'lm(', '&', 'lm(', '&', 'F', '&', 'lm(', '&', 'lm(', '&', '&', 'lm(', '&', '&', '&', 'lm(', '&', '&', '&', ')lm', '&', 'lm(', 'lm(', '&', '&', '&', ')lm', 'lm(', '&', 'lm(', '&', 'lm(', 'lm(', '&', '&', ')lm', 'lm(', 'lm(', '&', ')lm', '&', ')lm', ')lm', 'lm(', 'lm(', 'lm(', 'lm(', ')lm', ')lm', ')lm', 'lm(', 'lm(', 'lm(', '&', ')lm', ')lm', ')lm', 'lm(', 'lm(', 'lm(', 'lm(', ')lm', ')lm', ')lm', 'lm(', 'lm(', 'lm(', 'lm(', ')lm', 'lm(', ')lm', 'lm(', ')lm', 'lm(', ')lm', 'lm(', ')lm', 'lm(', ')lm', 'lm(', ""Peet's"", ')lm', ')lm', ')lm', 'lm(', '!', 'lm(', ""Peet's"", ')lm', ')lm', ')lm', ')lm', 'lm(', ""Peet's"", ')lm', ')lm', ')lm', ')lm', 'lm(', ')lm', 'lm(', ""Peet's"", ')lm', ')lm', ')lm', ')lm', 'lm(', ""Peet's"", ')lm', ')lm', ')lm', ')lm', 'lm(', ')lm', 'lm(', ')lm', ')lm', ')lm', ')lm', ')lm', ')lm', ')lm', 'lm(', ""Peet's"", ')lm', ')lm', ')lm', ')lm', 'lm(', ""Peet's"", ')lm', ')lm', ')lm', ')lm', ')lm', ')lm', ')lm', ')lm', ')lm', ')lm', ')lm', ')lm', ')lm', ')lm', ')lm', ')lm', ')lm', ""Peet's"", ')lm', ')lm', ')lm', ')lm', ')lm', ')lm', ')lm', ')lm', ')lm', ')lm', ')lm', ')lm', ')lm', ""Peet's"", ')lm', ')lm']",False
9809,keep visiting UTLA Beauty and Westwood Sporting Goods an infinite number of times,& G F utla_beauty G F westwood_sporting_goods,Los Angeles #1,"error:['&', 'F', '&', 'lm(', 'lm(', 'UTLA', ')lm', ')lm', ')lm', 'U', 'U', 'lm(', 'lm(', ')lm', '&', '&', '!', 'lm(', 'lm(', '&', '&', '&', '&', 'lm(', 'lm(', 'lm(', '&', '&', '&', '&', 'lm(', 'lm(', '&', '&', '&', '&', 'lm(', '&', '&', '&', '&', 'lm(', '&', '&', '&', '&', '&', '&', '&', '&', 'lm(', '&', '&', '&', '&', 'lm(', '&', '&', '&', '&', 'lm(', '&', '&', '&', 'lm(', '&', '&', '&', 'lm(', '&', 'lm(', '&', '&', 'lm(', '&', 'lm(', '&', '&', 'lm(', '&', 'lm(', '&', 'lm(', '&', 'lm(', '&', 'lm(', '&', 'lm(', '&', 'lm(', '&', 'lm(', 'lm(', '&', 'lm(', '!', 'lm(', 'UTLA', ')lm', ')lm', ')lm', '!', 'lm(', 'UTLA', ')lm', ')lm', ')lm', '!', 'lm(', 'UTLA', ')lm', ')lm', ')lm', '!', 'lm(', 'lm(', 'UTLA', ')lm', ')lm', ')lm', '!', 'lm(', 'UTLA', ')lm', ')lm', ')lm', '!', 'lm(', 'UTLA', ')lm', ')lm', ')lm', ')lm', 'lm(', 'lm(', ')lm', ')lm', ')lm', ')lm', ')lm', ')lm', ')lm', ')lm', ')lm', ')lm', ')lm', ')lm', ')lm', ')lm', ')lm', ')lm', ')lm', 'UTLA', ')lm', ')lm', ')lm', ')lm', 'lm(', 'UTLA', ')lm', ')lm', ')lm', ')lm', ')lm', ')lm', 'UTLA', ')lm', ')lm', ')lm', ')lm', ')lm', ')lm', ')lm', ')lm', ')lm', ')lm', ')lm', ')lm', 'UTLA', ')lm', ')lm', ')lm', ')lm', ')lm', 'UTLA', ')lm', ')lm', ')lm', ')lm', ')lm', ')lm', ')lm', ')lm', ')lm', ')lm', ')lm', ')lm', 'UTLA']",False
9810,continue visiting Red Pelican Music and Peet's Coffee & Tea an infinite number of times,& G F red_pelican_music G F peet's_coffee_&_tea,Los Angeles #1,"error:['&', 'F', '&', 'lm(', 'lm(', 'Red', ')lm', ')lm', ')lm', 'U', 'lm(', 'lm(', 'Red', ')lm', ')lm', '&', 'lm(', 'lm(', 'lm(', '&', '&', '!', 'lm(', ')lm', '&', '!', 'lm(', 'lm(', 'Red', ')lm', ')lm', ')lm', 'lm(', 'lm(', '&', '&', '&', '&', 'lm(', '&', '&', '&', 'lm(', '&', 'Red', 'Red', ')lm', ')lm', 'F', 'lm(', 'lm(', 'Red', 'Red', ')lm', ')lm', 'lm(', 'lm(', '&', 'Red', '&', '&', '&', '&', 'lm(', 'lm(', 'Red', 'Red', ')lm', ')lm', ')lm', 'lm(', 'lm(', 'Red', 'Red', '&', '&', '&', '&', 'lm(', 'Red', 'Red', 'Red', ')lm', ')lm', ')lm', 'lm(', 'Red', 'Red', 'Red', ')lm', ')lm', '&', 'lm(', 'Red', 'Red', ')lm', ')lm', ')lm', ')lm', 'lm(', 'Red', 'Red', ')lm', ')lm', ')lm', ')lm', 'Red', 'Red', 'Red', ')lm', ')lm', ')lm', 'lm(', 'Red', 'Red', 'Red', ')lm', ')lm', ')lm', ')lm', 'Red', 'Red', ')lm', ')lm', ')lm', ')lm', 'Red', 'Red', ')lm', ')lm', ')lm', ')lm', 'Red', 'Red', ')lm', ')lm', ')lm', ')lm', 'Red', ')lm', ')lm', ')lm', ')lm', 'Red', ')lm', ')lm', ')lm', 'Red', ')lm', ')lm', ')lm', 'Red', ')lm', ')lm', ')lm', 'Red', ')lm', ')lm', ')lm', 'Red', ')lm', ')lm', ')lm', ')lm', 'Red', 'Red', ')lm', ')lm', ')lm', ')lm', ')lm', 'Red', 'Red', ')lm', ')lm', ')lm', ')lm', ')lm', 'Red', 'Red', ')lm', ')lm', ')lm', ')lm', ')lm', ')lm', 'Red', 'Red', ')lm', ')lm', ')lm', ')lm', ')lm', ')lm', 'Red', 'Red', ')lm', ')lm', ')lm']",False
9811,continue visiting Veggie Grill and Kinross Building South an infinite number of times,& G F veggie_grill G F kinross_building_south,Los Angeles #1,"error:['&', 'F', '&', 'lm(', 'lm(', 'Veggie', ')lm', ')lm', ')lm', 'U', 'lm(', 'lm(', 'Veggie', ')lm', '&', '!', 'lm(', 'lm(', 'lm(', '&', '&', '!', 'lm(', '&', '&', 'lm(', 'lm(', 'Building', ')lm', '&', '!', 'lm(', 'Building', ')lm', 'Building', ')lm', ')lm', 'lm(', 'lm(', 'Building', ')lm', '&', '&', 'lm(', 'lm(', 'Building', 'Building', ')lm', '&', '!', 'lm(', 'lm(', 'Building', 'Building', ')lm', ')lm', 'F', 'lm(', 'lm(', 'Building', '&', 'Building', ')lm', 'F', 'lm(', 'Building', 'Veggie', ')lm', ')lm', ')lm', 'lm(', 'lm(', 'Building', 'Building', ')lm', 'Building', ')lm', 'lm(', 'lm(', 'Building', 'Veggie', ')lm', ')lm', 'Building', 'lm(', 'lm(', 'Building', ')lm', 'Building', ')lm', ')lm', 'lm(', 'Building', 'Building', ')lm', 'Building', ')lm', 'lm(', 'Building', 'lm(', 'Building', ')lm', ')lm', 'Building', ')lm', 'Building', ')lm', 'Building', ')lm', ')lm', 'Building', ')lm', 'Building', ')lm', ')lm', 'Building', ')lm', 'Building', ')lm', ')lm', 'Building', ')lm', 'Building', ')lm', ')lm', 'Building', ')lm', 'Building', ')lm', ')lm', 'Building', ')lm', 'Building', ')lm', ')lm', 'Building', ')lm', ')lm', 'Building', ')lm', 'Building', ')lm', ')lm', 'Building', ')lm', ')lm', 'Building', ')lm', 'Building', ')lm', ')lm', 'Building', ')lm', ')lm', 'Building', ')lm', ')lm', 'Building', ')lm', 'Building', ')lm', ')lm', 'Building', ')lm', ')lm', 'Building', ')lm', ')lm', 'Building', ')lm', ')lm', 'Building', ')lm', ')lm', 'Building', ')lm', ')lm', 'Building', ')lm', ')lm', 'Building', ')lm', ')lm', 'Building', ')lm', ')lm', 'Building', ')lm', ')lm', 'Building', ')lm', ')lm', 'Building', ')lm', ')lm', 'Building', ')lm', ')lm', 'Building']",False
9812,visit Parking 36 exactly once,M parking_36 | ! parking_36 G | parking_36 G ! parking_36,Los Angeles #1,"error:['!', '&', '&', 'lm(', '36', 'Parking', 'Parking', '36', ')lm', 'U', 'lm(', 'lm(', 'Parking', '36', ')lm']",False
9813,visit Native Foods exactly once,M native_foods | ! native_foods G | native_foods G ! native_foods,Los Angeles #1,"error:['!', '&', '&', 'lm(', 'Foods', 'Native', 'Native', 'Foods', ')lm', 'U', 'lm(', 'lm(', 'Native', 'Foods', ')lm']",False
9814,go to U-Mini exactly once,M u-mini | ! u-mini G | u-mini G ! u-mini,Los Angeles #1,! F & village_center_newsstand )lm )lm U village_center_newsstand lm( village_center_newsstand lm( U-Mini )lm & ! village_center_newsstand lm( u-mini,False
9815,go to Iso Fusion Café exactly once,M iso_fusion_café | ! iso_fusion_café G | iso_fusion_café G ! iso_fusion_café,Los Angeles #1,"error:['!', '&', '&', 'lm(', 'lm(', ')lm', ')lm', ')lm', ')lm', 'U', 'lm(', 'Iso', 'Fusion', ')lm', '&', '!', 'lm(', 'Iso', 'Fusion', 'Fusion', ')lm']",False
9816,make your way to Native Foods exactly once,M native_foods | ! native_foods G | native_foods G ! native_foods,Los Angeles #1,"error:['!', '&', '&', 'lm(', 'Native', ')lm', ')lm', 'U', 'U', 'lm(', 'Native', ')lm', ')lm', '&', '!', 'lm(', 'Native', 'Foods', ')lm']",False
9817,make your way to Mongol BBQ exactly once,M mongol_bbq | ! mongol_bbq G | mongol_bbq G ! mongol_bbq,Los Angeles #1,"error:['!', '&', '&', 'lm(', 'Mongol', ')lm', ')lm', 'U', 'U', 'lm(', 'Mongol', ')lm', ')lm', '&', '!', 'lm(', 'Mongol', 'BBQ', ')lm']",False
9818,you have to visit Parking 32 exactly once,M parking_32 | ! parking_32 G | parking_32 G ! parking_32,Los Angeles #1,! F & parking_36 )lm U village_center_newsstand lm( parking_32 & ! parking_32,False
9819,you have to visit U-Mini exactly once,M u-mini | ! u-mini G | u-mini G ! u-mini,Los Angeles #1,"error:['!', 'F', 'lm(', 'lm(', 'U-Mini', ')lm']",False
9820,you must reach Denny's exactly once,M denny's | ! denny's G | denny's G ! denny's,Los Angeles #1,! i lamonicas_ny-pizza,False
9821,you must reach Iso Fusion Café exactly once,M iso_fusion_café | ! iso_fusion_café G | iso_fusion_café G ! iso_fusion_café,Los Angeles #1,"error:['!', '&', '&', 'lm(', 'lm(', ')lm', ')lm', 'Fusion', ')lm', 'Iso', 'lm(', 'Iso', 'Fusion', ')lm', ')lm', 'F', 'lm(', 'Iso', 'Fusion', 'Fusion']",False
9822,visit Veggie Grill exactly once no more no less,M veggie_grill | ! veggie_grill G | veggie_grill G ! veggie_grill,Los Angeles #1,"error:['!', '&', 'lm(', 'lm(', 'lm(', ')lm', ')lm', ')lm', 'lm(', 'lm(', 'Veggie', 'Grill', ')lm', ')lm', 'F', 'lm(', 'lm(', 'Grill', ')lm']",False
9823,visit Victoria's Secret exactly once no more no less,M victoria's_secret | ! victoria's_secret G | victoria's_secret G ! victoria's_secret,Los Angeles #1,"error:['!', '&', 'lm(', 'lm(', 'lm(', ')lm', ')lm', ')lm', 'lm(', 'lm(', ""Victoria's"", 'Secret', ')lm', ')lm', 'F', 'lm(', 'lm(', 'Secret', ')lm']",False
9824,navigate to London Cleaners exactly once,M london_cleaners | ! london_cleaners G | london_cleaners G ! london_cleaners,Los Angeles #1,"error:['!', '&', 'lm(', 'lm(', 'London', ')lm', ')lm', 'U', 'lm(', 'lm(', 'London', 'Cleaners', ')lm', '&', '!', 'lm(', 'London', 'Cleaners', ')lm']",False
9825,navigate to Yogurtland exactly once,M yogurtland | ! yogurtland G | yogurtland G ! yogurtland,Los Angeles #1,! & yogurtland,False
