,nl_command,ltl,map_name,result,eq
6780,visit Dairy Queen Commonwealth Animal Hospital Subway Fuel Pizza and Harris Teeter,& F dairy_queen & F commonwealth_animal_hospital & F subway & F fuel_pizza F harris_teeter,Charlotte #2,"error:['&', 'F', 'lm(', 'Dairy', 'Queen', ')lm', '&', 'F', 'lm(', 'Subway', 'Pizza', ')lm', 'F', 'lm(', 'lm(', 'Harris', 'Teeter', ')lm']",False
6781,visit Dairy Queen Public Library of Charlotte and Mecklenburg County - Plaza Midwood Branch Harris Teeter Fuel Pizza and Diamond Restaurant,& F dairy_queen & F public_library_of_charlotte_and_mecklenburg_county_-_plaza_midwood_branch & F harris_teeter & F fuel_pizza F diamond_restaurant,Charlotte #2,"error:['&', 'F', 'lm(', 'lm(', 'Queen', ')lm', 'of', 'F', ')lm', '&', 'F', 'lm(', 'lm(', 'and', ')lm', ')lm', ')lm', 'F', 'lm(', 'lm(', 'Pizza', 'Pizza', ')lm', ')lm', 'lm(', 'lm(', 'lm(']",False
6782,sometime visit Harris Teeter The Plaza Post Office Wells Fargo CVS and Dish,& F harris_teeter & F wells_fargo & F the_plaza_post_office & F dish F cvs,Charlotte #2,& F harris_teeter & F the_plaza_post_office & F elizabeth_billiards,False
6783,sometime visit Dish CVS Harris Teeter Subway and Diamond Restaurant,& F dish & F harris_teeter & F cvs & F diamond_restaurant F subway,Charlotte #2,"error:['&', 'F', 'lm(', 'Dish', 'CVS', ')lm', 'F', 'lm(', 'lm(', 'Subway', 'and', 'Restaurant', ')lm']",False
6784,eventually go visit Nova's Bakery Wells Fargo Harris Teeter Commonwealth Animal Hospital and The Plaza Post Office,& F nova's_bakery & F wells_fargo & F the_plaza_post_office & F commonwealth_animal_hospital F harris_teeter,Charlotte #2,"error:['&', 'F', 'lm(', ""Nova's"", ""Nova's"", ')lm', '&', 'F', 'lm(', 'lm(', 'St', ')lm', ')lm', ')lm', 'F', 'lm(', 'lm(', 'lm(', 'Teeter', 'Teeter', ')lm']",False
6785,eventually go visit Zada Jane's Nova's Bakery Public Library of Charlotte and Mecklenburg County - Plaza Midwood Branch Commonwealth Animal Hospital and Fuel Pizza,& F zada_jane's & F nova's_bakery & F fuel_pizza & F commonwealth_animal_hospital F public_library_of_charlotte_and_mecklenburg_county_-_plaza_midwood_branch,Charlotte #2,"error:['&', 'F', 'lm(', 'lm(', 'Zada', ')lm', ')lm', '&', 'F', 'lm(', 'lm(', 'St', 'Pizza', ')lm', ')lm', 'F', 'lm(', 'lm(', ')lm', ')lm', 'of', ')lm', ')lm']",False
6786,go to Diamond Restaurant Zada Jane's Nova's Bakery Dish and Elizabeth Billiards,& F diamond_restaurant & F zada_jane's & F nova's_bakery & F dish F elizabeth_billiards,Charlotte #2,"error:['&', 'F', 'lm(', 'Diamond', 'Restaurant', ')lm', '&', 'F', 'lm(', 'lm(', 'Dish', ')lm', ')lm', ')lm', 'lm(', 'lm(', 'lm(']",False
6787,go to Dairy Queen Fuel Pizza Wells Fargo Diamond Restaurant and Dish,& F dairy_queen & F fuel_pizza & F wells_fargo & F diamond_restaurant F dish,Charlotte #2,"error:['&', 'F', 'lm(', 'Dairy', 'Pizza', ')lm', '&', 'F', 'lm(', 'lm(', 'Diamond', 'Restaurant', ')lm', 'F', 'lm(', 'lm(', 'Pizza', ')lm']",False
6788,go to Fuel Pizza go to The Plaza Post Office go to Diamond Restaurant go to Common Market go to Zada Jane's,& F fuel_pizza & F the_plaza_post_office & F diamond_restaurant & F common_market F zada_jane's,Charlotte #2,& F fuel_pizza & F the_plaza_post_office & F diamond_restaurant F zada_jane's,False
6789,go to Dish go to Commonwealth Animal Hospital go to Fuel Pizza go to Subway go to Harris Teeter,& F dish & F commonwealth_animal_hospital & F fuel_pizza & F subway F harris_teeter,Charlotte #2,& F dish F & fuel_pizza F elizabeth_billiards,False
6790,visit Harris Teeter Common Market Commonwealth Animal Hospital Public Library of Charlotte and Mecklenburg County - Plaza Midwood Branch Nova's Bakery in any order required,& F harris_teeter & F common_market & F commonwealth_animal_hospital & F public_library_of_charlotte_and_mecklenburg_county_-_plaza_midwood_branch F nova's_bakery,Charlotte #2,& F harris_teeter & F commonwealth_animal_hospital & F & public_library_of_charlotte_and_mecklenburg_county_-_plaza_midwood_branch )lm F F elizabeth_billiards lm( elizabeth_billiards,False
6791,visit Wells Fargo Harris Teeter Nova's Bakery Common Market CVS in any order required,& F wells_fargo & F harris_teeter & F nova's_bakery & F common_market F cvs,Charlotte #2,"error:['&', 'F', 'lm(', 'Wells', 'Fargo', ')lm', '&', 'F', 'lm(', 'Bakery', 'Common', ')lm', ')lm', 'F', 'lm(', 'Market', 'CVS', ')lm']",False
6792,visit all locations The Plaza Post Office Subway Public Library of Charlotte and Mecklenburg County - Plaza Midwood Branch Dish Common Market,& F the_plaza_post_office & F subway & F public_library_of_charlotte_and_mecklenburg_county_-_plaza_midwood_branch & F dish F common_market,Charlotte #2,& F the_plaza_post_office & F public_library_of_charlotte_and_mecklenburg_county_-_plaza_midwood_branch F public_library_of_charlotte_and_mecklenburg_county_-_plaza_midwood_branch,False
6793,visit all locations Harris Teeter Wells Fargo Diamond Restaurant The Plaza Post Office Common Market,& F harris_teeter & F wells_fargo & F diamond_restaurant & F the_plaza_post_office F common_market,Charlotte #2,& F diamond_restaurant & F diamond_restaurant & F the_plaza_post_office,False
6794,reach the following five locations The Plaza Post Office Dish CVS Elizabeth Billiards Common Market,& F the_plaza_post_office & F dish & F cvs & F elizabeth_billiards F common_market,Charlotte #2,& F the_plaza_post_office & cvs,False
6795,reach the following five locations Dairy Queen Commonwealth Animal Hospital CVS Nova's Bakery Fuel Pizza,& F dairy_queen & F commonwealth_animal_hospital & F cvs & F nova's_bakery F fuel_pizza,Charlotte #2,"error:['&', 'F', 'lm(', 'lm(', 'Dairy', 'Queen', ')lm', 'F', 'lm(', 'lm(', 'Fuel', 'Pizza', ')lm', 'F', 'lm(', 'lm(', 'the', ')lm', 'Pizza', ')lm']",False
6796,find the following CVS Zada Jane's Public Library of Charlotte and Mecklenburg County - Plaza Midwood Branch Elizabeth Billiards The Plaza Post Office,& F cvs & F zada_jane's & F public_library_of_charlotte_and_mecklenburg_county_-_plaza_midwood_branch & F elizabeth_billiards F the_plaza_post_office,Charlotte #2,"error:['&', 'F', 'lm(', 'CVS', 'Zada', ')lm', '&', 'F', 'lm(', 'lm(', 'Charlotte', 'Charlotte', 'of', 'Charlotte', ')lm', '&', 'F', 'lm(', 'The', '-', ')lm', ')lm', ')lm', 'F', 'lm(', 'The', ')lm']",False
6797,find the following CVS Diamond Restaurant Dairy Queen The Plaza Post Office Elizabeth Billiards,& F cvs & F diamond_restaurant & F dairy_queen & F the_plaza_post_office F elizabeth_billiards,Charlotte #2,& F diamond_restaurant & F dairy_queen & F the_plaza_post_office,False
6798,go to Common Market Subway CVS Nova's Bakery and Commonwealth Animal Hospital in arbitrary order,& F common_market & F subway & F cvs & F nova's_bakery F commonwealth_animal_hospital,Charlotte #2,"error:['&', 'F', 'lm(', 'Common', 'Market', ')lm', '&', 'F', 'lm(', 'Bakery', 'Bakery', ')lm', 'F', 'lm(', 'lm(', 'Animal', 'Hospital', ')lm']",False
6799,go to CVS The Plaza Post Office Common Market Diamond Restaurant and Dairy Queen in arbitrary order,& F cvs & F the_plaza_post_office & F common_market & F diamond_restaurant F dairy_queen,Charlotte #2,& F the_plaza_post_office & F the_plaza_post_office & F diamond_restaurant,False
6800,make sure Subway Zada Jane's Harris Teeter Elizabeth Billiards and The Plaza Post Office are all visited,& F subway & F zada_jane's & F harris_teeter & F elizabeth_billiards F the_plaza_post_office,Charlotte #2,"error:['&', 'F', 'lm(', 'Subway', 'Zada', ')lm', '&', 'F', 'lm(', 'Elizabeth', 'Billiards', ')lm', 'F', 'lm(', 'lm(', 'The', 'Post', ')lm']",False
6801,make sure Fuel Pizza Subway Wells Fargo Nova's Bakery and Common Market are all visited,& F fuel_pizza & F subway & F wells_fargo & F nova's_bakery F common_market,Charlotte #2,"error:['&', 'F', 'lm(', 'Fuel', 'Pizza', ')lm', '&', 'F', 'lm(', 'Fargo', ""Nova's"", ')lm', 'F', 'lm(', 'lm(', 'Market', 'Market', ')lm']",False
6802,do not stop until Commonwealth Animal Hospital The Plaza Post Office Public Library of Charlotte and Mecklenburg County - Plaza Midwood Branch Fuel Pizza and CVS are all visited,& F commonwealth_animal_hospital & F the_plaza_post_office & F public_library_of_charlotte_and_mecklenburg_county_-_plaza_midwood_branch & F fuel_pizza F cvs,Charlotte #2,& F dish & F the_plaza_post_office & F public_library_of_charlotte_and_mecklenburg_county_-_plaza_midwood_branch F fuel_pizza,False
6803,do not stop until CVS Elizabeth Billiards Public Library of Charlotte and Mecklenburg County - Plaza Midwood Branch Harris Teeter and Fuel Pizza are all visited,& F cvs & F elizabeth_billiards & F public_library_of_charlotte_and_mecklenburg_county_-_plaza_midwood_branch & F harris_teeter F fuel_pizza,Charlotte #2,"error:['&', 'F', 'lm(', 'CVS', 'CVS', 'Elizabeth', ')lm', '&', 'F', 'lm(', 'Charlotte', 'and', 'Mecklenburg', 'of', 'Charlotte', ')lm', 'F', 'lm(', 'lm(', 'Branch', 'Pizza', ')lm', 'F', 'lm(', 'lm(', 'Pizza', ')lm']",False
6804,make your way to Diamond Restaurant Harris Teeter Subway Wells Fargo and Public Library of Charlotte and Mecklenburg County - Plaza Midwood Branch,& F diamond_restaurant & F harris_teeter & F subway & F wells_fargo F public_library_of_charlotte_and_mecklenburg_county_-_plaza_midwood_branch,Charlotte #2,"error:['&', 'F', 'lm(', 'Diamond', 'Restaurant', ')lm', '&', 'F', 'lm(', 'Teeter', 'Subway', ')lm', '&', 'F', 'lm(', 'Mecklenburg', 'St', '-', 'of', ')lm', ')lm', 'F', 'lm(', 'lm(', ')lm', ')lm']",False
6805,make your way to Common Market Wells Fargo Zada Jane's Fuel Pizza and Diamond Restaurant,& F common_market & F wells_fargo & F zada_jane's & F fuel_pizza F diamond_restaurant,Charlotte #2,"error:['&', 'F', 'lm(', 'Common', 'Market', ')lm', '&', 'F', 'lm(', ""Jane's"", 'Pizza', ')lm', 'F', 'lm(', 'lm(', 'Restaurant', ')lm']",False
6806,visit CVS Elizabeth Billiards Fuel Pizza Wells Fargo and Dairy Queen in any order,& F cvs & F elizabeth_billiards & F fuel_pizza & F wells_fargo F dairy_queen,Charlotte #2,"error:['&', 'F', 'lm(', 'CVS', 'Elizabeth', ')lm', '&', 'F', 'lm(', 'Wells', 'Fargo', ')lm', 'F', 'lm(', 'lm(', 'Queen', 'Queen', ')lm']",False
6807,visit Harris Teeter Nova's Bakery Public Library of Charlotte and Mecklenburg County - Plaza Midwood Branch Wells Fargo and Common Market in any order,& F harris_teeter & F nova's_bakery & F public_library_of_charlotte_and_mecklenburg_county_-_plaza_midwood_branch & F wells_fargo F common_market,Charlotte #2,"error:['&', 'F', 'lm(', 'Harris', 'Teeter', ')lm', '&', 'F', 'lm(', 'Public', 'and', 'of', 'of', ')lm', ')lm', 'F', 'lm(', 'lm(', 'and', '-', 'Plaza', ')lm', 'F', 'F', 'lm(', 'lm(', 'Market', ')lm']",False
6808,visit Dish Public Library of Charlotte and Mecklenburg County - Plaza Midwood Branch Zada Jane's Common Market and The Plaza Post Office in no particular order,& F public_library_of_charlotte_and_mecklenburg_county_-_plaza_midwood_branch & F the_plaza_post_office & F dish & F zada_jane's F common_market,Charlotte #2,"error:['&', 'F', 'lm(', 'Dish', 'Public', 'Library', 'of', 'Library', ')lm', '&', 'F', 'lm(', 'Mecklenburg', 'and', '-', 'Plaza', ')lm', ')lm', 'F', 'lm(', 'lm(', 'Zada', ""Jane's"", ')lm', 'F', 'F', 'lm(', 'The', ')lm', ')lm']",False
6809,visit Harris Teeter Dairy Queen Fuel Pizza Nova's Bakery and Subway in no particular order,& F dairy_queen & F subway & F harris_teeter & F fuel_pizza F nova's_bakery,Charlotte #2,"error:['&', 'F', 'lm(', 'Harris']",False
6810,go to Harris Teeter Diamond Restaurant Fuel Pizza CVS and Subway at least once,& F harris_teeter & F subway & F fuel_pizza & F diamond_restaurant F cvs,Charlotte #2,"error:['&', 'F', 'lm(', 'Harris', 'Teeter', ')lm', '&', 'F', 'lm(', 'lm(', 'CVS', 'Pizza', ')lm', 'F', 'lm(', 'lm(', 'Diamond', 'Restaurant', ')lm']",False
6811,go to Zada Jane's Dairy Queen Diamond Restaurant Harris Teeter and Commonwealth Animal Hospital at least once,& F zada_jane's & F commonwealth_animal_hospital & F diamond_restaurant & F dairy_queen F harris_teeter,Charlotte #2,"error:['&', 'F', 'lm(', 'Zada', ""Jane's"", ')lm', '&', 'F', 'lm(', 'lm(', 'Teeter', 'Restaurant', ')lm', 'F', 'lm(', 'lm(', 'lm(', ')lm']",False
6812,go to Public Library of Charlotte and Mecklenburg County - Plaza Midwood Branch Nova's Bakery Dairy Queen Subway and Common Market,& F nova's_bakery & F public_library_of_charlotte_and_mecklenburg_county_-_plaza_midwood_branch & F subway & F common_market F dairy_queen,Charlotte #2,"error:['&', 'F', 'lm(', 'lm(', 'Library', ')lm', 'of', 'Charlotte', ')lm', '&', 'F', 'lm(', 'lm(', ')lm', ')lm', ')lm', ')lm', ')lm', 'lm(', 'lm(', ')lm', ')lm', 'of', ')lm']",False
6813,go to Commonwealth Animal Hospital Common Market Subway Elizabeth Billiards and Dairy Queen,& F common_market & F commonwealth_animal_hospital & F elizabeth_billiards & F dairy_queen F subway,Charlotte #2,"error:['&', 'F', 'lm(', 'Commonwealth', 'Animal', ')lm', '&', 'F', 'lm(', 'lm(', 'Elizabeth', 'Elizabeth', ')lm', ')lm', 'lm(', 'lm(', 'lm(', ')lm']",False
6814,go to Wells Fargo Commonwealth Animal Hospital Harris Teeter Subway and The Plaza Post Office in any order,& F the_plaza_post_office & F harris_teeter & F commonwealth_animal_hospital & F subway F wells_fargo,Charlotte #2,"error:['&', 'F', 'lm(', 'lm(', 'Wells', ')lm', '&', 'F', 'lm(', 'lm(', 'lm(', 'Fargo', ')lm', ')lm', 'F', 'F', 'lm(', 'The', 'The', ')lm', ')lm']",False
6815,go to Subway The Plaza Post Office Wells Fargo Zada Jane's and Commonwealth Animal Hospital in any order,& F commonwealth_animal_hospital & F wells_fargo & F the_plaza_post_office & F zada_jane's F subway,Charlotte #2,& F the_plaza_post_office & F the_plaza_post_office & F commonwealth_animal_hospital F the_plaza_post_office,False
6816,visit Elizabeth Billiards Fuel Pizza Common Market Dish and Public Library of Charlotte and Mecklenburg County - Plaza Midwood Branch in no specific order,& F elizabeth_billiards & F fuel_pizza & F common_market & F dish F public_library_of_charlotte_and_mecklenburg_county_-_plaza_midwood_branch,Charlotte #2,"error:['&', 'G', 'F', 'lm(', 'Pizza', ')lm', '&', '&', 'F', 'lm(', 'lm(', 'and', 'and', 'of', ')lm', 'F', 'F', 'lm(', 'lm(', 'and', 'of', ')lm', ')lm', 'F', 'F', 'lm(', 'lm(']",False
6817,visit Fuel Pizza Common Market Dairy Queen Wells Fargo and Nova's Bakery in no specific order,& F fuel_pizza & F common_market & F dairy_queen & F wells_fargo F nova's_bakery,Charlotte #2,"error:['&', 'F', 'lm(', 'lm(', 'Pizza', ')lm', '&', 'F', 'F', 'lm(', 'Fargo', 'and', 'F', 'F', 'F', 'lm(', 'lm(', 'Pizza', ')lm']",False
6818,reach Zada Jane's The Plaza Post Office Elizabeth Billiards Nova's Bakery and Commonwealth Animal Hospital in any order,& F zada_jane's & F the_plaza_post_office & F elizabeth_billiards & F nova's_bakery F commonwealth_animal_hospital,Charlotte #2,"error:['&', 'F', 'lm(', 'The', 'Zada', ')lm', '&', 'F', 'lm(', 'The', 'Plaza', ')lm', '&', 'F', 'lm(', ""Nova's"", 'Bakery', ')lm', 'F', 'lm(', 'lm(', 'Animal', 'Hospital', ')lm']",False
6819,reach Fuel Pizza Commonwealth Animal Hospital Wells Fargo Dish and Diamond Restaurant in any order,& F fuel_pizza & F commonwealth_animal_hospital & F wells_fargo & F dish F diamond_restaurant,Charlotte #2,& F fuel_pizza & F wells_fargo & F diamond_restaurant,False
6820,make sure you go to Subway Elizabeth Billiards Diamond Restaurant Fuel Pizza Nova's Bakery in any order,& F subway & F elizabeth_billiards & F diamond_restaurant & F fuel_pizza F nova's_bakery,Charlotte #2,"error:['&', 'F', 'lm(', 'Subway', 'Elizabeth', ')lm', '&', 'F', 'lm(', 'Fuel', 'Pizza', ')lm', 'F', 'lm(', 'lm(', 'Pizza', ')lm']",False
6821,make sure you go to Elizabeth Billiards Diamond Restaurant Wells Fargo Harris Teeter Public Library of Charlotte and Mecklenburg County - Plaza Midwood Branch in any order,& F elizabeth_billiards & F diamond_restaurant & F wells_fargo & F harris_teeter F public_library_of_charlotte_and_mecklenburg_county_-_plaza_midwood_branch,Charlotte #2,"error:['&', 'F', 'lm(', 'Elizabeth', 'Billiards', ')lm', '&', 'F', 'lm(', 'Wells', 'Fargo', ')lm', '&', 'F', 'lm(', 'lm(', 'County', '-', 'Midwood', 'Branch', ')lm', 'F', 'lm(', 'lm(', 'St', 'St']",False
6822,you must visit Wells Fargo Commonwealth Animal Hospital Diamond Restaurant Common Market Dish but it can be done in any order,& F wells_fargo & F commonwealth_animal_hospital & F diamond_restaurant & F common_market F dish,Charlotte #2,"error:['&', 'G', '&', 'lm(', 'lm(', 'Fargo', 'Restaurant', ')lm', 'lm(', 'lm(', 'Wells', 'Fargo', 'Fargo', ')lm', '&', 'F', 'lm(', 'lm(', 'Market', 'Dish', ')lm', 'lm(', 'lm(', 'F', 'F', 'F', 'F', 'F', 'F', 'lm(', 'lm(']",False
6823,you must visit Zada Jane's Fuel Pizza Dish Diamond Restaurant Commonwealth Animal Hospital but it can be done in any order,& F zada_jane's & F fuel_pizza & F dish & F diamond_restaurant F commonwealth_animal_hospital,Charlotte #2,"error:['&', 'F', '&', 'lm(', 'lm(', 'Pizza', ')lm', 'lm(', 'lm(', 'lm(', 'Zada', 'Pizza', 'Pizza', ')lm', '&', 'F', 'lm(', 'lm(', 'Animal', ')lm', ')lm', ')lm', 'F', 'lm(', 'lm(', 'Animal', 'Hospital', ')lm']",False
6824,in no particular order visit Elizabeth Billiards Commonwealth Animal Hospital Nova's Bakery Harris Teeter The Plaza Post Office,& F elizabeth_billiards & F commonwealth_animal_hospital & F nova's_bakery & F harris_teeter F the_plaza_post_office,Charlotte #2,& F diamond_restaurant & F nova's_bakery & F the_plaza_post_office,False
6825,in no particular order visit Subway Fuel Pizza Dish Harris Teeter Nova's Bakery,& F subway & F fuel_pizza & F dish & F harris_teeter F nova's_bakery,Charlotte #2,& F subway F fuel_pizza,False
6826,do not visit Wells Fargo until you visit CVS visit CVS only once do not visit CVS until you visit Dish visit Dish only once do no visit Dish until you visit Harris Teeter visit Harris Teeter only once,& & U ! dish harris_teeter & U ! cvs dish & U ! wells_fargo cvs F wells_fargo & U ! harris_teeter U harris_teeter U ! harris_teeter dish & U ! dish U dish U ! dish cvs U ! cvs U cvs U ! cvs wells_fargo,Charlotte #2,"error:['&', '&', 'U', '!', 'lm(', 'CVS', 'CVS', ')lm', 'lm(', 'Dish', 'Dish', ')lm', 'F', 'lm(', '!', 'lm(', 'lm(', ')lm', ')lm', 'CVS', ')lm', ')lm', 'U', '!', 'lm(', '!', 'lm(', 'CVS', 'CVS', ')lm', 'lm(', 'lm(', 'U', '!', 'Harris', 'Harris', 'Harris', 'Harris', ')lm', 'Harris', 'Harris', 'Harris', ')lm', '!', 'Harris', 'Harris', '!', 'Harris', 'Harris', ')lm', ')lm', 'lm(', ')lm', 'CVS', ')lm', ')lm', ')lm', ')lm', 'Dish', ')lm', ')lm', 'Dish', ')lm', ')lm', 'Dish', ')lm', 'Dish', ')lm', 'CVS', ')lm', ')lm', 'CVS', ')lm', ')lm']",False
6827,do not visit CVS until you visit Commonwealth Animal Hospital visit Commonwealth Animal Hospital only once do not visit Commonwealth Animal Hospital until you visit Dish visit Dish only once do no visit Dish until you visit The Plaza Post Office visit The Plaza Post Office only once,& & U ! dish the_plaza_post_office & U ! commonwealth_animal_hospital dish & U ! cvs commonwealth_animal_hospital F cvs & U ! the_plaza_post_office U the_plaza_post_office U ! the_plaza_post_office dish & U ! dish U dish U ! dish commonwealth_animal_hospital U ! commonwealth_animal_hospital U commonwealth_animal_hospital U ! commonwealth_animal_hospital cvs,Charlotte #2,"error:['&', '&', 'U', '!', 'lm(', 'The', 'Dish', ')lm', 'lm(', 'The', 'Plaza', ')lm', '&', 'U', '!', 'lm(', 'CVS', 'CVS', ')lm', 'lm(', 'The', 'Hospital', ')lm', 'F', 'lm(', 'Animal', 'Animal', ')lm', ')lm', 'U', 'lm(', 'lm(', 'lm(', 'The', 'U', 'U', 'U', 'U', 'The', 'The', 'U', 'U', '!', 'lm(', 'The', 'The', ')lm', 'The', 'lm(', 'The', 'The', ')lm', 'U', '!', 'The', 'lm(', 'The', 'lm(', ')lm', 'lm(', 'The', 'The', ')lm', 'U', '!', 'lm(', 'The', 'lm(', ')lm', 'Animal', 'Animal', ')lm', ')lm', 'Commonwealth', ')lm', ')lm', 'Hospital', ')lm', 'Commonwealth', 'lm(', 'Commonwealth', 'lm(', ')lm', 'Commonwealth', 'lm(', 'Commonwealth', 'lm(', ')lm', 'Commonwealth', 'lm(', ')lm', 'Commonwealth', 'lm(']",False
6828,visit Harris Teeter then Public Library of Charlotte and Mecklenburg County - Plaza Midwood Branch then Elizabeth Billiards and then Subway you can only visit each landmark once,& & U ! public_library_of_charlotte_and_mecklenburg_county_-_plaza_midwood_branch harris_teeter & U ! elizabeth_billiards public_library_of_charlotte_and_mecklenburg_county_-_plaza_midwood_branch & U ! subway elizabeth_billiards F subway & U ! harris_teeter U harris_teeter U ! harris_teeter public_library_of_charlotte_and_mecklenburg_county_-_plaza_midwood_branch & U ! public_library_of_charlotte_and_mecklenburg_county_-_plaza_midwood_branch U public_library_of_charlotte_and_mecklenburg_county_-_plaza_midwood_branch U ! public_library_of_charlotte_and_mecklenburg_county_-_plaza_midwood_branch elizabeth_billiards U ! elizabeth_billiards U elizabeth_billiards U ! elizabeth_billiards subway,Charlotte #2,"error:['&', '&', 'U', '!', 'lm(', 'Public', 'and', '-', 'of', 'Charlotte', ')lm', 'lm(', 'Harris', 'Teeter', ')lm', '&', 'U', '!', 'lm(', 'Elizabeth', 'Billiards', ')lm', 'lm(', 'Charlotte', 'and', '-', 'of', 'Charlotte', ')lm', 'F', 'lm(', '!', 'Billiards', 'Subway', ')lm', ')lm', ')lm', ')lm', '!', 'lm(', 'lm(', 'lm(', ')lm', ')lm', ')lm', 'lm(', 'lm(', 'lm(', 'lm(', 'U', '!', 'lm(', 'Harris', 'Library', ')lm', 'Harris', 'Library', ')lm', 'Harris', 'Library', ')lm', 'Library', ')lm', 'Library', ')lm', 'Library', ')lm', 'of', 'lm(', 'Library', ')lm', 'of', 'Library', ')lm', 'of', 'lm(', 'Charlotte', 'of', 'lm(', 'Charlotte', 'Charlotte', ')lm', 'of', 'Charlotte', ')lm', 'Charlotte', 'Charlotte', 'Charlotte', 'Charlotte', 'Charlotte', 'Charlotte', 'Charlotte', 'lm(', 'Charlotte', 'Charlotte', 'Charlotte', 'Charlotte', 'Charlotte', 'lm(', 'and', 'Charlotte', 'Charlotte', 'Charlotte', 'and', ')lm', 'and', 'Charlotte', 'of', 'lm(', 'and', 'and', ')lm', 'and', '-', 'and', ')lm', 'and', '-', ')lm', 'and', ')lm', 'and', '-', ')lm', 'and', ')lm', 'and', 'Subway', 'and', 'Subway', 'and', 'lm(', 'and']",False
6829,visit CVS then Wells Fargo then Public Library of Charlotte and Mecklenburg County - Plaza Midwood Branch and then Commonwealth Animal Hospital you can only visit each landmark once,& & U ! wells_fargo cvs & U ! public_library_of_charlotte_and_mecklenburg_county_-_plaza_midwood_branch wells_fargo & U ! commonwealth_animal_hospital public_library_of_charlotte_and_mecklenburg_county_-_plaza_midwood_branch F commonwealth_animal_hospital & U ! cvs U cvs U ! cvs wells_fargo & U ! wells_fargo U wells_fargo U ! wells_fargo public_library_of_charlotte_and_mecklenburg_county_-_plaza_midwood_branch U ! public_library_of_charlotte_and_mecklenburg_county_-_plaza_midwood_branch U public_library_of_charlotte_and_mecklenburg_county_-_plaza_midwood_branch U ! public_library_of_charlotte_and_mecklenburg_county_-_plaza_midwood_branch commonwealth_animal_hospital,Charlotte #2,"error:['&', '&', 'U', '!', 'lm(', 'Public', 'and', 'Library', 'of', 'Charlotte', ')lm', 'lm(', 'CVS', 'CVS', ')lm', '&', 'U', '!', 'lm(', 'County', 'St', '-', 'Plaza', 'Midwood', ')lm', 'lm(', 'Public', 'and', 'of', 'Charlotte', ')lm', '&', 'U', '!', 'lm(', 'Animal', 'Hospital', ')lm', 'lm(', ')lm', ')lm', ')lm', ')lm', ')lm', ')lm', ')lm', ')lm', ')lm', ')lm', ')lm', ')lm', 'lm(', ')lm', 'U', 'CVS', '!', 'lm(', 'CVS', '!', 'lm(', 'CVS', '!', 'lm(', 'CVS', '!', 'lm(', 'CVS', 'lm(', 'Library', ')lm', 'Library', 'Library', ')lm', 'Library', 'Library', ')lm', 'of', 'Library', ')lm', 'Library', 'of', 'Library', ')lm', 'of', 'Library', ')lm', 'of', 'Library', ')lm', 'of', 'Library', 'Charlotte', 'of', 'Library', ')lm', 'of', 'Charlotte', 'Charlotte', 'Charlotte', 'of', 'Charlotte', 'Charlotte', 'Charlotte', 'of', 'Library', ')lm', 'of', 'Charlotte', 'Charlotte', 'Charlotte', 'of', 'Library', ')lm', 'of', 'Charlotte', ')lm', 'and', 'Charlotte', 'Charlotte', ')lm', 'and', ')lm', 'and', ')lm', 'and', '-', 'and', ')lm', 'lm(', '-', 'and', ')lm', '-', 'lm(', '-', 'and', ')lm', 'lm(', '-', 'lm(', '-', 'lm(', '-', 'lm(']",False
6830,go to Zada Jane's but not through The Plaza Post Office Commonwealth Animal Hospital or Common Market and then go to The Plaza Post Office but not through Commonwealth Animal Hospital or Common Market and then go to Commonwealth Animal Hospital but not through Common Market and finally go to Common Market no revisiting is allowed,& & U ! the_plaza_post_office zada_jane's & U ! commonwealth_animal_hospital the_plaza_post_office & U ! common_market commonwealth_animal_hospital F common_market & U ! zada_jane's U zada_jane's U ! zada_jane's the_plaza_post_office & U ! the_plaza_post_office U the_plaza_post_office U ! the_plaza_post_office commonwealth_animal_hospital U ! commonwealth_animal_hospital U commonwealth_animal_hospital U ! commonwealth_animal_hospital common_market,Charlotte #2,"error:['&', '&', 'U', '!', 'lm(', 'The', 'Plaza', ')lm', 'lm(', 'Zada', ""Jane's"", ')lm', '&', 'U', '!', 'lm(', 'The', 'Plaza', ')lm', 'lm(', 'The', 'Plaza', ')lm', '&', 'U', '!', 'lm(', 'Hospital', ')lm', ')lm', 'lm(', 'lm(', ')lm', ')lm', ')lm', ')lm', '&', 'U', '!', 'lm(', 'Common', 'lm(', ')lm', 'lm(', ')lm', 'lm(', 'lm(', 'lm(', ')lm', 'Zada', ')lm', ')lm', ')lm', '!', 'lm(', 'Zada', ""Jane's"", ')lm', ')lm', 'U', '!', 'lm(', 'The', ')lm', ')lm', 'lm(', 'The', ')lm', ')lm', 'The', 'lm(', 'The', ')lm', 'The', 'The', ')lm', 'The', 'The', ')lm', 'The', 'The', ')lm', 'The', ')lm', 'The', ')lm', 'The', ')lm', 'The', ')lm', 'The', ')lm', ')lm', 'The', ')lm', ')lm', 'The', ')lm', ')lm', 'The', ')lm', ')lm', ')lm', ')lm', ')lm', ')lm', ')lm', ')lm', ')lm', ')lm', 'lm(', ')lm', ')lm', ')lm', 'lm(', ')lm', ')lm', ')lm', 'lm(', ')lm', 'lm(', ')lm', 'lm(', ')lm', 'lm(', ')lm', 'lm(', ')lm']",False
