,nl_command,ltl,map_name,result,eq
6845,stay away from Dish Fuel Pizza and Subway until you make Dairy Queen single visit to Dairy Queen and then make your way to Dish while staying away from Dairy Queen Fuel Pizza and Subway and then make your way to Fuel Pizza while staying away from Dairy Queen Dish or Subway and finally make your way to Subway while staying away from Dairy Queen Dish and Fuel Pizza,& & U ! dish dairy_queen & U ! fuel_pizza dish & U ! subway fuel_pizza F subway & U ! dairy_queen U dairy_queen U ! dairy_queen dish & U ! dish U dish U ! dish fuel_pizza U ! fuel_pizza U fuel_pizza U ! fuel_pizza subway,Charlotte #2,"error:['&', '&', 'U', '!', 'lm(', 'Dish', 'Pizza', ')lm', 'lm(', 'Dairy', 'Dairy', ')lm', '&', 'U', '!', 'lm(', 'Fuel', 'Pizza', ')lm', 'lm(', 'Dish', 'Pizza', ')lm', 'F', 'lm(', 'Pizza', 'Pizza', ')lm', '&', 'U', '!', 'lm(', 'Dairy', 'Queen', ')lm', 'U', 'lm(', 'lm(', 'Dairy', ')lm', 'U', 'U', '!', 'lm(', 'Dairy', ')lm', ')lm', 'lm(', ')lm', 'Pizza', ')lm', 'Pizza', ')lm', 'U', '!', 'lm(', 'Pizza', ')lm', 'lm(', 'Pizza', 'Dish', 'Dish', 'U', 'Pizza', ')lm', 'Pizza', 'Dish', 'Dish', ')lm', 'Pizza', ')lm', 'Pizza', 'Pizza', 'Pizza', 'Pizza', 'Pizza', ')lm', 'Pizza', 'Pizza', 'Pizza', 'Pizza', ')lm', 'Pizza', ')lm', 'Pizza', 'Pizza', ')lm', 'Pizza', ')lm', 'Pizza', 'Pizza', 'Pizza', ')lm', 'Pizza', ')lm', 'Pizza', 'Pizza', 'Pizza', ')lm', 'Pizza', 'Pizza', 'Pizza', ')lm', 'Pizza', ')lm', 'Pizza', 'Pizza', 'Pizza', 'Pizza', 'Pizza', ')lm', 'Pizza', 'Pizza', 'Pizza', 'Pizza', 'Pizza']",False
6846,head to Zada Jane's Commonwealth Animal Hospital Public Library of Charlotte and Mecklenburg County - Plaza Midwood Branch and Common Market in this order without skipping or revisiting any one of them,& & U ! commonwealth_animal_hospital zada_jane's & U ! public_library_of_charlotte_and_mecklenburg_county_-_plaza_midwood_branch commonwealth_animal_hospital & U ! common_market public_library_of_charlotte_and_mecklenburg_county_-_plaza_midwood_branch F common_market & U ! zada_jane's U zada_jane's U ! zada_jane's commonwealth_animal_hospital & U ! commonwealth_animal_hospital U commonwealth_animal_hospital U ! commonwealth_animal_hospital public_library_of_charlotte_and_mecklenburg_county_-_plaza_midwood_branch U ! public_library_of_charlotte_and_mecklenburg_county_-_plaza_midwood_branch U public_library_of_charlotte_and_mecklenburg_county_-_plaza_midwood_branch U ! public_library_of_charlotte_and_mecklenburg_county_-_plaza_midwood_branch common_market,Charlotte #2,"error:['&', '&', 'U', '!', 'lm(', 'Public', 'and', 'Library', 'Charlotte', ')lm', 'lm(', 'Zada', ""Jane's"", ')lm', '&', 'U', '!', 'lm(', 'County', 'St', '-', 'Plaza', ')lm', ')lm', 'lm(', 'Public', 'and', 'Library', 'Charlotte', ')lm', 'F', 'lm(', 'lm(', 'Common', 'Common', ')lm', ')lm', ')lm', ')lm', '!', 'lm(', 'lm(', 'Zada', ""Jane's"", ')lm', ')lm', 'Zada', ""Jane's"", ')lm', 'lm(', 'Zada', ""Jane's"", ""Jane's"", 'Commonwealth', ')lm', 'lm(', 'lm(', 'lm(', 'lm(', 'lm(', 'lm(', 'lm(', 'Library', 'Library', 'Library', 'Library', 'Library', 'Library', 'Library', 'Library', 'Library', 'Library', ')lm', 'Library', 'Library', 'Library', 'Library', 'Library', 'Library', 'Library', 'Library', 'Library', 'Library', ')lm', 'Library', 'Library', 'Library', 'Library', 'Library', 'Library', 'Library', 'Library', 'lm(', 'of', 'Library', ')lm', 'Library', 'Charlotte', 'Charlotte', 'Library', 'Charlotte', 'Library', 'Charlotte', 'Library', ')lm', 'of', 'lm(', ')lm', 'of', 'lm(', ')lm', 'of', 'lm(', ')lm', 'of', 'lm(', ')lm', 'of', 'lm(']",False
6847,head to Subway Wells Fargo The Plaza Post Office and Commonwealth Animal Hospital in this order without skipping or revisiting any one of them,& & U ! wells_fargo subway & U ! the_plaza_post_office wells_fargo & U ! commonwealth_animal_hospital the_plaza_post_office F commonwealth_animal_hospital & U ! subway U subway U ! subway wells_fargo & U ! wells_fargo U wells_fargo U ! wells_fargo the_plaza_post_office U ! the_plaza_post_office U the_plaza_post_office U ! the_plaza_post_office commonwealth_animal_hospital,Charlotte #2,"error:['&', '&', 'U', '!', 'lm(', 'The', 'Plaza', ')lm', 'lm(', 'Subway', 'Wells', ')lm', '&', 'U', '!', 'lm(', 'Animal', 'Hospital', ')lm', 'lm(', 'The', 'Plaza', ')lm', 'F', 'lm(', 'Commonwealth', 'Animal', ')lm', ')lm', 'U', '!', 'lm(', 'Subway', 'Wells', 'Wells', ')lm', 'U', 'lm(', 'Subway', 'Wells', 'Wells', ')lm', 'U', '!', 'lm(', 'Subway', 'Wells', 'Fargo', ')lm', 'lm(', 'The', 'The', 'Plaza', ')lm', 'U', '!', 'lm(', 'The', 'Plaza', ')lm', 'U', 'lm(', 'The', 'Plaza', 'Plaza', ')lm', 'U', '!', 'lm(', 'The', 'Plaza', 'Plaza', 'Post', 'Office', 'Office', 'Office', 'Office', ')lm']",False
6848,visit each of Dish Zada Jane's Common Market and Wells Fargo exactly once in this order,& & U ! zada_jane's dish & U ! common_market zada_jane's & U ! wells_fargo common_market F wells_fargo & U ! dish U dish U ! dish zada_jane's & U ! zada_jane's U zada_jane's U ! zada_jane's common_market U ! common_market U common_market U ! common_market wells_fargo,Charlotte #2,"error:['&', 'F', '&', 'lm(', 'lm(', 'St', ')lm', 'St', 'St', ')lm', 'lm(', 'lm(', 'St', 'St', 'St', ')lm', ')lm', ')lm', 'lm(', 'lm(', 'of', ')lm', ')lm']",False
6849,visit each of Commonwealth Animal Hospital Zada Jane's Public Library of Charlotte and Mecklenburg County - Plaza Midwood Branch and Fuel Pizza exactly once in this order,& & U ! zada_jane's commonwealth_animal_hospital & U ! public_library_of_charlotte_and_mecklenburg_county_-_plaza_midwood_branch zada_jane's & U ! fuel_pizza public_library_of_charlotte_and_mecklenburg_county_-_plaza_midwood_branch F fuel_pizza & U ! commonwealth_animal_hospital U commonwealth_animal_hospital U ! commonwealth_animal_hospital zada_jane's & U ! zada_jane's U zada_jane's U ! zada_jane's public_library_of_charlotte_and_mecklenburg_county_-_plaza_midwood_branch U ! public_library_of_charlotte_and_mecklenburg_county_-_plaza_midwood_branch U public_library_of_charlotte_and_mecklenburg_county_-_plaza_midwood_branch U ! public_library_of_charlotte_and_mecklenburg_county_-_plaza_midwood_branch fuel_pizza,Charlotte #2,"error:['&', 'F', '&', 'lm(', 'lm(', 'St', 'Library', ')lm', ')lm', ')lm', '&', 'lm(', 'lm(', 'lm(', 'Pizza', ')lm', 'of', 'F', 'lm(', 'lm(', 'Pizza', ')lm', 'of', ')lm', ')lm', ')lm', 'lm(', ')lm', 'of', ')lm', ')lm', 'of', ')lm', ')lm', ')lm', 'of', ')lm', ')lm', 'of', ')lm', ')lm', ')lm', 'of', ')lm', ')lm', ')lm', 'of', ')lm', ')lm']",False
6850,visit Public Library of Charlotte and Mecklenburg County - Plaza Midwood Branch but before visiting Public Library of Charlotte and Mecklenburg County - Plaza Midwood Branch you must visit Elizabeth Billiards only after that visit Commonwealth Animal Hospital after visiting Commonwealth Animal Hospital visit Dish visit each location once,& & U ! public_library_of_charlotte_and_mecklenburg_county_-_plaza_midwood_branch elizabeth_billiards & U ! commonwealth_animal_hospital public_library_of_charlotte_and_mecklenburg_county_-_plaza_midwood_branch & U ! dish commonwealth_animal_hospital F dish & U ! elizabeth_billiards U elizabeth_billiards U ! elizabeth_billiards public_library_of_charlotte_and_mecklenburg_county_-_plaza_midwood_branch & U ! public_library_of_charlotte_and_mecklenburg_county_-_plaza_midwood_branch U public_library_of_charlotte_and_mecklenburg_county_-_plaza_midwood_branch U ! public_library_of_charlotte_and_mecklenburg_county_-_plaza_midwood_branch commonwealth_animal_hospital U ! commonwealth_animal_hospital U commonwealth_animal_hospital U ! commonwealth_animal_hospital dish,Charlotte #2,"error:['&', '&', 'U', '!', 'lm(', 'Commonwealth', ')lm', '-', 'of', ')lm', ')lm', 'lm(', 'Commonwealth', 'Commonwealth', 'Commonwealth', '&', 'U', 'U', '!', 'lm(', 'Commonwealth', 'Animal', ')lm', 'lm(', 'Commonwealth', 'lm(', '-', 'of', '-', ')lm', ')lm', 'lm(', 'lm(', 'Commonwealth', 'lm(', ')lm', ')lm', ')lm', ')lm', '&', 'U', '!', 'lm(', 'Public', 'Public', 'Library', 'of', 'Library', ')lm', 'U', 'lm(', 'U', 'Library', 'Library', 'of', 'Library', ')lm', 'U', 'lm(', 'lm(', 'Elizabeth', 'lm(', ')lm', 'lm(', 'lm(', 'of', 'lm(', ')lm', '-', '-', '-', ')lm', ')lm', 'U', 'lm(', '-', '-', '-', ')lm', ')lm', ')lm', '-', '-', '-', ')lm', ')lm', ')lm', '-', 'lm(', '-', '-', ')lm', ')lm', ')lm', ')lm', '-', '-', '-', ')lm', ')lm', ')lm', ')lm', '-', '-', '-', ')lm', ')lm', ')lm', ')lm', '-', '-', 'Commonwealth', ')lm', ')lm']",False
6851,visit Public Library of Charlotte and Mecklenburg County - Plaza Midwood Branch but before visiting Public Library of Charlotte and Mecklenburg County - Plaza Midwood Branch you must visit Nova's Bakery only after that visit Harris Teeter after visiting Harris Teeter visit CVS visit each location once,& & U ! public_library_of_charlotte_and_mecklenburg_county_-_plaza_midwood_branch nova's_bakery & U ! harris_teeter public_library_of_charlotte_and_mecklenburg_county_-_plaza_midwood_branch & U ! cvs harris_teeter F cvs & U ! nova's_bakery U nova's_bakery U ! nova's_bakery public_library_of_charlotte_and_mecklenburg_county_-_plaza_midwood_branch & U ! public_library_of_charlotte_and_mecklenburg_county_-_plaza_midwood_branch U public_library_of_charlotte_and_mecklenburg_county_-_plaza_midwood_branch U ! public_library_of_charlotte_and_mecklenburg_county_-_plaza_midwood_branch harris_teeter U ! harris_teeter U harris_teeter U ! harris_teeter cvs,Charlotte #2,"error:['&', '&', 'U', '!', 'lm(', 'Harris', ')lm', '-', 'lm(', ')lm', ')lm', 'Harris', 'Harris', 'Harris', ')lm', '&', 'U', '!', 'lm(', 'Harris', ')lm', ')lm', 'lm(', ')lm', '-', '-', '-', '-', ')lm', ')lm', ')lm', 'lm(', 'lm(', 'Harris', ')lm', ')lm', ')lm', ')lm', ')lm', ')lm', 'U', '!', 'Public', 'Public', 'of', 'of', ')lm', ')lm', 'U', ')lm', ""Nova's"", 'lm(', ')lm', ')lm', 'lm(', 'of', 'Library', ')lm', 'of', 'of', ')lm', ')lm', 'lm(', '-', '-', '-', ')lm', ')lm', ')lm', '-', 'lm(', '-', '-', '-', ')lm', ')lm', ')lm', '-', '-', ')lm', ')lm', '-', '-', ')lm', ')lm', ')lm', '-', '-', '-', ')lm', ')lm', ')lm', '-', '-', ')lm', ')lm', ')lm', '-', '-', '-', ')lm', ')lm', ')lm']",False
6852,visit CVS only once while avoiding Elizabeth Billiards then visit Elizabeth Billiards once while avoiding Harris Teeter only after visiting Harris Teeter once visit Wells Fargo,& & U ! elizabeth_billiards cvs & U ! harris_teeter elizabeth_billiards & U ! wells_fargo harris_teeter F wells_fargo & U ! cvs U cvs U ! cvs elizabeth_billiards & U ! elizabeth_billiards U elizabeth_billiards U ! elizabeth_billiards harris_teeter U ! harris_teeter U harris_teeter U ! harris_teeter wells_fargo,Charlotte #2,"error:['&', '&', 'U', '!', 'lm(', 'Elizabeth', 'Billiards', ')lm', 'lm(', 'CVS', 'Teeter', ')lm', 'F', 'lm(', '!', 'lm(', ')lm', 'Elizabeth', ')lm', ')lm', 'U', '!', 'lm(', 'CVS', 'CVS', ')lm', ')lm', 'lm(', 'CVS', 'CVS', 'CVS', ')lm', 'CVS', 'lm(', 'CVS', 'CVS', ')lm', ')lm', 'lm(', 'Elizabeth', ')lm', ')lm', 'Elizabeth', 'Elizabeth', 'Elizabeth', ')lm', 'Elizabeth', 'Elizabeth', 'Elizabeth', ')lm', 'Elizabeth', 'Elizabeth', 'Elizabeth', 'Elizabeth', ')lm', 'Elizabeth', 'Elizabeth', 'Elizabeth', ')lm', 'Elizabeth', 'Elizabeth', ')lm']",False
6853,visit CVS only once while avoiding Fuel Pizza then visit Fuel Pizza once while avoiding Commonwealth Animal Hospital only after visiting Commonwealth Animal Hospital once visit Nova's Bakery,& & U ! fuel_pizza cvs & U ! commonwealth_animal_hospital fuel_pizza & U ! nova's_bakery commonwealth_animal_hospital F nova's_bakery & U ! cvs U cvs U ! cvs fuel_pizza & U ! fuel_pizza U fuel_pizza U ! fuel_pizza commonwealth_animal_hospital U ! commonwealth_animal_hospital U commonwealth_animal_hospital U ! commonwealth_animal_hospital nova's_bakery,Charlotte #2,"error:['&', '&', 'U', '!', 'lm(', 'Fuel', 'Pizza', ')lm', 'lm(', 'CVS', 'CVS', ')lm', '&', 'U', '!', 'lm(', 'lm(', 'Animal', ')lm', ')lm', 'lm(', 'Pizza', 'Pizza', ')lm', 'F', 'lm(', 'Animal', ')lm', ')lm', '&', 'U', '!', 'lm(', 'CVS', 'CVS', ')lm', 'U', 'lm(', 'CVS', 'CVS', ')lm', 'U', '!', 'lm(', 'CVS', 'CVS', ')lm', 'lm(', 'Pizza', 'Pizza', ')lm', 'U', '!', 'lm(', 'Pizza', 'Pizza', ')lm', 'U', 'lm(', 'Pizza', 'Pizza', ')lm', 'U', '!', 'lm(', 'Fuel', 'Pizza', ')lm', 'lm(', 'Animal', 'Pizza', ')lm']",False
6854,visit Commonwealth Animal Hospital Dish Fuel Pizza Dairy Queen once do not visit Dish without visiting Commonwealth Animal Hospital and do not visit Dish without visiting Fuel Pizza do not visit Dairy Queen without visiting Fuel Pizza,& & U ! dish commonwealth_animal_hospital & U ! fuel_pizza dish & U ! dairy_queen fuel_pizza F dairy_queen & U ! commonwealth_animal_hospital U commonwealth_animal_hospital U ! commonwealth_animal_hospital dish & U ! dish U dish U ! dish fuel_pizza U ! fuel_pizza U fuel_pizza U ! fuel_pizza dairy_queen,Charlotte #2,"error:['&', '&', 'U', '!', 'lm(', 'Fuel', 'Pizza', ')lm', 'lm(', 'Commonwealth', 'Animal', ')lm', '&', 'U', '!', 'lm(', 'lm(', 'Queen', ')lm', 'lm(', ')lm', 'lm(', 'Pizza', ')lm', 'F', 'F', 'lm(', 'Pizza', ')lm', ')lm', ')lm', 'U', 'lm(', 'lm(', 'lm(', 'Commonwealth', 'lm(', 'Commonwealth', ')lm', 'U', 'U', '!', 'lm(', 'Commonwealth', 'Animal', ')lm', 'Commonwealth', 'U', ')lm', 'lm(', 'Commonwealth', 'Pizza', ')lm', 'U', 'Pizza', ')lm', 'lm(', 'lm(', 'lm(', 'Pizza', ')lm', 'U', 'Pizza', ')lm', 'Pizza', ')lm', 'Pizza', ')lm', 'Pizza', ')lm', 'Pizza', ')lm', 'Pizza', ')lm', 'Pizza', ')lm', 'Pizza', ')lm', 'Pizza', ')lm', 'Pizza', ')lm', 'Pizza', ')lm', 'Pizza', ')lm', 'Pizza', ')lm']",False
6855,visit CVS Commonwealth Animal Hospital Public Library of Charlotte and Mecklenburg County - Plaza Midwood Branch Wells Fargo once do not visit Commonwealth Animal Hospital without visiting CVS and do not visit Commonwealth Animal Hospital without visiting Public Library of Charlotte and Mecklenburg County - Plaza Midwood Branch do not visit Wells Fargo without visiting Public Library of Charlotte and Mecklenburg County - Plaza Midwood Branch,& & U ! commonwealth_animal_hospital cvs & U ! public_library_of_charlotte_and_mecklenburg_county_-_plaza_midwood_branch commonwealth_animal_hospital & U ! wells_fargo public_library_of_charlotte_and_mecklenburg_county_-_plaza_midwood_branch F wells_fargo & U ! cvs U cvs U ! cvs commonwealth_animal_hospital & U ! commonwealth_animal_hospital U commonwealth_animal_hospital U ! commonwealth_animal_hospital public_library_of_charlotte_and_mecklenburg_county_-_plaza_midwood_branch U ! public_library_of_charlotte_and_mecklenburg_county_-_plaza_midwood_branch U public_library_of_charlotte_and_mecklenburg_county_-_plaza_midwood_branch U ! public_library_of_charlotte_and_mecklenburg_county_-_plaza_midwood_branch wells_fargo,Charlotte #2,"error:['&', '&', 'U', '!', 'lm(', 'Public', 'and', '-', 'of', 'Charlotte', ')lm', 'lm(', 'CVS', 'Commonwealth', ')lm', '&', 'U', '!', 'lm(', 'lm(', 'Hospital', '-', 'lm(', ')lm', ')lm', 'lm(', 'of', 'and', ')lm', 'of', ')lm', ')lm', 'lm(', 'U', '!', 'lm(', 'lm(', ')lm', ')lm', ')lm', ')lm', 'lm(', 'lm(', 'lm(', 'lm(', 'lm(', 'lm(', 'lm(', 'lm(', 'U', ')lm', 'CVS', 'lm(', 'U', 'U', '!', 'lm(', 'CVS', 'lm(', ')lm', 'U', 'Library', ')lm', 'of', 'lm(', ')lm', 'Library', ')lm', 'of', 'lm(', 'Library', ')lm', 'of', 'Library', ')lm', 'of', 'of', 'Library', ')lm', 'of', 'of', 'Library', ')lm', 'of', 'of', 'Library', ')lm', 'of', 'of', 'Library', ')lm', 'of', 'of', 'Library', ')lm', 'of', 'of', 'lm(', 'Library', 'of', 'lm(', 'of', 'lm(', ')lm', 'of', 'lm(', 'and', '-', 'of', ')lm', ')lm', 'lm(', 'of', 'and', '-', '-', ')lm', 'lm(', 'lm(', 'lm(', '-', '-', 'lm(', 'lm(', 'lm(', '-', '-', 'lm(', 'lm(', 'lm(', '-', '-', 'lm(', 'lm(', 'lm(', 'lm(', 'lm(', '-', 'lm(', 'lm(', 'lm(', 'lm(', 'lm(']",False
6856,visit Nova's Bakery then Dish then Wells Fargo then The Plaza Post Office follow this strict order and visit each location only once,& & U ! dish nova's_bakery & U ! wells_fargo dish & U ! the_plaza_post_office wells_fargo F the_plaza_post_office & U ! nova's_bakery U nova's_bakery U ! nova's_bakery dish & U ! dish U dish U ! dish wells_fargo U ! wells_fargo U wells_fargo U ! wells_fargo the_plaza_post_office,Charlotte #2,"error:['&', '&', 'U', '!', 'lm(', 'The', 'Plaza', ')lm', 'lm(', ""Nova's"", 'Bakery', ')lm', '&', 'U', '!', 'lm(', 'The', 'follow', ')lm', 'lm(', 'The', 'Plaza', ')lm', 'F', 'lm(', 'The', 'Plaza', ')lm', '&', ')lm', '!', 'lm(', 'lm(', 'lm(', ""Nova's"", ')lm', ')lm', ""Nova's"", 'lm(', ""Nova's"", 'Bakery', ')lm', ""Nova's"", 'Bakery', ')lm', 'lm(', ""Nova's"", 'lm(', ""Nova's"", 'lm(', ')lm', 'lm(', 'lm(', 'lm(', 'lm(', 'lm(', 'Wells', 'Wells', ')lm', 'Wells', 'Fargo', 'Fargo', 'Fargo', 'Fargo', ')lm', 'lm(', 'Fargo', 'Fargo', 'Fargo', 'Fargo', 'Fargo', ')lm', 'lm(', 'Fargo', 'The', ')lm', ')lm', 'The', 'The', ')lm', ')lm', 'The', 'The', ')lm', ')lm']",False
6857,visit Common Market then Wells Fargo then Harris Teeter then CVS follow this strict order and visit each location only once,& & U ! wells_fargo common_market & U ! harris_teeter wells_fargo & U ! cvs harris_teeter F cvs & U ! common_market U common_market U ! common_market wells_fargo & U ! wells_fargo U wells_fargo U ! wells_fargo harris_teeter U ! harris_teeter U harris_teeter U ! harris_teeter cvs,Charlotte #2,"error:['&', '&', 'U', '!', 'lm(', 'Harris', 'Teeter', ')lm', 'lm(', 'Common', 'Market', ')lm', '&', 'U', '!', 'lm(', 'lm(', 'St', ')lm', 'lm(', ')lm', ')lm', 'lm(', 'Teeter', 'Teeter', 'F', 'F', 'lm(', 'lm(', ')lm', ')lm', ')lm', ')lm', ')lm', 'U', 'lm(', 'Common', 'lm(', 'Common', 'Market', ')lm', 'Common', 'U', 'Common', 'lm(', 'Common', 'Market', ')lm', 'Common', 'lm(', 'lm(', 'Common', 'lm(', 'lm(', 'lm(', 'lm(', 'Wells', 'lm(', 'Fargo', ')lm', 'Fargo', 'Harris', 'Harris', 'Harris', 'U', 'Harris', 'Harris', 'Harris', 'Harris', 'U', 'Harris', 'Harris', 'Harris', 'Harris', 'U', 'Harris', 'Harris', 'Harris', ')lm', 'Harris', 'Teeter', 'Teeter', 'Teeter', 'lm(', 'lm(', 'lm(', ')lm', 'Teeter', 'Teeter', ')lm', 'lm(']",False
6858,please go to Diamond Restaurant then Elizabeth Billiards then CVS then Harris Teeter in that specific order without revisiting previously visited location,& & U ! elizabeth_billiards diamond_restaurant & U ! cvs elizabeth_billiards & U ! harris_teeter cvs F harris_teeter & U ! diamond_restaurant U diamond_restaurant U ! diamond_restaurant elizabeth_billiards & U ! elizabeth_billiards U elizabeth_billiards U ! elizabeth_billiards cvs U ! cvs U cvs U ! cvs harris_teeter,Charlotte #2,"error:['&', '&', 'U', '!', 'lm(', 'Elizabeth', 'then', ')lm', 'lm(', 'lm(', 'Restaurant', ')lm', '&', 'U', '!', 'lm(', 'Harris', 'Teeter', ')lm', 'lm(', 'lm(', ')lm', 'F', 'F', 'F', 'lm(', 'lm(', 'Teeter', 'Teeter', ')lm', ')lm', 'Restaurant', 'Restaurant', ')lm', 'Restaurant', 'Restaurant', ')lm', 'U', '!', 'lm(', 'Restaurant', 'Restaurant', ')lm', 'U', '!', 'lm(', 'Restaurant', 'Restaurant', ')lm', 'lm(', 'lm(', 'lm(', 'lm(', 'lm(', 'lm(', 'Elizabeth', 'Billiards', ')lm', 'U', 'Elizabeth', 'Billiards', 'Billiards', 'Billiards', 'Billiards', ')lm', 'lm(', 'Billiards', 'Billiards', 'Billiards', ')lm', 'lm(', 'lm(', 'Billiards', 'CVS', ')lm', 'lm(', 'Teeter', ')lm', ')lm', 'Teeter', 'Teeter', ')lm', ')lm', 'Teeter', 'Teeter', ')lm']",False
6859,please go to Dish then Common Market then Public Library of Charlotte and Mecklenburg County - Plaza Midwood Branch then Nova's Bakery in that specific order without revisiting previously visited location,& & U ! common_market dish & U ! public_library_of_charlotte_and_mecklenburg_county_-_plaza_midwood_branch common_market & U ! nova's_bakery public_library_of_charlotte_and_mecklenburg_county_-_plaza_midwood_branch F nova's_bakery & U ! dish U dish U ! dish common_market & U ! common_market U common_market U ! common_market public_library_of_charlotte_and_mecklenburg_county_-_plaza_midwood_branch U ! public_library_of_charlotte_and_mecklenburg_county_-_plaza_midwood_branch U public_library_of_charlotte_and_mecklenburg_county_-_plaza_midwood_branch U ! public_library_of_charlotte_and_mecklenburg_county_-_plaza_midwood_branch nova's_bakery,Charlotte #2,"error:['&', '&', 'U', '!', 'lm(', 'Public', 'Library', 'Library', 'of', 'Charlotte', ')lm', 'lm(', 'Dish', 'Dish', ')lm', '&', 'U', '!', 'lm(', ""Nova's"", 'Bakery', ')lm', 'lm(', 'Public', 'Library', 'of', 'Charlotte', ')lm', 'F', 'lm(', ""Nova's"", 'Bakery', ')lm', '&', 'U', '!', 'lm(', 'Dish', ')lm', ')lm', 'U', 'lm(', 'lm(', 'Dish', ')lm', 'U', 'U', '!', 'lm(', 'Dish', ')lm', ')lm', 'lm(', 'lm(', ')lm', ')lm', ')lm', ')lm', 'Library', ')lm', 'lm(', 'Library', ')lm', 'Library', 'Library', 'Library', ')lm', 'Library', 'of', 'Library', ')lm', 'Library', 'of', 'Library', ')lm', 'Library', 'of', 'Library', ')lm', 'Library', 'of', 'Library', ')lm', 'Library', 'of', 'Library', ')lm', ')lm', 'of', 'Charlotte', ')lm', ')lm', 'of', 'Library', ')lm', ')lm', '-', 'Charlotte', ')lm', ')lm', '-', 'lm(', '-', '-', ')lm', ')lm', ')lm', '-', 'lm(', '-', '-', ')lm', ')lm', ')lm', '-', 'lm(', '-', 'Bakery', ')lm', ')lm']",False
6860,first go to Common Market once without visiting Public Library of Charlotte and Mecklenburg County - Plaza Midwood Branch then go to Public Library of Charlotte and Mecklenburg County - Plaza Midwood Branch once without visiting CVS then go to CVS once without visiting Subway finally go to Subway,& & U ! public_library_of_charlotte_and_mecklenburg_county_-_plaza_midwood_branch common_market & U ! cvs public_library_of_charlotte_and_mecklenburg_county_-_plaza_midwood_branch & U ! subway cvs F subway & U ! common_market U common_market U ! common_market public_library_of_charlotte_and_mecklenburg_county_-_plaza_midwood_branch & U ! public_library_of_charlotte_and_mecklenburg_county_-_plaza_midwood_branch U public_library_of_charlotte_and_mecklenburg_county_-_plaza_midwood_branch U ! public_library_of_charlotte_and_mecklenburg_county_-_plaza_midwood_branch cvs U ! cvs U cvs U ! cvs subway,Charlotte #2,"error:['&', '&', 'U', '!', 'lm(', 'Public', 'and', 'of', 'of', ')lm', ')lm', 'lm(', 'Common', 'Market', ')lm', '&', 'U', '!', 'lm(', 'Public', 'St', '-', 'of', 'Charlotte', ')lm', 'lm(', 'Public', 'and', 'of', 'of', ')lm', ')lm', '&', 'U', '!', 'lm(', 'Subway', ')lm', 'lm(', 'lm(', 'CVS', ')lm', 'lm(', 'lm(', 'lm(', ')lm', ')lm', ')lm', ')lm', ')lm', ')lm', ')lm', ')lm', ')lm', 'Market', 'Market', ')lm', 'Market', 'Market', ')lm', 'Market', ')lm', 'Market', ')lm', ')lm', 'U', '!', 'lm(', 'U', ')lm', 'lm(', 'of', ')lm', ')lm', 'of', 'lm(', 'Library', ')lm', 'of', 'Library', ')lm', 'of', 'of', ')lm', 'Library', 'of', 'of', ')lm', 'Library', 'of', 'of', ')lm', 'and', 'of', 'of', ')lm', 'and', 'of', 'of', ')lm', 'and', 'of', ')lm', 'and', 'of', ')lm', 'and', ')lm', 'of', ')lm', 'and', 'of', ')lm', ')lm', 'of', 'of', ')lm', 'and', ')lm', 'of', ')lm', ')lm', 'of', 'and', ')lm', 'of', 'and', ')lm', 'of', ')lm', ')lm', 'Public', ')lm', ')lm', 'of', 'Public', ')lm']",False
6861,first go to Subway once without visiting Common Market then go to Common Market once without visiting Fuel Pizza then go to Fuel Pizza once without visiting The Plaza Post Office finally go to The Plaza Post Office,& & U ! common_market subway & U ! fuel_pizza common_market & U ! the_plaza_post_office fuel_pizza F the_plaza_post_office & U ! subway U subway U ! subway common_market & U ! common_market U common_market U ! common_market fuel_pizza U ! fuel_pizza U fuel_pizza U ! fuel_pizza the_plaza_post_office,Charlotte #2,"error:['&', '&', 'U', '!', 'lm(', 'Common', 'Pizza', ')lm', 'lm(', 'Subway', 'Subway', ')lm', '&', 'U', '!', 'lm(', 'The', 'Plaza', ')lm', 'lm(', 'Pizza', 'Pizza', ')lm', 'F', 'lm(', 'The', 'Pizza', ')lm', '&', 'U', '!', 'lm(', 'Subway', 'Subway', ')lm', 'U', 'lm(', 'lm(', 'Subway', 'Subway', 'U', 'U', '!', 'lm(', 'Subway', 'Subway', ')lm', 'lm(', 'lm(', 'Pizza', ')lm', 'U', 'U', 'lm(', 'lm(', 'Common', 'Pizza', ')lm', 'U', 'Common', 'Pizza', ')lm', 'U', 'Pizza', 'lm(', 'Common', 'Pizza', ')lm', 'Pizza', 'Pizza', 'Pizza', ')lm', 'Pizza', 'Pizza', ')lm', 'Pizza', ')lm', 'Pizza', 'The', 'Pizza', ')lm', 'Pizza', 'The', 'Pizza', ')lm', 'Pizza', ')lm', 'Pizza', 'The', 'Pizza', ')lm', 'Pizza', 'The', 'lm(', 'The', ')lm', ')lm']",False
6862,first go to Subway once then go to Dish once while avoiding Dairy Queen then go to Dairy Queen once while avoiding Harris Teeter finally go to Harris Teeter,& & U ! dish subway & U ! dairy_queen dish & U ! harris_teeter dairy_queen F harris_teeter & U ! subway U subway U ! subway dish & U ! dish U dish U ! dish dairy_queen U ! dairy_queen U dairy_queen U ! dairy_queen harris_teeter,Charlotte #2,"error:['&', '&', 'U', '!', 'lm(', 'Dish', 'Dairy', ')lm', 'lm(', 'Subway', 'Subway', ')lm', '&', 'U', '!', 'lm(', 'Harris', 'Harris', ')lm', 'lm(', 'Dairy', 'Queen', ')lm', 'F', 'lm(', 'Dairy', 'Queen', ')lm', '&', 'U', '!', 'lm(', 'Subway', 'Subway', ')lm', 'U', 'lm(', 'Subway', 'Subway', ')lm', 'U', '!', 'lm(', 'Subway', 'Subway', ')lm', 'lm(', 'lm(', 'Dairy', 'Queen', ')lm', 'U', '!', 'lm(', 'Dish', 'Dish', ')lm', ')lm', 'lm(', 'Dairy', 'Dairy', 'Queen', 'U', 'U', '!', 'lm(', 'Dairy', 'Dairy', 'Queen', ')lm', 'lm(', 'Dairy', 'Dairy', 'Queen', ')lm']",False
