,nl_command,ltl,map_name,result,eq
7982,visit Walgreens Pharmacy while staying away from Purple Lot then visit Purple Lot while staying away from Infinite Smiles Family Dentistry then visit Infinite Smiles Family Dentistry while staying away from The UPS Store then visit The UPS Store while staying away from Texas Medical Center finally reach Texas Medical Center without returning to any previously visited locations,& & U ! purple_lot walgreens_pharmacy & U ! infinite_smiles_family_dentistry purple_lot & U ! the_ups_store infinite_smiles_family_dentistry & U ! texas_medical_center the_ups_store F texas_medical_center & U ! walgreens_pharmacy U walgreens_pharmacy U ! walgreens_pharmacy purple_lot & U ! purple_lot U purple_lot U ! purple_lot infinite_smiles_family_dentistry & U ! infinite_smiles_family_dentistry U infinite_smiles_family_dentistry U ! infinite_smiles_family_dentistry the_ups_store U ! the_ups_store U the_ups_store U ! the_ups_store texas_medical_center,Houston,"error:['&', '&', 'U', '!', 'lm(', 'Purple', 'Lot', ')lm', 'lm(', 'Walgreens', 'Pharmacy', ')lm', '&', 'U', '!', 'lm(', 'The', ')lm', ')lm', 'lm(', 'Purple', 'Lot', ')lm', '&', 'U', '!', 'lm(', 'The', 'Center', ')lm', 'lm(', 'The', ')lm', ')lm', 'F', 'lm(', 'The', 'Center', ')lm', '&', 'U', '!', 'lm(', 'Walgreens', 'Pharmacy', ')lm', 'U', 'lm(', 'Walgreens', 'Pharmacy', ')lm', 'U', '!', 'lm(', 'Walgreens', 'Walgreens', ')lm', 'lm(', 'lm(', 'Purple', ')lm', 'U', '!', 'lm(', 'lm(', 'lm(', ')lm', ')lm', 'lm(', 'Purple', ')lm', ')lm', 'U', '!', 'lm(', 'lm(', 'Purple', ')lm', ')lm', 'lm(', ')lm', ')lm', ')lm', 'lm(', '!', 'lm(', 'lm(', ')lm', ')lm', ')lm', ')lm', ')lm', 'lm(', ')lm', 'lm(', '!', 'lm(', 'lm(', ')lm', ')lm', ')lm', 'The', 'lm(', ')lm', 'Center', ')lm', 'Center', 'The', ')lm', ')lm', 'Center', 'The', ')lm', ')lm', 'Center', ')lm', 'Center', ')lm', ')lm', 'Center', ')lm', ')lm', 'Center', ')lm', ')lm', ')lm', 'Center', ')lm', ')lm', ')lm', ')lm', 'Center', ')lm', ')lm', ')lm', ')lm', 'Center', ')lm', ')lm', ')lm', ')lm', 'Center', ')lm', ')lm', ')lm', ')lm', 'Center', ')lm', ')lm', ')lm', ')lm', 'Center', ')lm', ')lm', ')lm', ')lm', 'Center', ')lm', ')lm', ')lm', ')lm', 'Center', ')lm', ')lm', ')lm', ')lm', 'Center', ')lm', ')lm', ')lm', ')lm', 'Center', ')lm', ')lm', ')lm', ')lm', 'Center', ')lm', ')lm', ')lm', ')lm', 'Center', ')lm', ')lm', ')lm', ')lm', 'Center', ')lm', ')lm', ')lm']",False
7983,visit North Kirby Lot while staying away from The UPS Store then visit The UPS Store while staying away from Olive Garden then visit Olive Garden while staying away from TGF Hair Salon then visit TGF Hair Salon while staying away from Glazed the Doughnut Cafe finally reach Glazed the Doughnut Cafe without returning to any previously visited locations,& & U ! the_ups_store north_kirby_lot & U ! olive_garden the_ups_store & U ! tgf_hair_salon olive_garden & U ! glazed_the_doughnut_cafe tgf_hair_salon F glazed_the_doughnut_cafe & U ! north_kirby_lot U north_kirby_lot U ! north_kirby_lot the_ups_store & U ! the_ups_store U the_ups_store U ! the_ups_store olive_garden & U ! olive_garden U olive_garden U ! olive_garden tgf_hair_salon U ! tgf_hair_salon U tgf_hair_salon U ! tgf_hair_salon glazed_the_doughnut_cafe,Houston,"error:['&', '&', 'U', '!', 'lm(', 'The', 'UPS', ')lm', 'lm(', 'North', 'Kirby', ')lm', '&', 'U', '!', 'lm(', 'The', 'Garden', ')lm', 'lm(', 'The', 'The', ')lm', '&', 'U', '!', 'lm(', 'lm(', 'Cafe', ')lm', 'lm(', ')lm', 'Garden', ')lm', ')lm', 'lm(', 'lm(', 'lm(', 'Cafe', ')lm', ')lm', 'U', 'lm(', 'lm(', 'North', 'Kirby', ')lm', ')lm', 'lm(', 'lm(', 'Kirby', 'Kirby', 'Kirby', 'Kirby', 'Kirby', 'lm(', 'lm(', ')lm', 'lm(', 'The', ')lm', ')lm', 'lm(', 'The', 'lm(', 'The', 'U', 'lm(', 'The', 'lm(', 'The', 'The', ')lm', ')lm', 'lm(', 'The', 'lm(', ')lm', 'lm(', 'lm(', 'The', 'lm(', ')lm', 'lm(', ')lm', 'lm(', ')lm', 'lm(', 'lm(', 'lm(', 'lm(', ')lm', 'lm(', ')lm', 'lm(', ')lm', 'lm(', ')lm', 'Cafe', 'the', 'lm(', ')lm', 'Cafe', 'the', 'lm(', ')lm', 'Cafe', 'the', ')lm', 'lm(', 'the', ')lm', 'Cafe', 'lm(', 'the', ')lm', 'Cafe', ')lm', 'lm(', 'the', ')lm', 'Cafe', ')lm', ')lm', 'the', ')lm', 'Cafe', ')lm', 'lm(', 'the', ')lm', 'Cafe', ')lm', ')lm', 'the', ')lm', 'Cafe', ')lm', ')lm', 'the', ')lm', ')lm', 'the', ')lm', 'Cafe', ')lm', ')lm', 'Cafe', ')lm', ')lm', ')lm', 'the', ')lm', ')lm', 'the', ')lm', 'Cafe', ')lm', ')lm', ')lm', 'the', ')lm', ')lm', ')lm', 'Cafe', ')lm', ')lm', 'Cafe', ')lm', ')lm', ')lm', 'the', ')lm', ')lm', ')lm', 'the', ')lm', 'Cafe', ')lm', ')lm', 'Cafe', ')lm', ')lm', ')lm', 'the', ')lm', ')lm', ')lm', 'Cafe', ')lm', ')lm', 'Cafe', ')lm', ')lm', ')lm', 'the', ')lm', ')lm']",False
7984,go to Fiesta but do not visit Domain at Kirby North Kirby Lot GameStop or Texas Medical Center and then go to Domain at Kirby but do not visit North Kirby Lot GameStop or Texas Medical Center or revisit Fiesta and then go to North Kirby Lot but do not visit GameStop or Texas Medical Center or revisit Fiesta or Domain at Kirby and then go to GameStop but do not visit Texas Medical Center or revisit Fiesta Domain at Kirby or North Kirby Lot and then go to Texas Medical Center but do not revisit Fiesta Domain at Kirby North Kirby Lot or GameStop,& & U ! domain_at_kirby fiesta & U ! north_kirby_lot domain_at_kirby & U ! gamestop north_kirby_lot & U ! texas_medical_center gamestop F texas_medical_center & U ! fiesta U fiesta U ! fiesta domain_at_kirby & U ! domain_at_kirby U domain_at_kirby U ! domain_at_kirby north_kirby_lot & U ! north_kirby_lot U north_kirby_lot U ! north_kirby_lot gamestop U ! gamestop U gamestop U ! gamestop texas_medical_center,Houston,"error:['&', '&', 'U', '!', 'lm(', 'Domain', 'Kirby', ')lm', 'lm(', ')lm', 'Fiesta', ')lm', '&', 'U', '!', 'lm(', 'lm(', 'Medical', ')lm', 'lm(', ')lm', ')lm', ')lm', ')lm', 'lm(', 'lm(', 'lm(', 'lm(', 'Center', ')lm', 'Center', 'U', '!', 'lm(', 'U', '!', 'lm(', 'U', 'lm(', 'lm(', 'U', 'lm(', 'lm(', 'lm(', 'lm(', 'lm(', 'lm(', 'lm(', 'lm(', 'lm(', 'lm(', 'lm(', ')lm', 'lm(', 'lm(', 'lm(', ')lm', 'lm(', 'lm(', 'lm(', ')lm', 'U', 'lm(', 'lm(', ')lm', 'U', '!', 'lm(', 'lm(', ')lm', 'U', 'lm(', 'lm(', ')lm', ')lm', 'lm(', '!', 'lm(', 'lm(', ')lm', ')lm', 'Center', ')lm', 'Center', ')lm', 'lm(', '!', 'lm(', 'lm(', ')lm', 'Center', ')lm', 'Center', ')lm', 'Center', ')lm', 'Center', ')lm', 'Center', ')lm', 'Center', ')lm', 'lm(', ')lm', 'Center', ')lm', 'Center', ')lm', 'Center', ')lm', 'Center', ')lm', 'Center', ')lm', 'Center', ')lm', 'lm(', ')lm', 'Center', ')lm', 'Center', ')lm', 'lm(', ')lm', 'Center', ')lm', 'Center', ')lm', 'lm(', ')lm', 'Center', ')lm', 'Center', ')lm', 'lm(', ')lm', 'Center', ')lm', 'lm(', ')lm', 'Center', ')lm', 'lm(', ')lm', 'Center', ')lm', 'lm(', ')lm', 'Center', ')lm', 'lm(', ')lm', 'Center', ')lm', 'lm(', ')lm', 'Center', ')lm', 'lm(', ')lm', 'Center', ')lm', 'lm(', ')lm', 'Center', ')lm', 'lm(', ')lm', 'Center', ')lm', 'lm(', ')lm', 'Center', ')lm', 'lm(', ')lm', 'Center', ')lm', 'lm(', ')lm', 'Center', ')lm', 'lm(', ')lm', 'Center', ')lm', 'lm(', ')lm', 'Center', ')lm', 'lm(', ')lm', 'Center', ')lm', 'lm(', ')lm', 'Center', ')lm', 'lm(']",False
7985,go to The UPS Store but do not visit Extended Stay America - Houston - Med. Ctr. - NRG Park - Kirby Glazed the Doughnut Cafe NRG Park or Viet's Express and then go to Extended Stay America - Houston - Med. Ctr. - NRG Park - Kirby but do not visit Glazed the Doughnut Cafe NRG Park or Viet's Express or revisit The UPS Store and then go to Glazed the Doughnut Cafe but do not visit NRG Park or Viet's Express or revisit The UPS Store or Extended Stay America - Houston - Med. Ctr. - NRG Park - Kirby and then go to NRG Park but do not visit Viet's Express or revisit The UPS Store Extended Stay America - Houston - Med. Ctr. - NRG Park - Kirby or Glazed the Doughnut Cafe and then go to Viet's Express but do not revisit The UPS Store Extended Stay America - Houston - Med. Ctr. - NRG Park - Kirby Glazed the Doughnut Cafe or NRG Park,& & U ! extended_stay_america_-_houston_-_med._ctr._-_nrg_park_-_kirby the_ups_store & U ! glazed_the_doughnut_cafe extended_stay_america_-_houston_-_med._ctr._-_nrg_park_-_kirby & U ! nrg_park glazed_the_doughnut_cafe & U ! viet's_express nrg_park F viet's_express & U ! the_ups_store U the_ups_store U ! the_ups_store extended_stay_america_-_houston_-_med._ctr._-_nrg_park_-_kirby & U ! extended_stay_america_-_houston_-_med._ctr._-_nrg_park_-_kirby U extended_stay_america_-_houston_-_med._ctr._-_nrg_park_-_kirby U ! extended_stay_america_-_houston_-_med._ctr._-_nrg_park_-_kirby glazed_the_doughnut_cafe & U ! glazed_the_doughnut_cafe U glazed_the_doughnut_cafe U ! glazed_the_doughnut_cafe nrg_park U ! nrg_park U nrg_park U ! nrg_park viet's_express,Houston,"error:['&', '&', 'U', '!', 'lm(', 'Extended', 'Stay', '-', 'lm(', ')lm', ')lm', 'lm(', 'The', 'UPS', ')lm', '&', 'U', '!', 'lm(', 'Glazed', ')lm', '-', ')lm', ')lm', ')lm', 'Extended', 'Stay', '-', 'U', 'U', '!', 'lm(', 'lm(', 'Park', 'the', 'Cafe', ')lm', 'lm(', 'lm(', ')lm', '-', '-', '-', '-', ')lm', 'Park', ')lm', '&', 'U', '!', 'lm(', 'The', ')lm', ')lm', 'U', 'lm(', 'lm(', 'UPS', 'UPS', 'U', 'lm(', 'The', 'UPS', ')lm', 'U', 'lm(', 'lm(', 'lm(', ')lm', 'U', '!', 'lm(', 'lm(', 'lm(', ')lm', 'lm(', '-', 'Park', '-', ')lm', 'U', '!', 'lm(', 'lm(', 'lm(', '-', '-', '-', '-', '-', 'Park', ')lm', 'U', '!', 'lm(', '!', 'lm(', '-', '-', '-', '-', '-', '-', '-', 'Park', 'Park', ')lm', 'Park', '!', 'lm(', 'lm(', 'Park', '-', '-', '-', '-', '-', 'Park', 'Park', 'Park', ')lm', 'Park', '!', 'Park', 'lm(', 'Park', 'Park', ')lm', 'Park', 'the', 'Park', 'Park', 'Park', 'Park', 'Park', 'Park', 'Park', 'Park', ')lm', 'Park', 'the', 'Park', ')lm', 'Park', ')lm', 'Park', 'the', 'Park', ')lm', 'Park', ')lm', 'Park', ')lm', 'Park', ')lm', 'Park', ')lm', 'Park', ')lm', 'lm(', 'lm(', 'Park', 'the', 'Park', ')lm', 'lm(', 'lm(', 'Park', ')lm', 'Park', ')lm', 'Park', ')lm', 'lm(', 'Park', ')lm', 'Park', ')lm', 'lm(', 'lm(', 'Park', ')lm', 'Park', ')lm', 'Park', ')lm', 'Park', ')lm', 'lm(', 'Park', ')lm', 'Park', ')lm', 'lm(', 'lm(', 'Park', ')lm', 'Park', ')lm']",False
7986,go to Holiday Inn Houston - NRG/Medical Center Area but only after going to TGF Hair Salon only once go to TGF Hair Salon only after going to Catfish Station only once go to Catfish Station only after going to Infinite Smiles Family Dentistry only once and go to Infinite Smiles Family Dentistry only after going to PetSmart only once,& & U ! infinite_smiles_family_dentistry petsmart & U ! catfish_station infinite_smiles_family_dentistry & U ! tgf_hair_salon catfish_station & U ! holiday_inn_houston_-_nrg/medical_center_area tgf_hair_salon F holiday_inn_houston_-_nrg/medical_center_area & U ! petsmart U petsmart U ! petsmart infinite_smiles_family_dentistry & U ! infinite_smiles_family_dentistry U infinite_smiles_family_dentistry U ! infinite_smiles_family_dentistry catfish_station & U ! catfish_station U catfish_station U ! catfish_station tgf_hair_salon U ! tgf_hair_salon U tgf_hair_salon U ! tgf_hair_salon holiday_inn_houston_-_nrg/medical_center_area,Houston,"error:['&', '&', 'U', '!', 'lm(', ')lm', 'Smiles', ')lm', 'lm(', ')lm', ')lm', ')lm', ')lm', 'U', '!', 'lm(', 'lm(', 'Smiles', ')lm', 'lm(', ')lm', ')lm', ')lm', ')lm', 'lm(', 'lm(', 'Center', ')lm', 'Center', ')lm', 'Center', ')lm', '&', 'Center', ')lm', 'lm(', ')lm', '-', ')lm', 'lm(', ')lm', 'lm(', ')lm', 'lm(', ')lm', 'lm(', ')lm', 'lm(', ')lm', 'lm(', ')lm', 'lm(', ')lm', ')lm', 'lm(', ')lm', ')lm', ')lm', 'lm(', ')lm', ')lm', ')lm', ')lm', 'lm(', ')lm', ')lm', ')lm', ')lm', 'lm(', ')lm', ')lm', ')lm', ')lm', ')lm', 'lm(', ')lm', ')lm', ')lm', ')lm', ')lm', ')lm', ')lm', ')lm', ')lm', ')lm', ')lm', ')lm', ')lm', ')lm', ')lm', ')lm', ')lm', ')lm', ')lm', ')lm', 'Infinite', 'lm(', ')lm', ')lm', ')lm', ')lm', ')lm', ')lm', ')lm', ')lm', ')lm', ')lm', ')lm', 'lm(', ')lm', ')lm', ')lm', ')lm', 'lm(', ')lm', 'only', ')lm', ')lm', ')lm', ')lm', ')lm', ')lm', 'Center', ')lm', ')lm', 'lm(', ')lm', ')lm', ')lm', 'Center', ')lm', ')lm', 'lm(', ')lm', ')lm', ')lm', 'Center', ')lm', ')lm', 'lm(', ')lm', ')lm', ')lm', ')lm', 'Center', ')lm', ')lm', 'lm(', ')lm', ')lm', ')lm', 'Center', ')lm', ')lm', 'lm(', ')lm', ')lm', ')lm', 'Center', ')lm', ')lm', 'lm(', ')lm', ')lm', ')lm', 'Center', ')lm', 'lm(', ')lm', ')lm', ')lm', ')lm', 'Center', ')lm', 'lm(', ')lm', ')lm', ')lm', ')lm', 'Center', ')lm', 'lm(', ')lm', ')lm', ')lm', ')lm', 'Center', ')lm', 'lm(', ')lm', ')lm', ')lm', ')lm', 'Center', ')lm', 'lm(', ')lm', ')lm', ')lm']",False
7987,go to Texas Medical Center but only after going to Domain at Kirby only once go to Domain at Kirby only after going to GameStop only once go to GameStop only after going to Akashi Asian Sushi Cuisine & Wine Bar only once and go to Akashi Asian Sushi Cuisine & Wine Bar only after going to Big Lots only once,& & U ! akashi_asian_sushi_cuisine_&_wine_bar big_lots & U ! gamestop akashi_asian_sushi_cuisine_&_wine_bar & U ! domain_at_kirby gamestop & U ! texas_medical_center domain_at_kirby F texas_medical_center & U ! big_lots U big_lots U ! big_lots akashi_asian_sushi_cuisine_&_wine_bar & U ! akashi_asian_sushi_cuisine_&_wine_bar U akashi_asian_sushi_cuisine_&_wine_bar U ! akashi_asian_sushi_cuisine_&_wine_bar gamestop & U ! gamestop U gamestop U ! gamestop domain_at_kirby U ! domain_at_kirby U domain_at_kirby U ! domain_at_kirby texas_medical_center,Houston,"error:['&', '&', 'U', '!', 'lm(', ')lm', ')lm', ')lm', 'lm(', ')lm', ')lm', ')lm', ')lm', 'U', '!', 'lm(', 'lm(', 'Asian', ')lm', 'lm(', ')lm', ')lm', ')lm', ')lm', 'lm(', 'lm(', '&', 'lm(', 'Center', ')lm', 'Center', ')lm', 'Center', ')lm', 'Center', ')lm', 'Center', ')lm', 'Center', ')lm', ')lm', 'lm(', ')lm', ')lm', 'lm(', ')lm', 'lm(', ')lm', 'lm(', ')lm', ')lm', 'lm(', ')lm', ')lm', ')lm', ')lm', 'lm(', ')lm', ')lm', ')lm', ')lm', 'lm(', ')lm', ')lm', ')lm', ')lm', ')lm', ')lm', ')lm', 'lm(', ')lm', ')lm', ')lm', ')lm', 'lm(', ')lm', ')lm', ')lm', ')lm', ')lm', ')lm', 'lm(', ')lm', ')lm', ')lm', ')lm', ')lm', ')lm', ')lm', ')lm', ')lm', ')lm', 'lm(', '&', ')lm', ')lm', '&', ')lm', ')lm', '&', ')lm', '&', ')lm', 'lm(', '&', ')lm', '&', ')lm', '&', ')lm', ')lm', '&', ')lm', ')lm', '&', ')lm', ')lm', 'lm(', ')lm', '&', ')lm', ')lm', 'lm(', ')lm', ')lm', ')lm', ')lm', 'lm(', ')lm', ')lm', ')lm', 'lm(', ')lm', 'Center', ')lm', ')lm', 'lm(', ')lm', 'Center', ')lm', ')lm', 'lm(', ')lm', ')lm', ')lm', ')lm', ')lm', 'Center', ')lm', ')lm', ')lm', 'lm(', ')lm', ')lm', ')lm', ')lm', 'Center', ')lm', ')lm', ')lm', ')lm', ')lm', ')lm', ')lm', ')lm', ')lm', ')lm', ')lm', ')lm', 'lm(', ')lm', 'Center', ')lm', ')lm', 'lm(', ')lm', ')lm', ')lm', ')lm', 'Center', ')lm', ')lm', ')lm', ')lm', ')lm', ')lm', ')lm', ')lm', ')lm', ')lm', ')lm', 'Center', ')lm', ')lm', 'lm(', ')lm', ')lm', ')lm', ')lm']",False
7988,first go to Viet's Express then go to Extended Stay America - Houston - Med. Ctr. - NRG Park - Kirby only after Viet's Express,& U ! extended_stay_america_-_houston_-_med._ctr._-_nrg_park_-_kirby viet's_express F extended_stay_america_-_houston_-_med._ctr._-_nrg_park_-_kirby,Houston,"error:['&', 'U', '!', 'lm(', 'Extended', '-', '-', '-', ')lm', ')lm', 'lm(', ""Viet's"", 'Express', ')lm', '&', 'U', '!', 'lm(', 'Park', 'Park', '-', 'Park', ')lm', ')lm', 'lm(', ')lm', '-', '-', '-', 'lm(', '-', ')lm', '-', 'lm(', 'lm(', ')lm', ')lm', ')lm', 'U', 'lm(', 'lm(', ""Viet's"", ""Viet's"", ""Viet's"", ""Viet's"", ')lm', 'lm(', 'lm(', '-', ')lm', '-', ')lm', 'lm(', '-', ')lm', '-', ')lm', '-', ')lm', '-', ')lm', '-', '-', '-', ')lm', '-', ')lm', '-', ')lm', '-', '-', ')lm', '-', '-', ')lm', '-', ')lm', '-', '-', ')lm', '-', ')lm', '-', ')lm', '-', '-', ')lm', '-', ')lm', '-', ')lm', '-', ')lm', '-', ')lm', '-', ')lm', '-', ')lm', '-', ')lm', '-', ')lm', ')lm', '-', ')lm', '-', ')lm', ')lm', '-', ')lm', ')lm', '-', ')lm', ')lm', ')lm', '-', ')lm', ')lm', ')lm', '-', ')lm', ')lm', ')lm', ')lm', ')lm', '-', ')lm', ')lm', ')lm', ')lm', ')lm', ')lm', '-', ')lm', ')lm', ')lm', ')lm', ')lm', ')lm', ')lm', '-', ')lm', ')lm', ')lm', ')lm', ')lm', ')lm', ')lm', ')lm', '-', ')lm', ')lm', ')lm', ')lm', ')lm', ')lm', ')lm', ')lm', '-', ')lm', ')lm', ')lm', ')lm', ')lm', ')lm', ')lm', ')lm', ')lm', '-']",False
7989,first go to SpringHill Suites Houston Medical Center/NRG Park then go to Five Guys only after SpringHill Suites Houston Medical Center/NRG Park,& U ! five_guys springhill_suites_houston_medical_center/nrg_park F five_guys,Houston,"error:['&', 'U', '!', 'lm(', 'Five', 'Five', ')lm', 'lm(', ')lm', 'SpringHill', 'Suites', ')lm', '&', 'lm(', '!', 'lm(', 'lm(', ')lm', ')lm', 'lm(', 'Park', 'Park', ')lm', 'F', 'lm(', 'lm(', 'lm(', ')lm', ')lm', 'U', '!', 'lm(', 'SpringHill', 'SpringHill', 'Suites', 'Houston', 'Houston', 'Medical', 'lm(', 'Park', 'lm(', 'Park', 'lm(', 'Park', 'lm(', 'Park', 'U', 'lm(', 'U', 'Park', 'lm(', 'Park', 'lm(', 'Park', 'lm(', 'Park', 'lm(', ')lm', 'Park', 'lm(', ')lm', ')lm', ')lm', ')lm', ')lm', ')lm', ')lm', ')lm', ')lm']",False
7990,go to Glazed the Doughnut Cafe but do not go to Glazed the Doughnut Cafe until you go to Holiday Inn Houston - NRG/Medical Center Area first,& U ! glazed_the_doughnut_cafe holiday_inn_houston_-_nrg/medical_center_area F glazed_the_doughnut_cafe,Houston,& U ! glazed_the_doughnut_cafe )lm five_guys lm( Holiday Inn - five_guys )lm F five_guys lm( glazed_the_doughnut_cafe,False
7991,go to Domain at Kirby but do not go to Domain at Kirby until you go to Holiday Inn Houston - NRG/Medical Center Area first,& U ! domain_at_kirby holiday_inn_houston_-_nrg/medical_center_area F domain_at_kirby,Houston,"error:['&', 'U', '!', 'lm(', 'Domain', 'Domain', ')lm', 'lm(', ')lm', 'lm(', '-', ')lm', ')lm', ')lm', 'F', 'lm(', 'lm(', ')lm', ')lm']",False
7992,head to Infinite Smiles Family Dentistry first and then to Texas Medical Center but do not visit Texas Medical Center if you have not been to Infinite Smiles Family Dentistry,& U ! texas_medical_center infinite_smiles_family_dentistry F texas_medical_center,Houston,"error:['&', '&', 'U', '!', 'lm(', 'Texas', 'Medical', ')lm', ')lm', 'lm(', 'Infinite', 'Smiles', 'Smiles', ')lm', 'F', 'lm(', 'Texas', 'Medical', ')lm', ')lm', 'U', '!', 'lm(', 'Infinite', 'Smiles', ')lm', 'U', 'lm(', 'lm(', 'U', ')lm', 'U', 'U', 'lm(', 'Infinite', 'Smiles', 'Family', 'Family', 'lm(', 'Texas', 'Texas', 'lm(', ')lm', 'U', '!', 'lm(', 'lm(', 'Center', ')lm', 'Center', 'Center', 'Center', ')lm']",False
7993,head to Fiesta first and then to PetSmart but do not visit PetSmart if you have not been to Fiesta,& U ! petsmart fiesta F petsmart,Houston,"error:['G', '!', 'lm(', 'lm(', 'PetSmart', ')lm', 'lm(', 'Fiesta', 'Fiesta', 'Fiesta', 'Fiesta', 'lm(', 'lm(', 'PetSmart', ')lm', ')lm', ')lm', '!', 'lm(', 'PetSmart', 'PetSmart', ')lm', ')lm', ')lm', 'lm(', 'PetSmart', 'PetSmart', 'PetSmart', ')lm', ')lm', ')lm', ')lm', ')lm', 'lm(', 'PetSmart', 'PetSmart', ')lm', ')lm', ')lm', ')lm', ')lm', ')lm', '!', 'lm(', 'PetSmart', 'PetSmart', ')lm', ')lm', ')lm', ')lm', ')lm', ')lm', ')lm', ')lm', 'lm(', '!', 'lm(', ')lm', ')lm', ')lm', ')lm', ')lm', ')lm', ')lm', ')lm']",False
7994,visit Viet's Express and TGF Hair Salon but do not visit TGF Hair Salon without visiting Viet's Express,& U ! tgf_hair_salon viet's_express F tgf_hair_salon,Houston,"error:['&', '&', 'U', '!', 'lm(', 'Salon', 'Salon', ')lm', 'lm(', ')lm', 'lm(', ""Viet's"", 'Express', ')lm', 'F', 'lm(', 'lm(', 'Hair', ')lm', 'and', ')lm', ')lm', 'U', 'lm(', 'lm(', ""Viet's"", 'Express', ')lm', 'lm(', 'lm(', 'lm(', ')lm', ')lm', 'Express', '!', 'lm(', 'lm(', ')lm', ')lm', 'lm(', 'lm(', ')lm', ')lm', ')lm', 'Hair', ')lm', 'lm(', ')lm', 'lm(', ')lm', 'lm(', ')lm', 'lm(', ')lm', ')lm', ')lm', ')lm', ')lm', 'lm(', ')lm', 'lm(', ')lm', 'lm(', ')lm', 'lm(', ')lm', 'lm(', ')lm', ')lm', ')lm', ')lm', 'lm(', ')lm', 'lm(', ')lm', 'lm(', ')lm', 'lm(', ')lm', 'lm(', ')lm', ')lm', ')lm', 'lm(', ')lm', 'lm(', ')lm', ')lm', ')lm', ')lm', 'lm(', ')lm', 'lm(', ')lm', ')lm', ')lm', 'lm(', ')lm', 'lm(', ')lm', ')lm', ')lm', ')lm', 'lm(', ')lm', ')lm', ')lm', 'lm(', ')lm', ')lm', ')lm', 'lm(', ')lm', ')lm', ')lm', 'lm(', ')lm', ')lm', ')lm', 'lm(', ')lm', ')lm', ')lm', 'lm(', ')lm', ')lm', ')lm', 'lm(', ')lm', ')lm', ')lm', 'lm(', ')lm', ')lm', ')lm', ')lm', 'lm(', ')lm', ')lm', ')lm', 'lm(', ')lm', ')lm', ')lm', 'lm(', ')lm', ')lm', ')lm', ')lm', 'lm(', ')lm', ')lm', ')lm', ')lm', 'lm(', ')lm', ')lm', ')lm', 'lm(', ')lm', ')lm', ')lm', ')lm', 'lm(', ')lm', ')lm', ')lm', ')lm', 'lm(', ')lm', ')lm']",False
7995,visit Chipotle and GameStop but do not visit GameStop without visiting Chipotle,& U ! gamestop chipotle F gamestop,Houston,"error:['&', '&', 'U', '!', 'lm(', 'GameStop', ')lm', ')lm', 'lm(', 'Chipotle', 'and', ')lm', ')lm', ')lm', 'lm(', 'lm(', 'Chipotle', ')lm', ')lm', 'Chipotle', '!', 'lm(', 'lm(', 'Chipotle', 'Chipotle', ')lm', 'lm(', 'lm(', 'lm(', 'lm(', ')lm', 'Chipotle', ')lm', 'lm(', 'lm(', 'lm(', 'lm(', ')lm', 'lm(', 'lm(', 'lm(', 'lm(', ')lm', ')lm', ')lm', ')lm', 'lm(', 'lm(', 'lm(', 'lm(', 'lm(', ')lm', 'lm(', 'lm(', 'lm(', ')lm', ')lm', ')lm', 'lm(', ')lm', 'lm(', ')lm', ')lm', ')lm', 'lm(', 'lm(', 'lm(', ')lm', ')lm', ')lm', 'lm(', 'lm(', ')lm', ')lm', ')lm', 'lm(', ')lm', 'lm(', ')lm', ')lm', ')lm', ')lm', 'lm(', ')lm', ')lm', ')lm', ')lm', ')lm', 'lm(', ')lm', ')lm', ')lm', ')lm', ')lm', ')lm', ')lm', ')lm', ')lm', ')lm', ')lm', ')lm', ')lm', ')lm', ')lm', ')lm', ')lm', ')lm', ')lm', ')lm', ')lm', ')lm', ')lm', ')lm', ')lm', ')lm', ')lm', ')lm', ')lm', ')lm', ')lm', ')lm', ')lm', ')lm', ')lm', ')lm', ')lm', ')lm', ')lm', ')lm', ')lm', ')lm', ')lm', ')lm', ')lm']",False
7996,you must visit Taco Cabana first before going to Pizza Hut,& U ! pizza_hut taco_cabana F pizza_hut,Houston,"error:['G', '!', 'lm(', 'going', 'Hut', ')lm', 'lm(', ')lm', 'lm(', 'Taco', 'Pizza', ')lm', 'F', 'lm(', 'lm(', 'Taco', ')lm', ')lm', ')lm', ')lm', 'lm(', 'Taco', 'Taco', ')lm', ')lm', 'Pizza', ')lm', 'Pizza', ')lm', 'Pizza', ')lm']",False
7997,you must visit PetSmart first before going to GameStop,& U ! gamestop petsmart F gamestop,Houston,"error:['M', 'lm(', 'lm(', 'GameStop', ')lm']",False
7998,go to TGF Hair Salon and only then go to Akashi Asian Sushi Cuisine & Wine Bar,& U ! akashi_asian_sushi_cuisine_&_wine_bar tgf_hair_salon F akashi_asian_sushi_cuisine_&_wine_bar,Houston,"error:['&', 'U', '!', 'lm(', 'Akashi', 'Sushi', ')lm', 'lm(', ')lm', 'TGF', ')lm', ')lm', ')lm', 'lm(', 'lm(', 'lm(', ')lm', ')lm', ')lm', ')lm', 'lm(', 'lm(', 'lm(', 'TGF', ')lm', ')lm', 'lm(', 'lm(', 'lm(', 'TGF', ')lm', ')lm', 'lm(', '!', 'lm(', ')lm', 'lm(', ')lm', 'Akashi', ')lm', ')lm', ')lm', ')lm', 'lm(', ')lm', 'lm(', '!', 'lm(', ')lm', 'lm(', ')lm', ')lm', ')lm', ')lm', ')lm', ')lm', ')lm', ')lm', 'lm(', '!', 'lm(', 'lm(', ')lm', ')lm', ')lm', ')lm', ')lm', ')lm', ')lm', ')lm', ')lm', ')lm', ')lm', ')lm', 'lm(', ')lm', 'lm(', ')lm', ')lm', ')lm', ')lm', ')lm', ')lm', ')lm', ')lm', ')lm', ')lm', ')lm', ')lm', ')lm', ')lm', 'lm(', ')lm', ')lm', ')lm', ')lm', ')lm', ')lm', ')lm', ')lm', ')lm', ')lm', ')lm', ')lm', ')lm', ')lm', ')lm', ')lm', ')lm', ')lm', ')lm', ')lm', ')lm', ')lm', ')lm', ')lm', ')lm', ')lm', ')lm', ')lm', ')lm', ')lm', ')lm', ')lm']",False
7999,go to Glazed the Doughnut Cafe and only then go to Olive Garden,& U ! olive_garden glazed_the_doughnut_cafe F olive_garden,Houston,& U ! olive_garden )lm five_guys lm( Glazed Cafe )lm F five_guys lm( olive_garden )lm U five_guys lm( glazed_the_doughnut_cafe,False
8000,go to Big Lots an infinite number of times,G F big_lots,Houston,"error:['G', 'F', 'lm(', 'G', 'G', ')lm', 'G', 'G', 'an', 'lm(', 'lm(', 'Lots', 'an', ')lm']",False
8001,go to Viet's Express an infinite number of times,G F viet's_express,Houston,"error:['G', 'F', 'lm(', 'G', 'G', ')lm', 'G', 'G', 'an', 'lm(', 'lm(', 'Express', 'an', ')lm']",False
8002,keep visiting NRG Park,G F nrg_park,Houston,"error:['G', 'F', 'lm(', 'Park', ')lm', 'G', 'G', 'F', 'lm(', 'lm(', ')lm', ')lm', 'G', 'G', 'G', 'G', 'lm(', 'Park', 'Park']",False
8003,keep visiting Antone's Import Co.,G F antone's_import_co.,Houston,G F antone's_import_co.,True
8004,visit Big Lots infinitely often,G F big_lots,Houston,G F fiesta,False
8005,visit Royal Nails & Spa infinitely often,G F royal_nails_&_spa,Houston,"error:['G', 'F', 'lm(', 'lm(', 'Royal', ')lm', 'G', 'G', 'lm(', 'lm(', 'Nails', ')lm', 'G', 'G', 'G', 'G', 'lm(', '&', '&', 'Spa', ')lm']",False
8006,make sure you frequent Capital One Bank infinitely,G F capital_one_bank,Houston,G i capital_one_bank,False
8007,make sure you frequent Viet's Express infinitely,G F viet's_express,Houston,G i viet's_express,False
8008,keep going to Big Lots,G F big_lots,Houston,"error:['G', 'F', 'lm(', 'Big', 'Lots', ')lm', 'G', 'G', 'lm(', 'lm(', 'G', ')lm', 'G', 'G', 'G', 'lm(', 'lm(', 'G', 'G', 'G', 'G', '!', 'lm(', 'Big', 'Big']",False
8009,keep going to SpringHill Suites Houston Medical Center/NRG Park,G F springhill_suites_houston_medical_center/nrg_park,Houston,"error:['G', 'F', 'lm(', 'lm(', ')lm', ')lm', 'G', 'G', 'F', 'lm(', 'lm(', ')lm', ')lm', ')lm', 'G', 'G', 'SpringHill', 'Suites', 'Suites']",False
8010,visit Catfish Station again and again,G F catfish_station,Houston,"error:['M', 'lm(', 'Catfish', 'Station', ')lm', '|', '!', 'lm(', 'lm(', ')lm', ')lm', 'G', 'lm(', 'lm(', 'lm(', ')lm', 'G', 'G', 'lm(', 'lm(', 'Catfish', ')lm', 'G', 'G', 'lm(', 'lm(', 'Catfish', ')lm', 'G', '!', 'lm(', 'lm(', ')lm', ')lm']",False
