,nl_command,ltl,map_name,result,eq
2602,visit The Oesterreicher-McCormick Cabin while staying away from Waffle House then visit Waffle House while staying away from Mayport East Coast Railway Depot then visit Mayport East Coast Railway Depot while staying away from Publix then visit Publix while staying away from Texaco finally reach Texaco without returning to any previously visited locations,& & U ! waffle_house the_oesterreicher-mccormick_cabin & U ! mayport_east_coast_railway_depot waffle_house & U ! publix mayport_east_coast_railway_depot & U ! texaco publix F texaco & U ! the_oesterreicher-mccormick_cabin U the_oesterreicher-mccormick_cabin U ! the_oesterreicher-mccormick_cabin waffle_house & U ! waffle_house U waffle_house U ! waffle_house mayport_east_coast_railway_depot & U ! mayport_east_coast_railway_depot U mayport_east_coast_railway_depot U ! mayport_east_coast_railway_depot publix U ! publix U publix U ! publix texaco,Jacksonville #2,"error:['&', '&', 'U', '!', 'lm(', 'House', 'House', ')lm', 'lm(', 'The', 'Oesterreicher-McCormick', ')lm', '&', 'U', '!', 'lm(', 'Coast', ')lm', ')lm', 'lm(', 'House', ')lm', '&', 'U', '!', 'lm(', 'U', '!', 'lm(', 'lm(', ')lm', 'lm(', 'lm(', ')lm', ')lm', ')lm', ')lm', 'lm(', 'lm(', 'lm(', 'lm(', ')lm', 'The', ')lm', 'U', 'The', 'The', 'U', 'U', 'U', 'The', 'The', ')lm', ')lm', 'U', 'lm(', 'U', ')lm', ')lm', ')lm', ')lm', ')lm', ')lm', ')lm', ')lm', ')lm', ')lm', ')lm', ')lm', ')lm', ')lm', ')lm', ')lm', ')lm', ')lm', ')lm', ')lm', ')lm', ')lm', ')lm', ')lm', ')lm', ')lm', ')lm', ')lm', ')lm', ')lm', ')lm', ')lm', ')lm', ')lm', ')lm', ')lm', ')lm', ')lm']",False
2603,visit East Coast Railway Foreman’s House #93 while staying away from 1903 Pablo Beach Post Office then visit 1903 Pablo Beach Post Office while staying away from Burrito Gallery then visit Burrito Gallery while staying away from Beaches Museum then visit Beaches Museum while staying away from St Paul's Catholic Church finally reach St Paul's Catholic Church without returning to any previously visited locations,& & U ! 1903_pablo_beach_post_office east_coast_railway_foreman’s_house_#93 & U ! burrito_gallery 1903_pablo_beach_post_office & U ! beaches_museum burrito_gallery & U ! st_paul's_catholic_church beaches_museum F st_paul's_catholic_church & U ! east_coast_railway_foreman’s_house_#93 U east_coast_railway_foreman’s_house_#93 U ! east_coast_railway_foreman’s_house_#93 1903_pablo_beach_post_office & U ! 1903_pablo_beach_post_office U 1903_pablo_beach_post_office U ! 1903_pablo_beach_post_office burrito_gallery & U ! burrito_gallery U burrito_gallery U ! burrito_gallery beaches_museum U ! beaches_museum U beaches_museum U ! beaches_museum st_paul's_catholic_church,Jacksonville #2,"error:['&', '&', 'U', '!', 'lm(', 'House', ')lm', ')lm', 'lm(', 'East', 'Coast', ')lm', ')lm', ')lm', ')lm', 'lm(', '!', 'lm(', 'lm(', ')lm', 'lm(', 'lm(', ')lm', ')lm', ')lm', ')lm', '!', 'U', '!', 'Church', ')lm', 'lm(', ')lm', ')lm', ')lm', ')lm', ')lm', 'Church', ')lm', 'lm(', 'U', 'U', 'U', 'U', 'U', 'U', 'Coast', 'Coast', 'U', 'U', 'U', 'U', 'U', 'U', 'U', 'lm(', 'U', 'Foreman’s', 'U', 'lm(', 'Foreman’s', ')lm', 'Foreman’s', ')lm', 'House', 'U', ')lm', 'House', ')lm', ')lm', 'House', 'U', ')lm', ')lm', ')lm', ')lm', ')lm', ')lm', ')lm', ')lm', ')lm', ')lm', ')lm', ')lm', 'lm(', 'lm(', 'lm(', 'lm(', 'lm(', ')lm', ')lm', ')lm', ')lm']",False
2604,go to Players by the Sea but only after going to The 1911 Train Engine only once go to The 1911 Train Engine only after going to Pet Supermarket only once go to Pet Supermarket only after going to East Coast Railway Foreman’s House #93 only once and go to East Coast Railway Foreman’s House #93 only after going to Texaco only once,& & U ! east_coast_railway_foreman’s_house_#93 texaco & U ! pet_supermarket east_coast_railway_foreman’s_house_#93 & U ! the_1911_train_engine pet_supermarket & U ! players_by_the_sea the_1911_train_engine F players_by_the_sea & U ! texaco U texaco U ! texaco east_coast_railway_foreman’s_house_#93 & U ! east_coast_railway_foreman’s_house_#93 U east_coast_railway_foreman’s_house_#93 U ! east_coast_railway_foreman’s_house_#93 pet_supermarket & U ! pet_supermarket U pet_supermarket U ! pet_supermarket the_1911_train_engine U ! the_1911_train_engine U the_1911_train_engine U ! the_1911_train_engine players_by_the_sea,Jacksonville #2,"error:['&', '&', 'U', '!', 'lm(', 'The', ')lm', ')lm', 'lm(', 'Texaco', 'Texaco', ')lm', '&', 'U', '!', 'lm(', 'The', '1911', ')lm', 'lm(', 'lm(', ')lm', ')lm', ')lm', ')lm', ')lm', '&', 'U', '!', 'lm(', 'lm(', 'lm(', 'the', 'Sea', ')lm', 'lm(', 'The', '1911', ')lm', 'lm(', 'lm(', 'lm(', 'lm(', ')lm', 'U', 'U', 'lm(', 'lm(', 'U', 'U', 'U', 'lm(', ')lm', 'U', ')lm', 'U', 'lm(', 'lm(', ')lm', 'U', ')lm', ')lm', ')lm', ')lm', ')lm', ')lm', ')lm', ')lm', ')lm', ')lm', ')lm', ')lm', ')lm', ')lm', ')lm', ')lm', ')lm', ')lm', ')lm', 'lm(', 'lm(', 'lm(', ')lm', ')lm', ')lm', ')lm', ')lm', ')lm', ')lm', ')lm', 'lm(', 'lm(', 'lm(', 'lm(', '1911', 'U', 'U', 'lm(', 'lm(', '1911', 'U', 'U', 'lm(', 'lm(', 'lm(', 'The', 'lm(', 'U', 'lm(', 'lm(', 'The', 'lm(']",False
2605,go to Mayport East Coast Railway Depot but only after going to East Coast Railway Foreman’s House #93 only once go to East Coast Railway Foreman’s House #93 only after going to The Oesterreicher-McCormick Cabin only once go to The Oesterreicher-McCormick Cabin only after going to Players by the Sea only once and go to Players by the Sea only after going to Publix only once,& & U ! players_by_the_sea publix & U ! the_oesterreicher-mccormick_cabin players_by_the_sea & U ! east_coast_railway_foreman’s_house_#93 the_oesterreicher-mccormick_cabin & U ! mayport_east_coast_railway_depot east_coast_railway_foreman’s_house_#93 F mayport_east_coast_railway_depot & U ! publix U publix U ! publix players_by_the_sea & U ! players_by_the_sea U players_by_the_sea U ! players_by_the_sea the_oesterreicher-mccormick_cabin & U ! the_oesterreicher-mccormick_cabin U the_oesterreicher-mccormick_cabin U ! the_oesterreicher-mccormick_cabin east_coast_railway_foreman’s_house_#93 U ! east_coast_railway_foreman’s_house_#93 U east_coast_railway_foreman’s_house_#93 U ! east_coast_railway_foreman’s_house_#93 mayport_east_coast_railway_depot,Jacksonville #2,"error:['&', '&', 'U', '!', 'lm(', 'The', 'Depot', ')lm', 'lm(', 'going', 'Publix', ')lm', '&', 'U', '!', 'lm(', 'The', ')lm', ')lm', 'lm(', 'The', ')lm', ')lm', '&', 'U', '!', 'lm(', 'The', ')lm', ')lm', 'lm(', 'The', ')lm', ')lm', 'F', 'lm(', ')lm', 'lm(', 'lm(', ')lm', ')lm', 'U', 'U', 'East', 'East', 'U', 'U', 'U', 'U', 'U', 'lm(', 'U', 'U', 'lm(', 'U', 'U', 'lm(', 'U', ')lm', 'U', 'lm(', 'lm(', ')lm', 'U', ')lm', 'lm(', ')lm', ')lm', ')lm', 'Depot', 'U', 'lm(', 'lm(', ')lm', ')lm', ')lm', ')lm', 'Depot', ')lm', ')lm', ')lm', ')lm', 'lm(', 'lm(', 'lm(', ')lm', ')lm', ')lm', ')lm', 'lm(', 'lm(', 'lm(', ')lm', ')lm', ')lm', ')lm', ')lm', ')lm', 'East', 'lm(', 'U', ')lm', 'U', 'lm(', 'lm(', 'The', ')lm', 'U', 'lm(', 'lm(', 'lm(', 'lm(', 'The', 'lm(', ')lm', 'U', 'lm(', 'The', 'lm(']",False
2606,go to St Vincent de Paul Thrift Store once without visiting Mayport East Coast Railway Depot then go to Mayport East Coast Railway Depot once without visiting Beaches Museum Chapel then go to Beaches Museum Chapel once without visiting Texaco then go to Texaco once without visiting Players by the Sea finally go to Players by the Sea,& & U ! mayport_east_coast_railway_depot st_vincent_de_paul_thrift_store & U ! beaches_museum_chapel mayport_east_coast_railway_depot & U ! texaco beaches_museum_chapel & U ! players_by_the_sea texaco F players_by_the_sea & U ! st_vincent_de_paul_thrift_store U st_vincent_de_paul_thrift_store U ! st_vincent_de_paul_thrift_store mayport_east_coast_railway_depot & U ! mayport_east_coast_railway_depot U mayport_east_coast_railway_depot U ! mayport_east_coast_railway_depot beaches_museum_chapel & U ! beaches_museum_chapel U beaches_museum_chapel U ! beaches_museum_chapel texaco U ! texaco U texaco U ! texaco players_by_the_sea,Jacksonville #2,"error:['&', '&', 'U', '!', 'lm(', 'Thrift', ')lm', ')lm', 'lm(', 'St', ')lm', ')lm', 'St', ')lm', '&', 'U', '!', 'lm(', 'Mayport', ')lm', 'lm(', 'lm(', ')lm', ')lm', 'lm(', ')lm', ')lm', ')lm', '&', 'U', '!', 'lm(', 'lm(', 'the', ')lm', ')lm', 'lm(', 'lm(', 'lm(', 'lm(', ')lm', 'U', 'U', 'U', 'Vincent', 'Vincent', 'U', 'U', 'lm(', 'U', 'U', 'lm(', 'U', 'U', 'lm(', 'de', ')lm', 'lm(', 'Paul', ')lm', 'lm(', 'Thrift', ')lm', 'lm(', 'Thrift', ')lm', 'lm(', 'Thrift', ')lm', ')lm', ')lm', ')lm', ')lm', ')lm', ')lm', ')lm', ')lm', ')lm', ')lm', ')lm', ')lm', ')lm', ')lm', ')lm', ')lm', ')lm', ')lm', ')lm', 'lm(', 'lm(', 'Mayport', 'lm(', 'Mayport', 'lm(', 'Mayport', 'lm(', ')lm', ')lm', ')lm', ')lm', ')lm', 'lm(', 'lm(', 'lm(']",False
2607,go to Pet Supermarket once without visiting Beaches Museum Chapel then go to Beaches Museum Chapel once without visiting The Oesterreicher-McCormick Cabin then go to The Oesterreicher-McCormick Cabin once without visiting Publix then go to Publix once without visiting Beaches Museum finally go to Beaches Museum,& & U ! beaches_museum_chapel pet_supermarket & U ! the_oesterreicher-mccormick_cabin beaches_museum_chapel & U ! publix the_oesterreicher-mccormick_cabin & U ! beaches_museum publix F beaches_museum & U ! pet_supermarket U pet_supermarket U ! pet_supermarket beaches_museum_chapel & U ! beaches_museum_chapel U beaches_museum_chapel U ! beaches_museum_chapel the_oesterreicher-mccormick_cabin & U ! the_oesterreicher-mccormick_cabin U the_oesterreicher-mccormick_cabin U ! the_oesterreicher-mccormick_cabin publix U ! publix U publix U ! publix beaches_museum,Jacksonville #2,"error:['&', '&', 'U', '!', 'lm(', 'Beaches', 'Beaches', ')lm', 'lm(', 'lm(', 'Pet', 'Supermarket', ')lm', '&', 'U', '!', 'lm(', 'The', ')lm', ')lm', 'lm(', 'The', ')lm', ')lm', '&', 'U', '!', 'lm(', 'lm(', ')lm', 'lm(', 'lm(', 'lm(', 'The', 'The', ')lm', ')lm', 'lm(', 'lm(', ')lm', ')lm', ')lm', ')lm', 'U', 'U', 'U', 'Supermarket', 'Supermarket', 'U', 'U', 'lm(', 'Supermarket', ')lm', 'U', 'lm(', ')lm', 'U', ')lm', ')lm', 'U', ')lm', ')lm', ')lm', ')lm', ')lm', ')lm', ')lm', 'Beaches', 'U', ')lm', 'Beaches', ')lm', ')lm', 'The', ')lm', ')lm', 'The', 'lm(', ')lm', 'The', 'lm(', ')lm', 'The', 'lm(', 'The', 'lm(', 'The', 'lm(', 'The', 'lm(', 'The', 'lm(', 'The', 'lm(', ')lm', 'The', 'lm(', ')lm', ')lm', ')lm', ')lm', 'U', 'lm(', 'lm(', 'lm(']",False
2608,find East Coast Railway Foreman’s House #93 while avoiding St Paul's Catholic Church then after finding East Coast Railway Foreman’s House #93 go to St Paul's Catholic Church,& U ! st_paul's_catholic_church east_coast_railway_foreman’s_house_#93 F st_paul's_catholic_church,Jacksonville #2,"error:['&', 'U', '!', 'lm(', 'Foreman’s', 'Foreman’s', ')lm', 'lm(', 'U', 'lm(', 'lm(', ')lm', ')lm', ')lm', ')lm', 'U', 'U', '!', 'lm(', 'Church', ')lm', 'lm(', 'lm(', 'Church', ')lm', ')lm', 'lm(', 'Church', ')lm', 'lm(', 'Church', ')lm', 'F', 'lm(', 'Church', ')lm', ')lm', 'Church', 'Church', ')lm']",False
2609,find Publix while avoiding Burrito Gallery then after finding Publix go to Burrito Gallery,& U ! burrito_gallery publix F burrito_gallery,Jacksonville #2,"error:['F', '&', 'lm(', 'lm(', 'Publix', ')lm', 'lm(', 'lm(', 'lm(', ')lm', ')lm', 'Gallery', ')lm', ')lm', 'lm(', 'lm(', 'Gallery', ')lm', ')lm', 'Gallery', ')lm', ')lm', ')lm', ')lm', ')lm', ')lm', ')lm', ')lm', 'Burrito', ')lm', 'Burrito', ')lm', 'Burrito', ')lm', ')lm', 'Burrito', ')lm', 'Burrito', 'Burrito', ')lm']",False
2610,visit The 1911 Train Engine and Publix but do not visit Publix without visiting The 1911 Train Engine,& U ! publix the_1911_train_engine F publix,Jacksonville #2,& & U ! the_1911_train_engine the_oesterreicher-mccormick_cabin )lm F waffle_house lm( The Publix )lm U ! waffle_house lm( The 1911 )lm U waffle_house lm( The The 1911 )lm U ! waffle_house lm( The 1911 )lm waffle_house lm( the_1911_train_engine,False
2611,visit The 1911 Train Engine and Cypress Productions but do not visit Cypress Productions without visiting The 1911 Train Engine,& U ! cypress_productions the_1911_train_engine F cypress_productions,Jacksonville #2,& & U ! the_1911_train_engine the_oesterreicher-mccormick_cabin )lm waffle_house lm( The and )lm U ! waffle_house lm( The 1911 )lm U ! waffle_house lm( The 1911 )lm waffle_house lm( The waffle_house,False
2612,visit St Vincent de Paul Thrift Store but do not visit St Vincent de Paul Thrift Store before you reach Mayport East Coast Railway Depot,& U ! st_vincent_de_paul_thrift_store mayport_east_coast_railway_depot F st_vincent_de_paul_thrift_store,Jacksonville #2,& U ! st_vincent_de_paul_thrift_store st_vincent_de_paul_thrift_store )lm waffle_house lm( waffle_house lm( st_vincent_de_paul_thrift_store )lm )lm waffle_house lm( waffle_house lm(,False
2613,visit Publix but do not visit Publix before you reach Players by the Sea,& U ! publix players_by_the_sea F publix,Jacksonville #2,"error:['&', 'i', 'lm(', 'Publix', 'Publix', ')lm', ')lm', 'U', 'lm(', 'lm(', ')lm', 'the', ')lm']",False
2614,visit The 1911 Train Engine but before visiting The 1911 Train Engine you must visit East Coast Railway Foreman’s House #93,& U ! the_1911_train_engine east_coast_railway_foreman’s_house_#93 F the_1911_train_engine,Jacksonville #2,& U ! the_1911_train_engine the_1911_train_engine,False
2615,visit Cypress Productions but before visiting Cypress Productions you must visit Texaco,& U ! cypress_productions texaco F cypress_productions,Jacksonville #2,"error:['&', 'U', '!', 'lm(', 'Cypress', 'Cypress', ')lm', 'lm(', 'lm(', ')lm', ')lm', ')lm', 'lm(', ')lm', ')lm', ')lm', ')lm', 'Productions', ')lm']",False
2616,go to Beaches Museum Chapel and then go to St Vincent de Paul Thrift Store but do not visit St Vincent de Paul Thrift Store before Beaches Museum Chapel is visited,& U ! st_vincent_de_paul_thrift_store beaches_museum_chapel F st_vincent_de_paul_thrift_store,Jacksonville #2,"error:['&', 'U', '!', 'lm(', 'Vincent', 'St', ')lm', 'lm(', 'lm(', 'Beaches', 'Museum', ')lm', ')lm', ')lm', 'lm(', 'lm(', 'lm(', 'Paul', ')lm', 'St', ')lm', ')lm', 'lm(', 'lm(', 'lm(', ')lm', ')lm', 'U', 'Museum', 'Museum', 'U', 'U', 'lm(', 'Museum', 'Museum']",False
2617,go to St Paul's Catholic Church and then go to Publix but do not visit Publix before St Paul's Catholic Church is visited,& U ! publix st_paul's_catholic_church F publix,Jacksonville #2,& U ! st_vincent_de_paul_thrift_store st_paul's_catholic_church,False
2618,go to The Oesterreicher-McCormick Cabin after going to 1903 Pablo Beach Post Office do not go to The Oesterreicher-McCormick Cabin before,& U ! the_oesterreicher-mccormick_cabin 1903_pablo_beach_post_office F the_oesterreicher-mccormick_cabin,Jacksonville #2,"error:['&', 'U', '!', 'lm(', 'The', ')lm', ')lm', 'lm(', 'Cabin', ')lm', ')lm', 'The', ')lm', ')lm', 'The', 'The', 'The', 'The', ')lm', ')lm', 'lm(', 'The', 'lm(', 'Oesterreicher-McCormick', ')lm']",False
2619,go to St Paul's Catholic Church after going to Players by the Sea do not go to St Paul's Catholic Church before,& U ! st_paul's_catholic_church players_by_the_sea F st_paul's_catholic_church,Jacksonville #2,& U ! st_paul's_catholic_church players_by_the_sea F st_paul's_catholic_church,True
2620,continue moving to Mayport East Coast Railway Depot,G F mayport_east_coast_railway_depot,Jacksonville #2,"error:['G', 'F', 'lm(', 'lm(', 'Mayport', ')lm', ')lm', ')lm', '!', 'lm(', 'Railway', 'Railway', ')lm']",False
2621,continue moving to St Paul's Catholic Church,G F st_paul's_catholic_church,Jacksonville #2,"error:['G', 'F', 'lm(', 'lm(', 'Catholic', 'Church', ')lm']",False
2622,frequent St Vincent de Paul Thrift Store infinitely,G F st_vincent_de_paul_thrift_store,Jacksonville #2,& G F st_paul's_catholic_church G G F st_vincent_de_paul_thrift_store,False
2623,frequent Beaches Museum infinitely,G F beaches_museum,Jacksonville #2,G F beaches_museum,True
2624,go to Mayport East Coast Railway Depot repeatedly,G F mayport_east_coast_railway_depot,Jacksonville #2,"error:['&', 'lm(', 'lm(', 'Mayport', 'East', ')lm', 'F', 'St', 'lm(', 'Railway', 'Depot', ')lm']",False
2625,go to Beaches Museum repeatedly,G F beaches_museum,Jacksonville #2,"error:['G', 'lm(', 'lm(', 'Beaches', ')lm']",False
2626,do not stop visiting Cypress Productions,G F cypress_productions,Jacksonville #2,G F cypress_productions,True
2627,do not stop visiting Pet Supermarket,G F pet_supermarket,Jacksonville #2,G F pet_supermarket,True
2628,make sure Mayport East Coast Railway Depot is visited infinitely,G F mayport_east_coast_railway_depot,Jacksonville #2,"error:['G', 'G', 'F', 'lm(', 'Mayport', ')lm', 'G', 'G', 'F', 'lm(', 'lm(', 'Depot', ')lm']",False
2629,make sure St Paul's Catholic Church is visited infinitely,G F st_paul's_catholic_church,Jacksonville #2,"error:['G', 'F', 'lm(', 'lm(', 'St', ')lm', 'G', 'G', 'F', 'lm(', 'lm(', ')lm', 'Church', ')lm']",False
2630,patrol Beaches Museum repeatedly,G F beaches_museum,Jacksonville #2,G F beaches_museum,True
2631,patrol The Oesterreicher-McCormick Cabin repeatedly,G F the_oesterreicher-mccormick_cabin,Jacksonville #2,G F the_oesterreicher-mccormick_cabin,True
2632,first go to Waffle House while avoiding Players by the Sea then go to Players by the Sea while staying away from Burrito Gallery then go to Burrito Gallery while staying away from The Oesterreicher-McCormick Cabin then visit The Oesterreicher-McCormick Cabin,& U ! players_by_the_sea waffle_house & U ! burrito_gallery players_by_the_sea & U ! the_oesterreicher-mccormick_cabin burrito_gallery F the_oesterreicher-mccormick_cabin,Jacksonville #2,"error:['&', '&', 'U', '!', 'lm(', 'Players', 'Players', 'the', ')lm', ')lm', 'lm(', 'The', 'Waffle', ')lm', '&', 'U', '!', 'lm(', 'The', 'Oesterreicher-McCormick', ')lm', 'lm(', 'The', 'Gallery', ')lm', 'F', 'lm(', 'The', ')lm', ')lm']",False
2633,first go to Burrito Gallery while avoiding The 1911 Train Engine then go to The 1911 Train Engine while staying away from St Paul's Catholic Church then go to St Paul's Catholic Church while staying away from Beaches Museum Chapel then visit Beaches Museum Chapel,& U ! the_1911_train_engine burrito_gallery & U ! st_paul's_catholic_church the_1911_train_engine & U ! beaches_museum_chapel st_paul's_catholic_church F beaches_museum_chapel,Jacksonville #2,"error:['&', 'U', '!', 'lm(', 'The', '1911', ')lm', 'lm(', 'Burrito', 'Gallery', ')lm', '&', 'U', '!', 'lm(', 'Train', ')lm', ')lm', 'lm(', 'The', 'The', ')lm', ')lm', '&', '!', 'lm(', 'lm(', ')lm', ')lm', 'lm(', ')lm', 'Church', ')lm', 'F', 'lm(', 'F', 'lm(', 'Church', ')lm', 'F', ')lm', ')lm', ')lm', ')lm', ')lm', ')lm', ')lm', ')lm', ')lm', ')lm', ')lm', 'U', 'U', 'The', 'The', 'The', 'U', ')lm', 'The', 'The', 'The', ')lm', ')lm', 'The', 'U', 'The', 'The', ')lm', 'The', 'U', 'The', 'lm(', 'The', ')lm', 'The', ')lm', ')lm', 'The', 'U', ')lm', ')lm', 'The', ')lm', ')lm', ')lm', ')lm', ')lm', 'Church', ')lm', 'lm(', ')lm', 'Church', ')lm', 'U', 'St', ')lm']",False
2634,go to The Oesterreicher-McCormick Cabin only after that go to Publix only then go to Burrito Gallery and only then go to Pet Supermarket,& U ! publix the_oesterreicher-mccormick_cabin & U ! burrito_gallery publix & U ! pet_supermarket burrito_gallery F pet_supermarket,Jacksonville #2,"error:['&', 'U', '!', 'lm(', 'The', 'Oesterreicher-McCormick', ')lm', 'lm(', 'U', '!', 'lm(', 'Cabin', ')lm', ')lm', ')lm', ')lm', 'lm(', ')lm', ')lm', ')lm', ')lm', ')lm', ')lm', ')lm', ')lm', ')lm', ')lm', ')lm', ')lm', ')lm', ')lm', ')lm']",False
2635,go to Burrito Gallery only after that go to Publix only then go to Waffle House and only then go to Mayport East Coast Railway Depot,& U ! publix burrito_gallery & U ! waffle_house publix & U ! mayport_east_coast_railway_depot waffle_house F mayport_east_coast_railway_depot,Jacksonville #2,"error:['&', 'U', '!', 'lm(', 'Waffle', ')lm', ')lm', 'lm(', 'lm(', 'lm(', 'lm(', 'Burrito', ')lm', ')lm', '&', 'U', '!', 'lm(', 'lm(', ')lm', ')lm', ')lm', ')lm', ')lm', ')lm', ')lm', ')lm', ')lm', ')lm', ')lm', ')lm', ')lm', ')lm', ')lm', ')lm', ')lm']",False
2636,go to Players by the Sea then Beaches Museum Chapel then Mayport East Coast Railway Depot finally St Paul's Catholic Church you can not visit Beaches Museum Chapel before Players by the Sea you can not visit Mayport East Coast Railway Depot before Beaches Museum Chapel you can not visit St Paul's Catholic Church before Mayport East Coast Railway Depot,& U ! beaches_museum_chapel players_by_the_sea & U ! mayport_east_coast_railway_depot beaches_museum_chapel & U ! st_paul's_catholic_church mayport_east_coast_railway_depot F st_paul's_catholic_church,Jacksonville #2,"error:['&', 'U', '!', 'lm(', 'Museum', 'Museum', ')lm', 'lm(', 'Players', 'Players', 'the', 'Sea', ')lm', '&', 'U', '!', 'lm(', 'Mayport', ')lm', ')lm', 'lm(', 'lm(', 'lm(', 'Museum', ')lm', ')lm', ')lm', 'U', '!', 'lm(', 'lm(', 'Church', ')lm', 'lm(', 'lm(', ')lm', ')lm', 'St', ')lm', ')lm', 'lm(', 'Church', ')lm', 'Church', ')lm', ')lm', 'Church', ')lm', ')lm', 'Church', ')lm', ')lm', 'Church', ')lm']",False
2637,go to The Oesterreicher-McCormick Cabin then Mayport East Coast Railway Depot then Waffle House finally Publix you can not visit Mayport East Coast Railway Depot before The Oesterreicher-McCormick Cabin you can not visit Waffle House before Mayport East Coast Railway Depot you can not visit Publix before Waffle House,& U ! mayport_east_coast_railway_depot the_oesterreicher-mccormick_cabin & U ! waffle_house mayport_east_coast_railway_depot & U ! publix waffle_house F publix,Jacksonville #2,"error:['&', 'U', '!', 'lm(', 'Mayport', 'East', ')lm', 'lm(', 'The', 'Oesterreicher-McCormick', ')lm', '&', 'U', '!', 'lm(', 'Waffle', ')lm', ')lm', 'lm(', 'Mayport', ')lm', ')lm', ')lm', '!', 'lm(', '!', 'lm(', 'lm(', ')lm', ')lm', ')lm', ')lm', ')lm', ')lm', ')lm', ')lm', ')lm', 'lm(', ')lm', ')lm', ')lm', ')lm', ')lm', 'Publix', 'Publix']",False
2638,visit Waffle House East Coast Railway Foreman’s House #93 Publix and Beaches Museum Chapel in this order without skipping any one of them,& U ! east_coast_railway_foreman’s_house_#93 waffle_house & U ! publix east_coast_railway_foreman’s_house_#93 & U ! beaches_museum_chapel publix F beaches_museum_chapel,Jacksonville #2,"error:['&', 'U', '!', 'lm(', 'Coast', 'Railway', ')lm', 'lm(', 'lm(', 'Waffle', 'Waffle', ')lm', '&', ')lm', '&', 'lm(', '!', 'lm(', ')lm', ')lm', ')lm', 'lm(', 'Foreman’s', ')lm', ')lm', ')lm', ')lm', ')lm', ')lm', ')lm', 'lm(', 'lm(', ')lm', 'lm(', ')lm', ')lm', 'lm(', 'lm(', 'Museum', ')lm', 'Chapel', ')lm', 'Chapel', ')lm', ')lm', ')lm']",False
2639,visit The 1911 Train Engine Beaches Museum Chapel Burrito Gallery and Beaches Museum in this order without skipping any one of them,& U ! beaches_museum_chapel the_1911_train_engine & U ! burrito_gallery beaches_museum_chapel & U ! beaches_museum burrito_gallery F beaches_museum,Jacksonville #2,& U ! the_1911_train_engine )lm waffle_house lm( the_oesterreicher-mccormick_cabin )lm & U ! waffle_house lm( waffle_house texaco lm( waffle_house lm( beaches_museum beaches_museum,False
2640,ensure that you visit Pet Supermarket but only after Publix in turn only visit Publix after Mayport East Coast Railway Depot only visit Mayport East Coast Railway Depot after Players by the Sea and only visit Players by the Sea after Beaches Museum,& U ! players_by_the_sea beaches_museum & U ! mayport_east_coast_railway_depot players_by_the_sea & U ! publix mayport_east_coast_railway_depot & U ! pet_supermarket publix F pet_supermarket,Jacksonville #2,"error:['&', 'U', '!', 'lm(', 'Railway', ')lm', ')lm', 'lm(', 'lm(', 'East', ')lm', ')lm', ')lm', ')lm', 'lm(', 'lm(', 'lm(', ')lm', 'the', ')lm', ')lm', ')lm', ')lm', ')lm', ')lm', 'the', ')lm', ')lm', ')lm', ')lm', 'the', ')lm', ')lm', ')lm', 'Railway', ')lm', ')lm', 'Sea', 'Supermarket', ')lm']",False
2641,ensure that you visit Texaco but only after Waffle House in turn only visit Waffle House after Cypress Productions only visit Cypress Productions after Players by the Sea and only visit Players by the Sea after Publix,& U ! players_by_the_sea publix & U ! cypress_productions players_by_the_sea & U ! waffle_house cypress_productions & U ! texaco waffle_house F texaco,Jacksonville #2,"error:['F', 'U', '!', 'lm(', 'Waffle', ')lm', ')lm', 'lm(', 'lm(', 'lm(', 'the', ')lm', ')lm', ')lm', 'lm(', '!', 'lm(', 'Players', 'the', 'Texaco', ')lm', ')lm', ')lm', 'the', ')lm', ')lm', ')lm', ')lm', 'Texaco', ')lm']",False
2642,visit Beaches Museum The 1911 Train Engine Waffle House East Coast Railway Foreman’s House #93 and Pet Supermarket in this strict order once the predecessor is visited you must visit the successor,& U ! the_1911_train_engine beaches_museum & U ! waffle_house the_1911_train_engine & U ! east_coast_railway_foreman’s_house_#93 waffle_house & U ! pet_supermarket east_coast_railway_foreman’s_house_#93 F pet_supermarket,Jacksonville #2,"error:['&', 'U', '!', 'lm(', 'The', '1911', ')lm', 'lm(', 'Beaches', 'Beaches', ')lm', '&', 'U', '!', 'lm(', 'lm(', ')lm', ')lm', 'lm(', ')lm', 'lm(', 'Engine', ')lm', ')lm', ')lm', ')lm', 'U', 'U', 'lm(', 'lm(', 'lm(', ')lm', ')lm', ')lm', ')lm', ')lm', ')lm', 'lm(', ')lm', 'lm(', 'lm(', ')lm', 'lm(', ')lm', ')lm', 'lm(', 'lm(', 'lm(', 'lm(', 'lm(', ')lm', 'lm(', 'lm(', ')lm', ')lm', ')lm']",False
