pattern_type,props,utterance,ltl_formula
patrolling,"['a', 'b', 'c', 'd']",keep going to a b c and d in any order,& G F a & G F b & G F c G F d
patrolling,"['a', 'b', 'c', 'd']",keep visiting a b c and d in any order infinitely,& G F a & G F b & G F c G F d
patrolling,"['a', 'b', 'c', 'd']",do not stop visiting a b c and d in no specific order,& G F a & G F b & G F c G F d
patrolling,"['a', 'b', 'c', 'd']",do not stop going to a b c and d in any order,& G F a & G F b & G F c G F d
patrolling,"['a', 'b', 'c', 'd', 'h']",keep visiting a b c d and h in no specific order,& G F a & G F b & G F c & G F d G F h
patrolling,"['a', 'b', 'c', 'd', 'h']",keep going to a b c d and h in any order,& G F a & G F b & G F c & G F d G F h
patrolling,"['a', 'b', 'c', 'd', 'h']",keep visiting a b c d and h in any order infinitely,& G F a & G F b & G F c & G F d G F h
patrolling,"['a', 'b', 'c', 'd', 'h']",do not stop visiting a b c d and h in no specific order,& G F a & G F b & G F c & G F d G F h
patrolling,"['a', 'b', 'c', 'd', 'h']",do not stop going to a b c d and h in no specific order,& G F a & G F b & G F c & G F d G F h
strictly_ordered_visit,"['a', 'b', 'c', 'd', 'h']",go to a only then go to b only then go to c only then go to d and only then go to h make sure to  not revisit any of the locations before completing the task,& & U ! b a & U ! c b & U ! d c & U ! h d F h & U ! a U a U !a b & U ! b U b U !b c & U ! c U c U !c d U ! d U d U !d h
strictly_ordered_visit,"['a', 'b', 'c', 'd', 'h']",go to a only then go to  b without returning only after that go to c without returning only after that go to d without returning  and finally only then go to h without returning,& & U ! b a & U ! c b & U ! d c & U ! h d F h & U ! a U a U !a b & U ! b U b U !b c & U ! c U c U !c d U ! d U d U !d h
strictly_ordered_visit,"['a', 'b', 'c', 'd', 'h']",go to h but only after going to d only once go to d only after going to c only once go to c only after going to b only once and go to b only after going to a only once,& & U ! b a & U ! c b & U ! d c & U ! h d F h & U ! a U a U !a b & U ! b U b U !b c & U ! c U c U !c d U ! d U d U !d h
strictly_ordered_visit,"['a', 'b', 'c', 'd', 'h']",visit a and only then visit b without returning to a only then visit c without returning to b only then visit d without returning to c and only then visit h without returning to d,& & U ! b a & U ! c b & U ! d c & U ! h d F h & U ! a U a U !a b & U ! b U b U !b c & U ! c U c U !c d U ! d U d U !d h
strictly_ordered_visit,"['a', 'b', 'c', 'd', 'h']",visit a b c d and h in that exact order once you leave a location you cannot return to it,& & U ! b a & U ! c b & U ! d c & U ! h d F h & U ! a U a U !a b & U ! b U b U !b c & U ! c U c U !c d U ! d U d U !d h
ordered_visit,"['a', 'b', 'c', 'd', 'h']",visit a do not visit b c d or h before visiting a then visit b do not visit c d or h before visiting b then visit c do not visit d or h before visiting c then visit d do not visit h before visiting d finally visit h,& U ! b a & U ! c b & U ! d c & U ! h d F h
ordered_visit,"['a', 'b', 'c', 'd', 'h']",visit a do not visit b c d or h until you visit a then visit b do not visit c d or h until you visit b then visit c do not visit d or h until you visit c then visit d do not visit h until you visit d finally reach h,& U ! b a & U ! c b & U ! d c & U ! h d F h
patrolling,"['a', 'b']",never stop visiting a and b,& G F a G F b
patrolling,"['a', 'b']",frequent a and b infinitely in any order,& G F a G F b
patrolling,"['a', 'b']",visit a and b an infinite number of times,& G F a G F b
patrolling,"['a', 'b']",keep going to a and b in arbitrary order,& G F a G F b
patrolling,"['a', 'b']",please keep visiting a and b without stopping,& G F a G F b
patrolling,['a'],never stop visiting a,G F a
patrolling,['a'],make sure a is visited infinitely,G F a
patrolling,['a'],visit a an infinite number of times,G F a
patrolling,['a'],frequent a infinitely,G F a
patrolling,['a'],please keep visiting a without stopping,G F a
ordered_visit,"['a', 'b', 'c']",go to a but not through b or c and then go to b but not through c and finally go to c,& U ! b a & U ! c b F c
ordered_visit,"['a', 'b', 'c']",make you way to a but keep avoiding b and c and head to b but keep avoiding c and then visit c,& U ! b a & U ! c b F c
ordered_visit,"['a', 'b', 'c']",direct yourself to a but keep away from b and c then go to b but bypass c and eventually make you way to c,& U ! b a & U ! c b F c
ordered_visit,"['a', 'b', 'c']",keep away from b and c while heading to a and then keep away from c while heading to b and eventually go to c,& U ! b a & U ! c b F c
ordered_visit,"['a', 'b', 'c']",visit a b and c in order but keep avoiding latter ones when you are heading to former ones,& U ! b a & U ! c b F c
patrolling,"['a', 'b']",keep visiting a and b in any order,& G F a G F b
patrolling,"['a', 'b']",make sure a and b are visited infinitely,& G F a G F b
patrolling,"['a', 'b']",do not stop visiting a and b,& G F a G F b
patrolling,"['a', 'b']",frequent a and b but the order can be arbitrary,& G F a G F b
patrolling,"['a', 'b']",keep going back and forth between a and b,& G F a G F b
