pattern_type,props,utterance,ltl_formula
strictly_ordered_visit,"['a', 'b', 'c', 'd', 'h']",do not go to h until d is visited and do not go to d until c is visited and do not go to c until b is visited and do not go to b until a is visited along the path never return to previous location you have been to,& & U ! b a & U ! c b & U ! d c & U ! h d F h & U ! a U a U !a b & U ! b U b U !b c & U ! c U c U !c d U ! d U d U !d h
strictly_ordered_visit,"['a', 'b', 'c', 'd', 'h']",make your way to h only after going to d before that make your way to d only after going to c before that make your way to c only after going to b before that make your way to b only after going to a do not go back to the previous location you have visited while heading to the next,& & U ! b a & U ! c b & U ! d c & U ! h d F h & U ! a U a U !a b & U ! b U b U !b c & U ! c U c U !c d U ! d U d U !d h
strictly_ordered_visit,"['a', 'b', 'c', 'd', 'h']",go to a but do not visit b c d or h and then go to b but do not visit c d or h or revisit a and then go to c but do not visit d or h or revisit a or b and then go to d but do not visit h or revisit a b or c and then go to h but do not revisit a b c or d,& & U ! b a & U ! c b & U ! d c & U ! h d F h & U ! a U a U !a b & U ! b U b U !b c & U ! c U c U !c d U ! d U d U !d h
strictly_ordered_visit,"['a', 'b', 'c', 'd', 'h']",visit a b c d and h in this order without skipping any one of them do not revisit any one of them once after you have been there,& & U ! b a & U ! c b & U ! d c & U ! h d F h & U ! a U a U !a b & U ! b U b U !b c & U ! c U c U !c d U ! d U d U !d h
strictly_ordered_visit,"['a', 'b', 'c', 'd']",go to a but not through b c or d and then go to b but not through c or d and then go to c but not through d and finally go to d no revisiting is allowed,& & U ! b a & U ! c b & U ! d c F d & U ! a U a U !a b & U ! b U b U !b c U ! c U c U !c d
strictly_ordered_visit,"['a', 'b', 'c', 'd']",do not go to d until c is visited and do not go to c until b is visited and do not go to b until a is visited along the path never return to previous location you have been to,& & U ! b a & U ! c b & U ! d c F d & U ! a U a U !a b & U ! b U b U !b c U ! c U c U !c d
strictly_ordered_visit,"['a', 'b', 'c', 'd']",make your way to d only after going to c before that make your way to c only after going to b before that make your way to b only after going to a do not go back to the previous location you have visited while heading to the next,& & U ! b a & U ! c b & U ! d c F d & U ! a U a U !a b & U ! b U b U !b c U ! c U c U !c d
strictly_ordered_visit,"['a', 'b', 'c', 'd']",go to a but do not visit b c or d and then go to b but do not visit c or d or revisit a and then go to c but do not visit d or revisit a or b and then go to d but do not revisit a b or c,& & U ! b a & U ! c b & U ! d c F d & U ! a U a U !a b & U ! b U b U !b c U ! c U c U !c d
strictly_ordered_visit,"['a', 'b', 'c', 'd']",visit a b c and d in this order without skipping any one of them do not revisit any one of them once after you have been there,& & U ! b a & U ! c b & U ! d c F d & U ! a U a U !a b & U ! b U b U !b c U ! c U c U !c d
strictly_ordered_visit,"['a', 'b', 'c']",go to a but not through b or c and then go to b but not through c and finally go to c no revisiting is allowed,& & U ! b a & U ! c b F c & U ! a U a U !a b U ! b U b U !b c
strictly_ordered_visit,"['a', 'b', 'c']",do not go to c until b is visited and do not go to b until a is visited along the path never return to previous location you have been to,& & U ! b a & U ! c b F c & U ! a U a U !a b U ! b U b U !b c
strictly_ordered_visit,"['a', 'b', 'c']",make your way to c only after going to b before that make your way to b only after going to a do not go back to the previous location you have visited while heading to the next,& & U ! b a & U ! c b F c & U ! a U a U !a b U ! b U b U !b c
strictly_ordered_visit,"['a', 'b', 'c']",go to a but do not visit b or c and then go to b but do not visit c or revisit a and then go to c but do not revisit a or b,& & U ! b a & U ! c b F c & U ! a U a U !a b U ! b U b U !b c
strictly_ordered_visit,"['a', 'b', 'c']",visit a b and c in this order without skipping any one of them do not revisit any one of them once after you have been there,& & U ! b a & U ! c b F c & U ! a U a U !a b U ! b U b U !b c
ordered_visit,"['a', 'b', 'c', 'd', 'h']",go to a but not through b c d or h and then go to b but not through c d or h and then go to c but not through d or h and then go to d but not through h and finally go to h,& U ! b a & U ! c b & U ! d c & U ! h d F h
ordered_visit,"['a', 'b', 'c', 'd', 'h']",go to a and only go to b only after a is visited and then go to c only after a and b are both visited and then go to d only after a b and c are all visited and then go to h only after a b c and d are all visited,& U ! b a & U ! c b & U ! d c & U ! h d F h
ordered_visit,"['a', 'b', 'c', 'd', 'h']",make your way to h only after going to d before that make your way to d only after going to c before that make your way to c only after going to b before that make your way to b only after going to a,& U ! b a & U ! c b & U ! d c & U ! h d F h
ordered_visit,"['a', 'b', 'c', 'd', 'h']",visit a b c d and h in this order without skipping any one of them,& U ! b a & U ! c b & U ! d c & U ! h d F h
ordered_visit,"['a', 'b', 'c', 'd', 'h']",do not go to h until d is visited and do not go to d until c is visited and do not go to c until b is visited and do not go to b until a is visited,& U ! b a & U ! c b & U ! d c & U ! h d F h
patrolling,"['a', 'b', 'c']",never stop visiting a b and c,& G F a & G F b G F c
patrolling,"['a', 'b', 'c']",frequent a b and c infinitely in any order,& G F a & G F b G F c
patrolling,"['a', 'b', 'c']",please keep visiting a b and c without stopping,& G F a & G F b G F c
patrolling,"['a', 'b', 'c']",make sure a b and c are visited infinitely,& G F a & G F b G F c
patrolling,"['a', 'b', 'c']",keep visiting a b and c in any order,& G F a & G F b G F c
patrolling,"['a', 'b', 'c', 'd']",never stop visiting a b c and d,& G F a & G F b & G F c G F d
patrolling,"['a', 'b', 'c', 'd']",frequent a b c and d infinitely in any order,& G F a & G F b & G F c G F d
patrolling,"['a', 'b', 'c', 'd']",please keep visiting a b c and d without stopping,& G F a & G F b & G F c G F d
patrolling,"['a', 'b', 'c', 'd']",make sure a b c and d are visited infinitely,& G F a & G F b & G F c G F d
patrolling,"['a', 'b', 'c', 'd']",keep visiting a b c and d in any order,& G F a & G F b & G F c G F d
patrolling,"['a', 'b', 'c', 'd', 'h']",never stop visiting a b c d and h,& G F a & G F b & G F c & G F d G F h
patrolling,"['a', 'b', 'c', 'd', 'h']",frequent a b c d and h infinitely in any order,& G F a & G F b & G F c & G F d G F h
patrolling,"['a', 'b', 'c', 'd', 'h']",please keep visiting a b c d and h without stopping,& G F a & G F b & G F c & G F d G F h
patrolling,"['a', 'b', 'c', 'd', 'h']",make sure a b c d and h are visited infinitely,& G F a & G F b & G F c & G F d G F h
patrolling,"['a', 'b', 'c', 'd', 'h']",keep visiting a b c d h in any order,& G F a & G F b & G F c & G F d G F h
fair_visit,"['a', 'b', 'c', 'd']",make sure you frequent a b c and d equally or at most one time in difference,& & F a & F b & F c F d & G i a W a & ! a W ! a b & G i b W b & ! b W ! b c & G i c W c & ! c W ! c d G i d W d & ! d W ! d a
fair_visit,"['a', 'b', 'c', 'd']",visit a b c and d multiple times in arbitrary order but do not visit one more than one time more than the other,& & F a & F b & F c F d & G i a W a & ! a W ! a b & G i b W b & ! b W ! b c & G i c W c & ! c W ! c d G i d W d & ! d W ! d a
fair_visit,"['a', 'b', 'c', 'd']",go to a b c and d any time and in any order but do not visit one more than the other more than once,& & F a & F b & F c F d & G i a W a & ! a W ! a b & G i b W b & ! b W ! b c & G i c W c & ! c W ! c d G i d W d & ! d W ! d a
fair_visit,"['a', 'b', 'c', 'd']",travel between a b c  and d multiple times in any sequence but ensure neither is visited more than once more than the other,& & F a & F b & F c F d & G i a W a & ! a W ! a b & G i b W b & ! b W ! b c & G i c W c & ! c W ! c d G i d W d & ! d W ! d a
fair_visit,"['a', 'b', 'c', 'd']",revisit a b c and d multiple times but be sure not to go to one more than the other more than once,& & F a & F b & F c F d & G i a W a & ! a W ! a b & G i b W b & ! b W ! b c & G i c W c & ! c W ! c d G i d W d & ! d W ! d a
fair_visit,"['a', 'b', 'c']",make sure you frequent a b and c equally or at most one time in difference,& & F a & F b F c & G i a W a & ! a W ! a b & G i b W b & ! b W ! b c G i c W c & ! c W ! c a
fair_visit,"['a', 'b', 'c']",visit a b and c multiple times in arbitrary order but do not visit one more than one time more than the other,& & F a & F b F c & G i a W a & ! a W ! a b & G i b W b & ! b W ! b c G i c W c & ! c W ! c a
fair_visit,"['a', 'b', 'c']",go to a b and c any time and in any order but do not visit one more than the other more than once,& & F a & F b F c & G i a W a & ! a W ! a b & G i b W b & ! b W ! b c G i c W c & ! c W ! c a
fair_visit,"['a', 'b', 'c']",travel between a b and c multiple times in any sequence but ensure neither is visited more than once more than the other,& & F a & F b F c & G i a W a & ! a W ! a b & G i b W b & ! b W ! b c G i c W c & ! c W ! c a
fair_visit,"['a', 'b', 'c']",revisit a b and c multiple times but be sure not to go to one more than the other more than once,& & F a & F b F c & G i a W a & ! a W ! a b & G i b W b & ! b W ! b c G i c W c & ! c W ! c a
fair_visit,"['a', 'b']",make sure you frequent a and b equally or at most one time in difference,& & F a F b & G i a W a & ! a W ! a b G i b W b & ! b W ! b a
fair_visit,"['a', 'b']",visit a and b multiple times in arbitrary order but do not visit one more than one time more than the other,& & F a F b & G i a W a & ! a W ! a b G i b W b & ! b W ! b a
fair_visit,"['a', 'b']",go to a and b any time and in any order but do not visit one more than the other more than once,& & F a F b & G i a W a & ! a W ! a b G i b W b & ! b W ! b a
fair_visit,"['a', 'b']",travel between a and b multiple times in any sequence but ensure neither is visited more than once more than the other,& & F a F b & G i a W a & ! a W ! a b G i b W b & ! b W ! b a
fair_visit,"['a', 'b']",revisit a and b multiple times but be sure not to go to one more than the other more than once,& & F a F b & G i a W a & ! a W ! a b G i b W b & ! b W ! b a
visit,['a'],go to a,F a
visit,['a'],visit a,F a
visit,['a'],stop by a,F a
visit,"['a', 'b']",move to a and b,& F a F b
visit,"['a', 'b']",go to a and b,& F a F b
visit,"['a', 'b']",stop by a and b,& F a F b
strictly_ordered_visit,"['a', 'b']",visit b but only after a also you cannot revisit a before completing the remaining tasks,& & U ! b a F b U ! a U a U !a b
strictly_ordered_visit,"['a', 'b']",go to a only then go to b but ensure to not revisit a,& & U ! b a F b U ! a U a U !a b
strictly_ordered_visit,"['a', 'b']",visit a and b in that exact sequence out of sequence visits and repeated visits are not permitted,& & U ! b a F b U ! a U a U !a b
strictly_ordered_visit,"['a', 'b']",go to a and only then go to b without returning to a,& & U ! b a F b U ! a U a U !a b
strictly_ordered_visit,"['a', 'b']",reach a and then b in that exact order without repetitions,& & U ! b a F b U ! a U a U !a b
sequenced_visit,"['a', 'b']",visit a then visit b,F & a F b
sequenced_visit,"['a', 'b']",visit a followed by b,F & a F b
sequenced_visit,"['a', 'b']",go to a then b,F & a F b
sequenced_visit,"['a', 'b']",go to b after visiting a,F & a F b
strictly_ordered_visit,"['a', 'b']",visit b but before visiting b you must visit a visit each location once,& & U ! b a F b U ! a U a U !a b
strictly_ordered_visit,"['a', 'b']",visit a and visit only once then eventually visit b do not visit b with visiting a,& & U ! b a F b U ! a U a U !a b
strictly_ordered_visit,"['a', 'b']",only visit a once then followed by b,& & U ! b a F b U ! a U a U !a b
strictly_ordered_visit,"['a', 'b']",visit a and b once but do not visit b with visiting a,& & U ! b a F b U ! a U a U !a b
patrolling,['a'],keep on visiting a forever,G F a
patrolling,['a'],go to a repeatedly,G F a
patrolling,['a'],visit a infinitely often,G F a
patrolling,['a'],make sure at any point in time you will visit a at least once in the future,G F a
patrolling,['a'],keep visiting a forever,G F a
patrolling,"['a', 'b']",keep visiting a and b forever,& G F a G F b
patrolling,"['a', 'b']",go to a and b infinitely often,& G F a G F b
patrolling,"['a', 'b']",repeatedly visit a and b forever,& G F a G F b
patrolling,"['a', 'b']",at any point in time you must visit a and b at least once after,& G F a G F b
patrolling,"['a', 'b']",always keep visiting a and b,& G F a G F b
patrolling,"['a', 'b', 'c']",keep visiting a b and c infinitely often,& G F a & G F b G F c
patrolling,"['a', 'b', 'c']",make sure you are always visiting a b and c,& G F a & G F b G F c
patrolling,"['a', 'b', 'c']",dont ever stop visiting a b and c,& G F a & G F b G F c
patrolling,"['a', 'b', 'c']",at any point in time ensure that you will visit a b and c at least once in the future,& G F a & G F b G F c
patrolling,"['a', 'b', 'c']",repeatedly keep visiting a b and c,& G F a & G F b G F c
patrolling,['a'],keep visiting a,G F a
patrolling,['a'],continue to visit a,G F a
patrolling,['a'],visit a again and again,G F a
patrolling,"['a', 'b']",keep going to a and b an infinite number of times,& G F a G F b
patrolling,"['a', 'b']",keep visiting a and b an infinite number of times,& G F a G F b
patrolling,"['a', 'b']",continue visiting  a and b an infinite number of times,& G F a G F b
patrolling,"['a', 'b']",dont stop visiting a and b,& G F a G F b
visit,"['a', 'b', 'c', 'd']",go to a go to b go to c and go to d,& F a & F b & F c F d
visit,"['a', 'b', 'c', 'd']",reach all the following locations a b c and d,& F a & F b & F c F d
visit,"['a', 'b', 'c', 'd']",visit a go to b reach c reach d,& F a & F b & F c F d
visit,"['a', 'b', 'c', 'd']",visit a b c and d in no particular order,& F a & F b & F c F d
visit,"['a', 'b', 'c', 'd']",visit a b c and d the order is not important,& F a & F b & F c F d
fair_visit,"['a', 'b']",visit a and b equally,& & F a F b & G i a W a & ! a W ! a b G i b W b & ! b W ! b a
fair_visit,"['a', 'b']",go to a and b arbitrarily but dont visit one more than other,& & F a F b & G i a W a & ! a W ! a b G i b W b & ! b W ! b a
fair_visit,"['a', 'b']",visit a and b with total number of visits to a equal to total number of visits to b,& & F a F b & G i a W a & ! a W ! a b G i b W b & ! b W ! b a
fair_visit,"['a', 'b']",visit a and b with total number of visits to a one more than the total number of visits to b,& & F a F b & G i a W a & ! a W ! a b G i b W b & ! b W ! b a
fair_visit,"['a', 'b', 'c', 'd', 'h']",visit a b c d and h equal number of times,& & F a & F b & F c & F d F h & G i a W a & ! a W ! a b & G i b W b & ! b W ! b c & G i c W c & ! c W ! c d & G i d W d & ! d W ! d h G i h W h & ! h W ! h a
fair_visit,"['a', 'b', 'c', 'd', 'h']",visit a b c d and h equal number of times,& & F a & F b & F c & F d F h & G i a W a & ! a W ! a b & G i b W b & ! b W ! b c & G i c W c & ! c W ! c d & G i d W d & ! d W ! d h G i h W h & ! h W ! h a
fair_visit,"['a', 'b', 'c', 'd', 'h']",visit a b c d and h with total number of visits same for each location,& & F a & F b & F c & F d F h & G i a W a & ! a W ! a b & G i b W b & ! b W ! b c & G i c W c & ! c W ! c d & G i d W d & ! d W ! d h G i h W h & ! h W ! h a
fair_visit,"['a', 'b', 'c', 'd', 'h']",visit a b c d and h with equal number of visits to a b d and c  and make total number of visits to d be one more than the total number of visits to a,& & F a & F b & F c & F d F h & G i a W a & ! a W ! a b & G i b W b & ! b W ! b c & G i c W c & ! c W ! c d & G i d W d & ! d W ! d h G i h W h & ! h W ! h a
sequenced_visit,"['a', 'b', 'c']",visit a then b then c,F & a F & b F c
sequenced_visit,"['a', 'b', 'c']",go to a then b then c,F & a F & b F c
sequenced_visit,"['a', 'b', 'c']",visit a b c one after the other,F & a F & b F c
sequenced_visit,"['a', 'b', 'c']",visit a followed by b which is then to be followed by c,F & a F & b F c
sequenced_visit,"['a', 'b', 'c', 'd']",visit a followed by b c and then d,F & a F & b F & c F d
sequenced_visit,"['a', 'b', 'c', 'd']",visit a then b then c and then d,F & a F & b F & c F d
sequenced_visit,"['a', 'b', 'c', 'd']",go to a then b then c and then d,F & a F & b F & c F d
sequenced_visit,"['a', 'b', 'c', 'd']",move to a then b c and then d,F & a F & b F & c F d
sequenced_visit,"['a', 'b', 'c', 'd']",visit a b c and d one after another,F & a F & b F & c F d
sequenced_visit,"['a', 'b', 'c', 'd', 'h']",visit a followed by b c d and then h,F & a F & b F & c F & d F h
sequenced_visit,"['a', 'b', 'c', 'd', 'h']",go to a b c d and then h,F & a F & b F & c F & d F h
sequenced_visit,"['a', 'b', 'c', 'd', 'h']",visit a b c d and then h,F & a F & b F & c F & d F h
ordered_visit,"['a', 'b']",visit b but before visiting b you must visit a,& U ! b a F b
ordered_visit,"['a', 'b']",visit a then eventually visit b do not visit b before visiting a,& U ! b a F b
ordered_visit,"['a', 'b']",visit a and continue visiting a but then you must visit b,& U ! b a F b
ordered_visit,"['a', 'b']",visit a and b but do not visit b without visiting a,& U ! b a F b
ordered_visit,"['a', 'b', 'c', 'd']",visit a before vising b c and d then visit b before visiting c d and then visit d before visiting c,& U ! b a & U ! c b & U ! d c F d
ordered_visit,"['a', 'b', 'c', 'd']",visit a b c and d in this strict order once the predecessor is visited you must visit the successor,& U ! b a & U ! c b & U ! d c F d
ordered_visit,"['a', 'b', 'c', 'd']",do not visit successor without visiting the predecessor in the following strict order a b c and d,& U ! b a & U ! c b & U ! d c F d
ordered_visit,"['a', 'b', 'c', 'd']",visit a continue visiting a but then you must visit b followed by c and then d,& U ! b a & U ! c b & U ! d c F d
ordered_visit,"['a', 'b', 'c', 'd', 'h']",visit a before vising b c d and h then visit b before visiting c d and h then visit d before visiting h and then visit h,& U ! b a & U ! c b & U ! d c & U ! h d F h
ordered_visit,"['a', 'b', 'c', 'd', 'h']",visit a b c d and h in this strict order once the predecessor is visited you must visit the successor,& U ! b a & U ! c b & U ! d c & U ! h d F h
ordered_visit,"['a', 'b', 'c', 'd', 'h']",visit a b c d and h in this strict order once the predecessor is visited you must visit the successor,& U ! b a & U ! c b & U ! d c & U ! h d F h
ordered_visit,"['a', 'b', 'c', 'd', 'h']",visit a continue visiting a but then you must visit b followed by c d and then h,& U ! b a & U ! c b & U ! d c & U ! h d F h
strictly_ordered_visit,"['a', 'b', 'c']",visit b but before visiting b you must visit a only after that visit c visit each location once,& & U ! b a & U ! c b F c & U ! a U a U !a b U ! b U b U !b c
strictly_ordered_visit,"['a', 'b', 'c']",visit a  only once then eventually visit b one time then visit c in the future once,& & U ! b a & U ! c b F c & U ! a U a U !a b U ! b U b U !b c
strictly_ordered_visit,"['a', 'b', 'c']",visit a b and c once do not visit b without visiting a and do not visit c without visiting b,& & U ! b a & U ! c b F c & U ! a U a U !a b U ! b U b U !b c
strictly_ordered_visit,"['a', 'b', 'c']",only visit a once followed by visiting b then visiting c once,& & U ! b a & U ! c b F c & U ! a U a U !a b U ! b U b U !b c
strictly_ordered_visit,"['a', 'b', 'c', 'd']",visit b but before visiting b you must visit a only after that visit c after visiting c visit d visit each location once,& & U ! b a & U ! c b & U ! d c F d & U ! a U a U !a b & U ! b U b U !b c U ! c U c U !c d
strictly_ordered_visit,"['a', 'b', 'c', 'd']",visit a only once then eventually visit b once after that visit c in the future once followed by onetime visit to d,& & U ! b a & U ! c b & U ! d c F d & U ! a U a U !a b & U ! b U b U !b c U ! c U c U !c d
strictly_ordered_visit,"['a', 'b', 'c', 'd']",visit a b c d once do not visit b without visiting a and do not visit b without visiting c do not visit d without visiting c,& & U ! b a & U ! c b & U ! d c F d & U ! a U a U !a b & U ! b U b U !b c U ! c U c U !c d
strictly_ordered_visit,"['a', 'b', 'c', 'd']",visit a followed by a one time visits to b then c then visit dfollow this strict order,& & U ! b a & U ! c b & U ! d c F d & U ! a U a U !a b & U ! b U b U !b c U ! c U c U !c d
strictly_ordered_visit,"['a', 'b', 'c', 'd', 'h']",visit b but before visiting b you must visit a after that visit c dont visit c without visiting a and b then visit d followed by h visit each location once,& & U ! b a & U ! c b & U ! d c & U ! h d F h & U ! a U a U !a b & U ! b U b U !b c & U ! c U c U !c d U ! d U d U !d h
strictly_ordered_visit,"['a', 'b', 'c', 'd', 'h']",visit a only once then eventually visit b only once then visit c in the future for one time followed by one visit to d and after that h,& & U ! b a & U ! c b & U ! d c & U ! h d F h & U ! a U a U !a b & U ! b U b U !b c & U ! c U c U !c d U ! d U d U !d h
strictly_ordered_visit,"['a', 'b', 'c', 'd', 'h']",visit a b c d and h once do not visit b without visiting a and do not visit c without visiting b also do not visit d without visiting c and do not visit h without visiting d,& & U ! b a & U ! c b & U ! d c & U ! h d F h & U ! a U a U !a b & U ! b U b U !b c & U ! c U c U !c d U ! d U d U !d h
strictly_ordered_visit,"['a', 'b', 'c', 'd', 'h']",visit a followed by visiting b then visit c d and h in this exact order visit all locations once,& & U ! b a & U ! c b & U ! d c & U ! h d F h & U ! a U a U !a b & U ! b U b U !b c & U ! c U c U !c d U ! d U d U !d h
patrolling,"['a', 'b', 'c']",keep going to a b and c an infinite number of times,& G F a & G F b G F c
patrolling,"['a', 'b', 'c']",keep visiting a b and c an infinite number of times,& G F a & G F b G F c
patrolling,"['a', 'b', 'c']",continue visiting  a b and c an infinite number of times,& G F a & G F b G F c
patrolling,"['a', 'b', 'c']",dont stop visiting a b and c,& G F a & G F b G F c
patrolling,"['a', 'b', 'c', 'd']",keep going to a b c and d an infinite number of times,& G F a & G F b & G F c G F d
patrolling,"['a', 'b', 'c', 'd']",keep visiting a b c and d an infinite number of times,& G F a & G F b & G F c G F d
patrolling,"['a', 'b', 'c', 'd']",continue visiting  a b c and d an infinite number of times,& G F a & G F b & G F c G F d
patrolling,"['a', 'b', 'c', 'd']",dont stop visiting a b cand d,& G F a & G F b & G F c G F d
patrolling,"['a', 'b', 'c', 'd', 'h']",keep going to a b c d and h an infinite number of times,& G F a & G F b & G F c & G F d G F h
patrolling,"['a', 'b', 'c', 'd', 'h']",keep visiting a b c d and h an infinite number of times,& G F a & G F b & G F c & G F d G F h
patrolling,"['a', 'b', 'c', 'd', 'h']",dont stop visiting a b c d and h,& G F a & G F b & G F c & G F d G F h
patrolling,"['a', 'b', 'c', 'd', 'h']",continue visiting  a b c d and h an infinite number of times,& G F a & G F b & G F c & G F d G F h
fair_visit,"['a', 'b', 'c']",visit a b and c equal number of times,& & F a & F b F c & G i a W a & ! a W ! a b & G i b W b & ! b W ! b c G i c W c & ! c W ! c a
fair_visit,"['a', 'b', 'c']",go to a b and c arbitrarily but dont visit one more than other,& & F a & F b F c & G i a W a & ! a W ! a b & G i b W b & ! b W ! b c G i c W c & ! c W ! c a
fair_visit,"['a', 'b', 'c']",visit a b and c with total number of visits same for each location,& & F a & F b F c & G i a W a & ! a W ! a b & G i b W b & ! b W ! b c G i c W c & ! c W ! c a
fair_visit,"['a', 'b', 'c']",visit a b and c with equal number of visits to a and b and make the total number of visits to c be one more than the total number of visits to a,& & F a & F b F c & G i a W a & ! a W ! a b & G i b W b & ! b W ! b c G i c W c & ! c W ! c a
fair_visit,"['a', 'b', 'c', 'd']",visit a b c and d equal number of times,& & F a & F b & F c F d & G i a W a & ! a W ! a b & G i b W b & ! b W ! b c & G i c W c & ! c W ! c d G i d W d & ! d W ! d a
fair_visit,"['a', 'b', 'c', 'd']",visit a b c and d equal number of times,& & F a & F b & F c F d & G i a W a & ! a W ! a b & G i b W b & ! b W ! b c & G i c W c & ! c W ! c d G i d W d & ! d W ! d a
fair_visit,"['a', 'b', 'c', 'd']",visit a b c and d with total number of visits same for each location,& & F a & F b & F c F d & G i a W a & ! a W ! a b & G i b W b & ! b W ! b c & G i c W c & ! c W ! c d G i d W d & ! d W ! d a
fair_visit,"['a', 'b', 'c', 'd']",visit a b c and d with equal number of visits to a b and c  and make total number of visits to d be one more than the total number of visits to a,& & F a & F b & F c F d & G i a W a & ! a W ! a b & G i b W b & ! b W ! b c & G i c W c & ! c W ! c d G i d W d & ! d W ! d a
visit,"['a', 'b', 'c', 'd']",move to a b c and d in any order,& F a & F b & F c F d
visit,"['a', 'b', 'c', 'd']",stop by a b c and d in any order,& F a & F b & F c F d
visit,"['a', 'b', 'c', 'd']",visit a b c and d in any order,& F a & F b & F c F d
visit,"['a', 'b', 'c', 'd']",move to a b c and d in any order,& F a & F b & F c F d
visit,"['a', 'b', 'c', 'd']",visit a b c and d in any order,& F a & F b & F c F d
visit,"['a', 'b', 'c', 'd']",stop by a b c and d in any order,& F a & F b & F c F d
visit,"['a', 'b', 'c']",move to a b and c in any order,& F a & F b F c
visit,"['a', 'b', 'c']",stop by a b and c in any order,& F a & F b F c
visit,"['a', 'b', 'c']",visit a b and c in any order,& F a & F b F c
