pattern_type,props,utterance,ltl_formula
strictly_ordered_visit,"['a', 'b', 'c', 'd']",please go to a then b then c then d in that specific order,& & U ! b a & U ! c b & U ! d c F d & U ! a U a U !a b & U ! b U b U !b c U ! c U c U !c d
strictly_ordered_visit,"['a', 'b', 'c', 'd']",follow the path from a to b to c to d directly,& & U ! b a & U ! c b & U ! d c F d & U ! a U a U !a b & U ! b U b U !b c U ! c U c U !c d
strictly_ordered_visit,"['a', 'b', 'c', 'd']",first go to a then go to b then go to c finally go to d,& & U ! b a & U ! c b & U ! d c F d & U ! a U a U !a b & U ! b U b U !b c U ! c U c U !c d
strictly_ordered_visit,"['a', 'b', 'c', 'd']",move directly from a to b to c to d,& & U ! b a & U ! c b & U ! d c F d & U ! a U a U !a b & U ! b U b U !b c U ! c U c U !c d
strictly_ordered_visit,"['a', 'b', 'c', 'd']",visit a then b then c and then d in that strict order,& & U ! b a & U ! c b & U ! d c F d & U ! a U a U !a b & U ! b U b U !b c U ! c U c U !c d
fair_visit,"['a', 'b', 'c', 'd']",visit a b c and d the same number of times,& & F a & F b & F c F d & G i a W a & ! a W ! a b & G i b W b & ! b W ! b c & G i c W c & ! c W ! c d G i d W d & ! d W ! d a
fair_visit,"['a', 'b', 'c', 'd']",visit a b c and d and then get to your goal then go to d c b and a to get back to the start,& & F a & F b & F c F d & G i a W a & ! a W ! a b & G i b W b & ! b W ! b c & G i c W c & ! c W ! c d G i d W d & ! d W ! d a
fair_visit,"['a', 'b', 'c', 'd']",if you start at a you must also go to b c and d likewise if you start at b you must go to a c and d if you start at c you must go to a b and d if you start at d you must go to a b and c,& & F a & F b & F c F d & G i a W a & ! a W ! a b & G i b W b & ! b W ! b c & G i c W c & ! c W ! c d G i d W d & ! d W ! d a
fair_visit,"['a', 'b', 'c', 'd']",if you go to one of a b c or d you must go to all of them,& & F a & F b & F c F d & G i a W a & ! a W ! a b & G i b W b & ! b W ! b c & G i c W c & ! c W ! c d G i d W d & ! d W ! d a
fair_visit,"['a', 'b', 'c', 'd']",you must go to a b c and d the same number of times,& & F a & F b & F c F d & G i a W a & ! a W ! a b & G i b W b & ! b W ! b c & G i c W c & ! c W ! c d G i d W d & ! d W ! d a
patrolling,"['a', 'b', 'c', 'd']",patrol around the locations a b c and d,& G F a & G F b & G F c G F d
patrolling,"['a', 'b', 'c', 'd']",circle around a b c and d,& G F a & G F b & G F c G F d
patrolling,"['a', 'b', 'c', 'd']",keep going to a b c and d,& G F a & G F b & G F c G F d
patrolling,"['a', 'b', 'c', 'd']",go to a b c and d over and over again,& G F a & G F b & G F c G F d
patrolling,"['a', 'b', 'c', 'd']",continue to stop at a b c and d,& G F a & G F b & G F c G F d
visit,"['a', 'b', 'c', 'd', 'h']",visit a b c d and h in any order,& F a & F b & F c & F d F h
visit,"['a', 'b', 'c', 'd', 'h']",visit c a d h and b in no particular order,& F a & F b & F c & F d F h
visit,"['a', 'b', 'c', 'd', 'h']",go to a d c h and b at least once,& F a & F b & F c & F d F h
visit,"['a', 'b', 'c', 'd', 'h']",go to b a h c and d,& F a & F b & F c & F d F h
visit,"['a', 'b', 'c', 'd', 'h']",go to h c b d and a in any sequence,& F a & F b & F c & F d F h
ordered_visit,"['a', 'b']",go to a and then go to b in that order,& U ! b a F b
ordered_visit,"['a', 'b']",go from a to b,& U ! b a F b
ordered_visit,"['a', 'b']",first go to a then go to b,& U ! b a F b
ordered_visit,"['a', 'b']",move from a directly to b,& U ! b a F b
ordered_visit,"['a', 'b']",travel from a directly to b,& U ! b a F b
strictly_ordered_visit,"['a', 'b', 'c']",go from a directly to b and then directly to c,& & U ! b a & U ! c b F c & U ! a U a U !a b U ! b U b U !b c
strictly_ordered_visit,"['a', 'b', 'c']",travel to a tob to c exactly in that order,& & U ! b a & U ! c b F c & U ! a U a U !a b U ! b U b U !b c
strictly_ordered_visit,"['a', 'b', 'c']",move exactly from a to b to c,& & U ! b a & U ! c b F c & U ! a U a U !a b U ! b U b U !b c
strictly_ordered_visit,"['a', 'b', 'c']",first visit a then go to b finally go to c,& & U ! b a & U ! c b F c & U ! a U a U !a b U ! b U b U !b c
strictly_ordered_visit,"['a', 'b', 'c']",go to a first go to b second go to c third,& & U ! b a & U ! c b F c & U ! a U a U !a b U ! b U b U !b c
fair_visit,"['a', 'b']",go to a and b the same number of times,& & F a F b & G i a W a & ! a W ! a b G i b W b & ! b W ! b a
fair_visit,"['a', 'b']",if you go to a you must also go to b and visa versa,& & F a F b & G i a W a & ! a W ! a b G i b W b & ! b W ! b a
fair_visit,"['a', 'b']",visit both a and b an equal number of times,& & F a F b & G i a W a & ! a W ! a b G i b W b & ! b W ! b a
fair_visit,"['a', 'b']",if you travel to b you must go to a if you travel to a you must go to b,& & F a F b & G i a W a & ! a W ! a b G i b W b & ! b W ! b a
fair_visit,"['a', 'b']",a and b must be seen the same amount of times,& & F a F b & G i a W a & ! a W ! a b G i b W b & ! b W ! b a
patrolling,['a'],please circle around a,G F a
patrolling,['a'],keep going to a,G F a
patrolling,['a'],always stop at a repeatedly,G F a
patrolling,['a'],cycle about a,G F a
patrolling,['a'],patrol around the landmark a,G F a
visit,['a'],please go to a,F a
visit,['a'],travel to a,F a
visit,['a'],visit a,F a
visit,['a'],stop at a,F a
visit,['a'],attend a,F a
visit,"['a', 'b']",go to a and b in any order,& F a F b
visit,"['a', 'b']",make sure to go to both a and b,& F a F b
visit,"['a', 'b']",attend a and b on your travels,& F a F b
visit,"['a', 'b']",make sure to go to both a and b at least once,& F a F b
visit,"['a', 'b']",go to b and a in any order,& F a F b
visit,"['a', 'b', 'c', 'd']",go to b d a and c in any order,& F a & F b & F c F d
visit,"['a', 'b', 'c', 'd']",attend to a d c and b on your travels,& F a & F b & F c F d
visit,"['a', 'b', 'c', 'd']",make sure to visit a b d and c in any sequence,& F a & F b & F c F d
visit,"['a', 'b', 'c', 'd']",please visit each of d c b and a,& F a & F b & F c F d
visit,"['a', 'b', 'c', 'd']",travel to a b c and d,& F a & F b & F c F d
sequenced_visit,"['a', 'b']",go to a and then to b,F & a F b
sequenced_visit,"['a', 'b']",visit a and then b in that sequence,F & a F b
sequenced_visit,"['a', 'b']",first go to a then go to b,F & a F b
sequenced_visit,"['a', 'b']",travel first to a and then directly to b,F & a F b
sequenced_visit,"['a', 'b']",go to a first second go to b,F & a F b
sequenced_visit,"['a', 'b', 'c', 'd']",go to a then go to b then go to c then go to d,F & a F & b F & c F d
sequenced_visit,"['a', 'b', 'c', 'd']",go from a to b to c to d in that sequence,F & a F & b F & c F d
sequenced_visit,"['a', 'b', 'c', 'd']",go from a to b to c to d and make sure to go to b after a c after b and d after c,F & a F & b F & c F d
sequenced_visit,"['a', 'b', 'c', 'd']",travel from a to b to c to d,F & a F & b F & c F d
sequenced_visit,"['a', 'b', 'c', 'd']",first go to a then visit b then see c finally attend d,F & a F & b F & c F d
sequenced_visit,"['a', 'b', 'c', 'd', 'h']",go from a to b to c to d to h in that sequence,F & a F & b F & c F & d F h
sequenced_visit,"['a', 'b', 'c', 'd', 'h']",visit a b c d and h dont visit b before a c before b d before c and h before d,F & a F & b F & c F & d F h
sequenced_visit,"['a', 'b', 'c', 'd', 'h']",visit a then b then c then d and finally h,F & a F & b F & c F & d F h
sequenced_visit,"['a', 'b', 'c', 'd', 'h']",first visit a visit b after a then visit c after b then visit d after c finally visit h after d,F & a F & b F & c F & d F h
sequenced_visit,"['a', 'b', 'c', 'd', 'h']",visit a first visit b afterwards then go to c after that and d after that finally go to h,F & a F & b F & c F & d F h
ordered_visit,"['a', 'b', 'c']",visit a b and c where b doesnt proceed a and c doesnt proceed b,& U ! b a & U ! c b F c
ordered_visit,"['a', 'b', 'c']",go to b after a and go to c after b,& U ! b a & U ! c b F c
ordered_visit,"['a', 'b', 'c']",go to a then b then c,& U ! b a & U ! c b F c
ordered_visit,"['a', 'b', 'c']",first go to a then go to b after a finally go to c after b,& U ! b a & U ! c b F c
ordered_visit,"['a', 'b', 'c']",first go to a then go to b finally visit c,& U ! b a & U ! c b F c
ordered_visit,"['a', 'b', 'c', 'd']",visit a before b b before c and c before d,& U ! b a & U ! c b & U ! d c F d
ordered_visit,"['a', 'b', 'c', 'd']",after a is visited go to b after visiting b go to c after visiting c go to d,& U ! b a & U ! c b & U ! d c F d
ordered_visit,"['a', 'b', 'c', 'd']",if you visit a you can go to b if you visit b you can go to c if you visit c you can go to d,& U ! b a & U ! c b & U ! d c F d
ordered_visit,"['a', 'b', 'c', 'd']",you cant visit b before a you cant visit c before b you cant visit d before c,& U ! b a & U ! c b & U ! d c F d
ordered_visit,"['a', 'b', 'c', 'd']",if you visited b you have visited a if you visited c you have visited b if you visited d you have visited c,& U ! b a & U ! c b & U ! d c F d
ordered_visit,"['a', 'b', 'c', 'd', 'h']",visit a before b b before c c before d and h before d,& U ! b a & U ! c b & U ! d c & U ! h d F h
ordered_visit,"['a', 'b', 'c', 'd', 'h']",if you visit a you can go to b if you visit b you can go to c if you visit c you can go to d if you visit d you can go to h,& U ! b a & U ! c b & U ! d c & U ! h d F h
ordered_visit,"['a', 'b', 'c', 'd', 'h']",you cant visit b before a you cant visit c before b you cant visit d before c you cant visit h before d,& U ! b a & U ! c b & U ! d c & U ! h d F h
ordered_visit,"['a', 'b', 'c', 'd', 'h']",if you visited b you have visited a if you visited c you have visited b if you visited d you have visited c  if you visited h you visited d,& U ! b a & U ! c b & U ! d c & U ! h d F h
ordered_visit,"['a', 'b', 'c', 'd', 'h']",if a is visited go to b if b is visited go to c if c is visited go to d if d is visited go to h,& U ! b a & U ! c b & U ! d c & U ! h d F h
strictly_ordered_visit,"['a', 'b']",visit a first then visit b,& & U ! b a F b U ! a U a U !a b
strictly_ordered_visit,"['a', 'b']",first go to a then go to b,& & U ! b a F b U ! a U a U !a b
strictly_ordered_visit,"['a', 'b']",go from a directly to b,& & U ! b a F b U ! a U a U !a b
strictly_ordered_visit,"['a', 'b']",start at a then go to b,& & U ! b a F b U ! a U a U !a b
strictly_ordered_visit,"['a', 'b']",you must go to a and then to b in that order,& & U ! b a F b U ! a U a U !a b
strictly_ordered_visit,"['a', 'b', 'c', 'd', 'h']",go from a to b to c to d to h directly in that order,& & U ! b a & U ! c b & U ! d c & U ! h d F h & U ! a U a U !a b & U ! b U b U !b c & U ! c U c U !c d U ! d U d U !d h
strictly_ordered_visit,"['a', 'b', 'c', 'd', 'h']",first visit a then visit b then visit c then visit d finally visit h,& & U ! b a & U ! c b & U ! d c & U ! h d F h & U ! a U a U !a b & U ! b U b U !b c & U ! c U c U !c d U ! d U d U !d h
strictly_ordered_visit,"['a', 'b', 'c', 'd', 'h']",go to a then b then c then d then h in that order,& & U ! b a & U ! c b & U ! d c & U ! h d F h & U ! a U a U !a b & U ! b U b U !b c & U ! c U c U !c d U ! d U d U !d h
strictly_ordered_visit,"['a', 'b', 'c', 'd', 'h']",go from a to b to c to d to h in that order,& & U ! b a & U ! c b & U ! d c & U ! h d F h & U ! a U a U !a b & U ! b U b U !b c & U ! c U c U !c d U ! d U d U !d h
strictly_ordered_visit,"['a', 'b', 'c', 'd', 'h']",start at a then go to b third go to c fourth go to d finally go to h,& & U ! b a & U ! c b & U ! d c & U ! h d F h & U ! a U a U !a b & U ! b U b U !b c & U ! c U c U !c d U ! d U d U !d h
fair_visit,"['a', 'b']",visit a and b but the number of times you visit a can never exceed the number of times you visit b by more than one,& & F a F b & G i a W a & ! a W ! a b G i b W b & ! b W ! b a
fair_visit,"['a', 'b']",go to a and b but the difference between the number of times you go to a and b is at most one,& & F a F b & G i a W a & ! a W ! a b G i b W b & ! b W ! b a
fair_visit,"['a', 'b']",fairly visit a and b that means the number of times you go to one location can be at most one more than the number of times you go to the other location,& & F a F b & G i a W a & ! a W ! a b G i b W b & ! b W ! b a
fair_visit,"['a', 'b', 'c']",visit a and b and c but the number of times you visit any one location can never exceed the number of times you visit any other location by more than one,& & F a & F b F c & G i a W a & ! a W ! a b & G i b W b & ! b W ! b c G i c W c & ! c W ! c a
fair_visit,"['a', 'b', 'c']",go to a and b and c but the difference between the number of times you go to any two locations a b or a c or b c is at most one,& & F a & F b F c & G i a W a & ! a W ! a b & G i b W b & ! b W ! b c G i c W c & ! c W ! c a
fair_visit,"['a', 'b', 'c']",fairly visit a and b and c that means the number of times you go to any one location can be at most one more than the number of times you go to any other location,& & F a & F b F c & G i a W a & ! a W ! a b & G i b W b & ! b W ! b c G i c W c & ! c W ! c a
fair_visit,"['a', 'b', 'c', 'd']",visit locations a and b and c and d but the number of times you visit any one location can never exceed the number of times you visit any other location by more than one,& & F a & F b & F c F d & G i a W a & ! a W ! a b & G i b W b & ! b W ! b c & G i c W c & ! c W ! c d G i d W d & ! d W ! d a
fair_visit,"['a', 'b', 'c', 'd']",go to locations a and b and c and d but the difference between the number of times you go to any two locations is at most one,& & F a & F b & F c F d & G i a W a & ! a W ! a b & G i b W b & ! b W ! b c & G i c W c & ! c W ! c d G i d W d & ! d W ! d a
fair_visit,"['a', 'b', 'c', 'd']",fairly visit locations a and b and c and d that means the number of times you go to any one location can be at most one more than the number of times you go to any other location,& & F a & F b & F c F d & G i a W a & ! a W ! a b & G i b W b & ! b W ! b c & G i c W c & ! c W ! c d G i d W d & ! d W ! d a
fair_visit,"['a', 'b', 'c', 'd', 'h']",visit locations a and b and c and d and h but the number of times you visit any one location can never exceed the number of times you visit any other location by more than one,& & F a & F b & F c & F d F h & G i a W a & ! a W ! a b & G i b W b & ! b W ! b c & G i c W c & ! c W ! c d & G i d W d & ! d W ! d h G i h W h & ! h W ! h a
fair_visit,"['a', 'b', 'c', 'd', 'h']",go to locations a and b and c and d and h but the difference between the number of times you go to any two locations is at most one,& & F a & F b & F c & F d F h & G i a W a & ! a W ! a b & G i b W b & ! b W ! b c & G i c W c & ! c W ! c d & G i d W d & ! d W ! d h G i h W h & ! h W ! h a
fair_visit,"['a', 'b', 'c', 'd', 'h']",fairly visit locations a and b and c and d and h that means the number of times you go to any one location can be at most one more than the number of times you go to any other location,& & F a & F b & F c & F d F h & G i a W a & ! a W ! a b & G i b W b & ! b W ! b c & G i c W c & ! c W ! c d & G i d W d & ! d W ! d h G i h W h & ! h W ! h a
fair_visit,"['a', 'b', 'c']",visit a b and c the same number of times,& & F a & F b F c & G i a W a & ! a W ! a b & G i b W b & ! b W ! b c G i c W c & ! c W ! c a
fair_visit,"['a', 'b', 'c']",if you go to one of the landmarks a b or c at any point you must visit the other two you missed,& & F a & F b F c & G i a W a & ! a W ! a b & G i b W b & ! b W ! b c G i c W c & ! c W ! c a
fair_visit,"['a', 'b', 'c']",go to b c and a an equal number of times,& & F a & F b F c & G i a W a & ! a W ! a b & G i b W b & ! b W ! b c G i c W c & ! c W ! c a
fair_visit,"['a', 'b', 'c']",visit a c and b at the same rate,& & F a & F b F c & G i a W a & ! a W ! a b & G i b W b & ! b W ! b c G i c W c & ! c W ! c a
fair_visit,"['a', 'b', 'c']",if you visit a visit b and c if you visit b visit a and c if you visit c visit a and b,& & F a & F b F c & G i a W a & ! a W ! a b & G i b W b & ! b W ! b c G i c W c & ! c W ! c a
fair_visit,"['a', 'b', 'c', 'd', 'h']",visit a h c b and d the same number of times,& & F a & F b & F c & F d F h & G i a W a & ! a W ! a b & G i b W b & ! b W ! b c & G i c W c & ! c W ! c d & G i d W d & ! d W ! d h G i h W h & ! h W ! h a
fair_visit,"['a', 'b', 'c', 'd', 'h']",for each time you go to one of the landmarks a b d c or h you must go to the others you missed,& & F a & F b & F c & F d F h & G i a W a & ! a W ! a b & G i b W b & ! b W ! b c & G i c W c & ! c W ! c d & G i d W d & ! d W ! d h G i h W h & ! h W ! h a
fair_visit,"['a', 'b', 'c', 'd', 'h']",visit c h a d and b equally,& & F a & F b & F c & F d F h & G i a W a & ! a W ! a b & G i b W b & ! b W ! b c & G i c W c & ! c W ! c d & G i d W d & ! d W ! d h G i h W h & ! h W ! h a
fair_visit,"['a', 'b', 'c', 'd', 'h']",go to a b c d and h an equal number of times,& & F a & F b & F c & F d F h & G i a W a & ! a W ! a b & G i b W b & ! b W ! b c & G i c W c & ! c W ! c d & G i d W d & ! d W ! d h G i h W h & ! h W ! h a
fair_visit,"['a', 'b', 'c', 'd', 'h']",please attend c a d h and b an identical number of times,& & F a & F b & F c & F d F h & G i a W a & ! a W ! a b & G i b W b & ! b W ! b c & G i c W c & ! c W ! c d & G i d W d & ! d W ! d h G i h W h & ! h W ! h a
patrolling,"['a', 'b']",move around a and b,& G F a G F b
patrolling,"['a', 'b']",cycle through a and b,& G F a G F b
patrolling,"['a', 'b']",go through b and a in a cycle,& G F a G F b
patrolling,"['a', 'b']",keep on visiting a and b,& G F a G F b
patrolling,"['a', 'b']",travel to a and b multiple times,& G F a G F b
patrolling,"['a', 'b', 'c']",move through a b and c in a circle,& G F a & G F b G F c
patrolling,"['a', 'b', 'c']",cycle through c a and b,& G F a & G F b G F c
patrolling,"['a', 'b', 'c']",travel through a c and b multiple times in a row,& G F a & G F b G F c
patrolling,"['a', 'b', 'c']",continuously move to c b and a,& G F a & G F b G F c
patrolling,"['a', 'b', 'c']",circle around a b and c,& G F a & G F b G F c
patrolling,"['a', 'b', 'c', 'd', 'h']",circle around h d c b and a,& G F a & G F b & G F c & G F d G F h
patrolling,"['a', 'b', 'c', 'd', 'h']",visit b c a d and h multiple times,& G F a & G F b & G F c & G F d G F h
patrolling,"['a', 'b', 'c', 'd', 'h']",go to a d c h and b in a continuous cycle,& G F a & G F b & G F c & G F d G F h
patrolling,"['a', 'b', 'c', 'd', 'h']",at every time step go to a b c d and h,& G F a & G F b & G F c & G F d G F h
patrolling,"['a', 'b', 'c', 'd', 'h']",cycle through d h b c and a,& G F a & G F b & G F c & G F d G F h
visit,"['a', 'b', 'c', 'd', 'h']",visit a b c d and h in no specific order,& F a & F b & F c & F d F h
visit,"['a', 'b', 'c', 'd', 'h']",reach a b c d and h in any order,& F a & F b & F c & F d F h
visit,"['a', 'b', 'c', 'd', 'h']",make sure you go to a b c d h in any order,& F a & F b & F c & F d F h
visit,"['a', 'b', 'c', 'd', 'h']",you must visit a b c d h but it can be done in any order,& F a & F b & F c & F d F h
visit,"['a', 'b', 'c', 'd', 'h']",in no particular order visit a b c d h,& F a & F b & F c & F d F h
strictly_ordered_visit,"['a', 'b', 'c']",visit a exactly once do not visit b or c before a then visit b exactly once  do not visit c before b finally visit c,& & U ! b a & U ! c b F c & U ! a U a U !a b U ! b U b U !b c
strictly_ordered_visit,"['a', 'b', 'c']",go to a exactly once then go to b exactly once finally go to c do not go to b or c before a do not go to c before b,& & U ! b a & U ! c b F c & U ! a U a U !a b U ! b U b U !b c
strictly_ordered_visit,"['a', 'b', 'c']",visit a exactly once while avoiding b and c then visit b exactly once while avoiding c finally visit c,& & U ! b a & U ! c b F c & U ! a U a U !a b U ! b U b U !b c
strictly_ordered_visit,"['a', 'b', 'c']",go to a exactly once while avoiding b and c then go to b exactly once while avoiding c finally go to c,& & U ! b a & U ! c b F c & U ! a U a U !a b U ! b U b U !b c
strictly_ordered_visit,"['a', 'b', 'c']",visit a exactly once avoid b or c before a then reach b exactly once  avoid c before b finally move to c,& & U ! b a & U ! c b F c & U ! a U a U !a b U ! b U b U !b c
sequenced_visit,"['a', 'b', 'c', 'd', 'h']",go to a then go to b then go to c then go to d finally go to h,F & a F & b F & c F & d F h
sequenced_visit,"['a', 'b', 'c', 'd', 'h']",visit a then visit b then visit c then visit d finally visit h,F & a F & b F & c F & d F h
sequenced_visit,"['a', 'b', 'c', 'd', 'h']",move to a then move to b then move to c then move to d finally move to h,F & a F & b F & c F & d F h
sequenced_visit,"['a', 'b', 'c', 'd', 'h']",first go to a then move to b then go visit c then visit d finally reach h,F & a F & b F & c F & d F h
sequenced_visit,"['a', 'b', 'c', 'd', 'h']",first make you way to a then you must go to b after that visit c then move to d finally reach h,F & a F & b F & c F & d F h
strictly_ordered_visit,"['a', 'b']",go to a only once but keep away from b and then visit b but keep away from a,& & U ! b a F b U ! a U a U !a b
strictly_ordered_visit,"['a', 'b']",visit a one time but not through b and head to b after a is visited but not through a,& & U ! b a F b U ! a U a U !a b
strictly_ordered_visit,"['a', 'b']",stay away from b until you make a single visit to a and then go to b while staying away from a,& & U ! b a F b U ! a U a U !a b
strictly_ordered_visit,"['a', 'b']",avoid b initially when a is not visited and then just visit a once and then visit b while avoiding a,& & U ! b a F b U ! a U a U !a b
strictly_ordered_visit,"['a', 'b']",do not visit b before you visit a and then go to b without revisiting a,& & U ! b a F b U ! a U a U !a b
sequenced_visit,"['a', 'b', 'c']",go to a then go to b then go to c,F & a F & b F c
sequenced_visit,"['a', 'b', 'c']",move to a then move to b then move to c,F & a F & b F c
sequenced_visit,"['a', 'b', 'c']",visit a then visit b then reach c,F & a F & b F c
sequenced_visit,"['a', 'b', 'c']",visit a then visit b finally reach c,F & a F & b F c
sequenced_visit,"['a', 'b', 'c']",move to a then move to b finally reach c,F & a F & b F c
ordered_visit,"['a', 'b', 'c']",go to a at least once while avoiding b and c then go to b at least once while avoiding c finally go to c,& U ! b a & U ! c b F c
ordered_visit,"['a', 'b', 'c']",visit a at least once do not visit b or c before a then visit b at least once do not visit c before b finally visit c,& U ! b a & U ! c b F c
ordered_visit,"['a', 'b', 'c']",visit a at least once then visit b at least once finally visit c do not visit b or c before a do not visit c before b,& U ! b a & U ! c b F c
ordered_visit,"['a', 'b', 'c']",move to a at least once do not visit b or c before a then move to b at least once do not visit c before b finally reach c,& U ! b a & U ! c b F c
ordered_visit,"['a', 'b', 'c']",move to a while avoiding b and c then move to b while avoiding c finally reach c,& U ! b a & U ! c b F c
strictly_ordered_visit,"['a', 'b', 'c', 'd']",go to a only once but keep away from b c and d and then go to b only once but keep away from a c and d and then go to c only once but keep way from a b and d and finally go to d once but keep away from a b and c,& & U ! b a & U ! c b & U ! d c F d & U ! a U a U !a b & U ! b U b U !b c U ! c U c U !c d
strictly_ordered_visit,"['a', 'b', 'c', 'd']",visit a one time but not through b c or d and then visit b once but not through a c or d and then visit c once but not through a b or d and then visit d once but not through a b or c,& & U ! b a & U ! c b & U ! d c F d & U ! a U a U !a b & U ! b U b U !b c U ! c U c U !c d
strictly_ordered_visit,"['a', 'b', 'c', 'd']",stay away from b c and d until you make a single visit to a and then make your way to b while staying away from a c and d and then make your way to c while staying away from a b or d and finally make your way to d while staying away from a b and c,& & U ! b a & U ! c b & U ! d c F d & U ! a U a U !a b & U ! b U b U !b c U ! c U c U !c d
strictly_ordered_visit,"['a', 'b', 'c', 'd']",head to a b c and d in this order without skipping or revisiting any one of them,& & U ! b a & U ! c b & U ! d c F d & U ! a U a U !a b & U ! b U b U !b c U ! c U c U !c d
strictly_ordered_visit,"['a', 'b', 'c', 'd']",visit each of a b c and d exactly once in this order,& & U ! b a & U ! c b & U ! d c F d & U ! a U a U !a b & U ! b U b U !b c U ! c U c U !c d
patrolling,"['a', 'b', 'c']",visit a b and c indefinitely,& G F a & G F b G F c
patrolling,"['a', 'b', 'c']",do not stop going to c a and b,& G F a & G F b G F c
patrolling,"['a', 'b', 'c']",travel to b c and a infinitely,& G F a & G F b G F c
patrolling,"['a', 'b', 'c']",explore b a and c forever,& G F a & G F b G F c
patrolling,"['a', 'b', 'c', 'd']",continuously visit a b c and d,& G F a & G F b & G F c G F d
patrolling,"['a', 'b', 'c', 'd']",do not go to c a d and b a finite number of times,& G F a & G F b & G F c G F d
patrolling,"['a', 'b', 'c', 'd']",perpetually travel to b c and a,& G F a & G F b & G F c G F d
patrolling,"['a', 'b', 'c', 'd']",explore b a and c endlessy,& G F a & G F b & G F c G F d
patrolling,"['a', 'b', 'c', 'd']",you are prohibited from not infinitely going to d c a and b,& G F a & G F b & G F c G F d
patrolling,"['a', 'b', 'c', 'd', 'h']",do not go to c a d h and b a finite number of times,& G F a & G F b & G F c & G F d G F h
patrolling,"['a', 'b', 'c', 'd', 'h']",visit a b h d and c with no limits,& G F a & G F b & G F c & G F d G F h
patrolling,"['a', 'b', 'c', 'd', 'h']",you are prohibited from not going to d c h b and a forever,& G F a & G F b & G F c & G F d G F h
patrolling,"['a', 'b', 'c', 'd', 'h']",you cannot stop traveling to c a h b and d,& G F a & G F b & G F c & G F d G F h
patrolling,"['a', 'b', 'c', 'd', 'h']",you are not allowed to cease exploring a b c d and h,& G F a & G F b & G F c & G F d G F h
patrolling,"['a', 'b', 'c', 'd']",keep visiting a b c and d in no specific order,& G F a & G F b & G F c G F d
