,nl_command,ltl,map_name,result,eq
4758,go to CPCC Central High at least once while avoiding CPCC Citizens Center and Halton Theatre then go to CPCC Citizens Center at least once while avoiding Halton Theatre finally go to Halton Theatre,& U ! cpcc_citizens_center cpcc_central_high & U ! halton_theatre cpcc_citizens_center F halton_theatre,Charlotte #1,"error:['&', '&', 'U', '!', 'lm(', 'CPCC', 'Citizens', ')lm', 'lm(', 'lm(', 'CPCC', 'Central', ')lm', '&', 'U', '!', 'lm(', 'CPCC', 'Theatre', ')lm', 'lm(', 'lm(', 'Citizens', 'Citizens', 'Center', ')lm', 'F', 'lm(', 'Theatre', 'Theatre', ')lm', '&', 'U', '!', 'lm(', 'CPCC', 'Central', ')lm', 'U', 'lm(', 'lm(', 'CPCC', 'Central', ')lm', 'U', '!', 'lm(', 'CPCC', 'Central', ')lm', 'Center', ')lm', 'CPCC', 'CPCC', 'Citizens', ')lm', 'U', '!', 'lm(', 'CPCC', 'CPCC', 'Citizens', 'Center', ')lm', 'lm(', 'Citizens', 'Citizens', 'Citizens', ')lm', 'U', '!', 'lm(', 'lm(', 'Citizens', 'Citizens', 'Center', ')lm', 'lm(', 'Theatre', ')lm']",False
4759,go to Halton Theatre at least once while avoiding CPCC Health Careers and CPCC Central High then go to CPCC Health Careers at least once while avoiding CPCC Central High finally go to CPCC Central High,& U ! cpcc_health_careers halton_theatre & U ! cpcc_central_high cpcc_health_careers F cpcc_central_high,Charlotte #1,"error:['&', '&', 'U', '!', 'lm(', 'CPCC', 'CPCC', 'Health', ')lm', 'lm(', 'lm(', 'Theatre', ')lm', '&', 'U', '!', 'lm(', 'CPCC', ')lm', ')lm', 'Health', 'lm(', ')lm', ')lm', 'Health', 'lm(', ')lm', 'Health', 'Health', 'lm(', ')lm', ')lm', 'lm(', 'lm(', 'Theatre', 'Theatre', ')lm', 'U', '!', 'lm(', 'Halton', 'Theatre', ')lm', 'lm(', 'lm(', 'Halton', 'Theatre', ')lm', 'U', '!', 'lm(', 'Halton', 'Health', 'Health', 'Health', ')lm', ')lm', 'Health', 'lm(', 'Health', 'Health', 'Health', ')lm', ')lm', 'Health', 'lm(', 'Health', 'Health', 'Health', ')lm', ')lm', 'Health', 'Health', 'lm(', 'Health', ')lm', 'Health', ')lm', ')lm', ')lm', ')lm', ')lm', ')lm']",False
4760,visit CPCC Overcash - Arts Wing at least once do not visit CPCC Giles Science Center or CPCC Pease Auditorium before CPCC Overcash - Arts Wing then visit CPCC Giles Science Center at least once do not visit CPCC Pease Auditorium before CPCC Giles Science Center finally visit CPCC Pease Auditorium,& U ! cpcc_giles_science_center cpcc_overcash_-_arts_wing & U ! cpcc_pease_auditorium cpcc_giles_science_center F cpcc_pease_auditorium,Charlotte #1,"error:['&', '&', 'U', '!', 'lm(', 'CPCC', 'CPCC', ')lm', 'lm(', 'lm(', 'CPCC', '-', 'Arts', 'Center', ')lm', '&', 'U', '!', 'lm(', 'CPCC', 'CPCC', ')lm', 'Center', ')lm', 'lm(', 'CPCC', 'Giles', ')lm', 'F', 'lm(', 'lm(', 'CPCC', 'Arts', 'Center', ')lm', '&', 'U', '!', 'lm(', 'CPCC', '-', 'Arts', 'Center', ')lm', 'U', 'lm(', 'CPCC', ')lm', 'Arts', 'U', ')lm', 'U', '!', 'lm(', 'Arts', 'Arts', 'Arts', ')lm', ')lm', 'CPCC', 'CPCC', 'CPCC', 'Giles', 'Giles', ')lm', 'U', 'lm(', 'CPCC', 'CPCC', 'Giles', 'Giles', ')lm', 'U', 'lm(', 'CPCC', 'Giles', 'Giles', 'Giles', ')lm', 'U', 'lm(', 'lm(', 'Giles', 'Giles', ')lm', ')lm', 'lm(', 'lm(', 'lm(', ')lm', 'Center', ')lm', ')lm', ')lm', ')lm', 'Center', ')lm']",False
4761,visit CPCC Citizens Center at least once do not visit Little Sugar Creek or CPCC Faculty/Theatre Parking before CPCC Citizens Center then visit Little Sugar Creek at least once do not visit CPCC Faculty/Theatre Parking before Little Sugar Creek finally visit CPCC Faculty/Theatre Parking,& U ! little_sugar_creek cpcc_citizens_center & U ! cpcc_faculty/theatre_parking little_sugar_creek F cpcc_faculty/theatre_parking,Charlotte #1,"error:['&', '&', 'U', '!', 'lm(', 'Sugar', 'Sugar', ')lm', 'lm(', 'lm(', 'CPCC', ')lm', 'Center', ')lm', '&', 'U', '!', 'lm(', 'Sugar', 'Faculty/Theatre', ')lm', 'lm(', 'Little', 'Sugar', 'Sugar', ')lm', 'F', 'lm(', 'Sugar', 'Sugar', ')lm', '&', '&', '!', 'lm(', 'lm(', 'CPCC', 'Center', 'Center', ')lm', 'U', 'lm(', 'CPCC', 'Citizens', 'Center', ')lm', 'U', '!', 'lm(', 'CPCC', 'Citizens', 'Center', ')lm', 'lm(', 'Sugar', 'Sugar', 'Sugar', 'Sugar', ')lm', '!', 'lm(', 'Sugar', 'Sugar', 'Sugar', 'Sugar', 'U', 'lm(', 'Sugar', 'Sugar', 'Sugar', ')lm', 'U', '!', 'lm(', 'Sugar', 'Sugar', 'Creek', ')lm', 'lm(', 'lm(', ')lm', ')lm']",False
4762,visit CPCC Tate Tower at least once then visit Independence Park at least once finally visit CPCC Sloan-Morgan do not visit Independence Park or CPCC Sloan-Morgan before CPCC Tate Tower do not visit CPCC Sloan-Morgan before Independence Park,& U ! independence_park cpcc_tate_tower & U ! cpcc_sloan-morgan independence_park F cpcc_sloan-morgan,Charlotte #1,"error:['F', '&', 'U', '!', 'lm(', 'Park', ')lm', 'lm(', 'lm(', 'Park', ')lm', '&', 'U', '!', 'lm(', 'Park', 'Park', ')lm', 'lm(', 'lm(', ')lm', 'Park', ')lm', 'U', 'lm(', 'lm(', 'CPCC', 'Park', 'Park', ')lm', 'U', '!', 'lm(', 'CPCC', 'Tate', 'Park', ')lm', 'U', 'lm(', 'CPCC', 'Park', 'Park', ')lm', 'U', '!', 'lm(', 'Park', 'Park', 'Park', ')lm', 'lm(', 'lm(', 'Park', ')lm', ')lm', 'U', 'lm(', 'lm(', 'Park', 'Park', 'Park', ')lm', 'lm(', 'lm(', 'lm(', 'Park', 'Park', ')lm', ')lm', 'lm(', 'lm(', 'Park', ')lm']",False
4763,visit CPCC Worrell at least once then visit CPCC Citizens Center at least once finally visit CPCC Giles Science Center do not visit CPCC Citizens Center or CPCC Giles Science Center before CPCC Worrell do not visit CPCC Giles Science Center before CPCC Citizens Center,& U ! cpcc_citizens_center cpcc_worrell & U ! cpcc_giles_science_center cpcc_citizens_center F cpcc_giles_science_center,Charlotte #1,"error:['F', '&', 'U', '!', 'lm(', 'CPCC', ')lm', ')lm', 'lm(', 'lm(', ')lm', ')lm', 'Center', ')lm', '&', 'lm(', 'lm(', 'Giles', 'Center', 'Center', ')lm', '&', 'U', '!', 'lm(', 'Center', ')lm', 'Center', ')lm', 'U', 'lm(', 'CPCC', 'Worrell', 'Center', 'Center', ')lm', 'U', 'lm(', 'CPCC', 'Worrell', ')lm', 'Center', ')lm', 'U', 'lm(', 'CPCC', ')lm', 'Center', ')lm', 'U', 'lm(', 'lm(', ')lm', ')lm', 'Center', 'Center', ')lm', 'U', 'lm(', 'lm(', ')lm', 'Center', 'Center', 'Center', ')lm', 'lm(', 'lm(', ')lm', 'Center', 'Center', 'Center', ')lm', 'lm(', 'lm(', 'least', 'Center', 'Center', 'Center', ')lm', 'U', 'lm(', 'lm(', 'Center', ')lm', 'Center', ')lm', ')lm']",False
4764,move to CPCC Terrell at least once do not visit CPCC Pease Auditorium or CPCC before CPCC Terrell then move to CPCC Pease Auditorium at least once do not visit CPCC before CPCC Pease Auditorium finally reach CPCC,& U ! cpcc_pease_auditorium cpcc_terrell & U ! cpcc cpcc_pease_auditorium F cpcc,Charlotte #1,"error:['&', '&', 'U', '!', 'lm(', 'CPCC', 'CPCC', ')lm', 'lm(', 'lm(', 'lm(', ')lm', '&', 'U', '!', 'lm(', 'lm(', ')lm', ')lm', ')lm', 'lm(', 'Pease', ')lm', ')lm', 'lm(', 'lm(', 'CPCC', ')lm', '&', '&', 'U', '!', 'lm(', 'CPCC', 'CPCC', 'Terrell', ')lm', 'U', 'lm(', 'CPCC', 'Terrell', ')lm', ')lm', 'U', '!', 'lm(', 'CPCC', 'Terrell', ')lm', 'CPCC', 'CPCC', 'CPCC', 'Pease', 'Pease', 'Pease', ')lm', 'U', 'lm(', 'Pease', 'Pease', 'Pease', ')lm', 'U', 'lm(', 'lm(', 'Pease', 'Pease', ')lm', ')lm', ')lm', 'lm(', 'lm(', ')lm', ')lm']",False
4765,move to CPCC Central High at least once do not visit CPCC Giles Science Center or Little Sugar Creek before CPCC Central High then move to CPCC Giles Science Center at least once do not visit Little Sugar Creek before CPCC Giles Science Center finally reach Little Sugar Creek,& U ! cpcc_giles_science_center cpcc_central_high & U ! little_sugar_creek cpcc_giles_science_center F little_sugar_creek,Charlotte #1,"error:['F', '&', 'U', '!', 'lm(', 'CPCC', 'CPCC', ')lm', 'lm(', 'lm(', 'lm(', ')lm', '&', 'U', '!', 'lm(', 'lm(', ')lm', ')lm', 'Center', ')lm', 'lm(', 'Giles', 'Giles', ')lm', 'F', 'lm(', 'lm(', 'Sugar', 'CPCC', 'Center', ')lm', '&', 'U', '!', 'lm(', 'CPCC', 'Central', ')lm', ')lm', 'U', 'lm(', 'CPCC', 'Central', ')lm', ')lm', 'U', '!', 'lm(', 'CPCC', 'Central', ')lm', ')lm', 'CPCC', 'CPCC', 'Giles', 'Giles', 'Giles', ')lm', 'U', '!', 'lm(', 'CPCC', 'Giles', 'Giles', 'Giles', 'U', 'lm(', 'lm(', 'Giles', 'Giles', 'Giles', ')lm', 'U', 'lm(', 'lm(', 'Giles', 'Giles', ')lm', 'Center', ')lm', 'lm(', 'lm(', 'Center', ')lm', 'Little', 'Center', ')lm', 'Little', ')lm', ')lm', 'Little', 'Little', ')lm', ')lm', 'Little', 'Little', ')lm', ')lm']",False
4766,move to Central Piedmont Community College while avoiding Gloria Victus Monument and CPCC Pease Auditorium then move to Gloria Victus Monument while avoiding CPCC Pease Auditorium finally reach CPCC Pease Auditorium,& U ! gloria_victus_monument central_piedmont_community_college & U ! cpcc_pease_auditorium gloria_victus_monument F cpcc_pease_auditorium,Charlotte #1,"error:['&', '&', 'U', '!', 'lm(', 'Community', 'College', ')lm', 'lm(', 'lm(', 'Central', ')lm', ')lm', 'U', 'U', 'lm(', 'lm(', 'Gloria', ')lm', ')lm', 'lm(', 'lm(', ')lm', ')lm', 'lm(', 'lm(', ')lm', ')lm', 'U', 'U', 'lm(', 'Central', 'Piedmont', 'Piedmont', 'College', ')lm', 'U', 'lm(', 'Central', 'Piedmont', 'Piedmont', 'College', ')lm', 'U', 'lm(', 'lm(', 'College', ')lm', 'U', '!', 'lm(', 'lm(', ')lm', ')lm', ')lm', 'lm(', 'lm(', 'lm(', ')lm', ')lm', ')lm', ')lm', ')lm', ')lm', ')lm', ')lm', ')lm', ')lm', ')lm', ')lm']",False
4767,move to CPCC Overcash - Arts Wing while avoiding CPCC Library and CPCC Worrell then move to CPCC Library while avoiding CPCC Worrell finally reach CPCC Worrell,& U ! cpcc_library cpcc_overcash_-_arts_wing & U ! cpcc_worrell cpcc_library F cpcc_worrell,Charlotte #1,"error:['&', '&', 'U', '!', 'lm(', 'Overcash', 'and', 'Arts', ')lm', ')lm', 'lm(', 'CPCC', '-', 'Arts', 'Arts', ')lm', 'F', 'lm(', '!', 'lm(', 'CPCC', 'Library', ')lm', 'lm(', 'U', '!', 'lm(', '-', 'Arts', 'Arts', 'Arts', ')lm', 'U', '!', 'lm(', 'CPCC', 'Arts', 'Arts', 'Arts', ')lm', 'U', 'lm(', 'lm(', 'CPCC', 'Arts', 'Arts', 'Arts', 'Library', ')lm', 'lm(', 'lm(', 'Library', ')lm', ')lm', 'U', '!', 'lm(', 'Library', 'Library', 'Library', ')lm', 'U', 'lm(', 'lm(', 'Library', 'Library', ')lm', ')lm']",False
4768,go to CPCC Health Careers but not through Central Piedmont Community College or CPCC Kratt and then go to Central Piedmont Community College but not through CPCC Kratt and finally go to CPCC Kratt,& U ! central_piedmont_community_college cpcc_health_careers & U ! cpcc_kratt central_piedmont_community_college F cpcc_kratt,Charlotte #1,& & U ! central_piedmont_community_college cpcc_health_careers )lm U U cpcc_overcash lm( central_piedmont_community_college )lm College )lm F cpcc_overcash lm( cpcc_overcash lm( and )lm & U ! ! cpcc_overcash lm( CPCC Health Health Health Careers )lm U cpcc_overcash lm( Health Health Health Health Careers )lm U ! cpcc_overcash lm( Health Careers Health Health central_piedmont_community_college )lm cpcc_overcash lm( College )lm )lm U cpcc_overcash lm( cpcc_overcash lm( College College )lm U cpcc_overcash lm( central_piedmont_community_college U ! central_piedmont_community_college,False
4769,go to CPCC Advanced Technology Center but not through CPCC Faculty/Theatre Parking or CPCC and then go to CPCC Faculty/Theatre Parking but not through CPCC and finally go to CPCC,& U ! cpcc_faculty/theatre_parking cpcc_advanced_technology_center & U ! cpcc cpcc_faculty/theatre_parking F cpcc,Charlotte #1,"error:['&', '&', 'U', '!', 'lm(', 'CPCC', ')lm', ')lm', 'lm(', 'Center', ')lm', 'lm(', 'Center', ')lm', '&', 'U', '!', 'lm(', 'and', ')lm', ')lm', ')lm', 'U', '!', 'lm(', 'CPCC', 'Center', 'Center', ')lm', 'U', 'lm(', 'lm(', 'CPCC', 'Center', 'Center', ')lm', 'U', 'lm(', 'CPCC', 'Advanced', 'Center', ')lm', 'U', '!', 'lm(', 'CPCC', 'Faculty/Theatre', ')lm', 'U', '!', 'lm(', 'lm(', 'Faculty/Theatre', 'Faculty/Theatre', ')lm', ')lm', 'lm(', 'lm(', 'Faculty/Theatre', ')lm']",False
4770,make your way to CPCC Central High but keep avoiding CPCC Giles Science Center and CPCC Tate Tower and head to CPCC Giles Science Center but keep avoiding CPCC Tate Tower and then visit CPCC Tate Tower,& U ! cpcc_giles_science_center cpcc_central_high & U ! cpcc_tate_tower cpcc_giles_science_center F cpcc_tate_tower,Charlotte #1,"error:['&', '&', 'U', '!', 'lm(', 'CPCC', 'CPCC', ')lm', 'lm(', 'lm(', 'CPCC', ')lm', 'Center', ')lm', 'F', 'lm(', 'lm(', 'and', 'Center', ')lm', ')lm', 'U', '!', 'lm(', 'your', 'Central', 'Central', ')lm', 'U', 'U', 'lm(', 'your', 'Central', 'Central', ')lm', 'U', '!', 'lm(', 'your', 'Central', ')lm', 'Center', ')lm', 'lm(', 'lm(', 'Center', ')lm', 'U', '!', 'lm(', 'lm(', 'Center', ')lm', 'Center', ')lm', 'lm(', ')lm', 'Center', ')lm', 'U', '!', 'lm(', 'Center', ')lm', 'Center', ')lm', 'U', 'lm(', 'Center', ')lm', 'Center', ')lm']",False
4771,make your way to CPCC Advanced Technology Center but keep avoiding Gloria Victus Monument and CPCC Citizens Center and head to Gloria Victus Monument but keep avoiding CPCC Citizens Center and then visit CPCC Citizens Center,& U ! gloria_victus_monument cpcc_advanced_technology_center & U ! cpcc_citizens_center gloria_victus_monument F cpcc_citizens_center,Charlotte #1,"error:['&', '&', 'U', '!', 'lm(', 'Technology', 'avoiding', 'Center', ')lm', 'lm(', 'your', 'Advanced', ')lm', 'Center', ')lm', 'F', 'lm(', 'U', 'and', 'Center', ')lm', '&', 'U', '!', 'lm(', 'your', 'Advanced', 'Center', 'Center', ')lm', 'U', 'lm(', 'your', 'Advanced', 'Center', 'Center', 'U', '!', 'lm(', 'your', 'Advanced', 'Center', 'Center', 'U', 'lm(', 'lm(', ')lm', 'Center', 'Center', 'U', '!', 'lm(', 'lm(', ')lm', 'Center', 'Center', 'Center', ')lm', 'lm(', ')lm', 'Center', 'Center', 'Center', ')lm', 'U', 'lm(', 'lm(', 'Center', ')lm', 'Center', ')lm']",False
4772,direct yourself to CPCC Tate Tower but keep away from CPCC Citizens Center and CPCC Sloan-Morgan then go to CPCC Citizens Center but bypass CPCC Sloan-Morgan and eventually make your way to CPCC Sloan-Morgan,& U ! cpcc_citizens_center cpcc_tate_tower & U ! cpcc_sloan-morgan cpcc_citizens_center F cpcc_sloan-morgan,Charlotte #1,"error:['&', '&', 'U', '!', 'lm(', 'CPCC', 'Center', ')lm', 'lm(', 'lm(', 'yourself', ')lm', 'Center', ')lm', 'F', 'lm(', 'CPCC', 'and', ')lm', 'Center', ')lm', 'U', '!', 'lm(', 'yourself', 'yourself', ')lm', ')lm', 'U', 'lm(', 'lm(', 'yourself', 'yourself', ')lm', 'U', '!', 'lm(', 'yourself', 'CPCC', ')lm', 'Center', ')lm', 'lm(', 'Tate', ')lm', ')lm', 'Center', ')lm', 'U', 'lm(', 'lm(', 'Center', 'Center', 'Center', ')lm', 'U', 'lm(', 'lm(', 'Center', ')lm', 'Center', ')lm', ')lm', 'lm(', 'Center', ')lm', 'Center', 'Center', ')lm', ')lm', ')lm', 'Center', ')lm', 'Center', ')lm', ')lm']",False
4773,direct yourself to CPCC Tate Tower but keep away from CPCC Terrell and CPCC Health Careers then go to CPCC Terrell but bypass CPCC Health Careers and eventually make your way to CPCC Health Careers,& U ! cpcc_terrell cpcc_tate_tower & U ! cpcc_health_careers cpcc_terrell F cpcc_health_careers,Charlotte #1,"error:['&', '&', 'U', '!', 'lm(', 'CPCC', ')lm', ')lm', 'lm(', 'lm(', 'yourself', ')lm', 'Health', 'lm(', ')lm', ')lm', 'Health', 'lm(', 'and', 'Health', 'Health', ')lm', ')lm', 'U', '!', 'lm(', 'direct', 'yourself', 'Health', 'Health', 'U', ')lm', 'lm(', 'yourself', 'yourself', 'Tate', ')lm', 'U', 'lm(', 'lm(', 'CPCC', 'Tate', ')lm', 'U', '!', 'lm(', 'Tate', ')lm', ')lm', ')lm', ')lm', 'lm(', 'CPCC', 'CPCC', 'CPCC', ')lm', ')lm', ')lm', 'lm(', 'Health', 'CPCC', 'Health', ')lm', ')lm', 'Health', 'Health', ')lm', ')lm', 'Health', 'Health', ')lm', 'Health', 'Health', ')lm', ')lm', 'Health', 'Health', 'Health', ')lm', ')lm', 'Health', 'Health', ')lm', ')lm', 'Health', 'Health', ')lm', ')lm', 'Health', 'Health', ')lm', ')lm']",False
4774,keep away from Gloria Victus Monument and CPCC Health Careers while heading to CPCC Pease Auditorium and then keep away from CPCC Health Careers while heading to Gloria Victus Monument and eventually go to CPCC Health Careers,& U ! gloria_victus_monument cpcc_pease_auditorium & U ! cpcc_health_careers gloria_victus_monument F cpcc_health_careers,Charlotte #1,"error:['&', '&', 'U', '!', 'lm(', 'Monument', 'and', 'Health', 'Health', ')lm', ')lm', 'lm(', 'Gloria', 'Victus', ')lm', '&', 'U', '!', 'lm(', 'lm(', 'and', ')lm', 'Health', ')lm', ')lm', 'lm(', 'lm(', ')lm', 'Health', 'Health', ')lm', ')lm', 'F', 'lm(', 'lm(', 'Gloria', 'Victus', 'Health', ')lm', 'U', 'U', 'lm(', 'Gloria', 'Gloria', 'Gloria', ')lm', 'U', 'lm(', 'lm(', 'Gloria', 'Victus', 'Health', 'Health', 'U', '!', 'lm(', 'lm(', ')lm', 'Health', 'Health', 'Health', ')lm', ')lm', 'Health', 'Health', 'lm(', ')lm', ')lm', 'Health', 'Health', 'Health', ')lm', ')lm', 'Health', 'Health', ')lm', ')lm', 'Health', 'Health', ')lm', ')lm', 'Health', 'Health', ')lm']",False
4775,keep away from CPCC and CPCC Sloan-Morgan while heading to CPCC Central High and then keep away from CPCC Sloan-Morgan while heading to CPCC and eventually go to CPCC Sloan-Morgan,& U ! cpcc cpcc_central_high & U ! cpcc_sloan-morgan cpcc F cpcc_sloan-morgan,Charlotte #1,"error:['&', '&', 'U', '!', 'lm(', 'CPCC', 'and', ')lm', 'lm(', 'lm(', 'CPCC', 'CPCC', ')lm', 'lm(', 'lm(', ')lm', 'and', ')lm', ')lm', 'U', 'lm(', 'lm(', 'and', ')lm', ')lm', 'U', 'U', 'lm(', 'lm(', 'CPCC', 'and', ')lm', 'U', 'U', 'lm(', 'CPCC', 'and', ')lm', ')lm', ')lm', 'lm(', 'lm(', 'and', ')lm', ')lm', ')lm', ')lm', 'lm(', ')lm', ')lm', ')lm', ')lm', ')lm', ')lm', ')lm']",False
4776,visit CPCC Overcash CPCC Giles Science Center and CPCC Worrell in order but keep avoiding latter ones when you are heading to former ones,& U ! cpcc_giles_science_center cpcc_overcash & U ! cpcc_worrell cpcc_giles_science_center F cpcc_worrell,Charlotte #1,"error:['&', '&', 'U', '!', 'lm(', 'avoiding', 'latter', ')lm', 'lm(', 'lm(', 'CPCC', 'Overcash', ')lm', 'Center', ')lm', 'F', 'lm(', 'Center', ')lm', ')lm', 'U', '!', 'lm(', 'CPCC', 'Overcash', ')lm', 'Center', ')lm', 'lm(', 'CPCC', 'Overcash', 'CPCC']",False
4777,visit CPCC Overcash - Arts Wing CPCC Central High and Little Sugar Creek in order but keep avoiding latter ones when you are heading to former ones,& U ! cpcc_central_high cpcc_overcash_-_arts_wing & U ! little_sugar_creek cpcc_central_high F little_sugar_creek,Charlotte #1,"error:['&', '&', 'U', '!', 'lm(', 'avoiding', 'latter', ')lm', 'lm(', 'lm(', '-', 'Arts', 'Arts', 'Arts', ')lm', 'F', 'lm(', 'lm(', '-', 'Arts', 'Arts', ')lm', ')lm', 'U', 'lm(', 'lm(', 'CPCC', 'Arts', 'Arts', ')lm', ')lm', 'U', 'lm(', 'CPCC', 'Arts', 'Arts', 'Arts', ')lm', 'U', '!', 'lm(', 'CPCC', 'Arts', 'Arts', 'Wing', ')lm', 'lm(', 'lm(', 'High', 'latter', ')lm']",False
4778,visit Little Sugar Creek CPCC Health Careers and CPCC Central High where CPCC Health Careers does not proceed Little Sugar Creek and CPCC Central High does not proceed CPCC Health Careers,& U ! cpcc_health_careers little_sugar_creek & U ! cpcc_central_high cpcc_health_careers F cpcc_central_high,Charlotte #1,"error:['&', '&', 'U', '!', 'lm(', ')lm', ')lm', ')lm', ')lm', ')lm', ')lm', '&', '!', '!', 'lm(', 'Health', 'and', ')lm', ')lm', ')lm', ')lm', 'lm(', 'Health', 'Health', 'Careers', ')lm', ')lm', '!', '!', 'lm(', 'Sugar', 'Health', 'Health', 'Health', ')lm', ')lm', '!', 'lm(', 'Sugar', 'Health', 'Health', 'Health', ')lm', ')lm', '!', 'lm(', 'Health', 'Health', 'Health', 'Health', 'Health', ')lm', 'lm(', '!', 'lm(', 'Health', 'Health', 'Health', 'Health', 'Health', ')lm', ')lm', 'Health', 'Health', 'Health', ')lm', 'Health', 'Health', ')lm']",False
4779,visit Gloria Victus Monument CPCC Overcash - Arts Wing and Halton Theatre where CPCC Overcash - Arts Wing does not proceed Gloria Victus Monument and Halton Theatre does not proceed CPCC Overcash - Arts Wing,& U ! cpcc_overcash_-_arts_wing gloria_victus_monument & U ! halton_theatre cpcc_overcash_-_arts_wing F halton_theatre,Charlotte #1,"error:['&', '&', 'U', '!', 'lm(', 'lm(', ')lm', ')lm', ')lm', ')lm', ')lm', '&', 'Arts', '!', ')lm', '&', 'Theatre', ')lm', '&', 'U', '-', 'Arts', 'Arts', ')lm', ')lm', 'lm(', 'CPCC', 'Overcash', 'Arts', ')lm', ')lm', '&', '!', '!', 'lm(', 'Gloria', 'Arts', 'Arts', ')lm', ')lm', 'lm(', 'Gloria', 'Victus', 'Arts', 'Arts', ')lm', ')lm', '!', 'lm(', 'Arts', 'Arts', 'Arts', ')lm', ')lm', '!', 'lm(', 'Arts', 'Arts', 'Arts', ')lm', ')lm', '!', 'lm(', 'Arts', 'Arts', 'Arts', ')lm', ')lm', '!', 'lm(', 'Arts', 'Arts', 'Arts', ')lm', ')lm', '!', 'lm(', 'Arts', 'Arts', 'Arts', ')lm']",False
4780,go to CPCC Overcash - Arts Wing after you have visited CPCC Overcash and go to CPCC Giles Science Center after you have visited CPCC Overcash - Arts Wing,& U ! cpcc_overcash_-_arts_wing cpcc_overcash & U ! cpcc_giles_science_center cpcc_overcash_-_arts_wing F cpcc_giles_science_center,Charlotte #1,"error:['&', 'i', 'lm(', 'lm(', ')lm', ')lm', ')lm', 'G', 'G', '!', 'lm(', 'CPCC', 'Arts', 'Arts', 'Center', ')lm']",False
4781,go to CPCC Library after you have visited CPCC Central High and go to Little Sugar Creek after you have visited CPCC Library,& U ! cpcc_library cpcc_central_high & U ! little_sugar_creek cpcc_library F little_sugar_creek,Charlotte #1,"error:['G', 'i', 'lm(', 'CPCC', 'CPCC', ')lm', ')lm', 'G', '!', 'lm(', 'Little', 'Library', ')lm', 'Library', ')lm']",False
4782,visit Independence Park first while avoiding CPCC Overcash and then move to CPCC Overcash while avoiding CPCC Sloan-Morgan then visit CPCC Sloan-Morgan,& U ! cpcc_overcash independence_park & U ! cpcc_sloan-morgan cpcc_overcash F cpcc_sloan-morgan,Charlotte #1,"error:['&', '&', 'U', '!', 'lm(', 'move', 'and', ')lm', 'lm(', 'lm(', 'Park', 'Park', ')lm', 'lm(', 'lm(', ')lm', 'lm(', 'lm(', 'Park', ')lm', ')lm', 'U', 'lm(', 'lm(', 'Park', 'Park', ')lm', 'U', '!', 'lm(', 'Park', 'Park', 'Park', ')lm', 'lm(', 'lm(', 'Park', 'avoiding', ')lm', ')lm', 'U', '!', 'lm(', 'avoiding', 'avoiding', 'avoiding', ')lm', ')lm']",False
4783,visit CPCC Zeiss first while avoiding CPCC and then move to CPCC while avoiding Independence Park then visit Independence Park,& U ! cpcc cpcc_zeiss & U ! independence_park cpcc F independence_park,Charlotte #1,"error:['&', '&', 'U', '!', 'lm(', 'move', 'Park', ')lm', 'lm(', 'CPCC', 'Zeiss', ')lm', 'lm(', 'Park', ')lm', 'lm(', 'lm(', 'Park', 'Park', ')lm', 'U', '!', 'lm(', 'CPCC', 'Zeiss', ')lm', ')lm', 'U', 'lm(', 'CPCC', 'CPCC', ')lm', 'U', '!', 'lm(', 'CPCC', 'Zeiss', 'Zeiss', ')lm', 'Park', ')lm', 'lm(', 'Park', 'Park', ')lm']",False
4784,first go to CPCC Worrell then go to Little Sugar Creek only after CPCC Worrell finally go to CPCC only after Little Sugar Creek,& U ! little_sugar_creek cpcc_worrell & U ! cpcc little_sugar_creek F cpcc,Charlotte #1,& & U ! little_sugar_creek cpcc_overcash_-_arts_wing CPCC Worrell Creek )lm U ! cpcc_overcash lm( CPCC Worrell Sugar Creek )lm ! cpcc_overcash lm( little_sugar_creek U ! little_sugar_creek,False
4785,first go to CPCC Giles Science Center then go to Independence Park only after CPCC Giles Science Center finally go to CPCC Zeiss only after Independence Park,& U ! independence_park cpcc_giles_science_center & U ! cpcc_zeiss independence_park F cpcc_zeiss,Charlotte #1,"error:['&', '&', 'U', '!', 'lm(', 'Independence', 'Park', ')lm', 'lm(', 'CPCC', 'CPCC', 'Giles', 'Center', ')lm', '&', 'U', '!', 'lm(', 'lm(', 'Park', ')lm', 'lm(', 'Park', 'Park', ')lm', 'F', 'lm(', '!', '!', ')lm', 'Center', ')lm', '&', '!', 'lm(', 'lm(', 'CPCC', 'Giles', 'Center', ')lm', 'U', 'lm(', 'CPCC', 'Giles', 'Giles', 'Center', ')lm', '!', 'lm(', 'lm(', 'Park', 'Park', 'Park', ')lm', '!', 'lm(', 'lm(', 'Park', 'Park', 'Park', 'lm(', 'lm(', 'lm(', 'Park', 'Park', 'Park', ')lm', 'U', 'lm(', 'lm(', 'Park', 'Park', ')lm', 'U', 'lm(', 'lm(', 'Park', ')lm', ')lm', '!', 'lm(', 'lm(', ')lm', ')lm']",False
4786,first go to Little Sugar Creek while staying away from CPCC Tate Tower then go to CPCC Tate Tower while staying away from CPCC Kratt finally visit CPCC Kratt,& U ! cpcc_tate_tower little_sugar_creek & U ! cpcc_kratt cpcc_tate_tower F cpcc_kratt,Charlotte #1,"error:['&', '&', 'U', '!', 'lm(', 'CPCC', ')lm', ')lm', 'lm(', 'Little', 'Sugar', 'Creek', ')lm', ')lm', 'lm(', 'lm(', 'lm(', ')lm', ')lm', ')lm', 'U', 'lm(', 'lm(', 'Sugar', 'Creek', 'Creek', ')lm', 'U', '!', 'lm(', 'Little', 'Sugar', 'Creek', 'Creek', ')lm', 'U', 'lm(', 'lm(', 'Sugar', 'Creek', 'Creek', ')lm', ')lm', 'lm(', 'lm(', 'CPCC', 'Tate', ')lm', ')lm', ')lm', 'lm(', 'lm(', ')lm', ')lm']",False
4787,first go to Little Sugar Creek while staying away from CPCC Worrell then go to CPCC Worrell while staying away from CPCC Tate Tower finally visit CPCC Tate Tower,& U ! cpcc_worrell little_sugar_creek & U ! cpcc_tate_tower cpcc_worrell F cpcc_tate_tower,Charlotte #1,"error:['&', '&', 'U', '!', 'lm(', 'CPCC', ')lm', ')lm', 'lm(', 'Little', 'Sugar', 'Creek', ')lm', 'lm(', 'lm(', 'lm(', 'lm(', ')lm', ')lm', ')lm', 'lm(', 'lm(', 'lm(', 'Sugar', 'Creek', ')lm', 'U', '!', 'lm(', 'Little', 'Sugar', 'Creek', 'Creek', ')lm', 'U', 'lm(', 'lm(', 'Sugar', 'Creek', 'Creek', ')lm', ')lm', 'CPCC', 'lm(', 'CPCC', ')lm', ')lm', ')lm', 'lm(', 'lm(', 'lm(']",False
4788,go to CPCC Central High but do not go to CPCC Central High until you go to CPCC Health Careers first,& U ! cpcc_central_high cpcc_health_careers F cpcc_central_high,Charlotte #1,"error:['&', '&', 'U', '!', 'lm(', 'CPCC', 'Central', ')lm', 'lm(', 'CPCC', 'Central', ')lm', ')lm', 'U', '!', 'CPCC', 'Central', ')lm', ')lm', '!', 'lm(', 'lm(', 'CPCC', 'Central', ')lm', 'U', '!', 'lm(', 'CPCC', 'Central', 'High', ')lm', 'U', '!', 'lm(', 'CPCC', 'Central']",False
4789,go to Central Piedmont Community College but do not go to Central Piedmont Community College until you go to CPCC first,& U ! central_piedmont_community_college cpcc F central_piedmont_community_college,Charlotte #1,"error:['&', '&', 'U', '!', 'lm(', 'Central', 'College', ')lm', 'lm(', 'Central', 'Piedmont', 'Community', ')lm', ')lm', 'lm(', 'lm(', 'College', ')lm', ')lm', 'College', 'lm(', 'lm(', 'Central', 'Piedmont', 'Community', 'College', ')lm', 'U', 'lm(', 'Central', 'Piedmont', 'Community']",False
