,nl_command,ltl,map_name,result,eq
5692,visit Sidetrack The Chicago Diner Rolled Around Bakery - Corporate and Home Bistro in this strict order once the predecessor is visited you must visit the successor,& U ! the_chicago_diner sidetrack & U ! rolled_around_bakery_-_corporate the_chicago_diner & U ! home_bistro rolled_around_bakery_-_corporate F home_bistro,Chicago #2,"error:['&', '&', 'U', '!', 'lm(', 'The', ')lm', ')lm', 'lm(', 'The', 'Chicago', ')lm', '&', 'U', '!', 'lm(', 'The', ')lm', ')lm', 'lm(', 'Around', '-', '-', 'Corporate', ')lm', 'F', 'lm(', 'The', ')lm', ')lm', '&', 'U', '!', 'lm(', 'The', 'Chicago', ')lm', 'U', 'lm(', 'The', ')lm', ')lm', 'U', '!', 'lm(', 'The', 'Chicago', ')lm', 'lm(', 'The', '-', '-', ')lm', ')lm', 'U', '!', 'lm(', 'lm(', 'Around', '-', 'Corporate', ')lm', 'U', 'lm(', 'lm(', 'Around', '-', 'Corporate', ')lm', ')lm', '!', 'lm(', 'lm(', '-', '-', 'Corporate', ')lm', ')lm', 'lm(', ')lm', ')lm']",False
5693,visit Ann Sather Town Hall Pub Beatnix and Cocktail in this strict order once the predecessor is visited you must visit the successor,& U ! town_hall_pub ann_sather & U ! beatnix town_hall_pub & U ! cocktail beatnix F cocktail,Chicago #2,"error:['G', '&', 'U', '!', 'lm(', 'Beatnix', ')lm', 'lm(', 'lm(', 'Ann', 'Town', ')lm', ')lm', 'lm(', 'lm(', 'lm(', 'the', 'and', ')lm', ')lm', '!', 'lm(', 'lm(', 'Ann', 'Sather', ')lm', 'U', 'lm(', 'lm(', 'Ann', 'Town']",False
5694,do not visit successor without visiting the predecessor in the following strict order Wood Cocktail Sidetrack and Rolled Around Bakery - Corporate,& U ! cocktail wood & U ! sidetrack cocktail & U ! rolled_around_bakery_-_corporate sidetrack F rolled_around_bakery_-_corporate,Chicago #2,"error:['&', 'G', 'lm(', 'lm(', 'Wood', ')lm', 'lm(', 'lm(', 'lm(', 'Wood', 'the', ')lm', ')lm', '!', 'lm(', 'lm(', 'Wood', 'the', ')lm', ')lm', '!', 'lm(', 'lm(', 'Wood', 'the', ')lm', ')lm', '!', 'lm(', 'lm(', 'the', 'the', ')lm', ')lm', ')lm', '!', 'lm(', 'the', 'the', 'the', ')lm', ')lm', '!', 'lm(', 'lm(', 'the', 'the', 'the', ')lm', ')lm', '!', 'lm(', 'the', 'the', 'the', ')lm', ')lm', ')lm', 'lm(', 'lm(', 'the', 'the', 'the', ')lm', ')lm', ')lm', 'lm(', 'lm(', 'the', 'the', 'the', ')lm', ')lm']",False
5695,do not visit successor without visiting the predecessor in the following strict order Halsted St & Roscoe St Home Bistro XO and Wendt Playlot,& U ! home_bistro halsted_st_&_roscoe_st & U ! xo home_bistro & U ! wendt_playlot xo F wendt_playlot,Chicago #2,"error:['&', 'G', '!', 'lm(', 'St', ')lm', ')lm', ')lm', 'St', ')lm', ')lm', 'lm(', 'lm(', 'lm(', 'St', 'the', ')lm', 'F', '!', 'lm(', 'lm(', 'St', 'the', 'the', 'St', ')lm', 'F', 'lm(', 'lm(', 'the', 'the', ')lm', ')lm', 'F', 'lm(', 'lm(', 'the', 'the', 'the', 'St', ')lm', '!', 'lm(', 'lm(', 'the', 'the', 'the', ')lm', ')lm', '!', 'lm(', 'lm(', 'the', 'the', 'St', ')lm', 'St', 'lm(', 'lm(', 'the', 'the', 'the', 'St', ')lm', 'St', 'lm(', 'lm(', 'lm(', 'the', 'St', ')lm', 'St', ')lm', 'lm(', 'lm(', 'St', 'the', 'St', ')lm', 'St', ')lm', 'lm(', 'lm(', 'St', 'the', 'the', 'St', ')lm', ')lm', 'St', 'lm(', 'lm(', 'St', ')lm', 'the', ')lm', 'St', ')lm', ')lm', 'St', ')lm', 'the', ')lm', 'St', ')lm', 'St', ')lm', 'the', ')lm', ')lm', ')lm', 'St', ')lm', 'the', ')lm', 'the', ')lm', 'St', ')lm', 'St', ')lm', 'the', ')lm', 'the', ')lm', ')lm', ')lm', 'St', 'the', 'the', 'the', 'the', ')lm', ')lm', ')lm', 'St', ')lm', 'the', 'the', 'the', ')lm', ')lm', ')lm', 'St', 'the', 'the', 'the', 'the', ')lm', ')lm', ')lm', 'St', ')lm', 'the', 'the', 'the', 'the', ')lm', ')lm', ')lm', 'St', 'the', 'the', 'the', 'the', ')lm', ')lm', ')lm', 'St', 'the', 'the', 'the', 'the', ')lm', ')lm', ')lm', 'St', 'the', 'the', 'the', 'the', ')lm', ')lm', ')lm', 'St', 'the', 'the', 'the', 'the', ')lm', ')lm', ')lm', 'St', 'the', 'the', 'the', 'the', ')lm', ')lm']",False
5696,visit The Chicago Diner then Rolled Around Bakery - Corporate then Roscoe's Tavern & Cafe then Home Bistro while ensuring not to visit Rolled Around Bakery - Corporate before The Chicago Diner not to visit Roscoe's Tavern & Cafe before Rolled Around Bakery - Corporate not to visit Home Bistro before Roscoe's Tavern & Cafe,& U ! rolled_around_bakery_-_corporate the_chicago_diner & U ! roscoe's_tavern_&_cafe rolled_around_bakery_-_corporate & U ! home_bistro roscoe's_tavern_&_cafe F home_bistro,Chicago #2,"error:['&', '&', 'U', '!', 'lm(', 'Rolled', 'Cafe', ')lm', 'lm(', 'The', 'Chicago', ')lm', '&', 'U', '!', 'lm(', 'lm(', 'Cafe', ')lm', 'lm(', 'lm(', 'Cafe', ')lm', 'F', 'lm(', 'lm(', 'Cafe', ')lm', '&', 'U', '!', 'lm(', 'The', 'Cafe', ')lm', 'U', 'lm(', 'The', 'Chicago', ')lm', 'U', '!', 'lm(', 'The', 'Chicago', ')lm', 'lm(', 'Rolled', 'Around', '-', 'Corporate', ')lm', ')lm', 'U', '!', 'lm(', 'Around', 'Around', '-', 'Corporate', ')lm', 'U', 'lm(', 'lm(', 'Around', '-', 'Corporate', ')lm', 'U', '!', 'lm(', 'Cafe', 'Cafe', ')lm', 'U', 'lm(', 'lm(', 'Cafe', 'Cafe', ')lm', ')lm', 'Cafe', ')lm', ')lm', 'Cafe', ')lm', ')lm', 'Cafe', ')lm', ')lm']",False
5697,visit Yefseis Cafe then El Mariache Restaurant then Beatnix then Home Bistro while ensuring not to visit El Mariache Restaurant before Yefseis Cafe not to visit Beatnix before El Mariache Restaurant not to visit Home Bistro before Beatnix,& U ! el_mariache_restaurant yefseis_cafe & U ! beatnix el_mariache_restaurant & U ! home_bistro beatnix F home_bistro,Chicago #2,"error:['&', '&', 'U', '!', 'lm(', 'El', 'Mariache', 'Restaurant', ')lm', 'lm(', 'Yefseis', 'Cafe', ')lm', 'F', 'lm(', '!', '!', 'Restaurant', ')lm', 'Restaurant', ')lm', 'U', 'lm(', 'lm(', 'Cafe', 'Restaurant', ')lm', 'U', '!', 'lm(', 'Cafe', 'Cafe', ')lm', 'U', 'lm(', 'Yefseis', 'Cafe', 'Restaurant', 'U', '!', 'lm(', 'Yefseis', 'Cafe', 'Restaurant', ')lm', 'lm(', 'lm(', 'Restaurant', 'Restaurant', ')lm', 'U', '!', 'lm(', 'lm(', 'Restaurant', 'Restaurant', ')lm', 'lm(', 'lm(', ')lm', 'Restaurant', ')lm']",False
5698,visit 7-Eleven first while avoiding Yefseis Cafe then visit Yefseis Cafe while avoiding Shiawase Japanese Restaurant then visit Shiawase Japanese Restaurant while avoiding Pets First then visit Pets First,& U ! yefseis_cafe 7-eleven & U ! shiawase_japanese_restaurant yefseis_cafe & U ! pets_first shiawase_japanese_restaurant F pets_first,Chicago #2,"error:['&', '&', 'U', '!', 'lm(', 'Cafe', 'Cafe', ')lm', 'lm(', '7-Eleven', 'Cafe', ')lm', '&', 'U', '!', 'lm(', 'Shiawase', 'Japanese', 'Restaurant', ')lm', 'lm(', 'Yefseis', 'Cafe', ')lm', '&', 'U', '!', 'lm(', 'lm(', ')lm', ')lm', 'lm(', 'lm(', 'Restaurant', ')lm', 'lm(', 'lm(', ')lm', ')lm', '&', 'U', '!', 'lm(', '7-Eleven', 'Cafe', 'Cafe', 'Cafe', 'U', 'lm(', 'lm(', 'Cafe', 'Cafe', 'Cafe', 'Cafe', 'lm(', 'Cafe', 'Cafe', 'Cafe', 'Cafe', ')lm', 'U', 'lm(', 'lm(', 'Cafe', 'Cafe', 'Cafe', 'Cafe', ')lm', 'lm(', 'lm(', 'lm(', 'Restaurant', ')lm', 'U', '!', 'lm(', 'Restaurant', ')lm', 'U', '!', 'lm(', 'Restaurant', ')lm', 'U', 'Restaurant', 'lm(', 'Restaurant', ')lm', 'Restaurant', ')lm']",False
5699,visit Cocktail first while avoiding Beatnix then visit Beatnix while avoiding Wendt Playlot then visit Wendt Playlot while avoiding 7-Eleven then visit 7-Eleven,& U ! beatnix cocktail & U ! wendt_playlot beatnix & U ! 7-eleven wendt_playlot F 7-eleven,Chicago #2,"error:['&', '&', 'U', '!', 'lm(', 'Beatnix', 'Beatnix', ')lm', 'lm(', 'lm(', 'Cocktail', 'Beatnix', 'avoiding', ')lm', ')lm', 'lm(', 'lm(', 'Beatnix', 'Beatnix', 'avoiding', ')lm', ')lm', '!', 'lm(', 'lm(', 'Beatnix', ')lm', ')lm', 'U', '!', 'lm(', 'Cocktail', 'avoiding', 'avoiding', ')lm', ')lm', '!', 'lm(', 'Cocktail', 'avoiding', 'avoiding', 'avoiding', ')lm', ')lm', 'lm(', 'lm(', 'avoiding', 'avoiding', 'avoiding', ')lm']",False
5700,reach Town Hall Pub without going to Best Western Plus Hawthorne Terrace then go to Best Western Plus Hawthorne Terrace without passing Minibar then go to Minibar without passing Boystown finally go to Boystown,& U ! best_western_plus_hawthorne_terrace town_hall_pub & U ! minibar best_western_plus_hawthorne_terrace & U ! boystown minibar F boystown,Chicago #2,"error:['&', '&', 'U', '!', 'lm(', 'Best', ')lm', ')lm', 'lm(', 'lm(', 'Town', 'Hall', ')lm', ')lm', 'U', 'U', 'lm(', 'lm(', ')lm', ')lm', ')lm', 'lm(', 'lm(', 'Best', 'Western', ')lm', ')lm', 'F', 'lm(', 'lm(', 'Hall', 'Pub', ')lm', '&', 'U', '!', 'lm(', 'Town', 'Hall', 'Pub', ')lm', 'U', '!', 'lm(', 'Town', 'Hall', 'Best', ')lm', 'U', 'lm(', 'lm(', 'Best', 'Western', ')lm', ')lm', '!', 'lm(', 'lm(', 'Plus', 'Plus', ')lm', ')lm', '!', 'lm(', 'Hawthorne', 'Hawthorne', ')lm', 'U', '!', 'lm(', 'Best', 'Western', ')lm', 'U', '!', 'lm(', 'Best', 'Western', ')lm', 'U', '!', 'lm(', 'lm(', ')lm', ')lm', ')lm', ')lm', ')lm']",False
5701,reach Minibar without going to The Chicago Diner then go to The Chicago Diner without passing Shiawase Japanese Restaurant then go to Shiawase Japanese Restaurant without passing Broadway & Roscoe SB finally go to Broadway & Roscoe SB,& U ! the_chicago_diner minibar & U ! shiawase_japanese_restaurant the_chicago_diner & U ! broadway_&_roscoe_sb shiawase_japanese_restaurant F broadway_&_roscoe_sb,Chicago #2,"error:['&', '&', 'U', '!', 'lm(', 'The', 'Chicago', ')lm', 'lm(', 'The', 'Chicago', ')lm', '&', 'U', '!', 'lm(', 'Shiawase', 'Japanese', 'Restaurant', ')lm', 'lm(', 'The', 'Chicago', ')lm', '&', 'U', '!', 'lm(', '&', '&', ')lm', 'lm(', 'lm(', 'Shiawase', 'Restaurant', ')lm', 'F', 'lm(', 'lm(', '&', ')lm', '&', 'U', '!', 'lm(', 'lm(', 'Minibar', 'Chicago', ')lm', 'U', 'lm(', 'The', 'The', ')lm', 'U', '!', 'lm(', 'The', 'The', ')lm', 'The', 'lm(', 'The', 'The', ')lm', ')lm', '!', 'The', 'The', ')lm', ')lm', 'U', 'lm(', 'The', 'Chicago', 'Chicago', ')lm', 'U', '!', 'lm(', 'The', 'Chicago', ')lm', 'lm(', 'Restaurant', 'Restaurant', 'Restaurant', 'Restaurant', ')lm', 'U', 'lm(', 'lm(', 'Restaurant', 'Restaurant', 'Restaurant', ')lm', ')lm', 'lm(', ')lm', 'Restaurant', 'Restaurant', ')lm', ')lm', ')lm', ')lm', ')lm', ')lm', ')lm', ')lm']",False
5702,visit Halsted St & Roscoe St without visiting Nookie's then visit Nookie's without visiting Town Hall Pub then visit Town Hall Pub without visiting Wendt Playlot finally visit Wendt Playlot,& U ! nookie's halsted_st_&_roscoe_st & U ! town_hall_pub nookie's & U ! wendt_playlot town_hall_pub F wendt_playlot,Chicago #2,"error:['&', '&', 'U', '!', 'lm(', ""Nookie's"", ""Nookie's"", ')lm', 'lm(', 'lm(', 'Halsted', 'St', ')lm', ')lm', 'U', '!', 'lm(', 'lm(', 'St', ')lm', ')lm', ')lm', ')lm', 'lm(', 'lm(', 'St', ')lm', 'St', ')lm', 'U', 'lm(', 'Halsted', 'St', 'St', ')lm', 'U', '!', 'lm(', 'Halsted', 'St', 'St', ')lm', 'lm(', 'lm(', 'lm(', 'St', ')lm', ')lm', 'U', '!', 'lm(', 'St', 'St', 'St', ')lm', 'lm(', 'lm(', ')lm', ')lm']",False
5703,visit Wendt Playlot without visiting Beatnix then visit Beatnix without visiting Broadway & Roscoe SB then visit Broadway & Roscoe SB without visiting Halsted & Roscoe finally visit Halsted & Roscoe,& U ! beatnix wendt_playlot & U ! broadway_&_roscoe_sb beatnix & U ! halsted_&_roscoe broadway_&_roscoe_sb F halsted_&_roscoe,Chicago #2,"error:['&', '&', 'U', '!', 'lm(', 'Beatnix', 'Beatnix', ')lm', 'lm(', 'lm(', 'Wendt', 'Playlot', ')lm', ')lm', ')lm', ')lm', 'lm(', 'lm(', ')lm', ')lm', ')lm', 'U', '!', 'lm(', 'lm(', 'Wendt', 'Playlot', ')lm', 'U', '!', 'lm(', 'Wendt', 'Playlot', 'Playlot', ')lm', 'U', '!', 'lm(', 'Wendt', 'Playlot', 'visiting', ')lm', ')lm', 'lm(', 'lm(', '&', '&', ')lm', ')lm', 'U', 'lm(', 'lm(', '&', '&', ')lm', ')lm', ')lm', 'lm(', '&', '&', ')lm', ')lm', ')lm', 'lm(', '&', '&', ')lm']",False
5704,first go to Nookie's while avoiding Minibar then go to Minibar while staying away from El Mariache Restaurant then go to El Mariache Restaurant while staying away from XO then visit XO,& U ! minibar nookie's & U ! el_mariache_restaurant minibar & U ! xo el_mariache_restaurant F xo,Chicago #2,"error:['&', '&', 'U', '!', 'lm(', 'go', 'Restaurant', 'Restaurant', ')lm', 'lm(', ""Nookie's"", ""Nookie's"", ""Nookie's"", 'avoiding', ""Nookie's"", ')lm', 'F', 'lm(', 'lm(', 'Restaurant', 'Restaurant', ')lm', 'U', '!', 'lm(', ""Nookie's"", ""Nookie's"", ')lm', 'U', 'U', 'lm(', 'lm(', ""Nookie's"", ""Nookie's"", 'Minibar', ')lm', 'U', '!', 'lm(', ""Nookie's"", 'Restaurant', 'Restaurant', ')lm', 'U', 'lm(', 'lm(', ""Nookie's"", 'Minibar', 'Restaurant', ')lm', ')lm', 'lm(', 'lm(', 'Restaurant', 'Restaurant', 'Restaurant', ')lm', ')lm', 'lm(', 'lm(', 'lm(', ')lm', ')lm', ')lm', ')lm']",False
5705,first go to 7-Eleven while avoiding Sidetrack then go to Sidetrack while staying away from Jacquelines's then go to Jacquelines's while staying away from Shiawase Japanese Restaurant then visit Shiawase Japanese Restaurant,& U ! sidetrack 7-eleven & U ! jacquelines's sidetrack & U ! shiawase_japanese_restaurant jacquelines's F shiawase_japanese_restaurant,Chicago #2,"error:['&', '&', 'U', '!', 'lm(', 'go', 'Restaurant', ')lm', 'lm(', '7-Eleven', '7-Eleven', '7-Eleven', 'avoiding', '7-Eleven', ')lm', 'lm(', 'lm(', 'lm(', 'Restaurant', 'Restaurant', ')lm', 'U', '!', 'lm(', '7-Eleven', 'Sidetrack', 'Restaurant', ')lm', 'U', 'lm(', 'lm(', '7-Eleven', 'Sidetrack', ')lm', 'U', '!', 'lm(', '7-Eleven', 'Sidetrack', 'Restaurant', ')lm', 'U', 'lm(', 'lm(', '7-Eleven', 'Sidetrack', 'Sidetrack', ')lm', ')lm', 'lm(', 'lm(', 'Restaurant', 'Restaurant', 'Restaurant', ')lm', ')lm', 'lm(', 'lm(', ')lm', ')lm', ')lm', ')lm', 'lm(', 'lm(', 'lm(', ')lm', ')lm']",False
5706,go to 7-Eleven then Home Bistro then The Chicago Diner finally Nookie's you can not visit Home Bistro before 7-Eleven you can not visit The Chicago Diner before Home Bistro you can not visit Nookie's before The Chicago Diner,& U ! home_bistro 7-eleven & U ! the_chicago_diner home_bistro & U ! nookie's the_chicago_diner F nookie's,Chicago #2,"error:['&', '&', 'U', '!', 'lm(', 'The', ')lm', ')lm', 'lm(', 'The', ')lm', ')lm', 'U', 'lm(', 'The', 'The', ')lm', 'U', '!', 'lm(', 'The', ')lm', ')lm', 'U', 'lm(', 'The', 'The', ')lm', 'U', '!', 'lm(', 'The', ')lm', ')lm', 'U', 'lm(', 'The', ')lm', ')lm', 'U', '!', 'lm(', 'The', ')lm', ')lm', 'The', 'The', 'lm(', ')lm', ')lm', ')lm', 'The', 'lm(', 'The', ')lm', ')lm']",False
5707,go to Jacquelines's then Broadway & Roscoe SB then El Mariache Restaurant finally XO you can not visit Broadway & Roscoe SB before Jacquelines's you can not visit El Mariache Restaurant before Broadway & Roscoe SB you can not visit XO before El Mariache Restaurant,& U ! broadway_&_roscoe_sb jacquelines's & U ! el_mariache_restaurant broadway_&_roscoe_sb & U ! xo el_mariache_restaurant F xo,Chicago #2,"error:['&', '&', 'U', '!', 'lm(', 'El', 'Mariache', 'Restaurant', ')lm', 'lm(', ""Jacquelines's"", 'Broadway', 'Restaurant', ')lm', 'F', 'lm(', 'lm(', 'Restaurant', 'Restaurant', ')lm', 'U', '!', 'lm(', 'lm(', ""Jacquelines's"", 'Restaurant', ')lm', 'U', 'lm(', ""Jacquelines's"", 'Restaurant', 'Restaurant', ')lm', 'U', 'lm(', ""Jacquelines's"", ""Jacquelines's"", 'Restaurant', ')lm', 'lm(', 'lm(', 'lm(', 'Restaurant', 'Restaurant', ')lm', 'U', '!', 'lm(', 'Restaurant', 'Restaurant', ')lm', ')lm', 'lm(', 'lm(', 'Restaurant', 'Restaurant', ')lm']",False
5708,go to Roscoe's Tavern & Cafe but not through Cocktail Minibar Town Hall Pub or Pets First and then go to Cocktail but not through Minibar Town Hall Pub or Pets First and then go to Minibar but not through Town Hall Pub or Pets First and then go to Town Hall Pub but not through Pets First and finally go to Pets First,& U ! cocktail roscoe's_tavern_&_cafe & U ! minibar cocktail & U ! town_hall_pub minibar & U ! pets_first town_hall_pub F pets_first,Chicago #2,"error:['&', '&', 'U', '!', 'lm(', 'Cocktail', ')lm', ')lm', 'lm(', ""Roscoe's"", 'Cafe', ')lm', '&', 'U', '!', 'lm(', 'lm(', 'Cafe', ')lm', 'lm(', 'Cocktail', 'Minibar', ')lm', ')lm', 'lm(', 'U', 'lm(', 'lm(', 'Pets', ')lm', ')lm', '&', 'U', '!', 'lm(', ""Roscoe's"", 'Cafe', ')lm', '&', 'U', '!', 'lm(', ""Roscoe's"", 'Cafe', ')lm', 'U', '!', 'lm(', ""Roscoe's"", 'Cafe', ')lm', 'U', '!', 'lm(', 'Cafe', ')lm', 'U', '!', 'lm(', 'lm(', 'Cafe', ')lm', 'lm(', 'lm(', 'lm(', 'Minibar', 'Minibar', ')lm', 'U', '!', 'lm(', 'lm(', 'Minibar', 'Minibar', ')lm', 'U', 'lm(', 'lm(', 'Minibar', ')lm', 'U', '!', 'lm(', 'lm(', 'Minibar', ')lm', 'U', '!', 'lm(', 'lm(', ')lm', 'or', ')lm', 'U', '!', 'lm(', 'or', ')lm', ')lm', 'U', '!', 'lm(', 'or', ')lm', ')lm']",False
5709,go to Shiawase Japanese Restaurant but not through Jacquelines's Yefseis Cafe XO or Town Hall Pub and then go to Jacquelines's but not through Yefseis Cafe XO or Town Hall Pub and then go to Yefseis Cafe but not through XO or Town Hall Pub and then go to XO but not through Town Hall Pub and finally go to Town Hall Pub,& U ! jacquelines's shiawase_japanese_restaurant & U ! yefseis_cafe jacquelines's & U ! xo yefseis_cafe & U ! town_hall_pub xo F town_hall_pub,Chicago #2,"error:['&', '&', 'U', '!', 'lm(', ""Jacquelines's"", 'Cafe', ')lm', 'lm(', 'Shiawase', 'Japanese', 'Restaurant', ')lm', '&', 'U', '!', 'lm(', 'XO', 'Cafe', ')lm', 'lm(', 'Cafe', 'Cafe', ')lm', 'F', 'lm(', 'lm(', 'and', ')lm', 'Restaurant', ')lm', '&', 'U', '!', 'lm(', 'Shiawase', 'Restaurant', ')lm', '&', 'U', '!', 'lm(', 'Shiawase', 'Restaurant', 'Restaurant', ')lm', 'U', 'lm(', 'Shiawase', 'Restaurant', 'Cafe', ')lm', 'Cafe', 'lm(', 'lm(', 'Cafe', 'Cafe', ')lm', 'U', '!', 'lm(', 'Cafe', 'Cafe', ')lm', 'U', 'lm(', 'lm(', 'Cafe', ')lm', 'U', '!', 'lm(', 'Cafe', 'Cafe', ')lm', 'U', 'lm(', 'lm(', 'Cafe', 'Cafe', ')lm', 'U', '!', 'lm(', 'lm(', 'Cafe', ')lm', 'U', '!', 'lm(', 'lm(', 'Cafe', ')lm', 'U', '!', 'lm(', 'lm(', 'Cafe', ')lm', 'U', '!', 'lm(', 'lm(', 'Cafe', ')lm', ')lm', 'lm(', 'lm(', ')lm']",False
5710,go to Jacquelines's and only go to Best Western Plus Hawthorne Terrace only after Jacquelines's is visited and then go to Nookie's only after Jacquelines's and Best Western Plus Hawthorne Terrace are both visited and then go to Wendt Playlot only after Jacquelines's Best Western Plus Hawthorne Terrace and Nookie's are all visited and then go to Minibar only after Jacquelines's Best Western Plus Hawthorne Terrace Nookie's and Wendt Playlot are all visited,& U ! best_western_plus_hawthorne_terrace jacquelines's & U ! nookie's best_western_plus_hawthorne_terrace & U ! wendt_playlot nookie's & U ! minibar wendt_playlot F minibar,Chicago #2,"error:['&', '&', 'U', '!', 'lm(', 'Best', 'and', ')lm', 'lm(', 'lm(', ""Jacquelines's"", ""Jacquelines's"", ')lm', ')lm', 'U', '!', 'lm(', 'lm(', 'and', ')lm', ')lm', 'lm(', 'lm(', 'Hawthorne', ')lm', ')lm', 'U', 'lm(', 'lm(', 'lm(', ')lm', ')lm', ')lm', ')lm', ')lm', ')lm', ')lm', 'lm(', 'lm(', 'lm(', 'and', ')lm', '&', 'U', '!', 'lm(', ""Jacquelines's"", 'and', 'and', ')lm', 'U', '!', 'and', 'and', 'and', 'and', ')lm', '!', 'and', 'and', 'and', 'and', ')lm', ')lm', 'lm(', 'and', 'and', 'Plus', ')lm', ')lm', '!', 'lm(', 'lm(', 'and', ')lm', ')lm', ')lm', 'lm(', 'lm(', 'lm(', ')lm', 'and', ')lm', ')lm', ')lm', 'lm(', 'lm(', ')lm', ')lm', ')lm', ')lm', ')lm', ')lm', ')lm', ')lm', ')lm', ')lm', ')lm', ')lm', ')lm', ')lm', ')lm', ')lm', ')lm', ')lm', ')lm', ')lm', ')lm', ')lm', ')lm', ')lm', ')lm', ')lm', ')lm', ')lm', ')lm', ')lm']",False
5711,go to Halsted St & Roscoe St and only go to Pets First only after Halsted St & Roscoe St is visited and then go to Ann Sather only after Halsted St & Roscoe St and Pets First are both visited and then go to Cocktail only after Halsted St & Roscoe St Pets First and Ann Sather are all visited and then go to Town Hall Pub only after Halsted St & Roscoe St Pets First Ann Sather and Cocktail are all visited,& U ! pets_first halsted_st_&_roscoe_st & U ! ann_sather pets_first & U ! cocktail ann_sather & U ! town_hall_pub cocktail F town_hall_pub,Chicago #2,"error:['&', '&', 'U', '!', 'lm(', 'Town', ')lm', ')lm', 'lm(', 'lm(', 'Halsted', 'Halsted', 'Halsted', 'St', ')lm', '&', 'U', '!', 'lm(', 'Ann', 'and', ')lm', 'lm(', 'lm(', 'lm(', ')lm', 'St', ')lm', 'F', 'lm(', 'U', '!', 'lm(', ')lm', ')lm', ')lm', 'St', ')lm', '&', 'U', 'lm(', 'lm(', 'Halsted', ')lm', 'St', 'St', ')lm', 'U', 'lm(', 'lm(', 'Halsted', 'Halsted', 'St', 'St', ')lm', 'U', 'lm(', 'Halsted', 'St', 'St', 'St', ')lm', 'U', 'lm(', 'lm(', 'St', 'St', 'St', 'St', ')lm', 'lm(', 'lm(', 'lm(', 'St', 'St', ')lm', 'St', ')lm', 'lm(', 'lm(', ')lm', 'St', ')lm', 'St', ')lm', 'lm(', '!', 'lm(', 'lm(', 'St', ')lm', 'U', '!', 'lm(', 'lm(', 'St', ')lm', 'St', ')lm', 'U', '!', 'lm(', 'U', ')lm', 'St', ')lm', 'St', ')lm', 'U', '!', 'lm(', 'lm(', 'St', ')lm', 'St', ')lm', 'U', '!', 'lm(', 'lm(', 'St', ')lm', 'St', ')lm', 'U', 'lm(', 'lm(', ')lm', 'St', ')lm', ')lm', ')lm', 'lm(', 'lm(', 'St', ')lm', ')lm', 'St', ')lm', ')lm']",False
5712,make your way to Best Western Plus Hawthorne Terrace only after going to Nookie's before that make your way to Nookie's only after going to Halsted St & Roscoe St before that make your way to Halsted St & Roscoe St only after going to Pets First before that make your way to Pets First only after going to Wendt Playlot,& U ! pets_first wendt_playlot & U ! halsted_st_&_roscoe_st pets_first & U ! nookie's halsted_st_&_roscoe_st & U ! best_western_plus_hawthorne_terrace nookie's F best_western_plus_hawthorne_terrace,Chicago #2,"error:['&', '&', 'U', '!', 'lm(', 'Pets', ')lm', ')lm', 'lm(', 'lm(', 'lm(', ')lm', 'Halsted', 'Pets', ')lm', '&', 'U', '!', 'lm(', 'your', ')lm', ')lm', 'lm(', 'lm(', ')lm', ')lm', 'St', ')lm', '&', 'U', '!', 'lm(', 'Best', 'Western', 'Plus', ')lm', 'lm(', 'lm(', 'St', ')lm', 'F', 'U', '!', 'lm(', 'Best', 'Western', 'Plus', ')lm', '&', 'U', '!', 'lm(', 'Best', 'Western', ')lm', '&', 'U', '!', 'lm(', 'lm(', ')lm', ')lm', 'U', '!', 'lm(', 'lm(', ')lm', ')lm', 'U', '!', 'lm(', 'lm(', ')lm', ')lm', 'U', '!', 'lm(', 'lm(', ')lm', ')lm', 'U', '!', 'lm(', 'lm(', ')lm', ')lm', 'St', ')lm', ')lm', 'lm(', 'lm(', ')lm', 'St', ')lm', 'St', ')lm', 'lm(', 'lm(', 'St', ')lm', 'U', '!', 'lm(', 'lm(', 'St', ')lm', 'St', 'St', ')lm', 'U', '!', 'lm(', 'St', ')lm', 'St', ')lm', 'St', ')lm', 'U', '!', 'lm(', 'St', ')lm', 'St', ')lm', 'U', '!', 'lm(', 'St', ')lm', ')lm', 'St', ')lm', 'lm(', 'lm(', 'St', ')lm', ')lm', 'St', ')lm', 'U', '!', 'lm(', ')lm', ')lm', ')lm', 'St', ')lm', ')lm', 'U', '!', 'lm(', ')lm', 'St', ')lm', 'U', '!', 'lm(', ')lm', ')lm', ')lm', 'St', ')lm', ')lm', 'Western', 'Plus', 'Plus', ')lm']",False
5713,make your way to Wendt Playlot only after going to El Mariache Restaurant before that make your way to El Mariache Restaurant only after going to Pets First before that make your way to Pets First only after going to Home Bistro before that make your way to Home Bistro only after going to Cocktail,& U ! home_bistro cocktail & U ! pets_first home_bistro & U ! el_mariache_restaurant pets_first & U ! wendt_playlot el_mariache_restaurant F wendt_playlot,Chicago #2,& & U ! home_bistro )lm town_hall_pub lm( halsted_&_roscoe U ! wood halsted_&_roscoe U ! wood wood F halsted_&_roscoe,False
5714,visit Halsted & Roscoe Minibar Wendt Playlot El Mariache Restaurant and Broadway United Methodist Church in this order without skipping any one of them,& U ! minibar halsted_&_roscoe & U ! wendt_playlot minibar & U ! el_mariache_restaurant wendt_playlot & U ! broadway_united_methodist_church el_mariache_restaurant F broadway_united_methodist_church,Chicago #2,"error:['&', '&', 'U', '!', 'lm(', 'Playlot', 'Restaurant', ')lm', 'lm(', 'Halsted', '&', ')lm', '&', 'U', '!', 'lm(', 'United', 'Church', ')lm', 'lm(', 'El', 'Restaurant', ')lm', 'F', 'lm(', 'lm(', 'and', ')lm', ')lm', 'U', '!', 'lm(', 'Halsted', '&', 'Roscoe', ')lm', 'U', 'lm(', '&', '&', 'Roscoe', ')lm', 'U', '!', 'lm(', 'Halsted', '&', 'Roscoe', ')lm', 'lm(', 'Playlot', 'Restaurant', 'Restaurant', ')lm', 'U', '!', 'lm(', 'Wendt', 'Playlot', 'Restaurant', ')lm', 'lm(', 'lm(', 'El', 'Restaurant', ')lm', 'U', '!', 'lm(', 'El', 'Restaurant', 'Restaurant', ')lm', 'lm(', 'lm(', ')lm', ')lm']",False
5715,visit Sidetrack Broadway United Methodist Church Best Western Plus Hawthorne Terrace Wood and Halsted & Roscoe in this order without skipping any one of them,& U ! broadway_united_methodist_church sidetrack & U ! best_western_plus_hawthorne_terrace broadway_united_methodist_church & U ! wood best_western_plus_hawthorne_terrace & U ! halsted_&_roscoe wood F halsted_&_roscoe,Chicago #2,"error:['&', '&', 'U', '!', 'lm(', 'Best', ')lm', ')lm', 'lm(', 'lm(', 'Sidetrack', 'Church', ')lm', '&', 'U', '!', 'lm(', 'Wood', 'and', ')lm', 'lm(', 'lm(', 'Western', 'Church', ')lm', 'F', 'lm(', 'lm(', 'and', '&', ')lm', ')lm', '&', 'U', '!', 'lm(', 'Sidetrack', 'Broadway', 'Church', ')lm', 'U', 'lm(', 'Sidetrack', 'Broadway', 'Church', 'Church', 'U', 'U', 'lm(', 'lm(', 'Church', 'Church', 'Church', 'U', 'lm(', 'lm(', 'lm(', 'Church', 'Church', ')lm', 'U', 'lm(', 'lm(', 'Western', 'Western', ')lm', 'U', '!', 'lm(', 'lm(', 'Western', 'Western', ')lm', ')lm', 'lm(', 'lm(', 'lm(', 'Plus', ')lm', ')lm', ')lm', ')lm']",False
5716,do not go to Cocktail until Roscoe's Tavern & Cafe is visited and do not go to Roscoe's Tavern & Cafe until Home Bistro is visited and do not go to Home Bistro until Ann Sather is visited and do not go to Ann Sather until Town Hall Pub is visited,& U ! ann_sather town_hall_pub & U ! home_bistro ann_sather & U ! roscoe's_tavern_&_cafe home_bistro & U ! cocktail roscoe's_tavern_&_cafe F cocktail,Chicago #2,"error:['&', '&', 'U', '!', 'lm(', 'Ann', ')lm', ')lm', 'lm(', 'lm(', 'lm(', ')lm', ')lm', ')lm', ')lm', '&', 'U', '!', 'lm(', 'Cafe', ')lm', 'lm(', 'lm(', 'Cafe', ')lm', 'F', 'lm(', 'lm(', 'Cafe', ')lm', '&', 'U', '!', 'lm(', ""Roscoe's"", ""Roscoe's"", ')lm', ')lm', 'U', 'lm(', ""Roscoe's"", ""Roscoe's"", ')lm', ')lm', 'U', '!', 'lm(', ""Roscoe's"", ')lm', ')lm', ')lm', 'lm(', 'lm(', 'lm(', ')lm', ')lm', 'U', '!', 'lm(', 'lm(', ')lm', ')lm', ')lm', 'lm(', 'lm(', 'lm(', ')lm', ')lm', ')lm', ')lm', 'lm(', 'lm(', ')lm', ')lm']",False
