,nl_command,ltl,map_name,result,eq
6420,move to Diamond Restaurant at least once do not visit Commonwealth Animal Hospital or Fuel Pizza before Diamond Restaurant then move to Commonwealth Animal Hospital at least once do not visit Fuel Pizza before Commonwealth Animal Hospital finally reach Fuel Pizza,& U ! commonwealth_animal_hospital diamond_restaurant & U ! fuel_pizza commonwealth_animal_hospital F fuel_pizza,Charlotte #2,"error:['&', '&', 'U', '!', 'lm(', 'Commonwealth', 'Commonwealth', ')lm', 'lm(', 'lm(', 'Diamond', 'Restaurant', ')lm', '&', 'U', '!', 'lm(', 'Commonwealth', 'Pizza', 'Pizza', 'lm(', 'lm(', 'Animal', 'Animal', ')lm', 'F', 'lm(', 'Pizza', 'Pizza', ')lm', '&', 'U', '!', 'lm(', 'Diamond', 'Restaurant', ')lm', 'U', 'lm(', 'lm(', 'Restaurant', ')lm', 'U', '!', 'lm(', 'Restaurant', ')lm', ')lm', 'Commonwealth', 'Commonwealth', 'Commonwealth', 'Animal', ')lm', 'U', 'lm(', 'Commonwealth', 'Animal', 'Animal', ')lm', 'U', 'lm(', 'Commonwealth', 'Animal', 'Animal', ')lm', 'U', 'lm(', 'lm(', 'Animal', 'Animal', ')lm', ')lm', '!', 'lm(', 'Pizza', 'Pizza', ')lm', ')lm', 'lm(', 'Pizza', 'Pizza', ')lm']",False
6421,move to Common Market at least once do not visit Elizabeth Billiards or Dairy Queen before Common Market then move to Elizabeth Billiards at least once do not visit Dairy Queen before Elizabeth Billiards finally reach Dairy Queen,& U ! elizabeth_billiards common_market & U ! dairy_queen elizabeth_billiards F dairy_queen,Charlotte #2,"error:['&', '&', 'U', '!', 'lm(', 'Elizabeth', 'Elizabeth', ')lm', 'lm(', 'lm(', 'Elizabeth', ')lm', '&', 'U', '!', 'lm(', 'Elizabeth', ')lm', ')lm', 'lm(', 'lm(', 'Billiards', ')lm', 'F', 'lm(', 'lm(', 'Common', ')lm', '&', '&', 'U', '!', 'Common', 'Common', 'Market', ')lm', 'U', 'U', 'lm(', 'Common', 'Market', ')lm', ')lm', 'U', 'lm(', 'lm(', 'Elizabeth', 'Billiards', 'Billiards', ')lm', 'U', 'lm(', 'Elizabeth', 'Billiards', 'Billiards', 'Billiards', ')lm', 'U', 'lm(', 'Billiards', 'Billiards', 'Billiards', ')lm', 'U', 'lm(', 'lm(', 'Billiards', 'Billiards', ')lm', ')lm', ')lm', 'lm(']",False
6422,move to Common Market while avoiding Nova's Bakery and Fuel Pizza then move to Nova's Bakery while avoiding Fuel Pizza finally reach Fuel Pizza,& U ! nova's_bakery common_market & U ! fuel_pizza nova's_bakery F fuel_pizza,Charlotte #2,& & U ! public_library_of_charlotte_and_mecklenburg_county_-_plaza_midwood_branch )lm elizabeth_billiards lm( Common Market )lm )lm U ! elizabeth_billiards lm( Pizza Pizza )lm U ! elizabeth_billiards lm( elizabeth_billiards lm( Common Pizza )lm U elizabeth_billiards lm( Common Market Pizza )lm U ! elizabeth_billiards lm( Common Market Market )lm elizabeth_billiards lm( fuel_pizza U ! fuel_pizza,False
6423,move to Wells Fargo while avoiding Elizabeth Billiards and Dish then move to Elizabeth Billiards while avoiding Dish finally reach Dish,& U ! elizabeth_billiards wells_fargo & U ! dish elizabeth_billiards F dish,Charlotte #2,"error:['&', '&', 'U', '!', 'lm(', 'and', ')lm', ')lm', 'lm(', 'Wells', 'Fargo', ')lm', ')lm', 'lm(', 'lm(', 'lm(', 'lm(', 'Elizabeth', ')lm', 'U', '!', 'lm(', 'Wells', 'Fargo', 'Fargo', ')lm', 'U', '!', 'lm(', 'Wells', 'Fargo', 'Fargo', ')lm', 'U', 'lm(', 'lm(', 'and', ')lm', ')lm', ')lm', '!', 'lm(', 'lm(', ')lm', ')lm', ')lm', ')lm', ')lm', ')lm']",False
6424,go to Elizabeth Billiards but not through Dish or Dairy Queen and then go to Dish but not through Dairy Queen and finally go to Dairy Queen,& U ! dish elizabeth_billiards & U ! dairy_queen dish F dairy_queen,Charlotte #2,"error:['&', '&', 'U', '!', 'lm(', 'Dish', ')lm', 'lm(', 'lm(', 'Elizabeth', 'Billiards', ')lm', ')lm', ')lm', 'lm(', 'lm(', 'lm(', ')lm', ')lm', ')lm', ')lm', 'lm(', 'lm(', 'and', ')lm', ')lm', 'U', '!', 'lm(', 'Elizabeth', 'Billiards', 'Billiards', ')lm', 'U', '!', 'lm(', 'Elizabeth', 'Billiards', 'Billiards', ')lm', 'U', '!', 'lm(', 'Elizabeth', 'Billiards', 'Billiards', ')lm', ')lm', 'lm(', 'lm(', 'Dish', 'Dish', ')lm']",False
6425,go to Zada Jane's but not through Public Library of Charlotte and Mecklenburg County - Plaza Midwood Branch or Dairy Queen and then go to Public Library of Charlotte and Mecklenburg County - Plaza Midwood Branch but not through Dairy Queen and finally go to Dairy Queen,& U ! public_library_of_charlotte_and_mecklenburg_county_-_plaza_midwood_branch zada_jane's & U ! dairy_queen public_library_of_charlotte_and_mecklenburg_county_-_plaza_midwood_branch F dairy_queen,Charlotte #2,"error:['&', '&', 'U', '!', 'lm(', 'Public', 'Library', ')lm', 'lm(', 'lm(', 'Zada', ""Jane's"", ')lm', '&', 'U', '!', 'lm(', 'lm(', '!', ')lm', 'of', 'of', 'Library', ')lm', 'lm(', 'of', 'Library', ')lm', '&', 'U', '!', 'lm(', 'lm(', 'and', ')lm', ')lm', 'lm(', 'lm(', '-', '-', 'of', 'Library', ')lm', 'F', 'lm(', 'lm(', 'and', ')lm', '&', 'U', '!', '!', 'lm(', 'Zada', ""Jane's"", ')lm', 'U', 'lm(', 'lm(', 'Zada', ""Jane's"", ""Jane's"", ')lm', 'U', '!', 'lm(', 'Library', 'Library', 'of', 'of', ')lm', 'U', '!', 'lm(', 'lm(', 'Library', 'Library', 'of', 'of', ')lm', ')lm', 'U', 'lm(', 'lm(', 'Library', ')lm', 'of', 'of', ')lm', 'U', '!', 'lm(', 'and', ')lm', 'of', 'of', ')lm', 'U', '!', 'lm(', 'and', '-', '-', ')lm', ')lm', 'U', '!', 'lm(', 'lm(', 'and', '-', '-', ')lm', ')lm', 'lm(', 'lm(', ')lm', '-', '-', ')lm', ')lm']",False
6426,make your way to Common Market but keep avoiding Elizabeth Billiards and Dairy Queen and head to Elizabeth Billiards but keep avoiding Dairy Queen and then visit Dairy Queen,& U ! elizabeth_billiards common_market & U ! dairy_queen elizabeth_billiards F dairy_queen,Charlotte #2,"error:['&', '&', 'U', '!', 'lm(', 'Billiards', ')lm', ')lm', 'lm(', 'Common', 'Market', ')lm', ')lm', 'lm(', 'lm(', 'lm(', 'lm(', 'and', ')lm', ')lm', 'U', 'lm(', 'lm(', 'Common', 'Market', ')lm', 'U', '!', 'lm(', 'your', 'Common', 'Market', ')lm', 'U', '!', 'lm(', 'Common', 'Market', 'avoiding', ')lm', ')lm', 'lm(', 'lm(', 'Common', 'avoiding', 'avoiding', ')lm', ')lm', 'lm(', 'lm(', 'lm(']",False
6427,make your way to Zada Jane's but keep avoiding Common Market and Elizabeth Billiards and head to Common Market but keep avoiding Elizabeth Billiards and then visit Elizabeth Billiards,& U ! common_market zada_jane's & U ! elizabeth_billiards common_market F elizabeth_billiards,Charlotte #2,"error:['&', '&', 'U', '!', 'lm(', 'Market', ')lm', ')lm', 'lm(', 'Zada', ""Jane's"", ')lm', ')lm', 'lm(', 'lm(', 'lm(', 'lm(', 'and', ')lm', ')lm', 'U', 'lm(', 'lm(', 'Zada', ""Jane's"", ')lm', 'U', '!', 'lm(', 'your', 'Zada', ""Jane's"", ')lm', 'U', '!', 'lm(', 'Zada', ""Jane's"", 'avoiding', ')lm', ')lm', 'lm(', 'lm(', 'Zada', 'avoiding', 'avoiding', ')lm', ')lm', 'lm(', 'lm(', 'lm(']",False
6428,direct yourself to CVS but keep away from Commonwealth Animal Hospital and Zada Jane's then go to Commonwealth Animal Hospital but bypass Zada Jane's and eventually make your way to Zada Jane's,& U ! commonwealth_animal_hospital cvs & U ! zada_jane's commonwealth_animal_hospital F zada_jane's,Charlotte #2,"error:['&', '&', 'U', '!', 'lm(', 'Commonwealth', ')lm', ')lm', 'lm(', 'lm(', 'yourself', ')lm', ')lm', ')lm', ')lm', 'lm(', 'lm(', 'and', 'and', ')lm', ')lm', 'U', '!', 'lm(', 'direct', 'yourself', ')lm', ')lm', 'U', 'lm(', 'lm(', 'yourself', 'yourself', ')lm', 'U', '!', 'lm(', 'yourself', 'CVS', ')lm', ')lm', 'Commonwealth', 'Commonwealth', 'Commonwealth', ')lm', ')lm', ')lm', 'lm(', 'lm(', 'Commonwealth', 'Animal', ')lm', ')lm', ')lm', 'lm(', 'Animal', 'Animal', ')lm', ')lm', ')lm', 'lm(', 'lm(', ')lm']",False
6429,direct yourself to CVS but keep away from Common Market and Zada Jane's then go to Common Market but bypass Zada Jane's and eventually make your way to Zada Jane's,& U ! common_market cvs & U ! zada_jane's common_market F zada_jane's,Charlotte #2,"error:['&', '&', 'U', '!', 'lm(', 'Common', ')lm', ')lm', 'lm(', 'lm(', ')lm', ')lm', 'lm(', ')lm', ')lm', 'and', ')lm', ')lm', ')lm', 'lm(', 'lm(', 'and', ')lm', ')lm', 'U', '!', 'lm(', 'direct', 'yourself', 'yourself', ')lm', 'U', 'lm(', 'lm(', 'yourself', 'CVS', ')lm', 'U', 'lm(', 'lm(', 'Common', 'Common', 'Common', ')lm', 'U', 'lm(', 'lm(', 'Common', 'Market', ')lm', ')lm', 'lm(', 'lm(', 'Market', 'Market', ')lm', ')lm', ')lm', 'lm(', 'lm(', ')lm', 'and', ')lm', ')lm']",False
6430,keep away from Dish and Commonwealth Animal Hospital while heading to Wells Fargo and then keep away from Commonwealth Animal Hospital while heading to Dish and eventually go to Commonwealth Animal Hospital,& U ! dish wells_fargo & U ! commonwealth_animal_hospital dish F commonwealth_animal_hospital,Charlotte #2,"error:['&', '&', 'U', '!', 'lm(', 'Dish', 'and', ')lm', 'lm(', 'lm(', 'Dish', 'Dish', ')lm', 'lm(', 'lm(', ')lm', 'and', 'lm(', ')lm', ')lm', ')lm', 'U', 'lm(', 'lm(', 'and', ')lm', ')lm', 'U', '!', 'lm(', 'Dish', 'and', 'Dish', ')lm', 'U', 'lm(', 'lm(', 'and', ')lm', ')lm', ')lm', 'U', 'lm(', 'lm(', ')lm', 'and', ')lm', ')lm', ')lm', 'lm(', 'lm(', ')lm', ')lm', ')lm', ')lm', ')lm', ')lm', ')lm', ')lm', ')lm']",False
6431,keep away from Zada Jane's and The Plaza Post Office while heading to Fuel Pizza and then keep away from The Plaza Post Office while heading to Zada Jane's and eventually go to The Plaza Post Office,& U ! zada_jane's fuel_pizza & U ! the_plaza_post_office zada_jane's F the_plaza_post_office,Charlotte #2,"error:['&', '&', 'U', '!', 'lm(', 'The', ')lm', ')lm', 'lm(', 'The', ')lm', ')lm', '&', 'U', '!', 'lm(', 'The', 'Pizza', ')lm', 'lm(', 'The', ')lm', ')lm', 'F', 'lm(', 'The', '!', ')lm', ')lm', 'U', ')lm', 'lm(', 'lm(', 'lm(', 'Pizza', ')lm', '&', 'U', '!', 'lm(', 'Zada', 'Zada', ')lm', 'U', 'lm(', 'lm(', 'Zada', 'and', ')lm', 'U', '!', 'The', 'The', ')lm', ')lm', 'U', 'lm(', 'The', 'The', ')lm', ')lm', 'The', 'The', 'The', ')lm', ')lm', 'U', '!', 'The', 'The', ')lm', ')lm', ')lm', 'lm(', 'lm(', ')lm', ')lm', ')lm', ')lm', ')lm', ')lm', ')lm']",False
6432,visit Elizabeth Billiards Subway and Dish in order but keep avoiding latter ones when you are heading to former ones,& U ! subway elizabeth_billiards & U ! dish subway F dish,Charlotte #2,"error:['&', '&', 'U', '!', 'lm(', 'avoiding', 'latter', ')lm', 'lm(', 'Elizabeth', 'Billiards', 'Billiards', ')lm', 'U', 'lm(', 'lm(', 'Elizabeth', ')lm', ')lm', 'U', '!', 'lm(', 'Billiards', 'Subway']",False
6433,visit Common Market Zada Jane's and Dairy Queen in order but keep avoiding latter ones when you are heading to former ones,& U ! zada_jane's common_market & U ! dairy_queen zada_jane's F dairy_queen,Charlotte #2,& & U ! common_market common_market U subway common_market )lm U elizabeth_billiards lm( Common Market,False
6434,visit Public Library of Charlotte and Mecklenburg County - Plaza Midwood Branch Common Market and Zada Jane's where Common Market does not proceed Public Library of Charlotte and Mecklenburg County - Plaza Midwood Branch and Zada Jane's does not proceed Common Market,& U ! common_market public_library_of_charlotte_and_mecklenburg_county_-_plaza_midwood_branch & U ! zada_jane's common_market F zada_jane's,Charlotte #2,"error:['&', '&', 'U', '!', 'lm(', 'lm(', ')lm', ')lm', ')lm', 'lm(', 'Library', ')lm', 'of', 'of', ')lm', ')lm', 'U', '!', 'lm(', 'lm(', 'and', ')lm', ')lm', ')lm', 'lm(', '-', 'and', ')lm', ')lm', ')lm', 'U', 'lm(', 'lm(', ')lm', ')lm', 'of', 'of', ')lm', ')lm', 'F', 'lm(', 'Library', 'and', ')lm', 'of', ')lm', ')lm', '!', 'lm(', 'Library', 'Library', 'of', 'of', 'Library', ')lm', 'U', 'lm(', 'Library', 'and', '-', 'of', ')lm', ')lm', '!', 'lm(', 'lm(', 'and', '-', 'of', ')lm', ')lm', '!', 'lm(', 'lm(', ')lm', '-', '-', ')lm', ')lm', '!', 'lm(', '-', '-', ')lm', ')lm', ')lm', '!', 'lm(', ')lm', 'and', '-', ')lm', ')lm', '!', 'lm(', ')lm', ')lm', ')lm']",False
6435,visit Commonwealth Animal Hospital Fuel Pizza and CVS where Fuel Pizza does not proceed Commonwealth Animal Hospital and CVS does not proceed Fuel Pizza,& U ! fuel_pizza commonwealth_animal_hospital & U ! cvs fuel_pizza F cvs,Charlotte #2,& G ! cvs )lm & G ! elizabeth_billiards lm( fuel_pizza & G ! fuel_pizza,False
6436,go to Common Market after you have visited Elizabeth Billiards and go to Subway after you have visited Common Market,& U ! common_market elizabeth_billiards & U ! subway common_market F subway,Charlotte #2,"error:['G', 'i', 'lm(', 'Elizabeth', ')lm', ')lm', 'X', 'G', '!', 'lm(', 'Common', 'Market', ')lm']",False
6437,go to The Plaza Post Office after you have visited Fuel Pizza and go to Harris Teeter after you have visited The Plaza Post Office,& U ! the_plaza_post_office fuel_pizza & U ! harris_teeter the_plaza_post_office F harris_teeter,Charlotte #2,"error:['&', 'G', 'lm(', 'The', ')lm', 'Pizza', ')lm', 'G', '!', 'lm(', 'The', 'Plaza', ')lm']",False
6438,visit CVS first while avoiding The Plaza Post Office and then move to The Plaza Post Office while avoiding Fuel Pizza then visit Fuel Pizza,& U ! the_plaza_post_office cvs & U ! fuel_pizza the_plaza_post_office F fuel_pizza,Charlotte #2,"error:['&', '&', 'U', '!', 'lm(', 'The', ')lm', ')lm', 'lm(', 'The', ')lm', ')lm', '&', 'U', '!', 'lm(', 'The', 'Pizza', ')lm', '&', 'lm(', '!', 'Pizza', 'Pizza', ')lm', '&', 'U', '!', 'lm(', 'The', 'Plaza', ')lm', 'U', 'lm(', 'The', 'Plaza', ')lm', 'U', '!', 'lm(', 'The', 'The', ')lm', 'lm(', 'The', 'The', ')lm', ')lm', 'U', 'lm(', 'The', 'The', ')lm', ')lm', 'lm(', 'lm(', 'The', ')lm', ')lm', ')lm', ')lm', 'lm(', ')lm', ')lm', ')lm']",False
6439,visit Dish first while avoiding Diamond Restaurant and then move to Diamond Restaurant while avoiding Common Market then visit Common Market,& U ! diamond_restaurant dish & U ! common_market diamond_restaurant F common_market,Charlotte #2,"error:['&', '&', 'U', '!', 'lm(', 'move', 'Restaurant', 'Restaurant', ')lm', 'lm(', 'Dish', 'Diamond', 'Restaurant', ')lm', 'F', 'lm(', 'Diamond', 'Diamond', 'Restaurant', ')lm', 'U', '!', 'lm(', 'Dish', 'Diamond', 'Restaurant', ')lm', 'U', 'lm(', 'Restaurant', 'Restaurant', ')lm', 'U', '!', 'lm(', 'Dish', 'Restaurant', ')lm', 'lm(', 'lm(', 'Restaurant', 'Restaurant', ')lm', 'U', '!', 'lm(', 'Restaurant', 'Restaurant', 'Restaurant', ')lm', 'lm(', 'lm(', ')lm', 'Restaurant', ')lm']",False
6440,first go to Dish then go to Fuel Pizza only after Dish finally go to Subway only after Fuel Pizza,& U ! fuel_pizza dish & U ! subway fuel_pizza F subway,Charlotte #2,"error:['G', '&', 'U', '!', 'lm(', 'Pizza', 'Pizza', ')lm', 'lm(', 'lm(', 'Pizza', 'Pizza', ')lm', '&', 'lm(', 'lm(', 'Fuel', 'Pizza', 'Pizza', ')lm', 'U', '!', 'lm(', 'Pizza', 'Pizza', 'Pizza', ')lm', '!', 'lm(', 'Pizza', 'Pizza', 'Pizza', ')lm', 'U', 'lm(', 'lm(', 'Pizza', 'Pizza', 'Pizza', 'U', '!', 'lm(', 'Pizza', 'Pizza', 'Pizza', ')lm', '!', 'lm(', 'lm(', 'Pizza', 'Pizza', 'Pizza', ')lm', 'lm(', 'lm(', 'Pizza', 'Pizza', 'Pizza', ')lm']",False
6441,first go to Harris Teeter then go to Dish only after Harris Teeter finally go to Wells Fargo only after Dish,& U ! dish harris_teeter & U ! wells_fargo dish F wells_fargo,Charlotte #2,"error:['&', '&', 'U', '!', 'lm(', 'Dish', ')lm', 'lm(', 'lm(', 'Harris', 'Teeter', ')lm', ')lm', 'lm(', '!', 'lm(', ')lm', ')lm', ')lm', 'U', '!', 'lm(', 'Dish', 'Dish', ')lm', 'U', '!', 'lm(', 'Harris', 'Teeter', 'Dish', ')lm', 'U', '!', 'lm(', 'Harris', 'Teeter', 'Dish', ')lm', 'U', 'lm(', 'lm(', 'Dish', 'Dish', ')lm', 'U', '!', 'lm(', 'Dish', 'Dish', 'Dish']",False
6442,first go to Public Library of Charlotte and Mecklenburg County - Plaza Midwood Branch while staying away from Nova's Bakery then go to Nova's Bakery while staying away from Wells Fargo finally visit Wells Fargo,& U ! nova's_bakery public_library_of_charlotte_and_mecklenburg_county_-_plaza_midwood_branch & U ! wells_fargo nova's_bakery F wells_fargo,Charlotte #2,"error:['&', '&', 'U', '!', 'lm(', 'and', ')lm', ')lm', 'lm(', 'lm(', 'Public', 'Library', 'of', 'of', ')lm', ')lm', 'U', 'lm(', 'lm(', ')lm', ')lm', ')lm', ')lm', ')lm', ')lm', '-', 'and', ')lm', ')lm', 'U', 'lm(', 'lm(', 'Library', 'of', 'of', 'of', ')lm', ')lm', 'U', 'lm(', 'lm(', 'Public', 'Library', 'of', 'of', 'Library', ')lm', 'U', 'lm(', 'and', '-', 'of', 'of', ')lm', ')lm', '!', 'lm(', 'lm(', 'and', '-', 'of', ')lm', ')lm', 'lm(', 'lm(', '-', '-', '-', ')lm', ')lm', '!', 'lm(', 'lm(', 'Plaza', '-', ')lm', ')lm', ')lm', ')lm', 'lm(']",False
6443,first go to Public Library of Charlotte and Mecklenburg County - Plaza Midwood Branch while staying away from Zada Jane's then go to Zada Jane's while staying away from Nova's Bakery finally visit Nova's Bakery,& U ! zada_jane's public_library_of_charlotte_and_mecklenburg_county_-_plaza_midwood_branch & U ! nova's_bakery zada_jane's F nova's_bakery,Charlotte #2,"error:['&', '&', 'U', '!', 'lm(', 'and', ')lm', ')lm', 'lm(', 'lm(', 'Public', 'Library', 'of', 'of', ')lm', ')lm', 'U', 'lm(', 'lm(', ')lm', ')lm', ')lm', ')lm', ')lm', ')lm', '-', 'and', ')lm', ')lm', 'U', 'lm(', 'lm(', 'Library', 'of', 'of', 'of', ')lm', ')lm', 'U', 'lm(', 'lm(', 'Public', 'Library', 'of', 'of', 'Library', ')lm', 'U', 'lm(', 'and', '-', 'of', 'of', ')lm', ')lm', '!', 'lm(', 'lm(', 'and', '-', 'of', ')lm', ')lm', 'lm(', 'lm(', '-', '-', '-', ')lm', ')lm', '!', 'lm(', 'lm(', 'Plaza', '-', ')lm', ')lm', ')lm', ')lm', 'lm(']",False
6444,go to Commonwealth Animal Hospital but do not go to Commonwealth Animal Hospital until you go to Elizabeth Billiards first,& U ! commonwealth_animal_hospital elizabeth_billiards F commonwealth_animal_hospital,Charlotte #2,"error:['&', '&', 'U', '!', 'lm(', 'Commonwealth', 'Animal', ')lm', 'lm(', 'Commonwealth', 'Animal', ')lm', ')lm', 'U', '!', 'Commonwealth', 'Animal', ')lm', ')lm', '!', 'lm(', 'lm(', 'Commonwealth', 'Animal', ')lm', 'U', '!', 'lm(', 'Commonwealth', 'Animal', 'Hospital', ')lm', 'U', '!', 'lm(', 'Commonwealth', 'Animal']",False
6445,go to Elizabeth Billiards but do not go to Elizabeth Billiards until you go to Dairy Queen first,& U ! elizabeth_billiards dairy_queen F elizabeth_billiards,Charlotte #2,"error:['U', '!', 'lm(', 'Elizabeth', 'Elizabeth', ')lm', 'lm(', 'lm(', 'Elizabeth', ')lm', ')lm', ')lm', '!', 'lm(', 'Elizabeth', ')lm', ')lm', ')lm', '!', 'lm(', 'Elizabeth', 'Billiards', ')lm']",False
6446,find CVS but not until you find Dish first,& U ! cvs dish F cvs,Charlotte #2,"error:['F', 'lm(', 'Dish', 'CVS']",False
6447,find Public Library of Charlotte and Mecklenburg County - Plaza Midwood Branch but not until you find Diamond Restaurant first,& U ! public_library_of_charlotte_and_mecklenburg_county_-_plaza_midwood_branch diamond_restaurant F public_library_of_charlotte_and_mecklenburg_county_-_plaza_midwood_branch,Charlotte #2,"error:['&', '&', 'U', '!', 'lm(', 'Midwood', '-', 'of', 'Library', ')lm', 'lm(', 'lm(', 'and', '-', 'of', ')lm', ')lm', 'U', 'lm(', '-', 'and', ')lm', ')lm', 'U', '!', 'lm(', 'lm(', 'Library', 'Library', 'of', ')lm', ')lm', 'lm(', 'lm(', 'Library', 'Library', 'of']",False
6448,find Zada Jane's while avoiding Dairy Queen then after finding Zada Jane's go to Dairy Queen,& U ! dairy_queen zada_jane's F dairy_queen,Charlotte #2,& & U ! public_library_of_charlotte_and_mecklenburg_county_-_plaza_midwood_branch )lm elizabeth_billiards lm( zada_jane's )lm elizabeth_billiards lm( dairy_queen ! elizabeth_billiards lm( Zada Dairy Queen )lm U ! elizabeth_billiards lm( finding Zada,False
6449,find Nova's Bakery while avoiding Diamond Restaurant then after finding Nova's Bakery go to Diamond Restaurant,& U ! diamond_restaurant nova's_bakery F diamond_restaurant,Charlotte #2,"error:['&', '&', 'U', '!', 'lm(', ""Nova's"", 'Restaurant', ')lm', 'lm(', 'lm(', ""Nova's"", 'Restaurant', ')lm', 'F', 'lm(', 'lm(', 'Restaurant', 'Restaurant', ')lm', 'U', '!', 'lm(', ""Nova's"", 'Restaurant', 'Restaurant', ')lm', '!', 'lm(', ""Nova's"", 'Diamond', 'Restaurant', ')lm', 'U', '!', 'lm(', ""Nova's"", 'Restaurant', 'Restaurant', ')lm', '!', 'lm(', 'lm(', 'Restaurant', 'Restaurant', 'Restaurant', ')lm', 'lm(', 'lm(', ')lm', ')lm', 'Restaurant', ')lm']",False
6450,first go to Zada Jane's while avoiding Elizabeth Billiards then move to Elizabeth Billiards,& U ! elizabeth_billiards zada_jane's F elizabeth_billiards,Charlotte #2,"error:['&', '&', 'lm(', 'lm(', 'Elizabeth', ')lm', ')lm', 'lm(', 'Zada', ""Jane's"", ""Jane's"", ')lm', ')lm', '!', 'lm(', 'Zada', ""Jane's"", ')lm', ')lm', '!', '!', 'lm(', 'Zada', ""Jane's"", ')lm', ')lm', '!', 'lm(', 'Zada', 'Elizabeth', 'Billiards']",False
6451,first go to Diamond Restaurant while avoiding Nova's Bakery then move to Nova's Bakery,& U ! nova's_bakery diamond_restaurant F nova's_bakery,Charlotte #2,"error:['&', '&', 'U', '!', 'lm(', 'Restaurant', ')lm', 'lm(', 'lm(', 'Restaurant', 'Restaurant', ')lm', 'F', 'lm(', 'lm(', 'Restaurant', 'Restaurant', ')lm', 'U', '!', 'lm(', 'Restaurant', 'Restaurant', ')lm', 'U', '!', 'lm(', 'Restaurant', 'Restaurant', 'Restaurant', ')lm', '!', 'lm(', 'Diamond', 'Restaurant', 'Restaurant', ')lm']",False
6452,go to Nova's Bakery while staying away from Fuel Pizza then move to Fuel Pizza,& U ! fuel_pizza nova's_bakery F fuel_pizza,Charlotte #2,"error:['&', '&', 'lm(', 'lm(', 'Pizza', 'Pizza', ')lm', 'lm(', ""Nova's"", 'Pizza', 'Pizza', ')lm', 'U', 'lm(', 'Pizza', 'Pizza', ')lm', 'U', '!', 'lm(', 'lm(', 'Pizza', 'Pizza', ')lm', 'U', 'lm(', ""Nova's"", 'Pizza', 'Pizza', ')lm', 'U', '!', 'lm(', ""Nova's"", 'Pizza', 'Pizza', ')lm', 'U', 'lm(', ""Nova's"", 'Pizza', 'Pizza', ')lm', 'U', 'lm(', 'lm(', 'Pizza', 'Pizza', 'Pizza']",False
6453,go to Dairy Queen while staying away from Nova's Bakery then move to Nova's Bakery,& U ! nova's_bakery dairy_queen F nova's_bakery,Charlotte #2,"error:['&', '&', 'lm(', 'lm(', ""Nova's"", ')lm', ')lm', 'lm(', 'Dairy', 'Queen', ')lm', ')lm', 'U', '!', 'lm(', 'Dairy', 'Queen', ')lm', ')lm', '!', 'lm(', 'Dairy', 'Queen', ')lm', ')lm', 'U', '!', 'lm(', 'Dairy', 'Queen', 'Queen', ')lm', ')lm', 'lm(', 'lm(', ""Nova's""]",False
6454,go to Commonwealth Animal Hospital and then go to The Plaza Post Office but do not visit The Plaza Post Office before Commonwealth Animal Hospital is visited,& U ! the_plaza_post_office commonwealth_animal_hospital F the_plaza_post_office,Charlotte #2,"error:['&', '&', 'U', '!', 'lm(', 'The', 'Plaza', ')lm', 'lm(', 'Commonwealth', 'Animal', ')lm', 'F', 'lm(', 'The', ')lm', ')lm', 'lm(', 'The', 'The', ')lm', 'U', '!', 'lm(', 'Commonwealth', 'Animal', ')lm', 'U', 'U', 'lm(', 'Commonwealth', 'Animal', ')lm', 'U', '!', 'lm(', 'The', 'Commonwealth', ')lm', ')lm', 'lm(', 'The', ')lm', ')lm', ')lm', ')lm', 'The', 'lm(', 'The', ')lm', ')lm', ')lm', 'The', 'The', ')lm', ')lm', ')lm', 'lm(', 'The', 'The', ')lm', ')lm', ')lm', 'lm(', 'The', ')lm', ')lm', ')lm', ')lm', ')lm']",False
6455,go to Public Library of Charlotte and Mecklenburg County - Plaza Midwood Branch and then go to Subway but do not visit Subway before Public Library of Charlotte and Mecklenburg County - Plaza Midwood Branch is visited,& U ! subway public_library_of_charlotte_and_mecklenburg_county_-_plaza_midwood_branch F subway,Charlotte #2,"error:['&', '&', 'U', '!', 'lm(', 'Public', 'Public', '-', 'of', 'Library', ')lm', 'lm(', 'of', 'Library', 'Library', 'of', 'of', 'Library', ')lm', 'F', 'lm(', 'lm(', 'and', '-', 'of', ')lm', ')lm', 'U', '!', 'lm(', 'Public', 'Library', 'of', 'of', 'Library', ')lm', 'U', 'lm(', 'Public', 'Library', 'of', 'of', ')lm', 'U', '!', 'lm(', 'Public', 'Library', 'of', 'of', 'Library', ')lm', 'lm(', 'lm(', ')lm', 'of', 'of', ')lm', ')lm', 'U', 'lm(', 'lm(', ')lm', 'Library', 'of', 'of', ')lm', ')lm']",False
6456,visit Subway and visit Diamond Restaurant only if Subway is visited,& U ! diamond_restaurant subway F diamond_restaurant,Charlotte #2,G i subway )lm elizabeth_billiards lm( diamond_restaurant,False
6457,visit CVS and visit Zada Jane's only if CVS is visited,& U ! zada_jane's cvs F zada_jane's,Charlotte #2,"error:['G', 'lm(', 'lm(', 'CVS', ')lm']",False
6458,go to Nova's Bakery but only visit Nova's Bakery if you already visited Harris Teeter,& U ! nova's_bakery harris_teeter F nova's_bakery,Charlotte #2,"error:['G', 'i', 'lm(', 'already', ""Nova's"", ')lm', 'X', 'G', '!', ""Nova's"", 'Bakery', ')lm']",False
6459,go to Fuel Pizza but only visit Fuel Pizza if you already visited Elizabeth Billiards,& U ! fuel_pizza elizabeth_billiards F fuel_pizza,Charlotte #2,G i fuel_pizza X fuel_pizza,False
6460,go to Zada Jane's but keep avoiding Fuel Pizza and once you have been to Zada Jane's go to Fuel Pizza,& U ! fuel_pizza zada_jane's F fuel_pizza,Charlotte #2,"error:['&', '&', '&', 'lm(', 'Fuel', 'Pizza', ')lm', 'lm(', 'lm(', 'Pizza', 'Pizza', ')lm', 'U', 'lm(', 'lm(', 'Zada', 'Pizza', 'Pizza', ')lm', 'U', '!', 'lm(', 'Zada', 'Pizza', 'Pizza', ')lm', 'U', 'lm(', 'lm(', 'Zada', 'Pizza', 'Pizza', ')lm', 'U', 'lm(', 'Zada', ""Jane's"", 'Pizza', 'Pizza', ')lm', 'U', 'lm(', 'lm(', 'Zada', 'Pizza', 'Pizza', ')lm', 'U', 'lm(', 'lm(', ')lm', 'Pizza', 'Pizza']",False
6461,go to Subway but keep avoiding Elizabeth Billiards and once you have been to Subway go to Elizabeth Billiards,& U ! elizabeth_billiards subway F elizabeth_billiards,Charlotte #2,"error:['G', 'F', '&', 'lm(', 'and', ')lm', ')lm', 'lm(', 'Subway', 'Subway', 'Subway', ')lm', ')lm', '!', 'lm(', 'Elizabeth', 'Elizabeth', ')lm', ')lm', 'U', '!', 'lm(', 'Elizabeth', 'Elizabeth', ')lm', 'F', '!', 'lm(', 'lm(', 'Elizabeth', 'Elizabeth', ')lm', 'U', '!', 'lm(', 'Subway', 'Elizabeth', 'Elizabeth', ')lm', 'U', '!', 'lm(', 'Elizabeth', 'Elizabeth']",False
