,nl_command,ltl,map_name,result,eq
4868,visit Central Piedmont Community College then CPCC Faculty/Theatre Parking then Independence Park then CPCC Advanced Technology Center while ensuring not to visit CPCC Faculty/Theatre Parking before Central Piedmont Community College not to visit Independence Park before CPCC Faculty/Theatre Parking not to visit CPCC Advanced Technology Center before Independence Park,& U ! cpcc_faculty/theatre_parking central_piedmont_community_college & U ! independence_park cpcc_faculty/theatre_parking & U ! cpcc_advanced_technology_center independence_park F cpcc_advanced_technology_center,Charlotte #1,"error:['&', '&', 'U', '!', 'lm(', 'CPCC', 'Park', ')lm', 'lm(', 'lm(', 'Central', 'Piedmont', ')lm', 'College', ')lm', '&', 'U', '!', 'lm(', 'Center', ')lm', 'lm(', 'Park', 'Park', ')lm', 'F', 'lm(', 'lm(', 'Park', ')lm', '&', 'U', '!', 'lm(', 'Central', 'College', ')lm', 'College', ')lm', 'lm(', 'Central', 'Piedmont', 'Piedmont', 'College', ')lm', 'U', 'lm(', 'Central', 'Piedmont', 'Community', 'College', ')lm', 'lm(', 'lm(', 'Faculty/Theatre', 'Faculty/Theatre', ')lm', ')lm', 'U', '!', 'lm(', 'Faculty/Theatre', 'Park', ')lm', 'U', 'lm(', 'lm(', 'Park', ')lm', 'Park', ')lm', 'lm(', 'lm(', 'Park', ')lm', 'Park', ')lm', ')lm', 'lm(', 'Park', ')lm', 'Park', ')lm', ')lm', 'Park', ')lm', ')lm', 'Park', ')lm', ')lm']",False
4869,visit Independence Park then Gloria Victus Monument then Halton Theatre then CPCC Tate Tower while ensuring not to visit Gloria Victus Monument before Independence Park not to visit Halton Theatre before Gloria Victus Monument not to visit CPCC Tate Tower before Halton Theatre,& U ! gloria_victus_monument independence_park & U ! halton_theatre gloria_victus_monument & U ! cpcc_tate_tower halton_theatre F cpcc_tate_tower,Charlotte #1,& & U ! halton_theatre independence_park )lm Park )lm & cpcc_overcash lm( ! Theatre )lm )lm Theatre )lm U cpcc_overcash lm( Park Theatre )lm & U ! cpcc_overcash lm( Park Park Park )lm cpcc_overcash lm( cpcc_overcash lm( Theatre )lm U ! cpcc_overcash lm( Independence Park Park )lm cpcc_overcash lm( cpcc_overcash lm( Theatre )lm U U cpcc_overcash lm( cpcc_overcash lm( Theatre Theatre )lm U cpcc_overcash lm( cpcc_pease_auditorium )lm Theatre cpcc_overcash lm( cpcc_pease_auditorium,False
4870,visit CPCC Terrell first while avoiding CPCC Overcash then visit CPCC Overcash while avoiding CPCC Sloan-Morgan then visit CPCC Sloan-Morgan while avoiding Gloria Victus Monument then visit Gloria Victus Monument,& U ! cpcc_overcash cpcc_terrell & U ! cpcc_sloan-morgan cpcc_overcash & U ! gloria_victus_monument cpcc_sloan-morgan F gloria_victus_monument,Charlotte #1,"error:['&', '&', 'U', '!', 'lm(', 'CPCC', 'Overcash', ')lm', 'lm(', 'lm(', 'CPCC', 'Terrell', ')lm', ')lm', ')lm', ')lm', 'lm(', 'lm(', ')lm', ')lm', ')lm', 'U', '!', 'lm(', 'lm(', 'CPCC', 'Terrell', ')lm', 'U', 'U', '!', 'lm(', 'CPCC', 'Terrell', 'avoiding', 'Terrell', ')lm', 'lm(', 'lm(', 'avoiding', 'avoiding', 'avoiding', ')lm', ')lm', 'U', 'lm(', 'avoiding', 'avoiding', 'avoiding', 'avoiding', 'avoiding', ')lm', ')lm', 'lm(', 'avoiding', 'avoiding', 'avoiding', ')lm', ')lm', ')lm', 'lm(', 'avoiding', 'avoiding', 'avoiding', ')lm', ')lm']",False
4871,visit Aspire first while avoiding CPCC Worrell then visit CPCC Worrell while avoiding CPCC Library then visit CPCC Library while avoiding Halton Theatre then visit Halton Theatre,& U ! cpcc_worrell aspire & U ! cpcc_library cpcc_worrell & U ! halton_theatre cpcc_library F halton_theatre,Charlotte #1,"error:['&', '&', 'U', '!', 'lm(', 'CPCC', 'Library', ')lm', 'lm(', 'Aspire', 'Aspire', ')lm', ')lm', 'Library', ')lm', 'F', 'lm(', 'Theatre', 'Theatre', ')lm', 'U', 'U', '!', 'lm(', 'Aspire', ')lm', ')lm', 'U', 'lm(', 'lm(', 'Aspire', 'CPCC', 'Worrell', ')lm', 'U', '!', 'lm(', 'Aspire', 'CPCC', 'avoiding', 'Library', 'Library', ')lm', 'lm(', 'CPCC', 'avoiding', 'avoiding', 'Library', ')lm', 'U', 'lm(', 'lm(', 'avoiding', 'Library', 'Library', 'Library', ')lm', 'lm(', 'avoiding', 'Library', 'avoiding', 'Library', ')lm', 'U', '!', 'lm(', 'Library', 'Library', 'avoiding', 'Library', ')lm']",False
4872,reach CPCC Overcash without going to Little Sugar Creek then go to Little Sugar Creek without passing CPCC Citizens Center then go to CPCC Citizens Center without passing CPCC Sloan-Morgan finally go to CPCC Sloan-Morgan,& U ! little_sugar_creek cpcc_overcash & U ! cpcc_citizens_center little_sugar_creek & U ! cpcc_sloan-morgan cpcc_citizens_center F cpcc_sloan-morgan,Charlotte #1,"error:['&', '&', 'U', '!', 'lm(', 'Little', 'Sugar', 'Creek', ')lm', 'lm(', 'lm(', 'CPCC', 'Sugar', 'Little', 'Little', ')lm', ')lm', 'U', '!', 'lm(', 'CPCC', 'Citizens', ')lm', ')lm', 'lm(', 'Sugar', 'Creek', ')lm', 'Center', ')lm', 'lm(', 'lm(', 'CPCC', ')lm', '&', ')lm', '&', 'U', '!', 'lm(', 'CPCC', 'Overcash', 'Little', 'Little', ')lm', 'U', 'lm(', 'lm(', 'Little', 'Little', 'Little', 'Little', ')lm', 'Little', 'lm(', 'Little', 'Little', 'Little', 'Little', 'Little', ')lm', ')lm', '!', 'lm(', 'Little', 'Little', 'Little', 'Little', 'Little', ')lm', 'Center', 'Little', 'Little', 'Sugar', ')lm', 'Center', ')lm', '!', 'lm(', 'Sugar', 'Creek', 'Center', ')lm', 'U', 'lm(', 'lm(', 'Creek', 'Center', ')lm', 'Center', ')lm', 'lm(', 'Center', ')lm', 'Center', ')lm', ')lm', 'Center', ')lm', ')lm']",False
4873,reach CPCC Sloan-Morgan without going to Gloria Victus Monument then go to Gloria Victus Monument without passing CPCC Central High then go to CPCC Central High without passing CPCC Kratt finally go to CPCC Kratt,& U ! gloria_victus_monument cpcc_sloan-morgan & U ! cpcc_central_high gloria_victus_monument & U ! cpcc_kratt cpcc_central_high F cpcc_kratt,Charlotte #1,"error:['&', '&', 'U', '!', 'lm(', 'Gloria', 'Victus', ')lm', 'lm(', 'lm(', 'CPCC', 'Sloan-Morgan', ')lm', '&', 'U', '!', 'lm(', 'CPCC', ')lm', ')lm', 'lm(', 'lm(', 'Gloria', 'Victus', ')lm', ')lm', 'U', 'lm(', 'lm(', ')lm', ')lm', ')lm', ')lm', '&', 'U', '!', 'lm(', 'CPCC', 'Sloan-Morgan', 'Sloan-Morgan', ')lm', '&', 'U', 'lm(', 'lm(', 'CPCC', 'Sloan-Morgan', 'Gloria', ')lm', 'U', 'lm(', 'lm(', 'Gloria', 'Gloria', 'Victus', ')lm', 'lm(', 'lm(', 'Gloria', 'Gloria', 'Victus', ')lm', ')lm', '!', 'lm(', 'Gloria', 'Victus', 'Victus', 'Victus', ')lm', 'U', 'lm(', 'lm(', 'Victus', 'Victus', 'Victus', ')lm', 'U', 'lm(', 'lm(', 'Victus', ')lm', ')lm', ')lm', '!', 'lm(', 'lm(', ')lm', ')lm', ')lm', ')lm', ')lm']",False
4874,visit CPCC Health Careers without visiting CPCC Zeiss then visit CPCC Zeiss without visiting Little Sugar Creek then visit Little Sugar Creek without visiting Independence Park finally visit Independence Park,& U ! cpcc_zeiss cpcc_health_careers & U ! little_sugar_creek cpcc_zeiss & U ! independence_park little_sugar_creek F independence_park,Charlotte #1,"error:['&', '&', 'U', '!', 'lm(', 'CPCC', ')lm', ')lm', 'lm(', 'lm(', 'CPCC', 'Health', 'Health', 'Health', ')lm', ')lm', 'U', 'lm(', 'lm(', 'Park', ')lm', ')lm', 'U', '!', 'lm(', 'Health', 'Careers', 'Health', 'Little', 'Park', ')lm', 'U', 'lm(', 'Health', 'Careers', 'Health', 'Health', ')lm', 'U', 'U', '!', 'lm(', 'Health', 'Health', 'Health', 'Health', ')lm', ')lm', 'lm(', 'lm(', 'Health', 'Health', 'Health', 'Health', ')lm', ')lm', 'U', 'lm(', 'lm(', 'Health', 'Health', 'Little', 'Little', ')lm', ')lm', 'lm(', 'lm(', 'Park', ')lm', 'Little', ')lm', ')lm', 'lm(', 'lm(', 'Park', ')lm']",False
4875,visit Little Sugar Creek without visiting CPCC Central High then visit CPCC Central High without visiting Halton Theatre then visit Halton Theatre without visiting CPCC Health Careers finally visit CPCC Health Careers,& U ! cpcc_central_high little_sugar_creek & U ! halton_theatre cpcc_central_high & U ! cpcc_health_careers halton_theatre F cpcc_health_careers,Charlotte #1,& & U ! cpcc_pease_auditorium little_sugar_creek )lm U U cpcc_overcash lm( cpcc_pease_auditorium cpcc_pease_auditorium,False
4876,first go to CPCC Citizens Center while avoiding CPCC Kratt then go to CPCC Kratt while staying away from Central Piedmont Community College then go to Central Piedmont Community College while staying away from Independence Park then visit Independence Park,& U ! cpcc_kratt cpcc_citizens_center & U ! central_piedmont_community_college cpcc_kratt & U ! independence_park central_piedmont_community_college F independence_park,Charlotte #1,& & U ! central_piedmont_community_college cpcc_citizens_center & U ! independence_park central_piedmont_community_college ! cpcc_citizens_center cpcc_citizens_center,False
4877,first go to Gloria Victus Monument while avoiding CPCC Tate Tower then go to CPCC Tate Tower while staying away from Central Piedmont Community College then go to Central Piedmont Community College while staying away from Aspire then visit Aspire,& U ! cpcc_tate_tower gloria_victus_monument & U ! central_piedmont_community_college cpcc_tate_tower & U ! aspire central_piedmont_community_college F aspire,Charlotte #1,"error:['&', '&', 'U', '!', 'lm(', 'CPCC', 'Tate', ')lm', 'lm(', 'lm(', 'Gloria', 'Victus', 'Victus', ')lm', '&', 'U', '!', 'lm(', 'Central', 'College', ')lm', 'lm(', 'lm(', 'CPCC', 'Tate', ')lm', ')lm', 'U', 'lm(', 'lm(', 'College', ')lm', '&', 'U', '!', 'lm(', 'lm(', 'Gloria', 'Victus', ')lm', ')lm', 'U', 'lm(', 'Gloria', 'Gloria', 'Victus', 'Victus', ')lm', 'U', 'lm(', 'Gloria', 'Victus', 'Victus', ')lm', ')lm', 'lm(', 'lm(', 'CPCC', 'Tate', ')lm', 'U', 'U', 'lm(', 'lm(', 'CPCC', 'Tate', 'Tate', ')lm', 'U', 'lm(', 'lm(', 'Tate', 'Tate', ')lm', ')lm', ')lm', 'lm(', 'lm(', 'College', 'College', ')lm', ')lm', 'lm(', 'College', 'College', ')lm']",False
4878,go to CPCC Kratt then CPCC Advanced Technology Center then Little Sugar Creek finally CPCC Citizens Center you can not visit CPCC Advanced Technology Center before CPCC Kratt you can not visit Little Sugar Creek before CPCC Advanced Technology Center you can not visit CPCC Citizens Center before Little Sugar Creek,& U ! cpcc_advanced_technology_center cpcc_kratt & U ! little_sugar_creek cpcc_advanced_technology_center & U ! cpcc_citizens_center little_sugar_creek F cpcc_citizens_center,Charlotte #1,& & U ! little_sugar_creek cpcc Center Center )lm U cpcc_overcash lm( CPCC Center Center Center U ! cpcc_giles_science_center cpcc_giles_science_center cpcc_giles_science_center Little cpcc_overcash lm(,False
4879,go to 100kV Transmission Line then CPCC Advanced Technology Center then CPCC Terrell finally CPCC Worrell you can not visit CPCC Advanced Technology Center before 100kV Transmission Line you can not visit CPCC Terrell before CPCC Advanced Technology Center you can not visit CPCC Worrell before CPCC Terrell,& U ! cpcc_advanced_technology_center 100kv_transmission_line & U ! cpcc_terrell cpcc_advanced_technology_center & U ! cpcc_worrell cpcc_terrell F cpcc_worrell,Charlotte #1,"error:['&', '&', 'U', '!', 'lm(', 'CPCC', 'Advanced', ')lm', 'lm(', 'lm(', '100kV', 'Transmission', ')lm', ')lm', 'U', '!', 'lm(', 'Center', ')lm', 'Center', ')lm', 'lm(', 'lm(', 'lm(', 'lm(', 'Center', ')lm', 'F', 'lm(', 'lm(', '100kV', 'Center', 'Center', ')lm', 'U', 'lm(', '100kV', '100kV', 'Transmission', 'Center', 'U', 'U', 'lm(', '100kV', 'Transmission', 'Transmission', 'Center', ')lm', 'U', 'lm(', 'lm(', ')lm', 'Center', 'Center', ')lm', 'U', 'lm(', 'lm(', 'Center', ')lm', 'Center', ')lm']",False
4880,go to CPCC Citizens Center but not through CPCC Overcash - Arts Wing CPCC Library Gloria Victus Monument or CPCC Faculty/Theatre Parking and then go to CPCC Overcash - Arts Wing but not through CPCC Library Gloria Victus Monument or CPCC Faculty/Theatre Parking and then go to CPCC Library but not through Gloria Victus Monument or CPCC Faculty/Theatre Parking and then go to Gloria Victus Monument but not through CPCC Faculty/Theatre Parking and finally go to CPCC Faculty/Theatre Parking,& U ! cpcc_overcash_-_arts_wing cpcc_citizens_center & U ! cpcc_library cpcc_overcash_-_arts_wing & U ! gloria_victus_monument cpcc_library & U ! cpcc_faculty/theatre_parking gloria_victus_monument F cpcc_faculty/theatre_parking,Charlotte #1,"error:['&', '&', 'U', '!', 'lm(', 'CPCC', 'Overcash', 'Arts', 'Arts', ')lm', 'lm(', 'lm(', 'CPCC', 'Citizens', 'Center', ')lm', '&', 'U', '!', 'lm(', 'Gloria', 'Library', ')lm', 'lm(', 'lm(', '-', 'Arts', 'Arts', 'Library', ')lm', '&', 'U', '!', 'lm(', 'CPCC', 'Overcash', ')lm', 'Center', ')lm', 'lm(', 'Library', 'Library', ')lm', 'F', 'lm(', 'lm(', 'and', ')lm', '&', 'U', '!', 'lm(', 'CPCC', 'Center', ')lm', 'Center', 'U', 'U', 'lm(', 'CPCC', 'Center', 'Center', ')lm', 'U', '!', 'lm(', 'CPCC', 'Citizens', 'Center', ')lm', 'lm(', 'lm(', '-', 'Arts', 'Arts', 'Arts', 'Arts', ')lm', '&', 'U', '!', 'lm(', 'Arts', 'Arts', 'Arts', 'Arts', ')lm', 'U', 'lm(', 'lm(', 'Overcash', 'Arts', 'Arts', 'Arts', 'Library', ')lm', 'U', '!', 'lm(', 'lm(', 'Arts', 'Arts', 'Library', ')lm', 'lm(', 'lm(', 'Library', ')lm', 'U', '!', 'lm(', 'lm(', 'Library', ')lm', 'U', '!', 'lm(', 'Victus', 'Library', ')lm', 'U', '!', 'lm(', 'lm(', 'Library', ')lm', 'U', '!', 'lm(', 'lm(', 'Library', ')lm', 'U', '!', 'lm(', 'lm(', 'Library', ')lm']",False
4881,go to CPCC Faculty/Theatre Parking but not through CPCC Citizens Center CPCC Tate Tower CPCC Giles Science Center or CPCC Pease Auditorium and then go to CPCC Citizens Center but not through CPCC Tate Tower CPCC Giles Science Center or CPCC Pease Auditorium and then go to CPCC Tate Tower but not through CPCC Giles Science Center or CPCC Pease Auditorium and then go to CPCC Giles Science Center but not through CPCC Pease Auditorium and finally go to CPCC Pease Auditorium,& U ! cpcc_citizens_center cpcc_faculty/theatre_parking & U ! cpcc_tate_tower cpcc_citizens_center & U ! cpcc_giles_science_center cpcc_tate_tower & U ! cpcc_pease_auditorium cpcc_giles_science_center F cpcc_pease_auditorium,Charlotte #1,"error:['&', '&', 'U', '!', 'lm(', 'CPCC', 'Citizens', ')lm', 'lm(', 'lm(', 'CPCC', 'Faculty/Theatre', 'Center', ')lm', '&', 'U', '!', 'lm(', 'Tate', 'Tate', 'Center', ')lm', 'lm(', 'Center', ')lm', 'Center', ')lm', 'U', 'lm(', 'lm(', '!', ')lm', 'Center', 'Center', ')lm', 'lm(', 'Center', ')lm', 'Center', 'lm(', 'U', 'lm(', ')lm', 'and', ')lm', 'Center', ')lm', 'U', 'lm(', 'CPCC', 'CPCC', 'Center', 'Center', ')lm', 'U', 'lm(', 'CPCC', 'Faculty/Theatre', 'Center', 'Center', ')lm', 'U', 'lm(', 'CPCC', 'Faculty/Theatre', 'Center', 'Center', ')lm', 'U', 'lm(', 'lm(', 'Citizens', 'Center', 'Center', ')lm', 'U', '!', 'lm(', 'CPCC', 'Citizens', 'Center', 'Center', ')lm', 'U', 'lm(', 'lm(', 'Citizens', 'Center', 'Center', 'Center', ')lm', 'U', 'lm(', 'lm(', ')lm', 'Center', 'Center', 'Center', ')lm', 'U', '!', 'lm(', ')lm', 'Center', ')lm', 'Center', ')lm', 'U', '!', 'lm(', 'Tower', 'Center', ')lm', 'Center', ')lm', 'U', '!', 'lm(', 'lm(', 'Center', ')lm', 'Center', ')lm', 'U', '!', 'lm(', 'Center', ')lm', 'Center', 'Center', ')lm', 'U', '!', 'lm(', 'Center', ')lm', 'Center', 'Center', ')lm', 'U', '!', 'lm(', 'Center', ')lm', 'Center', ')lm', 'U', '!', 'lm(', 'Center', ')lm', 'Center', ')lm']",False
4882,go to 100kV Transmission Line and only go to CPCC Giles Science Center only after 100kV Transmission Line is visited and then go to CPCC Library only after 100kV Transmission Line and CPCC Giles Science Center are both visited and then go to CPCC Overcash - Arts Wing only after 100kV Transmission Line CPCC Giles Science Center and CPCC Library are all visited and then go to Gloria Victus Monument only after 100kV Transmission Line CPCC Giles Science Center CPCC Library and CPCC Overcash - Arts Wing are all visited,& U ! cpcc_giles_science_center 100kv_transmission_line & U ! cpcc_library cpcc_giles_science_center & U ! cpcc_overcash_-_arts_wing cpcc_library & U ! gloria_victus_monument cpcc_overcash_-_arts_wing F gloria_victus_monument,Charlotte #1,"error:['&', '&', 'U', '!', 'lm(', 'CPCC', ')lm', 'Arts', 'Center', ')lm', 'lm(', '100kV', 'Transmission', ')lm', '&', 'U', '!', 'lm(', 'CPCC', 'and', 'Arts', 'Center', ')lm', 'lm(', 'Center', ')lm', 'Center', 'Center', 'U', 'lm(', 'lm(', 'and', 'Arts', 'Center', ')lm', '&', 'U', '!', 'lm(', '100kV', 'and', 'Arts', 'Center', ')lm', 'lm(', 'lm(', '100kV', 'Transmission', 'Arts', 'Center', ')lm', 'U', 'lm(', 'lm(', '100kV', 'Transmission', 'Line', ')lm', 'U', 'lm(', 'lm(', '100kV', 'and', 'Center', 'Center', ')lm', 'lm(', 'lm(', ')lm', 'Center', 'Center', 'Center', ')lm', 'U', 'lm(', 'lm(', 'Center', 'Center', 'Center', 'Center', ')lm', 'U', 'lm(', 'lm(', 'Center', 'Center', 'Center', 'Center', ')lm', 'U', 'lm(', 'lm(', 'Center', 'Center', 'Center', ')lm', 'U', '!', 'lm(', ')lm', ')lm', ')lm', '!', 'lm(', 'lm(', ')lm', 'and', 'Arts', ')lm', ')lm', '!', 'lm(', '!', 'lm(', ')lm', 'and', 'Arts', ')lm', ')lm', '!', 'lm(', 'lm(', 'and', 'Arts', 'Center', ')lm', ')lm', '!', 'lm(', 'lm(', ')lm', ')lm', 'Center', ')lm', ')lm', ')lm']",False
4883,go to Central Piedmont Community College and only go to CPCC Faculty/Theatre Parking only after Central Piedmont Community College is visited and then go to CPCC Worrell only after Central Piedmont Community College and CPCC Faculty/Theatre Parking are both visited and then go to Halton Theatre only after Central Piedmont Community College CPCC Faculty/Theatre Parking and CPCC Worrell are all visited and then go to CPCC Citizens Center only after Central Piedmont Community College CPCC Faculty/Theatre Parking CPCC Worrell and Halton Theatre are all visited,& U ! cpcc_faculty/theatre_parking central_piedmont_community_college & U ! cpcc_worrell cpcc_faculty/theatre_parking & U ! halton_theatre cpcc_worrell & U ! cpcc_citizens_center halton_theatre F cpcc_citizens_center,Charlotte #1,"error:['&', '&', 'U', '!', 'lm(', 'Halton', 'College', ')lm', 'lm(', 'lm(', 'College', ')lm', '&', 'U', '!', 'lm(', 'CPCC', 'College', ')lm', 'lm(', 'lm(', 'College', ')lm', '&', 'U', '!', 'lm(', 'lm(', 'Theatre', ')lm', 'lm(', 'lm(', 'College', ')lm', 'F', 'College', ')lm', ')lm', ')lm', ')lm', '&', '!', 'lm(', 'lm(', 'Central', 'Piedmont', 'Community', ')lm', 'U', '!', 'lm(', 'Central', 'College', 'College', ')lm', 'U', 'lm(', 'Central', 'College', ')lm', 'College', ')lm', 'lm(', 'lm(', 'College', ')lm', ')lm', 'College', ')lm', 'lm(', 'lm(', 'College', ')lm', ')lm', ')lm', ')lm', 'lm(', 'lm(', 'College', ')lm', ')lm', ')lm', '!', 'lm(', 'lm(', 'College', ')lm', ')lm', '!', 'lm(', 'lm(', 'College', ')lm', 'U', '!', 'lm(', 'lm(', 'College', ')lm', 'U', '!', 'lm(', ')lm', 'College', ')lm', 'U', '!', 'lm(', ')lm', 'College', ')lm', 'U', '!', 'lm(', 'lm(', 'College', ')lm', 'U', '!', 'lm(', 'lm(', 'College', ')lm', ')lm', ')lm', 'lm(', 'lm(', 'College', ')lm', ')lm', ')lm', ')lm', 'lm(', 'lm(', 'College', ')lm', ')lm']",False
4884,make your way to 100kV Transmission Line only after going to CPCC Library before that make your way to CPCC Library only after going to CPCC Citizens Center before that make your way to CPCC Citizens Center only after going to CPCC Faculty/Theatre Parking before that make your way to CPCC Faculty/Theatre Parking only after going to Aspire,& U ! cpcc_faculty/theatre_parking aspire & U ! cpcc_citizens_center cpcc_faculty/theatre_parking & U ! cpcc_library cpcc_citizens_center & U ! 100kv_transmission_line cpcc_library F 100kv_transmission_line,Charlotte #1,"error:['&', '&', 'U', '!', 'lm(', 'CPCC', ')lm', ')lm', 'lm(', 'lm(', 'lm(', ')lm', '&', 'U', ')lm', '&', 'U', '!', 'lm(', 'Center', ')lm', 'lm(', 'Center', ')lm', '&', 'U', '!', 'lm(', 'lm(', '100kV', ')lm', 'Center', ')lm', ')lm', 'U', 'U', 'lm(', 'lm(', '100kV', 'Transmission', ')lm', '&', 'U', '!', 'lm(', '100kV', 'Transmission', ')lm', 'Library', ')lm', 'U', 'lm(', 'lm(', 'CPCC', ')lm', '&', 'U', '!', 'lm(', 'CPCC', 'CPCC', ')lm', ')lm', 'U', 'lm(', 'lm(', ')lm', ')lm', 'U', '!', 'lm(', 'lm(', ')lm', ')lm', 'U', '!', 'lm(', 'lm(', ')lm', ')lm']",False
4885,make your way to Independence Park only after going to CPCC Library before that make your way to CPCC Library only after going to Central Piedmont Community College before that make your way to Central Piedmont Community College only after going to CPCC Central High before that make your way to CPCC Central High only after going to CPCC Health Careers,& U ! cpcc_central_high cpcc_health_careers & U ! central_piedmont_community_college cpcc_central_high & U ! cpcc_library central_piedmont_community_college & U ! independence_park cpcc_library F independence_park,Charlotte #1,"error:['&', '&', 'U', '!', 'lm(', 'CPCC', ')lm', ')lm', 'lm(', 'lm(', 'lm(', 'Health', 'Health', 'CPCC', ')lm', '&', 'U', '!', 'lm(', 'lm(', 'College', ')lm', 'lm(', 'lm(', ')lm', ')lm', '&', 'U', '!', 'lm(', 'lm(', 'Library', ')lm', 'lm(', 'College', ')lm', '&', 'U', '!', 'lm(', 'Park', 'Park', ')lm', 'lm(', 'Library', ')lm', 'F', 'lm(', 'Park', 'Park', ')lm', '&', 'U', '!', 'lm(', 'lm(', 'Park', ')lm', '&', 'U', '!', 'lm(', 'CPCC', ')lm', ')lm', 'U', '!', 'lm(', 'Health', 'CPCC', ')lm', ')lm', 'U', 'lm(', 'lm(', ')lm', ')lm', 'U', '!', 'lm(', 'lm(', ')lm', ')lm', 'U', '!', 'lm(', 'lm(', ')lm', ')lm', 'U', '!', 'lm(', 'lm(', ')lm', ')lm', 'U', '!', 'lm(', 'lm(', ')lm', ')lm', 'lm(', 'College', ')lm', ')lm', 'U', '!', 'lm(', 'College', ')lm', ')lm', 'U', '!', 'lm(', 'College', ')lm', ')lm', 'College', ')lm', 'lm(', 'College', ')lm', ')lm', 'U', '!', 'lm(', 'College', ')lm', ')lm', 'U', '!', 'lm(', 'College', ')lm', ')lm', 'U', '!', 'lm(', 'College', ')lm', ')lm', 'U', '!', 'lm(', ')lm', 'Library', ')lm', 'U', '!', 'lm(', 'Library', ')lm', 'U', '!', 'lm(', 'Library', ')lm']",False
4886,visit 100kV Transmission Line CPCC Pease Auditorium CPCC Central High CPCC Overcash and CPCC Overcash - Arts Wing in this order without skipping any one of them,& U ! cpcc_pease_auditorium 100kv_transmission_line & U ! cpcc_central_high cpcc_pease_auditorium & U ! cpcc_overcash cpcc_central_high & U ! cpcc_overcash_-_arts_wing cpcc_overcash F cpcc_overcash_-_arts_wing,Charlotte #1,"error:['&', '&', 'U', '!', 'lm(', 'Auditorium', ')lm', ')lm', 'lm(', 'lm(', '100kV', 'Transmission', ')lm', ')lm', 'U', 'U', 'lm(', 'lm(', '-', 'Arts', 'Arts', ')lm', 'lm(', 'lm(', 'Central', 'High', ')lm', 'F', 'lm(', 'lm(', 'and', ')lm', ')lm', '&', 'U', '!', 'lm(', '100kV', 'Transmission', 'Transmission', ')lm', 'U', 'lm(', 'Transmission', 'Line', 'Line', ')lm', 'U', '!', 'lm(', 'Transmission', 'Line', 'Line', ')lm', 'lm(', 'lm(', 'Auditorium', 'CPCC', 'CPCC', ')lm', 'U', '!', 'lm(', 'Auditorium', 'CPCC', 'CPCC', ')lm', 'U', 'lm(', 'lm(', 'CPCC', 'CPCC', 'CPCC', ')lm', 'U', '!', 'lm(', 'CPCC', 'CPCC', 'Central', ')lm', 'lm(', 'lm(', 'Arts', ')lm', ')lm', ')lm']",False
4887,visit Halton Theatre CPCC Kratt 100kV Transmission Line Independence Park and CPCC Faculty/Theatre Parking in this order without skipping any one of them,& U ! cpcc_kratt halton_theatre & U ! 100kv_transmission_line cpcc_kratt & U ! independence_park 100kv_transmission_line & U ! cpcc_faculty/theatre_parking independence_park F cpcc_faculty/theatre_parking,Charlotte #1,"error:['&', '&', 'U', '!', 'lm(', '100kV', 'Park', ')lm', 'lm(', 'Theatre', 'Theatre', ')lm', '&', 'U', '!', 'lm(', 'Park', ')lm', 'lm(', 'lm(', 'Park', ')lm', 'F', 'lm(', 'lm(', 'Theatre', ')lm', '&', 'U', '!', 'lm(', 'Theatre', 'Theatre', ')lm', 'U', 'lm(', 'Theatre', 'Theatre', ')lm', 'U', '!', 'lm(', 'Theatre', 'Theatre', ')lm', 'lm(', 'lm(', '100kV', 'Transmission', 'Park', ')lm', 'U', '!', 'lm(', '100kV', '100kV', 'Transmission', 'Park', ')lm', 'lm(', 'lm(', 'Transmission', 'Transmission', 'Park', ')lm', 'U', '!', 'lm(', 'Transmission', 'Transmission', 'Park', ')lm', 'lm(', 'lm(', ')lm', ')lm']",False
4888,do not go to CPCC Sloan-Morgan until CPCC Library is visited and do not go to CPCC Library until CPCC Giles Science Center is visited and do not go to CPCC Giles Science Center until CPCC Overcash - Arts Wing is visited and do not go to CPCC Overcash - Arts Wing until CPCC Overcash is visited,& U ! cpcc_overcash_-_arts_wing cpcc_overcash & U ! cpcc_giles_science_center cpcc_overcash_-_arts_wing & U ! cpcc_library cpcc_giles_science_center & U ! cpcc_sloan-morgan cpcc_library F cpcc_sloan-morgan,Charlotte #1,"error:['&', '&', 'U', '!', 'lm(', 'CPCC', ')lm', 'Arts', ')lm', ')lm', 'lm(', 'CPCC', ')lm', ')lm', ')lm', 'U', ')lm', 'lm(', 'lm(', '-', 'Arts', 'Center', ')lm', 'lm(', 'lm(', ')lm', '-', 'lm(', 'lm(', ')lm', 'lm(', 'lm(', 'Library', ')lm', '&', 'U', '!', 'lm(', 'CPCC', 'CPCC', ')lm', '&', 'U', '!', 'lm(', 'CPCC', ')lm', ')lm', 'U', '!', 'lm(', 'CPCC', ')lm', ')lm', 'U', '!', 'lm(', 'lm(', ')lm', ')lm', 'U', '!', 'lm(', 'lm(', ')lm', ')lm', ')lm', 'lm(', 'lm(', 'lm(', ')lm', ')lm', ')lm', 'lm(', 'lm(', 'lm(', ')lm', ')lm', ')lm', 'CPCC', ')lm', ')lm', ')lm', ')lm', ')lm', 'lm(', 'lm(', ')lm', 'Arts', 'Arts', ')lm', ')lm', 'U', '!', 'lm(', 'Arts', 'Arts', ')lm', ')lm', 'Center', ')lm', 'lm(', ')lm', 'Arts', 'Arts', ')lm', ')lm']",False
